helpfulCounts,ratings,reviewText
"3684","5","I had read on here that people were having trouble with the cookie being too thin, so I added a 1/2 cup more flour, and also 1/2 more peanut butter. the cookie came out great! also added 1 teaspoon vanilla."
"2087","5","This is an excellent recipe. My family likes peanut butter cookies to be a little softer/chewier so I increased the flour by 1/4 cup and also added 1/4 cup more peanut butter. Also, I baked them on 350 for about 9 minutes or so- but watch carefully not too over bake them! They were just soooo good!"
"1753","5","Thank you Shirley! This is a fabulous recipe. After reading some very helpful comments, I made a few minor changes. Increased peanut butter to 1 1/2 cups, added an additional 1/4 cup flour, baked at 350 degrees for 9-10 minutes. After forming the dough into balls, I dipped them in sugar and with sugar side up, gently created a criss-cross pattern on top. The cookies are well balanced--crispy edges, chewy centers. Delicate peanut butter flavor. My whole family loved them!!"
"576","5","These cookies were for sure the best Peanut Butter cookies I ever made. I too added just a little more flour and a little more Peanut Butter. I made 2 dozen cookies with them and they were a hit. I made them super soft and gooey. Pull them out of the oven even when they are soft, and let them cool, they will be just the right crispiness on top but soft on the inside. I think I baked my cookies for about 6 or 7 minutes.   Good luck and enjoy!"
"527","4","Very good cookies with just a little tweaking. I added 1 tsp. of vanilla and, because I like my peanut butter cookies very peanut buttery, an additional cup of peanut butter. Just for something a little different I threw in a package of chocolate/peanut butter swirl chips. Because the dough is made with butter, chill the dough till somewhat firm and you won't end up with thin cookies...no need to add more flour!"
"462","5","I love these cookies! I was out of crunchy PB, so I used creamy, also didn't have unsalted butter, so used the salted and left out the 1/2 tsp. salt. Also, mine took exactly 10 minutes to bake. My kids loved them!!"
"296","4","As is the recipe is 4 stars. I would have given it 5 stars if I hadn't had to make some changes. I followed the suggestions of others and added 1/4 c. extra flour and 1/4 c. extra peanut butter, and put 1 t. vanilla in. I rolled them in sugar before pressing with a fork. I baked them at 350 for 9 minutes. Thanks for a good base recipe."
"208","5","This is a great recipe! My recommendationns are as follow: Cook for 8 minutes on 350. Add 1/4C more peanut butter. Don't flatten the cookies down too much unless you want a crunchy cookie. Substatute a small amount of oil for butter for a more moist cookie. And of course....add a couple handfulls of chocolate chips! This recipes was really delightful!"
"198","3","Ok, to start, the flavor of these cookies is phenomenal. Absolutely delicious. The problem is, you definitely should make these cookies a couple of times before you plan on taking them to any parties. My first try resulted in underdone peanut butter pancakes, and overdone peanut butter frisbees. The cookies flattened out literally to be about an eighth of an inch thick. Not cool. They also spread so wide, that I had beautiful octagonally shaped cookies after I had cut them all apart. After shoving the dough back into the fridge for few days due to frustration, I tried again, and discovered a few changes that make for better cookies. They still don't look like the ones in the picture, but oh well. For one, cool the dough longer than an hour. Three days is perhaps a bit long, but definitely give it a good, solid amount of time in the fridge. Next, don't squish the balls done with a fork. The melting butter and peanut butter doesn't need any help going flat. There aren't any cute fork imprints, but after your cookie has turned into a manhole cover, you don't see the fork marks anyways. Third, after baking, the cookies are going to be really squishy. You're going to think they're not done. Take them out anyways, and carefully move them from the hot baking sheet to a cool, flat surface (like plates, not racks!!). The cookies will cool and be nice and soft, but will harden a bit too, so you can actually eat them. I also added white chocolate chunks, which was yummy."
"185","5","I have been using this recipe since I was a litle girl and first began baking! My best friend's Mom made them for us and I thought they were the best cookie around. My 'twist' to the recipe is rolling each ball in granulated sugar before flattening with a fork and baking. It really adds to the final results and everyone loves them."
"179","4","I creamed the butter, peanut butter, and sugar with my hands. I also tried to beat the eggs with my hands. The hardest part though was sifting and stirring the flour into the mix with my hands.  My mix turned out really lumpy and dry and I couldn't get it to make balls. It just crumbled out of my hands when I rolled them together like sand.  Don't worry if you also do this! I found a way to fix it!  Just add a qaurter stick of melted butter and a little dribble of milk.  The cookies turned out crappy still. But if you like crappy cookies then this is a life saver!"
"54","4","I've been making this recipe for over 4 years now, and people consistently ask me to bring these to gatherings. I do make a few changes as recommended by others, and have it down to a science now. Here are my changes: Use 1/2 cup extra flour use 1/4 cup extra peanut butter - CREAMY to balance the crunchy portion add one overflowing tsp vanilla bake 9 minutes instead of 10  Perfect."
"31","5","This is a great old fashioned recipe. They are crispy yet chewy and great with crunchy peanutbutter. I added 1 tsp. of vanilla to the recipe. Just like grandma used to make. I made them in about 1' balls (using a melon baller) and flattened with a fork in a criss cross pattern. Made about 6 dozen medium sized cookies."
"25","5","The best peanut butter cookies I have ever made. Putting the dough into the fridge is a must! I even made sure to put it back in to the fridge between batches, otherwise it gets too gooey to roll into balls for baking. Even the raw dough was delicious! I almost made myself sick eating the leftover dough and the hot cookies from the oven. Will make these time and time again!"
"22","5","SOFT CHEWY peanut butter cookies. Amazing. I'm always reluctant to bake PB cookies because so often they're dry and hard. This recipe is brilliant. I made very few changes, just up'd the peanut butter to 1.5c per others recommendations. I'm a sucker for extra decadent, so I threw in a bag of PB chips and a cup chopped roasted peanuts. Not necessary but gave it an extra dose of peanutty goodness. Really though, you can't go wrong with this one!"
"21","5","So great! I followed other commenter's suggestion of adding 1/4 cup more flour and 1/2 cup more peanut butter. Also if you have trouble with flat cookies, make sure baking soda is fresh! It goes flat after 30 days or so. I also cooked at 350 for 9 minutes and that worked perfectly."
"18","5","The perfect beanut butter cookie! YUMMM!! I make these up every year to go in my cookie platers for friends and family. Everybody loves them."
"17","5","followed a few reviewer's advise and added 1/2 cup extra peanut butter....I also usd salted butter so I did not add the extra in the recipe. I also used creamy peanut butter instead of chunky. Baked for 10 minutes for chewy cookies...delicious!!!! :o)"
"17","1","these were more like cake cookies, and the peanut butter taste was not nearly strong enough for me...i don't understand how this got so many good ratings. i will not make this again."
"16","5","An excellent peanut butter cookie recipe! I made this exactly as written. The dough tasted totally amazing, lol. The cookies were awesome too. Nice and crisp with an excellent peanut and butter flavor. This is going to be my go-to peanut butter cookie recipe...thanks for sharing!"
"15","5","Can we say Wholesome goodness. On 1-15-03 I had a massive craving for peanut butter cookies. So I tried this recipe...if I could rate this with 10 stars I would. I'm still making them. Move over Betty here comes Shirley! On the gay scale of 0-10 fingersnaps...it gets 20! You go GURL! Just hope the boyfriend doesn't find the batch I stashed. Oh and these were never crumbly, or burnt on the bottom,just in for 10 minuntes no longer, no later! FABULOUS!!! BUT GET SOME STRONG MAN TO MIX IN THE DRY THINGS INTO THE PEANUTBUTTER/BUTTER...CAUSE MY DELICATE ARM ALMOST FELL OFF...;)"
"14","5","Following the reviews, I added about a quarter cup to a half cup of extra peanut butter and of flour plus a teaspoon of vanilla and used smooth peanut butter since I don't keep crunchy on hand. The cookies got rave reviews.  I took them to work as well as to a girls' night and people were very happy with them. I separated them into half batches - one of which I had in the fridge for barely an hour and the other which was in for 24 hours - both turned out well!   Additionally, I baked the first batch a tad under the suggested time (as my oven burns hot) and they were soft for days. The second batch I baked to recommendations and they were much firmer and were crumbly biscuit cookies (though not hard) the next day so depending on what kind you want, watch the baking time!"
"13","5","I have made peanut butter cookies MANY times, but the recipe that I always use is in storage. So, I decided to try this one, and it was really good! I only made half a batch, because we were low on peanut butter. And, I used all natural creamy peanut butter. I also added a half tsp. of vanilla. I didn't refrigerate the dough at all, and didn't really feel like I needed to. It was easy enough to work with. I made them a little on the small side, and rolled the balls in sugar before my 4yo made the criss-cross pattern with the fork. Then I baked them for 6 minutes and let them cool a minute on the pan before removing them. The cookies didn't spread too much like a lot of peanut butter cookies do, and I liked that. They are nice and crisp on the outside and chewy on the inside- everything a peanutbutter cookie should be! Other reviewers said that these needed more flour and more peanut butter. I disagree. I think the amounts were spot on. Perhaps their cookies thinned out too much because they flattened them too much while making the criss-cross pattern? This is a VERY GOOD peanut butter cookie recipe and I know I will be making them again and again."
"13","5","Fabulous cookie recipe! I used creamy peanut butter and salted butter because that's what I had on hand. I did add a scant 1/4th teaspoon of salt. I used brown sugar only, 2 cups. I refigerated the dough as directed and had no problem with over spreading. I made these cookies large. My husband who is very picky loved them. Surprise! Surprise!"
"12","4","these are really good peanut butter cookies. ihad to add about 1/2 a cup of water beacause they were a bit dry."
"12","5","These cookies have a crunchy but soft texture. I am nine years old (my mom supervised me!) and I do not like a lot of things but these are the best!!!! We did use only 3/4 cup of each sugar, which mom liked. We added 1/2 cup more of flour and peanut butter as others suggested. Mom says probably do not need the extra 1/2 cup of flour, that makes them a bit too crumbly."
"11","1","The portions on this recipe are all wrong. I made this exactly as stated and, first of all, it made way more than 24 cookies. Second, the flavor of these was just not there and the texture was not good. Waste of good ingredients."
"11","5","These cookies are amazing. Don't forget to put a slice of bread in with your cookie tin or jar to keep the cookies moist. YUM!"
"11","5","My new favorite Peanut butter cookie recipe!"
"10","5","This recipe has all the ingredients, but lacks the soul of a fabulous cookie if prepped as written. Here's my changes: 1st beat egg light and fluffy..rinse beaters and dry. Then cream butter; Start w warm butter and brown sugar, you should use high power then cream white sugar. Should take several minutes to cream..... . Scrape sides of bowl often to eliminate granules. Add peanut butter and blend well .finally add egg and beat to mix SIFT dry ingredients together, add a little at a time. Mix slowest speed until just blended  I baked at 375 for 6 minutes. Cookies did not look done, but left on cookie sheet for 5 minutes then transferred onto hard surface to cool. This seals in the moisture resulting In a crispy crunch and chewy delicious smooth pb taste!"
"10","5","Omigosh, SO good! Crisp, chewy, peanut buttery, delicious! I rolled in sugar as well, just for a little extra texture."
"10","5","I used salted butter and smooth peanut butter. I added 1 tsp of vanilla and omitted the salt. I also added a package of peanut butter chips. I made 2 tbsp sized balls, dipped the tops in sugar and pressed with a fork. I baked them for 9 minutes and let them cool 2 minutes before putting them on a cooling rack. I got exactly 3 dozen cookies. They taste great. (I skipped the chiling). Thanks."
"10","1","For a cookie, these were rather bland and had little to recommend them. They were dry, not sweet enough, and OILY. I'm not sure how a cookie can be dry and oily at the same time, but these managed."
"9","5","I added more salt, 1/2 t each of baking powder and baking soda. I also added 1 C finely ground dry-roasted peanuts for extra peanuttiest. Could possibly be the best PB cookies I've ever made."
"9","5","Another great cookie! I use this recipe in my bakery department at work, and my customers love this cookie. I make jumbo 4oz cookies, because my customers like big cookies. The cookie is soft and chewy and stay chewy and soft for days; however, my cookies never last more than a couple of days on the retail shelves. For variety, I dip the cookie half way into melted semi-sweet chocolate...wow, it has such a awesome look, it is hard to resist."
"8","5","This was a great recipe! I read through the reviews and decided to add more flour (1/2 cup) and peanut butter (1/2 cup) as suggested, and I also added about 1tsp of vanilla. The temperature was way too high at 375 in my oven, and after scorching the bottoms of the first batch, I reduced the heat to 325 and cooked for 9 minutes. After that, they came out perfect! I even added a milk chocolate center on some of them, for something extra! Great recipe, I plan on making these more often!"
"8","5","These came out perfect! I added some raisins, then baked them at 350* and kept a close eye on them. They were a perfect chewy goodness with crispy edges at about 7 min."
"8","5","OH...MY....GOSH!!! These are INSANELY fabulous!!! wow."
"8","1","Sorry but the flour that was added was soo much and the cookies crumbbled."
"8","5","I only had smooth peanut butter, but it turned out great. I followed other reviewers and added about 1/4 cup more peanut butter, but my boyfriend and I thought that it would have been fine without it. Next time, I will try the recipe as is. Also, I didn't have any issues with the baking temperature or time. I followed the original recipe and they turned out perfect."
"7","4","This recipe is really good!!!! My cookies came out perfect... I added 1 1/2 cups mini chocolate chips, 1/4 cup flour and 1/2 cup of pb to the recipe, I also decreased the temp to 350! They came out super yummy!"
"7","5","Delicious, love this recipe, have been making a similar one for the last little while, even good with chocolate chips as a final step. If I make plain peanut butter cookies, I always sprinkle a little white sugar on them before baking for the sweet tooth in me!"
"7","1","i used whole wheat flour instead of white, and that didn't work for me. The cookies didn't flatten out at all - they just burnt on the outside. Next time, I'll try half wheat flour, half white flour."
"7","5","Reading reviews before I made these, I decided to also increase the flour and peanut butter by 1/2 cup each and also added 1 teaspoon vanilla. With these changes I am giving this a 5 star rating. Many were saying that they spread too much using the original recipe, so I didn't want to take a chance. These are a very good tasting peanut butter cookie."
"7","4","These are a great, basic PB cookie. I ended up refrigerating them overnight and didn't have any problems with them spreading too thin."
"7","5","OMG these were AMAZING!!!! I finally found an amazing peanut Butter cookie recipe! i followed the recipe as followed but added 1/4 cup more of flour and Peanut Butter, i set my oven on 350 and baked them for 9 min, and they turned out soooo nice,and round (after rolling them into balls) and were so chewy, and had a good peanut butter flavor to them. they were a bit greasy on the first batch but on the second batch i placed paper towels on a plate to cool them on, and at the same time it sucked up the greasyness!!! WONDERFUL COOKIES!"
"7","5","I followed this recipe to the letter with the exception of adding an extra 1/4 cup peanut butter due to the suggestions in other reviews and I used salted butter and did not add any other salt. My dough was a little sticky due to the added peanut butter, but they were still easy to form. They were very easy to make. They came out perfect, crispy, and they melt in your mouth."
"7","5","These cookies are the best! I used creamy peanut butter instead of crunchy and increased the amount to 1 1/4 cups. Baked them for 9 mins. and they're perfect. Just the right amount of flavor and very moist and chewy. My hubby and I can't stop eating them. I'll use this recipe for peanut blossoms at Christmas, also!"
"7","4","My husband said they were really good but they weren't as peanut buttery as I would have liked and they were a little to crispy for me at first. So on the next batch, I left them in the fridge overnight I took them out before they browned and they were softer and tasted better - the way I like them."
"6","5","Thanks! This is a great recipe! I did as the others suggested with the extra quarter cup of flour and pnutbutter. I baked em at 365 for 8 mins and they were perfect. I also did a dozen not rolled in sugar, and the next rolled in sugar before baking, and all of the teen boys here that did the taste test said DEFINITELY rolled in sugar wins! They are soft, not dry at all! Thanks, this is my new recipe, tossing out the old one!"
"6","5","Really the perfect peanut butter cookie! I did customize it like others suggested and added an extra 1/2 cup of PB and an extra 1/2 cup of flour. If you make small cookies they will NOT break apart after cooking so I highly suggest smaller sized ones. I tried medium/larger ones and they were crumbly. I bake a LOT and these were truly among the best cookies I have ever made. They were great out of oven and still perfect much later in the day. I sent them in a care package to my son in college. I think anyone who loves peanut butter cookies will LOVE these."
"6","5","These are great!! I did go with the general consensus of adding on to the flour and peanut butter amounts, but accidentally over-baked the cookies. They didn't burn, but they didn't come out both crispy and chewy - just chewy. Watch very carefully how long you bake them!!"
"6","5","This the best recipe to make pretend (peanut free ) peanut butter cookies. We have a peanut allergy in our household. I thought we'd never have anything like a peanut butter cookie again. Unlike other peanut butter cookie recipes this one turns out great when using a peanut butter alternative. I use sunflower seed butter in place of the peanut butter. After rolling it into a ball, I dip the fork in sugar before pressing down. I bake the cookie as directed. This is a great recipe to use when making allergy friendly peanut butter cookies. We can tell a difference, but it the closest to the real thing we've gotten. Thanks for a great recipe!"
"6","5","Added 1/2 C of extra flour & 1/2 C of extra peanut butter like recommended. Dipped in sugar, and slightly flattened with a fork. Turned out AMAZING!!!!"
"6","5","My friends loved these! I added chocolate chips, vanilla, and more flour and peanut butter. I wish I had crunchy peanut butter with me, though! 10 minutes is perfect."
"6","5","This is my first attempt at a peanut butter cookie. It turned out really yummy ^^ It wasn't too sweet and had the perfect peanuty taste. Very soft too. Thanks for the recipe!"
"6","5","I used salted butter, creamy peanut butter, and cooked them for only 8 minutes so that they were *super* soft. My boyfriend and I really enjoyed these."
"6","5","Perfect Perfect Perfect Light, chewy, great texture and taste. Definitely a keeper. Timing is extremely important...it took 12 mins for mine but thats with a gas stove."
"5","5","The best recipe I found for peanut butter cookies. Took the advise of others and increased the flour by 1/2 cup and increased the peanut butter by 1/4 cup. Dough is much easier to work with after it has been placed in refrigerator. THANKS FOR SHARING!!!"
"5","5","I absolutely loved these cookies. I used salted butter and creamy peanut butter, but they were amazing."
"5","5","I took the suggestion of other users and added vanilla, extra peanut butter and extra flour....the cookies ended up tasting great!!"
"5","4","We like our PB cookies soft and chewy so I added a 1 cup more flour, 1 1/2 cup more peanut butter, also added 1 teaspoon vanilla. Cooked for 8-9 min on 350 degrees."
"5","4","I made the recipe as written and they are flat and lose the criss cross pattern. They do not look like a traditional peanut butter cookie."
"5","5","These are the best peanut butter cookies EVER. And I've made quite a few different recipes of them, as they're my husband's favorite cookie. Do not change a thing! I only added a teaspoon of vanilla, and sprinkled with sugar before smooshing slightly with a fork. AMAZING! Thanks for sharing!!"
"5","2","I added the extra flour and peanut butter other reviewers called for. Cookies were way too crumbly and dry tasting :("
"5","5","I made this for my family the first time and they were so good I made another batch for my kids school party (teachers prefer things without frosting in a class of 2 yr olds) Great Recipe and better than the bakery! I also really appreciate cookie recipes without shortening...I try not to cook with shortening if I can help it."
"5","4","After reading the reviews I added more flour and some vanilla. I still had to chill the dough for 1/2 hour before rolling into balls. As usual I did the fork dipped in sugar thing to make criss crosses. I also did 1/2 crunchy pb and 1/2 creamy (we don't like too much 'crunch'). The cookies were not as chewy or peanut buttery as I've had in the past, but the centers were soft with some crunch around the outside. My 6 year old enjoyed these!"
"5","5","These are GREAT, but like most reviewers, I took creative liberty with the recipe. I increased the flour to 2 3/4 cups, added a teaspoon of vanilla and used an entire 18 oz. jar of Jif crunchy peanut butter. I also threw in a bag (10 oz.) of Reese's peanut butter morsels at the end and rolled them in sugar before criss-crossing the oversized handmade dough balls -- lightly -- with a fork (we like our cookies big and chewy). Baked for 15 minutes at 350 degrees and cooled on stoneware for 3 minutes before transferring them to the cooling rack. Everyone is raving about how moist and chewy they are! This (modified) recipe is a keeper!"
"5","5","Great mailing cookies. I send these to my husband in Iraq on a regular basis. He loves getting them. I follow the recipe almost exactly. If you live in the south and use White Lilly Flour (the best) remember to add a little extra- I usually add another 1/4 to 1/2 cup- it's more finely milled and less dense, sort of like cake flour. Thanks for a great recipe."
"5","5","These were a HUGE hit both at work and with my boyfriend, who is somewhat of a peanut butter cookie connoiseur. As recommended, I increased the PB and flour and added vanilla too. Perfect!"
"5","5","I am pretty particular when it comes to cookies... seriously.. a good review doesnt come easy as far as I go, BUT this cookies rock! We added chocolate chips and they were fantastic.. .I bet they would be awesome without them, but yeah.. we do the chocolate thing. Thanks for posting this one.. This one is definitely a keeper."
"5","5","Man O Man these cookies are delish! This is the first time I have ever made peanut butter cookies from scratch and I'm glad I chose this recipe! I did add a 1/2 cup more flour and 1/2 cup more peanut butter. The cookies are so soft and chewy! Just the way I like 'em. Highly recommend this recipe. I'll be making them again!"
"5","5","Great cookies. They could use more peanut butter flavor, but I liked them. I added about 3 tbsp of ground flaxseed to the flour and I mixed in a cup of oats at the end. I also took the advice of a reviewer and rolled the balls in sugar. I found that the cookies would be fine without the sugar rolling. I also added 1/4 cup more flour and peanut butter per suggestions. I used 1/2 cup butter flavored vegetable shortening and 1/2 cup margarine.   I will make these again. Next time I'll add some chocolate chips to a batch. I got more than 24 cookies. I'd say I got close to 3 dozen. They were delicious. They made my guyfriend swoon."
"5","5","these cookies were great! my dad thought they were too."
