helpfulCounts,ratings,reviewText
"1","5","Delish. I used the chocolate condensed milk recipe for the frosting. This is amazingly good!"
"1","5","Made this cake for fathers day and it was a fantastic hit. I used the chocolate Ganache recipe from this site and whipped it for a frosting and it was fabulous. I'm not a coffee drinker but the coffee make this cake so rich and delicious. My hubby usually takes my bakery left overs to work but not this one....we actually froze the left overs wrapped in press n seal and then in a plastic container. We ate them about 2 weeks later and it was still fantastic. Will definitely make this again"
"1","5","I made this cake with the 'Rich Chocolate Frosting' recipe on here for my dad's birthday. I love chocolate cake when it's done right but so often it ends up being dry and crumbly. Not this cake- it was moist, delicious, and chocolatey! My mother, queen of the white cake, even admitted to liking it. All of us kept creeping back to the fridge over the next week to sneak bites of it. I highly recommend this recipe and also that you check out the frosting I used: http://allrecipes.com/recipe/rich-chocolate-frosting-2"
"1","5","Delicious. I used the 1 minute chocolate icing to frost it. Loved it."
"1","5","Followed the directions exactly. Used Hershey's cocoa and got a small starbuck's dark roast coffee (I don't own a coffee pot). The coffee was still hot when i added it, but it didnt' seem to make a difference. made 24 cupcakes which took 18 minutes in a 350 degree oven. Everyone at worked raved about them. Super moist :)"
"1","5","My family Loves this cake best of all the chocolate cakes, and they are chocolate fanatics! It's reliable, always tender, moist chocolaty and delicious, and its easy to make. Using real buttermilk makes a difference, so use it if you have it, and be sure to make the coffee very strong. If you have trouble removing the cake layers from the pans, you can grease the pans, then line the bottoms with greased parchment or waxed paper cut to fit, before flouring.  This makes a wonderful layer cake and works well with many different frostings."
"1","5","I've probably served this cake to over 100 people and everyone has said it's the best cake they've ever had. Its the only recipe I'll use.   My secret is Valhrona Chocolate, and a NICE cup of strong coffee. It makes a BIG difference. Even people who don't appreciate nice things will taste the difference.  If I'm planning on icing it and need to be sure i'll do a good job I'll evaporate the coffee so it's less than 1 cup but still has all the flavor... so the cake isn't as wet.  I didn't have butter milk so I made some with 1 cup of milk and 1 tablespoon of lemon juice set aside for a few minutes."
"1","5","Delicious! I made it gluten free by substituting the flour with a mix of rice flour, potato starch, tapioca starch and xantham gum. Also, I only have a toaster oven, so I put half the batter in a rice cooker and half in the toaster oven. The rice cooker cake was much more fluffy and moist. For a glaze, I melted butter and added sugar and coffee liqueur."
"1","5","Absolutely love it! Works every time"
"1","5","Yeah, this cake lives up to its rating - it had excellent flavor and texture - 2 things that seem a little elusive in most chocolate cakes. A great cake - I'm ending my quest for a perfect chocolate cake with this one. Thanks!"
"1","5","Wow! Just like my great grandmothers' recipe. I finally found something like it."
"1","5","This is hands down the best chocolate cake recipe I've made. I use Hershey's Dark Cocoa in it and it's great in 9X13, layer or cupcakes. It's absolutely to die for w/peanut butter icing! Thanks Marsha for sharing."
"1","5","This cake is amazing! I will never use different recipe. The batter is very thin as others have stated, but turned out very well. I made them as cupcakes 23 minutes in my oven. I used a 1/4 measuring cup to measure out batter and that was perfect. Used with the cinnamon coffee frosting from site (which was a great combination)"
"1","5","Awsome chocolate cake, very moist!"
"1","5","Absolutely delicious. So rich and fragrant, and incredibly simple! I needed to let mine cook for the entire 40 minutes, but it was so moist. It stayed that way even after cooling when some cakes tend to harden or dry out a bit. I sprayed my round cake pans with plenty of Baker's Joy (the oil and flour spray), but I'm sure a similar product will do just fine. It popped right out of the pan with little crumb left behind. Fabulous, because I wouldn't want to miss a bit of this cake! The batter does seem a little thin, but it bakes up perfectly. People at my church raved and devoured this cake so quickly! Amazing chocolate flavor, and I topped with 'Rich Chocolate Frosting' from this site for a really decadent experience. Try this cake, you won't regret it! It's my new go to chocolate cake!"
"1","5","I absolutely loved this cake. When it came out of the oven, it was almost black in color because of the chocolate and coffee. When I cut into the cake after frosting it, it gave off a delicious chocolately aroma, and it was extremely moist and delicious. This is my new go-to chocolate cake recipe. A real winner."
"1","5","This cake is by far the best cake I've ever tasted, it is so moist. i will defiantly be making this one again!"
"1","5","I've tried lots of chocolate cake recipes looking for 'THE' one... and this is it. Moist and true chocolate flavor I frosted it with a Swiss Buttercream...EXCELLENT!"
"1","5","Excellent; very moist & great texture. I baked in a 13x9 inch pan, had to substitute milk (1c) with cream of tartar (1 3/4 tsp) for the buttermilk b/c I didn't have any & it still turned out delicious!! Only thing was it didn't rise very well in the middle but that really didn't matter to me b/c the taste made up for it. This will definitely be my chocolate cake recipe. Frosted mine with a caramel frosting but the cake is so good you could get away with no frosting at all!!"
"1","5","This cake is fabulous! I used almond extract in the cake and frosting instead of vanilla. It is so chocolately and decadent. This recipe made my day."
"1","5","Super moist, lots of chocolate, everybody enjoyed and very easy to make - 1 bowl!"
"1","5","This is it!!! The perfect chocolate cake!!! Wow! Just perfect! Dangerously good! Deliciously moist, perfectly chocolatey. So so good! I made a couple changes out of necessity: I didn't have much milk, and I didn't want to brew coffee, so I used 2 cups of water instead. I also melted a couple ounces of Ghirardelli chocolate chips and stirred that into the batter. Made a LOVELY cake. The little bit that's left has been sitting on the counter, covered with plastic wrap. The cake is getting smaller and smaller...but it's tasting better and better as the days pass. Can't say enough good about this. Try it! You won't be disappointed."
"1","5","I baked in the NJ casinos for 10 years, and even though we used a buttermilk recipe for our chocolate cakes, they STILL weren't THIS good. I had to join this site just so I could give this cake one more 5-star rating. It's truly THAT good! Very, very, VERY moist. I will never use another recipe!"
"1","5","Soooo delicious."
"1","5","I have made this as a cake and as cupcakes several times. This is a foolproof recipe. I am a novice and even I can turn out great tasting cakes with this recipe. I followed a previous poster's suggestion about cupcakes. This recipe yielded about 26 medium cupcakes, baked perfectly at 350 F and for 22-23 min.  Thanks for this excellent recipe."
"1","5","Best chocolate cake ever. So moist and flavorful. I do have to adjust for high altitude with a tiny bit of extra flour, a higher oven temp etc, but it turns out beautifully."
"1","5","quite delicious and the best chocolate cake recipe I ever used"
"1","5","The cake was FANTASTIC!!! I would make no canges to the recipe perfect chocolate cake"
"1","5","This is, without a doubt, the best homemade chocolate cake I have ever tasted! I had all but given up on making any kind of homemade cakes because the boxed mixes always tasted way better...not anymore! I followed the recipe exactly as written, and this cake is super-moist and delicious, with a rich chocolate flavor. I topped it with the chocolate ganache (from this website) and it was perfect. It is an excellent base recipe for a chocolate cake and it could be used with a variety of frostings, fillings, toppings. YUM! :)"
"1","5","I followed the directions exactly and it turned out wonderful! I had no problems at all and the taste was excellent.. very moist. This will definitely be my go to chocolate cake recipe from now on. I frosted with the Creamy Chocolate Frosting recipe from this site... delicious!"
"1","5","Excellent flavor & texture-very chocolaty and moist. This is the best chocolate cake I've ever made. I tried this recipe because I read somewhere that hot coffee mixed with cocoa power intensifies the chocolate flavor. (There is a scientific explanation but I don't recall what it is). Instead of cake pans I used a greased muffin pan and baked for 22 minutes. They actually tasted better the next day. These came out so moist that they were hard to remove from the pan. I will definitely make this again but next time I will use paper liners instead of greasing the pan."
"1","5","Delicious, moist, chocolatey. I used a mixture of butter and coconut oil instead of vegetable oil, and I used carob instead of cocoa, only because it was all that was left in the store after the hurricane and I needed to use it up. I was worried it would ruin the chocolate experience but nope! The cake turned out wonderful. I made it in a spring form pan so it would be easy to maneuver. I also added about a cup of a chopped chocolate-toffee bar. It doesn't even need icing, it's heavenly all on it's own!"
"1","5","Save yourself the headache and hassle: LINE THE BOTTOM OF YOUR PAN with wax or parchment paper."
"1","5","This was really really good. I made this for a friends birthday party that was also a halloween costume party. The coffee gives this a dark chocolate ALMOST bitterness that is amazing. This moist and chocolaty cake is perfect for the coffee lover and the chocolate lover. I baked it in 2 8 inch cake tins and then 'glued' them together with buttercream (I used the 'Best Buttercream Frosting' found on this site). Only I added chocolate and coffee to the recipe. Yum!"
"1","5","I've used this cake recipe several times and every time I make it, it comes out delicious! Very good recipe, the family loves it, it definitely deserves five stars and two thumbs up!"
"1","5","This cake is really good. I followed the recipe ( changing nothing) and it came out fantastic. Like some others have mentioned, the batter is very thin and it does not rise a great deal. In 30 minutes the cake was beautifully done. I cut each layer in half and filled with black cherry preserves, then iced the cake with sour cream whipped cream icing."
"1","5","this the best cake i ever made, thank you for your recipe. i have had problems with chocolate cakes before, and this one it came up just perfect. the smell is awesome...  i am sure it will be success."
"1","5","I have always wondered where my Mom found this recipe, and now thanks to Kathy (2005), I realized it was right there on the back of the Hershey's Cocoa can! We have loved this cake for many years and have always considered it a special family favorite. Now, with the added insight of all of these great reviewers, I can't wait to try the Coffee Butter Frosting from this site when I make it for my Mom's birthday tomorrow!"
"1","5","Very good chocolate cake! This is now my go to recipe. I prefer the dark color and depth of chocolate you get with the special dark cocoa or jet black cocoa. So I used 1/2 c or more special dark and the remaining 1/4 c of regular standard cocoa. Very good with or without frosting."
"1","5","Amazing recipe!!!"
"1","5","This was the best chocolate cake I've ever made, and quite possibly the best I've had. Perfectly delicate and tender crumb, moist and absolutely melt in your mouth. I frosted with Creamy Chocolate frosting which I tweaked slightly and added some shavings of a Hershey bar to dress it up. This will be my go-to chocolate cake recipe from now on!"
"1","5","I've been baking this cake ever since I was 6 and found it in my mom's Hershey's cookbook. The only difference I notice is that this recipe calls for buttermilk while the one in the cookbook calls for sour milk (1 tsp vinegar mixed with the milk sours it). Since I never have buttermilk on hand, the sour milk is always the way I go.  Always this will be my favorite chocolate cake recipe. It is so moist and full of flavor. Unlike a lot of other cakes, this one gets better a day or two after being baked. It gets more moist and the flavors come out more, in my opinion."
"1","5","I made this to take to a pot luck last Sunday, and am just getting around to writing this review. This cake was SO delicious! Fortunately, we arrived at the pot luck a little late, and everyone had already eaten! Oh well, that just meant that we got to take 3/4 of the cake home for ourselves! They don't know what they missed! It was moist, just the right amount of chocolate, not too sweet, and downright decadent! I topped it with a chocolate butter cream, which was just perfect! This is one for the recipe box, that's for sure! Thanks for sharing!"
"1","5","Just made this...delicious! The batter is very wet and makes for rather fragile cake, but unbelievably moist with a lovely crumb. I used a combination of Dutch-processed cocoa and black cocoa, so I reversed the ratios of baking powder and baking soda. My cupcakes rose perfectly and are so dark and rich that they are almost black. I filled the cupcakes about 3/4 full, maybe a little less, and it made 24. I plan on frosting with whipped ganache and garnishing with fresh strawberries."
"1","5","Best homemade chocolate cake recipe ever. I made coffee icing to go on top and my teenagers and husband just wanted to know when I was making it again. It is, however, too moist to be a cake you use for soaking."
"1","5","LOVE this cake with a big glass of milk! Perfect chocolate flavor and so moist!"
"1","5","Best cake ever! I made cake pops with my 2-9 inch cakes, and mixed it with a cream cheese icing. The cake is so rich and moist and my cake pops froze very well. Everyone at my daughter's party loved them! I will never use another chocolate cake recipe again, because this is the best!"
"1","5","I've made this cake FOUR times in a month on public demand. :P It's just so awesome, people can't get enough. Easy to make and easy to finish. :D  Thanks for sharing this recipe. :)"
"1","5","This is a very easy cake to make. I entered this cake into our county fair and took first place!"
"1","1","the consistency is too flimsy (yes after being baked)"
"1","4","lovely simple chocolate cake recipe, very moist and tender crumb."
"1","5","Fantastic recipe. Very moist, almost sticky but amazing flavor. This will be my go-to recipe for chocolate cake from now on. Followed recipe exactly"
"1","5","It is indeed a very soft and moist cake that is easily whipped up! I halved the recipe to bake it in a 8x8 pan."
"1","5","Absolutely the most amazing chocolate cake I've ever had. I've tried tons of chocolate recipes, with most of them coming out too dry and very 'meh'. But this cake is SO moist. My boyfriend thought putting coffee in a chocolate cake would be gross, but you really can't taste it at all--he hates coffee, and he loved the cake. It's quite a dark chocolate cake, but people who don't usually like dark chocolate seem to like this cake a lot. I'll use this recipe again and again!"
"1","5","The only change I did was I baked it at 300 degrees and it came out fantastic. I used the fluffy white frosting found on this website and the kids loved it."
"1","5","Incredibly good. I don't like coffee, but it really works in this recipe. I used dark non-stick pans and had more trouble than usual separating the cake from the pans. Also the cake didn't rise as much as usual. But man is it moist and delicious! I was going to try a new flavor of icing (Duncan Hines Frosting Creations, chocolate almond). Fortunately I sampled before icing the cake – it was truly awful. The upside is that this cake is so good, you can actually eat it without frosting (I've never said that about any other cake).   Next time I may cut back on the sugar a little. Overall, a little high maintenance but moist, good texture and excellent flavor."
"1","5","I had been on a mission for the best chocolate cake recipe for about 3 years. I have made many on this site but for some reason always passed this one over. I knew my mission was complete the second I bit into this cake! I was very skeptical because the batter is so runny but my concern was unfounded. I undertook a mission to recreate Starbucks lattes as cupcakes and used this as a base for all of the mocha flavored ones (just added 3 packets of Via) and some additions such as chocolate chips for Java chip or a white chocolate filling for the white mocha. And as a cake this recipe is great with a strawberry or blueberry filling!"
"1","5","Hands down the best chocolate cake I've ever had! No need to search for the ultimate chocolate any longer...I've found it! Huge hit every time it's served. Even if you don't like coffee, use it anyway. You can't taste it but it makes the chocolate flavor pop! Excellent cake!"
"1","5","Fantastic recipe! I replaced vegetable oil with butter, it was so moist and not overly rich. I used the chocholate butter, which was just enough to cover a 9x13 cake.   6 tbsp. butter 1 cup powdered sugar 4 tbsp. cocoa 2 to 3 tbsp. milk  ENJOY!!"
"1","5","I made this twice. The first time it fell apart, but that was my first time making a two layered cake. I also used can frosting which was way to hard and not spreadable at all. So I gave it another shot at a party last weekend. This time I made my own frosting, first time as well, and it came out so much better. I got so many complements and was asked to make it for a friends birthday. It actually stir the baker in me to try more things. Thanks a lot! I would suggest refrigerating it over night when it is frosted and then leaving it out at room temperature for a few hours. It holds the cake together and gives the frosting the right consistency."
"1","5","This cake got great reviews from my friends. It's a keeper."
"1","5","OH MY GOSH. This cake is deserving of the title. Made it exactly according to the recipe (besides decaf coffee) and baked in 2 8x8 pans. I topped it with a frosting from this site 'Rich Chocolate Frosting'. For the frosting, I substituted coconut flavored creamer for milk. YUM!! All the leftovers went to my husband's work, and they're all wondering when I'm going to make it again. Three of the people were on diets and still couldn't resist a little piece!!! :) I imagine this would be DELICIOUS with some kind of real coconut frosting. It was delicious the way I made it with a hint of coconut in the frosting, too. But, even the cake itself is SO moist and decedent, and I'm not a huge chocolate person!"
"1","5","The BEST cake I have ever had!!! My family has food allergies so I used spelt flour instead of wheat. As for the buttermilk, I used soy milk and added 1 Tbs. apple cider vinegar. It turned out beautifully! For the icing I used a chocolate ganache recipe. This cake really is amazing!"
"1","5","i finally found a chocolate cake thst tastes like chocolate. Hip hip horray. Super moist light delacate crumb and soooo chocolatie. I used hersheys cocoa, and warm folgers coffee, when i tasted the batter it was almost like tasting a mocha, but the strong coffee flavor cooked out. however there is a small odd after taste. but i used really really strong coffee will make again and again and again and again...."
"1","5","There are no words to describe how absolutely delicious this cake is. I dissolved two packets of instant coffee in 1 cup water and let it cool in the fridge overnight Baked a dozen mini cupcakes for 15 mins and the remaining batter went in a bundt pan for 40 mins. I used the Peanut Butter Fudge Frosting recipe from this site, which I highly recommend. A tall cold glass of milk complemented the slice I enjoyed quite nicely. I read someones comment on here that they found this recipe years ago on the back of a Herseys Unsweetened Coco container...Wouldn't have expected anything less from Herseys. Many thanks to whoever came up with the original recipe, this will be my 'forever' chocolate cake recipe from now on."
"1","5","Made this for my parents 50th anniversary and it was so good."
"1","3","Cooked up nice and dark, and I loved how it rose high above my 9' pans while baking, but 40 min in a convection oven was too long. The edges got dry and nearly burnt. Overall the cake was a bit dry. I might try it again and cook for less time."
"1","5","Absolutely delicious! I will definitely be making this again. Thanks for sharing!"
"1","5","This cake is absolutely delicious and moist. You could easily use 3 9' cake pans. A light Chocolate Buttercream Icing is a good balance."
"1","5","Excellent! The cake recipe I was looking for so long. It is very moist and the dough has that dark color that I so missed in other recipes. No need to look for another one."
"1","5","This is such a great cake! I used chocolate soy milk instead of buttermilk. It came out PERFECT! So easy to make!"
"1","5","Yes! This is the cake I've been looking for! It is super moist, and has a very distinct cocoa flavour, not necessarily chocolaty. It takes just a few minutes to make, and keeps well for several days."
"1","5","This by far the best chocolate cake recipe I've ever used."
"1","5","Very good and very moist!!"
"1","5","Easy to make, moist and tasty. I substituted applesauce for oil. Iced it with the black ice icing, which tastes like pudding. Made a nice everday cake for snacks. I think if I had used a sweeter icing it would have made a nice bithday cake. Will make again since it was so easy. * Because I didn't have buttermilk, I used a quick substitute by using a tablespoon of vinegar in a cup of milk and let it set for 5 minutes. Worked great."
"1","5","Made this as cupcakes - cooked for about 20 minutes. This recipe is sweet, chocolatey, soft, moist perfection!"
"1","3","the cake came out like pack cake texture, it needed to be more moist. I had better chocolate cake. little disappointed."
"1","5","Never fails, moist and awesome! I find myself modifying all other chocolate cake recipes with what I think are the 2 standout ingredients in this one: Buttermilk and brewed coffee."
"1","5","perfecto"
"1","5","This is a great recipe. I am an amateur when it comes to cakes, but this recipe is easy to follow and the end result is magnificent. Although it is a bit hard to work with the cake -it comes out very moist- with icing or fondant, refrigerating it for an hour or two solves that issue.   I would recommend the recipe as it is, would not change a thing."
"1","5","moist and delicious mmmm!!!!!!!perfect chocolate cake"
"1","5","This reciipe is sooo easy and soo good. I can't give it enough stars. I didn't have any butter milk so I made my own using heavy whipping cream (from homemade butter search on this site). It turned out amazingly. My hubby thinks it tastes like a soft moist brownie. I used a chocolate frosting from this site as well. I recommend you try this cake. I will be making this cake into cupcakes for my neices 3rd birthday. Must try."
"1","5","Super yummy! Moist and delicious with wonderful flavor. There was nothing left after the potluck, my co-workers loved it!"
"1","5","This has the same texture as cake mix, very soft and moist. If you want something a bit more dense or a cake to carve, this is NOT your cake. I used Hershey's special dark cocoa and followed the recipe exactly. I also used whole fat buttermilk. One full recipe made 24 mini cupcakes, 12 standard cupcakes, and 1 6'x2' cake. It's not overly sweet, and I topped the cupcakes with strawberry swiss meringue buttercream and used the 6x2' cake to make a black forest cake. This peeled away from the cupcake wrappers just fine, but next time I'm going to grease my cake pan more generously since some of the bottom stuck to the pan."
"1","5","There is no other cake in the whole kingdom!!!!"
"1","5","I really like this cake. I wasn't a big dessert person until recently. My kids wouldn't put the bowl down and have been begging since it was made! Next time I will go with my gut and use cream cheese or buttercream frosting. I threw in chocolate chips that were left over from the cookies I baked as well. Love it and will make again :)"
"1","4","Great recipe, but didn't come out off the muffin pan, inspite of buttering the sides. Maybe the pan (Bundt muffin pan) needs to buttered and sprinkled with the crumbs. Nethertheless, I will definetely make this cake again."
"1","5","Best. Cake. Ever. (I top it with homemade cream cheese frosting)"
"1","5","The best chocolate Cake I ever made, very rich and moist!"
"1","5","This was the best chocolate cake! I made it for my son's birthday and everyone loved it! I made it exactly as written. Wouldn't change a thing! Thanks for the great recipe!"
"1","4","Made this recipe as cupcakes instead of a full cake; it was tasty and would make for a nice, light cake, but not a new favorite of mine for cupcakes. The texture is extremely light and fluffy-- definitely not a dense or fudgy cake for those who are looking for a little more heft, but the chocolate flavor is really nice. The only suggestion I might offer is to make sure that you're using a decent coffee; the flavor really comes through!"
