helpfulCounts,ratings,reviewText
"3820","4","This is a good peach cobbler - just the right spices and sweetness. You should note however the amount of baking powder - this is a very 'cake-like' cobbler. Also, the amount of cinammon-sugar on the top makes it very hard to tell when it is 'golden brown'. 'very thin' slices of peach also lead to a less chunky peachy cobbler than I really like, so you may want to make your slices reasonably substantial if you want good sized chunks of peach."
"3219","5","This is the best cobbler I have tasted! Family went nuts over it. Easy, too! I will make this again, for sure. I would include details on peeling the peaches for newbies. Place the peaches in boiling water for about 60 seconds, remove and plunge into cold water. The skins should slip right off."
"2339","4","This recipe is delicious. I have two suggestions to improve it though. First, I used fresh peaches from my boss's peach tree - some of them were quite under-ripe - and the recipe still came out very sweet. I will definitely make this again, but I will use a bit less sugar in the fruit and in the topping. Second, while the topping is super tasty (if a bit sweet), there's not enough of it! It doesn't need to be doubled but maybe 50% more topping would be great."
"1015","4","This is a very good recipe, but having been born and reared in the south, I remember all my mother's (and grandmother's) cobblers having a crust on top (not just spoonfuls dropped over it, but a full top crust.) Researching this in my mother's old recipe files, I found something interesting. This recipe is almost identical to hers, but steps 3 and 4 would be changed as follows: Combine 1 and one-half cups each of flour, sugar and milk. Pour this over the peach mixture. Sprinkle with sugar, with or without the cinnamon, and then dot with butter. Bake approx. 30 minutes.  I tried this recipe both ways, and my mother's way is an improvement. It is also easier, by the way."
"918","5","Coming from the Peach State, I'm really picky about peach cobbler. This recipe is fantastic! I made it with fresh peaches that were about to spoil in a day or two, so I ended up using all I had. This meant that I almost doubled the suggested amount of fruit, and even though I did not double the other ingredients, the recipe came out very well and I had none left over. So be generous with the fruit if you can!! Serve warm, with vanilla ice cream. Also, consider using other fresh fruits if peaches are not yet in season. I've made this with mangoes, blueberries, blackberries, and strawberries, and each time the results have been fantastic."
"470","5","This is absolutely one of my favorite recipes that I've tried so far. The ingredient proportions are right on the mark, and the procedure is so easy. I tried boiling the peaches to peel them, as suggested, but that didn't quite work out. Instead, I just peeled them with a knife, which worked out just fine and wasn't a hassle at all. When choosing peaches, be sure that they do not have any green on the skin -- this means the fruit hadn't developed before being picked, and it won't get any sweeter afterwards. The crust is unbelievable. When you pour in the boiling hot water, it immediately puffs up into a thick dough. This bakes into a thick, crumb-cake-like topping. The sugar amounts can be adjusted as desired. I found it to be just right. It is incredible with a scoop of vanilla or butter pecan ice cream (or both). My 'southern' gentleman companion, who has had his share of peach cobblers, really enjoyed it! Thanks for sharing this recipe."
"427","5","Made this fabulous dessert with my diabetic husband in mind for a church gathering. I used regular Splenda & Splenda Brown Sugar in place of the sugars, and served with sugar free ice cream. My husband couldn't get enough, and the non-diabetics loved it!"
"323","5","First, if you use salted butter cut back on the amount of salt that the recipe calls for by half otherwise the recipe will be really salty. Second, instead of baking it for thirty minutes cut that time in half otherwise it will be over done. Third, instead of 6 tablespoons of butter add 8 tablespoons. Other than that the recipe was really good."
"314","5","As a southern girl, I've had many variations of peach cobbler. This one definitely tops them all. I too cut my peaches into thicker wedges, 4 tbsp cornstarch and 8 tbsp butter."
"279","5","This is peach cobbler perfection! Delicious, old-fashioned taste. The brown sugar makes it so yummy and the crust has the perfect texture. I used 6 peaches and had ample filling. I highly recommend this recipe."
"273","5","We just loved this peach cobbler. I made it for my Mom's birthday, and it was quite the hit. We served it with vanilla Bluebell ice cream. If you make it in a 9'x13' pan like I did, be sure to increase the topping - maybe even double it. It is the best part of the dish, and we didn't have enough of it - several spots that were peach only. Also I'd increase the amount of cornstarch that is called for; we had a lot of liquid in the bottom of the pan that did not thicken up, nevertheless it was all delicious, and we'll definitely make this one again and again. We used a good vegetable peeler to peel the peaches - made the job a lot easier."
"134","5","Excellent! After trying many recipes, I think this is my favorite. I made it exactly according to the recipe other than using only about half of the amount of the cinnamon/sugar sprinkled on top.  For my own taste, I would probably cut down a little on the sugar next time, as my husband and I both prefer our desserts a little less sweet than most people.   I would probably also use more cornstarch, since it came out pretty liquidy. (But my peaches were a bit overripe and very juicy.)  A lot of people have commented that there isn't enough topping. The recipe calls for a 2-quart baking dish - that's an 8x8' pan. It sounds like a lot of the people are using 9x13 pans - that has nearly twice the surface size, so of course the topping isn't enough for that size pan. In an 8x8 pan, the topping was enough to just cover the top completely. With more batter in that size pan, the topping might not cook all the way through.   But with that said, I do agree that the amount of peaches was a bit much for that size pan and the amount of topping. I'd probably only use 6 peaches next time, for the same size pan. For a 9x13 pan, I'd probably increase the peach mixture by half, and double the topping."
"88","4","Very Good! Caution for those who are tempted to double the topping. The topping needs to be exposed to the heat in order to make a nice cobbler crust, so any dough that is unexposed to direct heat will be soft a gooey."
"87","3","This is an okay recipe. To me though, it's not a peach cobbler, it's peaches and biscuits. I live in the south and I don't know why this would be called southern peach cobbler. It was way to dry my family added cream to it just because it was to dry, and didn't have much of a taste. I followed the recipe as stated. I think next time I will be sticking to my old peach cobbler recipe."
"82","5","This came out really well... I had to double the recipe because I was cooking it for about 15-20 people! I went to the store only to find they had absolutely no fresh peaches! So I bought 7 bags of high quality frozen peaches. Defrosted them and followed the recipe exactly. Next time I may add another bag of peaches because there seemed to be much more dough than peaches... Oh and don't worry if the dough doesn't get all crumbly it should still come out just fine. I did have to cook it about 25 minutes longer than the recipe called for probably because I doubled it but I really also like a crisp top. Just pay attention to it towards the end to make sure you don't over cook the top. The cinnamon may make it appear as if it is golden and done but you really have to open the oven and take a good look at it to make sure. I have been now named the family's official cobbler maker! Thank you for sharing this really yummy recipe! I will be uploading a picture soon."
"76","5","Awesome topping-- everyone loved it. I skipped the 10 minutes baking the peaches on their own, and it turned out fine.  Also, I wonder why the recipe calls for boiling water-- I learned that everything needs to be COLD to create a tender crust. I used room-temp water, and the topping turned out great.  Thirdly, I'm not quick with a pastry cutter, so I opted to freeze my butter, grate it, and then freeze it again. This kept the butter cold and in little bits in the dough, which results in a tender topping."
"60","4","Wonderful and extremely easy recipe. The only changes I made was to use 1/2 cup of light brown sugar instead of 1/4 white and 1/4 brown. Also, as someone else suggested, used big slices of fresh peaches to feel texture. Last piece of advise on how to skin your peaches: 1. prepare a big pot of boiling water on high heat 2. Drop your peaches in and time it 55 to 60 seconds (and not a second more) 3.while waiting prepare a big bowl with ICE cold water with lots of ice in it 4. take peaches out of boiling water and drop them in ice cold one. If your peaches were ripe and you did everything right skin will slide right off the peaches. This is called blanching."
"44","5","This was my first time making cobbler and it turned out great!! I doubled the topping after reading the reviews and I'm glad I did it was the perfect amount. I also substituted white flour for whole wheat flour and added 1/2 cup oats to add a little crisp. I will definitely be making it again."
"42","5","I have been using this recipe for about a year now, and find that it is great with every type of fruit imaginable. I have of course used peaches, as well as, blueberries, blackberries, mango (was surprisingly good), cherries, and apples so far. I find this recipe to be very quick and easy for the results. Last summer I also made batches of the filling and then froze it, and had delicious cobbler all winter long.  When it comes to the topping I found that spooning in small little droplets (about the size of a grape), all over the filling netted the best result. It keeps the topping from being too thick in anyone place, and I generally have a bit of the topping left over."
"37","5","So good I almost slapped my momma!"
"34","5","Definately one of my new favorite deserts! I stuck to the recipe completely, though next time will use slightly more cornstarch as mine was still a little soupy. Here's what I did for the baking of it though. Put the peaches, and everything that goes with the peaches into a large cast iron skillet, cook on the stove boiling and letting it thicken for 8-10 min. Then scoop the cobbler topping on top and sprinkle with cin/sugar, same cooking as before.  p.s. do not forget to foil line a baking sheet to put under your dish!"
"27","5","Fabulous if you reduce the sugar. I took (as usual) other reviewers advice, and it turned out really, really perfect! I changed all of the '1/4 cup' sugars (with the peaches, and with the flour) to '1 Tablespoon' each, and it was still sweet, but pleasant. I also made an extra half of the topping (ie: 1.5 cups flour, 1.5 Tbsp white sugar, 1.5 Tbsp brown sugar, etc)  For the sprinkle on top, 1 tsp sugar and 1 tsp cinnamon is plenty."
"26","5","This was delicious! the crust was soft and sweet... i used fresh peaches even though they are nowhere near in season, but the whole thing, top to bottom came out delicious. will definitely use this again."
"25","5","Make this once and you will get requests to make again and again. I have to confess though, I have never actually used fresh peaches. Either because they aren't in season, or I'm just feeling too darn lazy to go to the trouble. If you are a lazy bum like me, just make sure and drain the peaches real well. I think I use about 3-4 cans of the kind that is in juice, not syrup. Also, serve with vanilla icea cream to get the full experience. My boyfriend and his daughter request this for their birthday instead of cake."
"21","4","I'm not a peach cobbler fan but this was good. I added 2 cups blueberries and some cinnamon to the peaches and used a few tablespoons of flour in place of the cornstarch. As others suggested, I lowered the heat to 375 after baking the peach mixture at 425 for 10 minutes. The peaches were not mushy at all and the topping was nicely browned."
"20","5","Wow! This is a beautiful, easy to do cobbler! I don't even LIKE peach cobbler- but my family does. The topping is what does it for me. Thank you again to the person who suggested the boiling water method of removing the skins of the peaches- they literally slid off! No wasted peach!  I doubled the recipe and I added a handful of raspberries- it was incredible and gave the cobbler some eye-catching color and tartness. This is the only peach cobbler recipe I will ever use again."
"19","4","Well, I'm from the South and I thought this was a little too sweet as written. If I make it again, I will definitely decrease the sugar somewhere (maybe also leave off the extra sugar in the cinnamon/sugar mixture that gets sprinkled over the top. If anyone uses the boiling water then cold water method to remove the skins, make sure you either do one at a time (removing the skin/chopping up one peach while another one is boiling) or take them out of the cold water immediately. I did all of my peaches at once and then let them sit in the cold water as I did them one at a time. The first peach worked beautifully - skin came right off. The subsequent peaches were harder and harder to get the skins off, until ultimately it was like I didn't put them in the boiling water at all. So I think you have a 'time limit' in which to get the skins off once you've put them in the cold water. I used 7 peaches and had enough filling. I also used 5 teaspoons of cornstartch, which kept my filling from being runny."
"16","5","Very good cobbler, the only suggestion I have is to cut the sugar/cinnamon mix that you sprinkle on top in half, the stated amount is way too much and makes it impossible to tell when the cobbler is golden brown."
"16","5","I really enjoyed this recipe. The only two changes I made were not hugely significant: I had some nectarines on hand as well as peaches so I used half nectarines and half peaches. It turned out great. The other was that with the extra 2 Tbsp. of butter left over from the cube of butter I pinched little pieces off and dolloped them onto the cobbler dough before baking. I don't know if this made a difference in the texture or not, but the cobbler was delightfully crispy and delicious. One thing I thought was strange though was what is the point of taking the time to cut the butter in when the point of cutting butter is to create a pastry like dough, but since you pour boiling water into the dough it just melts the butter, making the dough less pastry-like and more biscuit-y (not a problem for me, but just thought I'd mention it)? I will definitely make this recipe again!"
"15","5","Edit: I should also say I used a 9x13 pan and this time I did 1.5 the amount of topping. The topping is wonderful. Original: This is amazing! I didn't change a thing other than cooking it for only 25 mins the second time. This is the peach cobbler recipe for me! I picked up a tip from another peach cobbler recipe on this site: to get the skins off, take a pot of boiling water and put the peaches in it for about a minute. Carefully remove them from the water and let them cool slightly. The skins peel right off! And it's also really easy to cut them apart too."
"15","5","This is a great recipe. My husband loved it. I think next time I will use a little more peaches because we like our cobblers a little thicker."
"14","5","Very, very yummy!! I used two bags of frozen peaches and it turned out VERY good! I'm sure fresh Georgia peaches would be 100x better, but in the dead of winter frozen peaches worked fine."
"13","4","This is a wonderful recipe! I wasn't happy with the topping so I made my own because this batter is thick and didn't look very pretty. Used crumb topping consisting of brown sugar, flour, cinnamon and chilled butter. I covered it lightly with foil half way into cooking so the topping wouldn't burn......amazing!"
"13","5","This was an excellent Cobbler. I made minor modifications, based on other reviews..Added an extra 2tsp of cornstarch, lemon zest and 1 tsp almond extract to the filling, as well as 1 cup of blueberries. For the topping, i made 1.5 of it, and baked it all in a 9x13 dish. Delicious!"
"13","5","I tried this for a potluck, so I decided to increase the serving size to 12. I also used Del Monte's Orchard Select Peaches (jarred) which are amazing! The initial peach mixture had more liquid which I expected from canned peaches, but I added a little more cornstarch than called for, and sprinkled a couple handfuls of oats over the peaches to help soak up some juices. The breading soaked it all up nicely, and the whole dish came out moist and delicious! I got rave reviews at the potluck!"
"12","4","I love me some cobbler, and this recipe was a big success. I did, however, make several changes based on a pretty thorough review of the other reviews... 1) I did not bother to peel the peaches, 2) I cut bigger chunks rather than thin slices, 3) I cut the sugar for the fruit part in half, 4) I increased the topping amt made by 50%, 5) I also cut the sugar for the topping in half, 6) and I should have just mixed 1 TBS of sugar with the 1 tsp cinnamon for the final topper, I threw out most of the sugar/cin mix I had made b/c it would have been way too much. A lot of changes, but the recipe came out super yummy!"
"11","4","My family is known to have one of THE best Peach Cobblers in the State of Texas. This filling closely resembles what we typically put in a cobbler, so I knew right away it was going to be a winner. The only reason I didn't give this a 5star was because I thought it deserved some BUTTER! I put half a stick of butter in the filling, because I like a juicy and buttery tasting filling. It came out great! The crust was DELISH and I will be making this again! I will likely be adding some ground up walnuts and oats to the mixture for an added layer of flavor. But even if you don't this recipe is a winner! Also, I used canned peaches....I used one can plus the juice of another can. LOL YES, I like it juicy. I can't wait to fix this again!"
"11","5","Flavor is divine. I like more pie crust type cobblers, but this will definitely do! I found that the peach to dough ratio was just fine, added a tsp vanilla to peach mixture and added extra cornstarch as recommended. I'll do without extra cornstarch next time because I think the dense crust needs the extra juice. Thanks!"
"10","5","I was really torn between the drop-biscuit type of cobbler or the lattice top, but I'm soo glad I went with this one. I only used 6 peaches and had plenty of filling. I made 1.5 the amount of topping because that's my favorite part, but that's just personal preference, the amount stated in the recipe would have been just fine. I threw in a bit more cornstarch only because my peaches weren't all ripe. This turned out perfect! My grandpa who's from the South raved about this! However, I do have to add that peeling the peaches were the biggest pain in the butt! Boiling them and tossing them in iced water only worked for the really ripe peaches, I'd suggest a vegetable peeler. Also, I think canned sliced peaches would work just fine--I doubt many could tell the difference. Anyhow, absolutely delicious! Thank you!"
"10","5","Slap yo mama good! Easy as heck, peaches are way toooo expensive, frozen was too, so I used canned and they turned out GREAT! First time I left some of the canned juice in it, but there really isn't a need for it! If you want more 'cake' double the topping recipe, although I love it just the way it is! By accident when I made this the first time i did not read the instructions thoroughly, so I sprinkled with BROWN sugar and some cinnamon. 2nd time I did it the right way (with white sugar) and loved the brown sugar/cinnamon more!"
"10","3","Maybe my peaches weren't as juicy as everyone else's, but if I didn't add much more liquid I would have had cinnamon flavored paste with my peaches. After having to tweak the filling part of the mixture as much as I did (I added a couple of pats of butter, 1/4 c milk, and 1/2 cup water -- wanted to add some brandy for depth of flavor, but didn't want the extra calories), I just used my regular Bisquick cobbler topping (1 c Bisquick, 1/4 c milk, 1/4 c sour cream 2 T sugar). The end result was wonderful, but improvising made it turn out well. Of course, I don't think my peaches were from Georgia, so that probably had something to do with it! ;~)"
"10","5","I work as a baker in a middle school cafeteria and was looking for something different than the normal crust we use for cobbler. I used this recipe's topping for 100 servings of blueberry cobbler and without fail, everyone who ate it said it was the best they had ever eaten (missing vanilla ice cream only). Thank you very, very much."
"10","1","I made this cobbler for a church social we were having. I had great hopes in it turning out well with all the good ratings it had recieved. But I must say I was Very Disappointed in its turnout.The overall look came out too dark from the cinnamon mixture{easy fix}. On serving, I noticed it was a bit runny.Although, the following day after refrigeration,that wasn't the case. But the one thing I cannot ignore: the batter cooked up bitter. Baking powder most likely the culprit. The peaches taste was pretty good , something to work with. But the batter is a total DO-OVER. It was not a scrape down to the bottom item at church, which usually occurs."
"9","5","Excellent recipe! As written, the recipe provides a little less crust than I like so I just increased the crust ingredients by 50% the next time I baked it and it was perfect. Also, it is a bit sweet so if you prefer a more tart cobbler you can decrease the sugar a little."
"9","5","This was FABULOUS!!!! I took it to a gathering where there ended up being 5 fruit desserts (cherry pie, apple pie, raspberry tartlet, etc.) and it was the only one that got RAVE reviews! I did do two alterations - 1. I increased the topping to about one and half times as others had suggested. 2. I used 6 peaches and a pint of blueberries since I had them on hand and it sounded good to me. Everyone LOVED it - I even got a 'this is just like my grandmother would make!' Definitely a keeper recipe."
"9","1","I was very disappointed with this recipe. The batter of the cobbler turned into more of a cake consistency, and did not have much flavor. I typically make a cobbler with more of a streusel topping, but wanted to try something different. I would not make this again."
"8","1","I followed the recipe exactly, except that I accidentally put 3 instead of 2 teaspoons of cornstarch in it (accidentally grabbed the 1.5 teaspoon). It was a runny mess. Peach soup as another reviewer described it. There was more peach juice than anything else. The peaches were floating and the dough was sinking. Even the accidental extra teaspoon of cornstarch didn't help to thicken it. The crust was still raw after 30 minutes @ 425 but the sugar topping was starting to burn."
"8","5","This was fantastic! Only thing I did differently was used 10 peaches, and cut them into small chunks (was feeding 7 people.) I baked the first half at home, then waited to bake it the final 30 minutes until I was at the house where it would be consumed. Let it cool for about 20 minutes before we topped with vanilla ice cream - so yummy and simple!"
"8","5","This is a classic recipe which is fine as written. However, like any similar dish using fresh fruit, your proportions often should be adjusted slightly based on the size of your fruit and the degree of ripeness. I slightly under-measured my sugar as my peaches were pretty ripe and used a tiny bit less baking powder. I also used a little less white sugar and made up for it with more brown sugar, just because that is my preference in a recipe like this. The only thing I wish I'd done differently is to spread the batter more thin over the top because it was a bit thick in places, but that's easy to do next time. All-in-all, a 5 star classic!"
"8","5","I really enjoyed this recipe - and I'm not a big cobbler fan! It was a little sweet for my liking, so the second time I made this I cut back on the sugars just a tad. Oh, and fresh peaches make all the difference in the world! Thanks for sharing."
"8","5","This is completely delicious! The only change I made to this recipe was that I only used 1/2 teaspoon of baking powder because I didn't want too cakey a cobbler. I also slightly reduced the quantity of sugar - maybe using only 3 tablespoons of white sugar and 3 tablespoons of brown sugar. Also, I followed what another reviewer said and boiled the fresh peaches for 60 seconds before taking off the peel. It was definitely easier after boiling them to remove the peel but I also peeled a few with a vegetable peeler with no trouble. This cobbler tasted absolutely amazing. Both my boyfriend and I loved it."
"8","5","Just Wonderful!! Why would I make pie when it much easier to make cobbler. Doubled Peach filling except for the sugar and made 1 1/2 times the topping. Baked in a 9x13 glass dish and served with homemade vanilla ice cream. It doesn't get better than this!"
"8","5","This is the cobbler recipe I've been searching for! Easy to make and delicious. The topping is perfect. I served it for dessert tonight and my family couldn't get enough. I was hesitant to put the cinnamon sugar on top because I thought it would be too sweet. I didn't quite use the full amount but it complimented the dish nicely. I will definitely make this again. Thanks Amy!"
