helpfulCounts,ratings,reviewText
"2376","5","I made 2 cakes. The 1st one wasn't very appealing but it tasted great. The 2nd one looked beautiful and tasted even better. What did I do different the 2nd time? I read the cheesecake techniques article found on this website. I wrapped foil around the bottom of my pan & placed the pan on a cookie sheet. Then I filled the cookie sheet w/water. I baked the cheesecake for an hour then turned the oven off & let the cheesecake sit in the oven for another hour. This prevents the cake from sinking in the middle. Everyone loved it! It was delicious and I can't wait to make it again."
"1614","5","This recipe got rave reviews from my family on Christmas! One tip, which made this even easier to make: I used seedless raspberry jam instead of cooking the raspberries on the stove. I just microwaved 6 tablespoons of jam for 30 seconds before adding to the cheesecake. It was so much easier and tasted fantastic! I also microwaved the white chocolate with half-and-half with excellent results. I will definitely make this again! Everyone was so impressed!"
"973","5","This is SOOOOOOOOOOO delicious -- I've made it three times now, and it is already legendary within my extended family! :-) Just a couple of recommendations: definitely double the amount of cookie crumbs used for the crust; one cup barely covers the bottom of the springform pan. If you're using smashed up Oreos for your chocolate cookie crumbs (which is what I do), then you don't need anywhere near as much butter or sugar in the crust; the Oreo creamy filling provides lots of sweetness and stick-it-together-ness. I use 2 cups crushed Oreos, only one tablespoon sugar, and 1/4 cup melted butter -- the crust comes out perfect that way. Also, I'm not sure if I just have delinquently leaky springform pans or what, but the first time I made this, I ended up with melted butter dripping down from the bottom of the pan all over the bottom of my oven (quite a mess). Now I put a jelly roll pan on the oven shelf below to catch the dripping butter, and all is well. :-) I have ended up with a few cracks in the top of the cheesecake each time I have made this, but once I pile on tons of white chocolate shavings/curls, no one is the wiser! This cheesecake absolutely could NOT taste better -- people go CRAZY over it."
"433","5","Loved it. I'm making this for the THIRD time tonight! Everyone who tried the last one said it was better than my mom's cheesecake... and that's saying a ton!   A couple things though.. make sure you check it 15 minutes early. If it looks done in the over it will be OVER DONE on your plate! Tap the side of the pan with a spoon and if it jiggles as 'one piece' rather than like jello, it's done. if it doesn't jiggle at all it's over done.   And, If you're using a springform pan, you can put prachment paper on the bottom and it will just slide off the pan easly when it's time to cut it.   And as for cutting perfect, clean pieces - run a clean, long, thin knife under hot water. Quickly dry it off with a towell and slice straight down and out. Repeat for EVERY SLICE! Yes, it will take a while - but you'll have beautiful, perfect slices. ^_^"
"390","5","I used 2 cups of Oreo crumbs (I put them in my food processor, cream and all) , 1 Tablespoon sugar and 1/4 cup butter for the crust in a 10 in springform pan. I also used seedless raspberry preserves and that significantly decreased the time I spent making this cheesecake. Heating the preserves up slightly in the microwave (10-15 secs) makes it very easy to drop in the batter. I was very easy and it came out very pretty and delicious."
"316","4","I have made this cheesecake twice now. The first time i made it, I too, had a lot of trouble getting the raspberry seeds out which made the 'raspberry swirl' almost non-existent, however, it tasted wonderful. The SECOND time I made it, I made just a few changes. I made it in a 10' springform pan, and used 4 cups of white chocolate chips to give it extra white chocolate flavor. I also doubled the water to make the raspberry sauce and added 3.5 tablespoons of sugar, which made it drain out and taste wonderfully! I will always make it like that now, and encourage everyone to try this recipe no matter how they make it, or what alterations they make!"
"229","5","I made this for my sister-in-law's birthday and it was heavenly! It has a creamy texture with undertones of white chocolate and raspberry. My sister-in-law said it tasted 'professional.' I doubled the crust using 2 cups of Oreo cookies, 1/4 cup of butter and 1 T. of sugar. Double the raspberry sauce. It's easier to puree the raspberries with the sugar, press the ingredients through a fine-mesh stainer and then cook it. I added 6 T. of raspberry sauce to the cake without it overpowering the taste. The white chocolate and half-and-half can be safely microwaved on HI for 1 minute, stirred throroughly, microwaved and stirred thoroughly. 2-1/2 to 3 minutes should do it. To prevent any leakage, I use a 9' x 3' cake pan. Spray the bottom with Pam, add parchmant paper to the bottom and spray the parchmant. Cook the cheesecake in a water bath for the designated time. Remove from the water bath, carefully loosen the sides of the cake with an offset cake knife, then immediately refrigerate - uncovered - until morning. Never a crack. To remove the cake from the pan, heat water to almost boiling and gently dip the pan in (about 1') for 10 seconds. Turn the pan over on a large flat plate, tap the bottom and lift the pan away from the cake. Invert cake onto serving plate. If cake stays in pan, repeat the process. The cheesecake will not fall. I always do this with excellent results."
"202","5","This is an EXCELLENT cheesecake! I made it for my family Christmas dinner and everyone just raved about it! I would not change a thing on this recipe! I plan to make it for New Year's Eve! A cheesecake tip, when the cheesecake is almost done, turn off your oven and open the oven door. Do not take it out until the oven and cheesecake are completely cool. This will avoid cracks."
"164","5","This is a great recipe--everyone I've served it to, loved it. I use oreos for the crust. Put them in a ziplock bag and crush them with a meat mallet and rolling pin. Also, blend the raspberries and water in the blender and strain the berries before you make the sauce, much easier to get the seeds out. Save out a few raspberries to stir into the sauce that goes on top just before serving. Nice with a bit of white chocolate melted with a little bit of milk and drizzled on top."
"148","5","I already rated this recipe , I have to come back and say ,this is the ultimate recipe .Everyone who has a piece of this cheese cake can't get enough of it.. We love it..... and it always turns out great...."
"78","5","By far the most amazing cheesecake that I have ever eaten or created. I (the husband) find that for any special event, it’s requested that I bake this. Here are some tips however. 1) Multiply the crust recipe x1.5. I have found that if you use what’s specified the crust will be a little thin. And use Oreos! (Crush them in a freezer bag with a meat mallet. 2) You can use raspberry preserves (seedless) and save yourself some time w/o sacrificing quality. 3) Place parchment paper on the bottom of the spring form pan. This will help moving the cake without damaging it. 4) Bake at 325 for 60 minutes and submerged in a water bath. This is key as it will keep the sides from burning. 5) After 60 minutes, turn the oven off, prop the door open 2 inches and let the cake cool in the oven. (Approx. 1-2 hours) This will keep it from sinking in the middle."
"65","3","Don't know where I went wrong, since everyone else is raving about this. I baked mine for 60 minutes. I cooled, then chilled it for 24 hours. When cut, the center was very mushy. It's like the raspberry sauce had soaked into it. On top it looked beautiful (see picture) so I was very surprised that it didn't hold its texture well. I served it at a guild function, and there wasn't one 'swoon' which these ladies do for great, decadent desserts. Not one request for the recipe, which is always the usual course of things (as a chef, I hate being asked to give out recipes. It's like asking a doctor to give out free prescriptions. But with this recipe, I didn't have to worry - no requests.) It tasted fine, though nothing spectacular. The white chocolate cannot even be tasted, especially disappointing since I used expensive, imported Belgian white chocolate. I shouldn't have bothered. I've made many other cheesecakes, including just straight ones with no specialty flavorings, that were much better. I'm a chef, and have worked extensively as a caterer and pastry chef, so no rookie here. As cheesecakes go, this was merely OK. Not bad, but certainly not exceptional. I know that flies in the face of all the other glowing reviews, but I'm being completely honest. At best, I'd describe this as aggressively mediocre."
"54","4","Great recipe!!! Here's the solution for cracking...first, make sure your ingredients for the batter is at room temp before mixing. Also, DO NOT over work the batter especially when adding the eggs. Air will get trapped in the batter and when in the oven the air pockets expand and try to escape...thus, creating cracks on the surface. Also, when cooling, DO NOT put it in the refrigerator right away. Give it time to cool first. The cake will shrink too fast and create cracks that way too. Happy Baking!"
"51","5","The taste is awesome. I didn't have enough experience with cheesecakes and so it didn't look perfect. I had trouble getting the cake out of the pan. It didn't crack and it wasn't lumpy thanks to all of the tips., the raspberry sauce was bang on and is worth the extra time. I just wish I would've discovered some more tricks about baking a cheesecake. Here is what I discovered: Greese the sides and place wax paper on the bottom of the pan. Must use water (HOT) bath for even cookings 1' of water on a cookie sheet. Wrap the pan in foil so water doesn't seep through. DO NOT OPEN THE OVEN AFTER BAKING FOR 1 hour, leave the cake alone. After the initial 1 hour baking and the 1 hour resting time in the oven then transfer to refrigerator. Run a knife around the cake after it comes out of the oven so it doesn't stick to sides. Take dental floss and slide it through the bottom like you would a spatula if it gets stuck like mine did. Also mix the frozen raspberries water and sugar together and after it becomes melted then run through the wire strainer and then add the cornstarch to thicken. Check for sweetness I had to add more sugar to the raspberry mixture. Lastly, I cooked the crust first for 10 minutes and let it cool and then filled it with the cheesecake mixture. IT IS WONDERFUL AND I WILL MAKE THIS OVER AND OVER AGAIN!!!!!!!!!! THANK YOU TO WHOMEVER ORIGINALLY SUBMITTED THIS"
"47","5","Beat the eggs before mixing with the cream cheese.. One of the reasons cheescakes crack is because too much air is incorporated into the mixture.."
"44","5","I made this last week with a few changes. I used real white chocolate as I wanted a more authentic flavor. I used 8 blocks of the Baker's but felt that rendered just a little too subtle flavor, will use 10 next time and go from there. Also, I used the raspberry jam per other's advice. If you melt it slightly and drizzle it on (you can't let it drop in big chunks or it will sink and not mix in well) it will marble better. To do this I drizzled the jam back and forth in parallel lines, then added the top layer and drizzled the same way. Then turning the pan perpendicular to the jam lines, ran the knife gently through (make sure you go all the way to the bottom) using a back and forth motion (do not take the knife out of the cake as you do this)-the marbling turns out beautiful. My family loved this one and hubby commented on how great the cake looked with the marbling."
"42","5","This recipe is fabulous! I've made it several times, including for a bake-off contest at work -- it won 1st prize! I use chocolate graham crackers for the crust, and instead of pureeing fresh raspberries I use a 10-oz jar of seedless raspberry jam, microwaved just enough to make it spreadable. Garnish with whole fresh raspberies, white chocolate shavings & drizzle with dark chocolate ganache (microwave 1/4 c. Hersheys special dark chips with 1 T. heavy cream till melted, stir till shiny & then put in a zip-top bag; snip off one corner & squeeze to drizzle over the top of the cake.)"
"28","5","Incredible! I doubled the cookies for the crust, based on previous reviews and found that they were right. One cup just wasn't enough. I also cut down the sugar and butter on the crust and left the Oreo cream in - It does hold together just fine. One thing that is not listed in the ingredients is extra white chocolate for shavings and/or raspberries for the topping. Another hint: be sure to follow the cheesecake rule of thumb and line your springform pan (bottom and sides) with wax paper and place the foil lined springform pan in a jellyroll pan with about 1/2' of water. When the hour is up, turn off the oven, leave the door slightly ajar and allow to cool for another hour before removing and putting in the fridge. This is a foolproof method for all cheesecake recipes to avoid cracks and sinking. This recipe is very rich. Thanks for sharing!"
"23","5","Loved this cheesecake!! I think I read every single review and followed several tips. I made two cheesecakes, the 1st as a practice one that I sent to work with my husband, and the 2nd for my family on Christmas eve. I made the 1st one using seedless raspberry preserves, and the 2nd using the frozen raspberry sauce, think I would recommend using the sauce if you have the time - better raspberry flavor and the preserves were a little thin and sunk into the cheesecake. (I think this may have caused the crack in the finished cheesecake as I followed the same baking technique in both and the 1st was the only one that cracked.) I also reduced the amount of butter in the crust by a tablespoon and used a little over a cup of crushed chocolate graham crackers, the 1st attempt had butter leaking through the springform pan, as other reviewers have said. Also, be sure to scrape the bowl as you are mixing the cream cheese to avoid any lumps. Looked great and tasted even better - got awesome reviews from my family and my husbands coworkers. One more thing, to make this cheescake fill my 9x13 in pan better, I added another pkg of cream cheese, an egg and a couple Tbsp of sugar to the recipes. Turned out great!"
"23","5","This is AWESOME!!! Whenever I make this, people always ask, 'Did you really make this??' It is SO delicious and SO beautiful. It has a silky, creamy, heavenly texture and the flavor is utter bliss. This is truly not only the most delectable cheesecake, but the most beautiful cheesecake I've ever seen or made. I always make and add extra raspberry puree. I also press finely chopped toasted almonds around the entire outside of the cheesecake. Then I garnish the individual slices with homemade whipped cream, fresh raspberries and blackberries, sprinkle it with white chocolate curls and shavings and some chopped almonds, and then drizzle it all with a good quality melted bittersweet chocolate. A wonderful dessert that makes the moment and the people you make it for feel special..."
"22","5","The white chocolate chips added such a unique flavor and texture I never would have expected. This recipe was not as difficult as it sounds either. Yum!"
"22","5","I am quite embarassed to say that 4 of us ate the entire cheesecake within 2 hours...maybe there is such a thing as 'Too Good'!! :o)"
"22","5","As others have mentioned, this recipe does require quite a bit of preparation, but well worth it! I am a big fan of the Olive Garden's white chocolate raspberry cheesecake, and this tastes just like theirs! I made the cheesecake with Godiva White Chocolate, and served it with whipped cream and white chocolate shavings on top. Everyone loved this cheesecake!! I also mixed graham cracker crumbs and oreo cookie crumbs for the crust. Also, the idea of a water bath scares me a little, so I found a tip to cook the cheesecake with a pan of water directly underneath. When cooling, leave the cheesecake in the stove, and crack the oven door, and cool for six hours this way. This will minimize cracking."
"21","5","This cheesecake is absolutely fantastic! I read the reviews before making it and made the following changes to the crust as suggested- 2 cups crushed Oreos, 1 tablespoon sugar, and 1/4 cup melted butter. I also read that people were having a hard time straining the sauce so I cooked and continuously stirred sauce until berries were melted, strained it to remove seeds while it was still thin, then returned sauce to clean pan and allowed it to reduce. If you wait until the sauce is thick to strain the seeds it will be much harder! I also baked it as suggested by another review by wrapping the cake pan in foil and placing it on a broil pan, added water to broil pan, cooked for one hour and turned off the oven and allowed the cheesecake to sit for an hour. Only other suggestion it to allow your cream cheese and eggs to sit out for at least an hour before you make this. Room temp ingredients are key!"
"20","5","Brought this to an adults only birthday party and it was a HUGE hit. It was only my second cheesecake and I was apprehensive because my first attempt (using a different recipe) cracked. I followed all the tips and the result was very professional in appearance. I doubled the raspberry sauce recipe and poured it all over the finished (uncracked) product. I used the leftover white chocolate chips by melting them and pouring them into a wax paper lined bowl, allowing the chocolate to harden into a block. Using my vegetable peeler, I decorated the top of the cheesecake with white chocolate curls. It was beautiful and delicious. Thank you so much for this recipe!"
"18","5","I put the thawed raspberries in a food processor with the 1/2 cup of water and then strained them with no problem. Then I cooked them on the stove top with the sugar and cornstarch until thick, left it cool a little and spread it on top of the cooked and cooled cheesecake. I just felt like I needed something else on top so I did a search and found a big snowflake at southernliving.com. They even have a stencil to print out. I always do a water bath for cheesecake and they never crack."
"18","5","Amazing cheesecake recipe! However, even the best recipe can yield a less than perfect cheesecake if made with improper technique. Bring ingredients to room temperature before beginning. I doubled the cookie crumbs in the crust and used nearly a whole package of Oreos, but left butter the same. I also didn't bother making my own raspberry sauce, seedless raspberry jam works beautifully and saves a ton of time. Be careful not to over beat the batter as this will incorporate too much air and may cause cake to fall. Preheated oven to 350 and turned it down to 250 immediately after I put cheesecake in oven. Baked in a water bath for 1 1/2 hours and then turned oven off. Leave cheesecake in oven for at least 3 hours to cool slowly (this prevents it from falling and cracking). Once cheesecake is cool, refrigerate until ready to serve. I've made this twice now and received rave reviews each time. This one is a keeper! Thanks a million, CindyAnn!"
"17","5","Cake is great, not hard, just a pain in the but. Think about having to get rid of all the seeds in the raspberries. Good though. Get cookie crumbs from the baking section as opposed to chocolate wafers from the cookie section. That's 40% of your time right there!"
"16","5","One of the best cheesecakes I’ve ever made. I am not a fan of white chocolate, but that ingredient seemed to help the texture more than the flavor the cake. It’s very creamy and not too sweet. I compiled a list of the tips I followed:  -I used 6T of heated seedless jam (not jelly, not preserves)  -22 Oreos (regular – not double-stuff) with ½ stick butter made a great crust.  -I lined the pan with waxed paper, wrapped the whole pan in foil (for water-proofing) and placed the pan on a cookie sheet filled with 1/2' water.  -After 55 minutes of baking, I turned off the  oven, opened the door and let it cool completely in the oven.  -I made it the day before so it could thoroughly chill.  -I cut it with fishing line, then used a thin knife to slice the cookie crust."
"16","5","I work at the Olive Garden and was determined to make a cheescake just like the one we serve. THIS CHEESCAKE IS ABSOLUTELY DELICIOUS!! My mom went CrAzY over it, and my dad, who ONLY likes plain cheesecake, LOVED IT!! I couldn't stop eating it yesterday... I ate it for dessert after every meal and snack hehe =) For the crust I used the chocolate cookies from Oreo's and scraped out the filling. I also made a Raspberry sauce with my frozen raspberries: 2 1/2 cups raspberry juice, 1 cup sugar, and 4 teaspoons cornstarch. Delicious!!! It's even better every day it sits in the refrigerator. Make sure you wait at least 8 hours to eat like it says, it's much better after that!!"
"15","5","This is a wonderful cheesecake. Very light and delicious. I used pre-packaged Oreo cookies crumbs. They were actually $1.00 cheaper than the chocolate wafers and already crushed. I had to bake 20 minutes longer than recipe specified. I whipped 1/2 pint of heavy whipping cream 2 tablespoons of sugar and 1 teaspoon instant white chocolate pudding and piped it on top with a pastry bag, drizzled on raspberry sauce and topped white chocolate curls. It looked professional and like it was a lot of work when it really wasn't. Don't hesitate to try this recipe!"
"12","5","This cheesecake is absolutely sublime. While others may have complained it was difficult to make, I found it very easy and feel that something as delicious as this recipe is certainly worth the time and effort. I used frozen raspeberries from my garden and used cheesecloth in a strainer to remove the raspberry seeds with little problems. If you are looking for a divine dessert, do not hesitate to make this!"
"11","5","no surprise here, 5 stars isn't enough for this wonderful dessert! I used seedless raspberry jam and it was perfect! nice creamy texture and no cracks thanks to my waterbath. thanks for a great recipe!"
"11","5","I didn't add the raspberries and just made the cheesecake and instead of oreos (not a huge fan of that cookie or its crust) used golden oreos instead. Bought smuckers strawberry topping for the side if people wanted it and made a combo of sour cream/brown sugar as an optional topping too. Plain or with a fruit topping or sour cream topping very good and for me pretty easy to put together. Follow the cheesecake tips on this site and you won't be sorry such as making sure your cream cheese at room temp, eggs at room temp add those one at a time, and a water bath etc. really help with the end result esp. texture. And don't over beat! Also not a bad idea to cover the bottom and a bit up the sides of the ban with foil just in case of spring form pan leakage."
"10","5","'This is the best cheesecake I think I've ever eaten,' is what my sister said while eating this cheesecake which happened to be the first cheesecake I ever  made! I did research ALOT before making this cheesecake and I changed it up to a BLUEBERRY and white chocolate cheesecake instead of the raspberry ( which also meant that I didn't have to deal with those pesky seeds ) besides the cool factor of the blueberry cheesecake versus a raspberry or strawberry, the taste and texture were off the charts with this recipe!!! TIPS that helped me achieve cheesecake perfection were... Filling a muffin tin half full of water and baking cake on top of that to keep moisture in oven while cooking without making the crust soggy. Also I took some other advice to preheat oven to 350, then right as you put your cake in turn the oven down to 250 and bake for an hour and a half versus one hour. After the hour and a half were up turn the oven off, keep the door shut and leave cake in for 3 additional hours before moving in to the fridge. My very first cheesecake did not crack or sink and it was AMAZING!!!! I also found a simple recipe for a white chocolate cream sauce and instead of topping with remaing fill made earlier, I made the warm cream sauce, poured it over whole frozen blueberries (let them sit for a minute so that the warm chocolate cream sauce could warm the berries a bit), and spooned it over each individual slice. My friends and husband were in awe :)"
"10","4","It was just okay. The raspberry sauce did not make alot. It really tasted like a cheese cake, I could not detect the white chocolate/rapsberry."
"10","5","This cake was just superb! I baked it in a waterbath to prevent cracking, and it came out perfectly although it did need to be baked longer given that heating in a waterbath is a gentler method of cooking than baking straight in the pan. To garnish, I placed a few raspberries in the centre of the cake before serving, as well as resting some long white chocolate curls on top of the raspberries. (To make the curls I melted some white chocolate in a long strip, about 3 inches wide. I then let the chocolate sit for a few minutes until it was slightly firm, and took a long knife and scraped it against the chocolate. The chocolate was still malleable enough to shape it into lovely curls). I made it for my boyfriend when he had friends over, and everyone was surprised when they found out I baked it- they thought it was store-bought! Definitely worth the effort!! Thanks, Cindy:o)"
