helpfulCounts,ratings,reviewText
"761","5","These are EXCELLENT!!! Some of the best cookies I have ever made. I did make a few changes--half margarine/half shortening (I do this with all of my cookies...for some reason my cookies can turn out flat as frisbees, this prevents that from happening), and I did half brown sugar/half white sugar. The end result? OMG, cookies of divine chocolaty-ness, to die for. Better than the local bakery's chocolate chocolate chip cookies. I'd give it more stars if I could. Happy eating!"
"607","5","Great recipe just as written. Whenever a cookie recipe calls for butter I always chill the dough for an hour or so before baking as this prevents a flat cookie. The taste of butter can't be beat! The chocolate chips and nuts can be substituted with any variety of options...this time I used two King Size Hershey Bars with almonds, but vanilla chips, dried cherries, etc. could also be fun to try. Great recipe, great cookie. Thanks for sharing!"
"444","5","Ooo-ooo-oooh! Marvelous little bites of chocolate heaven. After reading previous reviews I was concerned about dryness after the first day so I used half butter and half butter-flavored shortening for the fat. Since I was using a small cookie scoop, I used mini chocolate chips (baked for 8 minutes)...all I can say is they are perfect for a chocoholic like me. For those who don't know this tip: Line your baking sheet with regular old aluminum foil and you'll have no problem with cookies sticking. Use a new sheet each time then slide the foil onto newspapers to cool slightly before removing cookies to wire racks. Thank you for the perfect recipe!"
"313","4","A little update - it has now been more than three days, and the cookies are still wonderfully soft and chewy in my airtight cookie jar. Also, if your cookies do dry out, try putting a slice of raw apple in there with them. They'll soften up soon. This apple trick also works for gingersnaps or any other cookie that gets hard quickly. It also works for brown sugar that has hardened. Don't leave the apple in there so long that it spoils, of course!"
"165","5","I used 1/2 cup butter and 1/2c shortening instead of the 1 cup of butter and they came out similiar to the wonderful 'Otis Spunkmeyer' cookies! Very tasty...be sure to use the lesser cooking time as they continue to cook on the sheet."
"150","5","These cookies are great! They are very soft and chewy with a nice rich chocolate flavor. In fact, they taste just like little brownies. I was concerned they would not turn out because the dough seemed thick and sticky, but baking at 350 degrees for exactly 8 min produced a perfectly plump and shiny cookie! Using half chocolate and half white chips makes these so cute! I will probably add chopped nuts next time I bake these which is sure to be soon!"
"141","5","Long review alert! Yes, even after 1000+ reviews, I am going to leave one! Deep chocolate flavor, pleasantly (but not overly) sweet, soft texture but not too gooey, perfect height(not flat) and just downright irresistible! I read through 100's of reviews and made the following tweaks to this recipe: 1/2 cup butter & 1/2 cup solid shortening instead of 1 c butter, 3/4 c white sugar & 3/4 c dark brown sugar instead of 1 1/2 c white sugar, 1 T vanilla instead of 2 t vanilla, used dutch processed cocoa, 1 t baking soda instead of 3/4 t, and added 1 t baking powder and 1 t instant coffee. In addition I used aluminum foil to line the pans and that eliminated any sticking. The dough was not sticky at all and it held together well without spreading (I didn't even refrigerate the batter between batches!). Several tips for cookie novices (I learned from previous reviewers): Mix the butter & shortening until fluffy, then add the eggs and vanilla and beat with a mixer until blended to death! When you think it's ready, do an extra minute. Mix(by hand, not mixer) the dry ingredients before adding to the wet ingredients. Mix the wet and dry ingredients with a wooden spoon until the dry ingredients are just mixed in. THEN, using a hand mixer, continue to blend the ingredients until you don't see a speck of dry material! At this point add the chips and nuts by hand. I made 40 cookies at about 2 1/2 inches across. Death by Chocolate! Whoo-hoo!"
"118","5","These are so chocolatey it's ridiculous! Not a bad thing, but I'm definitely going to add more nuts next time. They aren't dense, and they stay very soft. The only change I made to this recipe was to follow the suggestion to use 1 cup white and 1/2 cup brown sugar (light brown, very lightly packed), and it's perfect. Co-workers are giving thumbs-up!"
"89","5","I thought that these cookies were really good. Great flavor, my boyfriend loved them. Just make sure that you underbake them or they will get a bit hard."
"77","4","These were just what I needed to satisfy the chocolate craving! They were more like cake than cookie and the faster you can eat them the better cause they do get dry and crumbly after a day GREAT TASTE!"
"65","5","Wonderful cookies!"
"45","4","HELPFUL TIPS: I found no need at all to split this half white sugar/brown sugar especially since this is already perfect and sweet!!! I've tried it both ways. It's true that any combo of half butter/half shortening or all butter makes NO DIFFERENCE. So if you're trying to decide what will make the better product, don't let this consume you. Nice thick cookies = after mixing batter, stick it in the fridge for an hour+. Take out and bake. Took me 10 min and I usually use my batter the next day or two. You can ALWAYS freeze whatever you don't plan on eating in a week. Then just take out what you want the next week. Will taste exactly the same and your family will love you! :) I doubled the recipe because I freeze extras, and only used 2.5C of chocolate chips (mixed semi and milk chocolate) and it was PLENTY!!! I can't imagine putting more in. SO... if I were to make 1 batch, I'd just use a heaping CUP. This goes with any chocolate chip cookie recipe fwiw."
"25","5","These cookies are to die for! I followed the recipe for the most part, substituting 1 cup of margarine for 1 cup of butter, using 1 1/2 cups white chocolate chips and 1/2 cup semi-sweet chips, and needed an extra 1/4 cup of flour (however, that's just because I use my KitchenAid stand mixer to mix the dough). Instead of dropping by spoonful, I rolled into 1-ish inch balls and slightly flattened. Let them bake for 10 minutes until the top started cracking. And they were heaven! Soft and moist and full of flavour."
"24","2","these are waaayyyy to sweet!!!!!!!!!! it over powers the chocolate flavor. and they don't stay soft..... next time, if I decide to make these again...i will cut the sugar and replace some of it with brown sugar!!!!!1"
"22","5","these were soooo good, I used dark chocolate chips and baked them for about 8 mns exactly and let then cool, tasted like little mini brownies. GREAT"
"17","5","These cookies are AMAZING! Even after they're cooled, they still have that melt-in-your mouth quality and the chips are still soft. They taste like brownies. Awesome awesome recipe just as it is!"
"14","5","This was a wonderful chewy yummy cookie. I didn't find it to be cake like at all. It has a very chewy fudgy taste. Like a brownie...but with cookie taste and texture. I did change a couple of things though. I used 1c. white sugar and then used 1/2c. brown sugar. I also didn't have any nuts, so I decided I'd add 1/2c. coconut. It was almost like a chewy chocolate macaroon, and the cookies stayed soft for as long as they existed in my house."
"12","5","Great Cookies!!! I made a double* batch. I used 50% Butter and 50% Shortening. 2* cups White sugar and 1* cup brown sugar. I baked them for 12 minutes (made 2.5 inch diameter cookie). I also used walnuts. Each cookie has came out perfect."
"11","5","These cookies are really good! I found it best to refrigerate the dough for 30 minutes before cooking--these makes the dough easier to manage and not quite as sticky. I used my cookies to make icecream sandwiches. Ofcourse to do that, just take 2 cookies and mash 1 scoop of softened icecream between them. Wrap up and freeze! :-)"
"10","5","Woowwwwww awesome!! I followed the recipe exactly minus the walnuts (didn't have any in) but cannot wait to try w/ the walnuts...or maybe I'm just looking for an excuse to make them again- sooo good!"
"10","5","These are very nice cookies. My little sister, age 10, wanted to make double chocolate cookies, and this is the simplest recipe I could find, but we had to half it as we didn't have enough ingredients. In particular, we had no semisweet chocolate chips--so what I did was chop up the bittersweet chocolate I had into small chunks. The result were cookies that, because they weren't too sweet, were more grown-up than kids, in my opinion; but everyone loved them, especially my sister. This one's a keeper!"
"9","5","Deliciously rich and decadent. These are so good right out of the oven."
"9","5","Whoa these are good! Definate keepers! I only changed a couple of things: I used only half the butter called for and I also used 1 cup whole wheat flour. You can't taste the difference and they end up being a lot less greasy! These cookies aren't cakey at all, they are very moist and fudgey...as long as you don't overbake them!"
"9","5","If you're skeptical about this recipe, DONT BE!! This is by far the best cookie recipe I've ever made and tasted. I get all my cookie recipes on here and there has been soo many times a cookie recipe has had great reviews and they turn out horrible. But this is wonderful,especially if you love chocolate!!I did what many people said to do, use 1 cup white sugar and 3/4 cup brown sugar. I can't say it enough,these are delicious!!!!:)MUST TRY!"
"9","3","Good cookie. Good taste, but too crunchy. Definitely the kind of cookie to eat right out of the oven if you prefer them to be good and chewy!!"
"8","5","Yummy yum yum. I used 1 cup white sugar and 1/2 cup brown sugar."
"8","5","I used 1/2 chocolate chips and 1/2 peanut butter chips, and added pecans instead of walnuts. My kids were crazy about them!"
"7","5","Used 1/2 C shortening and 1/2 C butter. Used a half/half mixture of brown and white sugar. Moist inside, crispy out. Very tasty."
"7","4","This recipe was pretty good! I took the advice of the people who didn't like this recipe and added a little more flour so that they wouldn't flatten as much. I would also make half the sugar brown sugar rather than white. (I didn't do that. I was out of brown sugar, which is why I chose this recipe.) They are a little brownie-ish, but not as brownie-ish if you bake them a little longer."
"7","5","Oh my gosh! These are the best cookies I've ever had. I am a certified choc-o-holic and even I could only handle 2 of these cookies at a time. They are so rich and so soft. Even a week later they are soft. This is my new favorite recipe.  I didn't have any white chocolate chips (I don't care for them anyway, because chocolate isn't chocolate unless it's brown!) but they tasted wonderful and they didn't lack in taste in any way. Everyone who tasted them asked for the recipe!"
"7","5","Amazing, I would rate these higher if I could also. Unfortunately I am home alone and no one knows I have made them as yet, so it is taking a bucket of willpower not to eat them ALL. Divine and thoroughly decadent. Thanks for this keeper Kathy."
"6","1","Made these cookies several times and typically use half white sugar and half brown sugar. Have used different extracts for flavoring (almond once, mint once with mint chips). Always get asked for the recipe."
"6","5","OMG !! These were soooo good!! I made these for a dinner. I ended up having way too much dough so I wrapped it in parchment paper into a log and then wrapped it in cling wrap and when I wanted cookies I would cut out a few and bake. Really yummy and the frozen dough stayed well for a couple weeks (didn't last long!! LOL!!)"
"6","4","4 stars because they arent PERFECT but they are really good espcially when you take into account the most reveiwed review..."
"6","3","The batter was very thick and sticky, and didn't melt down into a normal cookie shape, the cookies pretty much just stayed weird lumps even after baking. I may flatten them with a spoon next time."
"6","5","The best! Kids love it, my husband loves it! Very quick and easy."
"6","5","I made these cookies for my family and these are by far the best double chocolate cookies I have ever tasted. I did the recipe just as it is written (I didn't think to look at the reviews first) and they came out wonderfully."
"6","5","Delicious! Definitely satisfies a chocolate craving. I followed others suggestions and used 1/2 brown and 1/2 white sugar. Also, used a whole cup of chopped nuts - just didn't seem like enough compared to the choc. chips otherwise. Used Ghiradelli's big semi sweet chips - they were great! I've kept mine in an airtight container and they are just as fresh as the day I baked them."
"6","5","These are fabulous! I substituted the sugar with Splenda (cup for cup) and the chocolate chips with sugarfree baking chips and they are still delicious. I can't eat sugar but my kids can, so I finally found a recipe that I can split in half and accomodate all of our needs!"
"6","5","great chocolate chocolate chip cookies! We added 2 tsp. peppermint extract and came up with mint chocolate chocolate chip cookies for a holiday twist!"
"5","5","Awesome!!!! My kids adore them."
"5","5","Very soft and chocolatey. Baked for 10.5 minutes. Good with coffee"
"5","5","Wow, almost 2,000 reviewers can't be wrong! Marvelous cookies. I used dark chocolate chips and cocoa on the second batch and they were even better."
"5","5","sooooo wonderful, used choc chips ad peanut butter chips. WOW!!! Also at Christmas time used this with mint chips, again, WOW!!!"
"5","5","Fixed my chocolate cravings!"
"5","3","These cookies were good, but boaring. I'm sure there is a better recipe. They were perfect, but boaring"
"5","5","yum!! i hope you make more recipes like this!!"
"5","5","Delicious! These cookies are amazing, like a mix of a cookie with brownie texture! I always add some white and dark chocolate chips."
"5","3","I followed the recipe with the butter and had no problem with the consistency. I have found that the main way to keep a cookie chewy is to completely melt the butter, whip in the sugar, and then let it cool down as much as possible without resolidifying before adding the eggs. It keeps the fat in the cookie consistent instead of little melting pockets of fat in the oven. My problem had more to do with the taste. The beauty of a cookie is its simplicity but this still needed something extra-either an extract, cherries, or caramel or SOMETHING other than chocolate chips. Even my husband turned his nose up. I did use dark chocolate cocoa powder because I prefer that extra depth but that didn't help. I like chocolate chips in chocolate cookies but these were a little too much for me. Thank you for posting (I enjoyed making them with my three year old) and I do suspect that it was a personal preference issue."
"5","5","These are one of my all time favorite cookies!!! The texture is perfect, the taste is perfect. The only think that I don't like is that every time I make them I never get any because they are all gone before I get a chance!!!"
"5","5","OOOoooohhhhhh! These are soooo yummy! Decadent, rich and gooey! I will DEFINATELY be making these again and again and again!"
"5","5","Easy to make, great cookies. I used 1 cup chocolate chips and 1 cup dried cherries."
"5","5","OMG!!! THESE WERE THE BEST COOKIES MY KIDS HAVE EVER HAD!! I CAN'T MAKE 'EM FAST ENOUGH! THEY ARE EATING THEM FASTER THAN I CAN MAKE THEM!! THANKS SO MUCH...NOW WE ARE ALL CHOCOHOLICS! FOLLOWED RECIPE TO A 'T' AND I THINK I WOULD HAVE PREFERRED A MORE BROWNIE LIKE COOKIE AS SOME REVIEWS SAID...MAYBE I DID SOMETHING WRONG? ANYWAYS, THESE ROCK AND WILL MAKE THEM OVER AND OVER AND OVER.....!!!!"
"5","5","A baker- I am not- but it's impossible to mess these up! The kids (one who doesnt usually like cookies??) LOVED them! I've made them twice already in the last 2 weeks! Soft and chewy, and SO GOOD!"
"5","5","Very good! I had a huge craving for chocolate and these satisfied it! I replaced 1/2c of white sugar with brown, as several people suggested. I also only baked each batch for 8 minutes. The batches I baked for longer we hard and crumbly the next day, while the 8 min batches stayed soft."
"5","5","Wow - I've been looking for a good chocolate cookie recipe and now I've found it! Soft and tastes like my favorite brownies! I used 1/2 C butter and 1/2 C shortening, 1 C chocolate chips and 1 C peanut butter chips...they were great!"
"5","5","This is an awesome cookie! It truly is my favorite. Thank you for submitting this recipie! Edited 11/15/2007: I still make these after all these years, it is one of my favorite cookie recipes of all time and I make a lot of cookies. If I could give it more stars I would. I never used nuts due to my nut allergies."
"4","5","DELICIOUS AND RICH! Added m&m's to some of the cookies per my son's request. Did not add as many chips as called for, may have only used about 1 1/4 cups or so. Did use nuts, they were good in there. Also used 1 c of brown sugar instead of 1 1/2 c of white sugar, turned out great that way, will do that again. 9 min was about perfect in our oven. Refrigerated batter when I wasn't using it to keep it from getting soft, but it was a really stiff batter."
"4","2","My hubby liked these but my 6 yr old took one bite and won't eat them. won't make again!"
"4","5","Loved these! I made a double batch and froze some into little pucks to take out and cook up whenever I had a chocolate craving :)"
"4","5","I used a mint cocoa powder and added a bit of peppermint flavor. My family doesn't care for nuts in their cookies so I left them out."
"4","3","I would give these 3.5 stars - they were just OK to me. I think next time I would make sandwich cookies with frosting in the middle to make them more exciting."
"4","5","Yummy! I used milk chocolate chips instead of semi-sweet and omitted the nuts. I otherwise made these as written and they were devoured quickly!"
"4","5","these cookies are great i love them and all my friends do too!!! i found that they come out very thick so it helps to take a spatula and pat them down when the are still warm. enjoy!!!"
"4","3","I dunno, these weren't bad, but if I'm looking for chocolate-chocolate chip cookies, I want them to be seriously rich and dark. Since these only have cocoa powder in them, they turned out light and cakey, and kind of wimpy on the chocolate taste. Guess I'll have to look for something using real baking chocolate."
"4","5","Followed this recipe exactly (without the walnuts) and it was fantastic! This was a huge hit with everyone - the grandparents, my husband, and my son!"
"4","4","This is a good recipe on its own, but I substituted half a stick of butter flavored Crisco and 1/2 a cup of butter (to contain spread during baking). Added in both white and brown sugar, used Ghiradelli's dark chocolate chips, 3/4 cup of slivered almonds, and one packet of Starbucks VIA Italian Roast instant coffee. I had to beat off the kids with a stick (...translation: I had to make three batches)"
"4","5","There is no such thing as too much chocolate and this prooves it! I also made this recipe using white chocolate chips instead of the regular chocolate chips"
"4","5","Wonderful recipe! These make great soft cookies and have a wonderful chocolate flavor! My niece made them for us and now the whole family has claimed the recipe. Thank you for submitting this recipe. It is our new favorite."
"4","5","I've gotta say these are the stars of this years Christmas cookies, well these and the beautiful Chocolate Crinkles III because they look like they're covered with melting snow. I upped the ante with a couple of ounces of chopped unsweetened solid chocolate and a few grains of course salt on top. WOW is the most common response after the first bite."
"4","4","Very yummy! I did make a few changes - I used all brown sugar instead of white (brown sugar will make for a moister cookie while white sugar makes the cookie crunchier) and 1 tablespoon of vanilla extract. Other users complained of flat cookies so they integrated shortening...I didn't do this and my cookies came out great. How flat your cookies are relates to how runny and sticky the batter is. If you use slightly softened butter and beat the sugar/egg/butter mixture really well, the batter holds up and you get chewy, slightly flattened cookie but still holds it's shape very well. If you nuke the butter in the microwave or bake on a hot day where your butter has melted to or almost to liquid form, the cookies will be thinner. Try cooling the batter in the refrigerator for about 20 minutes then re-beating before adding in the flour mixture, and proceed as normal. Also, I used 1/2 semisweet chips and 1/2 milk chocolate chips. Next time I will incorporate white chocolate chips and milk chocolate chips to really give a variety of chocolate flavors."
"4","5","these are completely heavenly, with the recipe prepared exactly as written. needs no substitutions or changes. my 3 year old and i made them this afternoon and haven't stopped munching on them since!"
"4","1","I'm sorry but this is truly the worst chocolate chip cookie recipe I've ever used. I followed the recipe to a t- the cookies are dry and flavorless. There is no salvaging this recipe, just try another one."
"4","5","Fair winner! My 9yo son made these as written and entered them in the county fair. He won best chocolate chip cookie, and was a finalist for best of show out of all children's cooking entries received. We lvoed eating the left overs later. Plus, since he only had to enter 6 cookies per recipe, we froze half of the dough. It thawed and cooked just fine weeks later."
"4","5","I gave this 5 stars for delivering exactly what it promises-a tasty, cakey, chocolaty cookie. My personal preference for a richer chocolate taste is to use bittersweet chips instead of semisweet and to use Ghiradelli cocoa powder instead of Hershey cocoa powder. We also used this recipe substituting mint/chocolate chips for the semisweet, and that was delicious."
"4","5","These are definitely my favorite cookies and are always a big hit with everyone! I make the recipe as is, which is the exact same as the one in my Hershey's cookbook (to a tee!). I have substituted peanut butter chips for the chocolate chips before, and they are always a crowd pleaser! Enjoy!"
"4","5","These are AMAZING cookies! I used the half brown half/white sugar AND half butter/half shortening suggestions and the cookies came out gorgeous. I also stirred in some Reese's pieces. SUPER YUM! I love this recipe!"
"4","5","Very good. I like to refrigerate my cookie dough. It seems like they always turn out looking nicer and it makes them hold their shape really well. Just scoop out a spoonful of cold dough and roll into a ball. Also, baking on parchment paper ensures they won't get too brown or overcooked on the bottom."
"4","4","pretty good. i would stick with regular tollhouse chocolate chips. i used the expensive ghirardelli chocolate chips and they didn't seem to taste very good for some reason. and i think it needed a touch more salt because they seemed to be flavorless, like someone else had mentioned. or maybe more sugar was needed. still, not bad."
"4","5","These cookies were PERFECT! Soft and chocolatey! I made a few adjustments. I used 3/4 cup white sugar, and 3/4 cup brown sugar packed. Also 2 TBSP of vanilla. I cooked them for 9 minutes and they are perfect! I just made these again and this time I used mini hershey's kisses chocolate chips and white chocolate chips and OMG!!!! If you are a chocolate lover...you'll pretty much orgasm in your pants."
"4","5","'MMMmmm!!!' They are so delicious! DEFINITELY let them cool on the cookie sheet before transferring them to the cooling rack. I made the mistake on one cookie on the first batch and the cookie crumbled. So, I left the rest alone to cool on there own before transferring them."
"4","5","Wow.... these cookies are just... well, the name says it all. I would like to share my own little take on these, which is perfect for anyone looking for the only possible way (in my humble opinion, anyhow) to improve upon these delights: 1. replace the chocolate chips with more or less the same amount of roughly chopped mexican chocolate, either bitter or semi-sweet (note: I'm not actually sure where you can find this... probably in food specialty stores, if not in your average super dooper market. For those of you who have never tried it, it is very grainy and sweet, filled with lots of cinnamon and spice)  2. add in a touch of extra cinnamon if you so desire  3. and for the ultimate twist... chop up 1-4 whole dried cayenne or other small red peppers very finely (remember to remove the seeds) and pop them in! It should add a really special and spicy note to the cookies that doesn't have to be overpowering. I understand that this isn't for everyone, but you should walk on the wild side and give it a go!"
"4","5","Very tasty! I took this to an office bakeoff and they were very popular."
"4","5","Wow! Unbelievable. Do not go near this recipe if you are on a diet! I used dark chocolate chips instead (they are 'health food' you know). I should be super-'healthy' now ;)...! My kids said I was the best cookie-maker EVER! Thank you for the great recipe!"
"4","5","These are amazing! I followed the recipe exactly and they came out moist, chocolately, and delicious. I made them to send to boyfriend deployed with the military. When he got them he said he had to hide them from everyone, definitely one I will use again."
