helpfulCounts,ratings,reviewText
"0","5","Delicious. I used an 8 inch cake pan so I had to bake 10 minutes longer."
"0","5","so creamy and rich. the oreo crust blends so nicely with the flavors. I will definitely make it again. the other reviews were so helpful. this was the first time I ever made a cheesecake. I'm so proud of the results. :)"
"0","5","So yummy!! I wrapped foil around the bottom of my pan & placed the pan on a cookie sheet. Then I filled the cookie sheet w/water. I baked the cheesecake for an hour then turned the oven off & let the cheesecake sit in the oven for another hour. This prevents the cake from sinking in the middle."
"0","5","So yummy! A friend made this for our supper club, her 1st time ever making a cheesecake and she did an amazing job! It looked identical to the picture and tasted better than I had imagined! She followed some of the tips and suggestions from others and it really made a difference for her! Cannot wait to make this myself!"
"0","5","I made this for my boyfriend for Valentine's Day because he loves cheesecake. Not only did he love it, his sister and mother loved it too! His sister even took some home. I replaced raspberry sauce with strawberry sauce because he particularly love strawberry cheesecake. I used 2 cups of strawberries, 2 tbsp water, 1/4 cup white sugar, 1/2 teaspoon balsamic vinegar, and 1tspn cornstarch mixed with 2tbsp water. It was a big hit. I will definitely make this again! Thank you!"
"0","5","This came out great and was so tasty. The only change I would make would be to use seedless raspberry jam next time instead of reducing frozen raspberries. I used chocolate grahamn crackers and they worked well."
"0","5","delicious! very, very rich flavor - I can only eat a small piece at a time. But excellent fix for my cheesecake craving! I love the raspberry swirls, and the white chocolate taste is pretty clear throughout the entire cheesecake"
"0","5","This was so good. I used Baileys Irish Cream instead of Half and Half. And made a fresh raspberry with cinnamon sauce to serve it with."
"0","5","I've baked this cake 2-3 times. My family absolutely loves it. This recipe was actually the basis on which I started making other cheesecakes."
"0","5","I used this to make my first ever cheesecake for Christmas with my in laws. it worked great, I used cherries instead and the flavors together were awsome. it was a great success."
"0","5","I would give this 10 stars if I could. It was that good. It is a beautiful dessert and fairly easy to make. I made the recipe as written except I used chocolate wafers for the crust instead of Oreos. I also put parchment paper on the bottom of the spring fold pan and baked the crust 10 minutes, cooled it before adding the filling. I don't know if this step was necessary but that is how I usually do crusts for cheesecakes. My husband loved this. We are not big dessert eaters but this one is heavenly. We had it on Christmas. I froze the half that we haven't eaten since there was just 2 of us. Hopefully it will be just as good."
"0","5","This recipe is amazing! I also use the seedless jam to save on time, it works beautifully and no one has complained or noticed yet. Microwaving the white chocolate and half in half works well to just be careful...start at 30seconds, stir then do 15 second intervals stirring in between each until melted. I've also used this as a base recipes and instead of raspberry jam I've used, cherry jam, strawberry jam , and crushed Oreos. All of which have been very well received. Enjoy!!"
"0","5","This is a true 5 star recipe. It turned out fantastic. It didn't sink or crack. The flavor was great and it wasn't overly sweet. All of my guests loved it. I followed Estella93's cooking tips. Thanks for this one!"
"0","5","My cheesecake was baked too long.The top of the cheesecake was browned and looked burnt (might have been self error:/ )but, overall myself and my guest loved the flavor of the cheesecake and the chocolate cookie crumbs.My guest all agreed the raspberry sauce was an excellent sweet and tart addition to the cheesecake!"
"0","5","I've made this 4 times, so obviously I think it's delicious. But no matter what I did the first three times it cracked horribly. Still tasted great, so I didn't mind too much but it bothered me a little. The fourth time I made it I omitted the raspberry sauce in the cake and just drizzled it over the slices instead. No cracks! It came out absolutely perfect. So I won't put sauce in the cake again.    Everyone I make this for loves it"
"0","5","This was my first attempt at making cheesecake. I had no idea I needed a springform pan, so I improvised by making them in muffin cups. Same temp for baking, but adjusted to 20 minutes only. They were a hit! Perfect portions and garnished with a raspberry and mint leaf. Will definitely make these again...no springform pan for me!"
"0","5","I made this recipe minus the chocolate crumb crust. This was delicious!!! Everyone loved it."
"0","4","I didn't have vanilla but decided that wasn't going to stop me! And I'm glad it didn't because it still turned out really well. I took advice from the other reviews and used 2 cups Oreos, 1/4 cup butter, and 1 tablespoon of sugar - and I only baked it for 45 minutes. Turned out great! I also followed the suggestion to use seedless raspberry jam, which worked well, but I would suggest using more than the recommended six tablespoons, as that didn't give it much raspberry taste. Overall a great recipe and execution for my first cheesecake ever!"
"0","5","Amazing recipe but the sugar can definitely be cut way back! I made the recipe omitting the 1/2 cup sugar and the extra sugar in the crust and it was still plenty sweet. In fact, the next time I make it, I will also it back on the white chocolate too- probably to 1 1/2c. I followed another review and used a jar of high quality raspberry jam (warmed it up and put through a strainer to remove seeds). This recipe (altered a smidge) is a keeper!"
"0","4","Delicious!! Easy to make."
"0","5","This was my first time to make a real cheesecake, springform pan and all. (The ol' crescent roll bars don't count, do they?) I followed the recipe exactly, and read most of the reviews for helpful hints. I did do a water bath, wrapping my pan in three layers of foil to keep it dry. I baked the cake for an hour and turned the oven off for another hour before I opened the door...and there were no cracks! I am so addicted to parchment paper that my family will probably bury me in it.....anyway, I cut a circle for the bottom of the pan, and put a strip around the side of the pan too. After I removed the cake from the oven, I just had to lightly run a butter knife around the edges of the cake and the strip of parchment paper pulled right away. The end result was great! Everyone loved it, and declared it to be my best dessert yet. I will admit to using melted seedless preserves in place of the homemade sauce. The melted white chocolate seemed to make my batter thinner than I expected, but it all worked out in the end. Thanks for the great recipe, and big thanks to all of you who submitted reviews with helpful cooking tips. I am still shocked that my cake didn't crack!"
"0","5","Absolutely amazing recipe, I have made it for multiple occasions and as brownies too. I highly recommend it!"
"0","5","It turned out beautiful and tasted wonderful, even though it was the first cheesecake I ever made. I used chocolate graham crackers for the crust's chocolate cookies with great results and really only needed the one cup listed."
"0","5","Turned out fantastic. I did use two cups of Oreos as others have done. Otherwise, made as instructed. It's my special dish for my wife. She loves it."
"0","5","Great recipe and super easy to follow. I only wish I read the reviews prior to making it because it cracked on me and was hard to get out of the pan. But the taste was bang on!"
"0","5","I have now made this cheese cake 5 times and each time they have turned out wonderful."
"0","5","I made this recipe for Thanksgiving this year... and it was a hit! I took the tip of the reviewer who used seedless raspberry jam instead of the whole fruit and it worked great-and saved alot of time. I also used chocolate graham crackers instead of cookies and it was perfect. Thank you so much for this recipe!"
"0","5","This is the best"
"0","5","First dessert I have ever made in my whole life. (58 yrs ) I am not joking. I had to buy all new utensils, including a spring pan.  I entered it in my company BBQ dessert contest. I received 1st place!! Now everyone wants me to make one for Thanksgiving. It was delicious!!!!"
"0","5","I add extra oreos for a thicker bottom. I also followed the recommendation of letting the cake cool down in the oven for a few hours to prevent cracking. I have made this cake dozens of times. Will be making it again tonight for my Grandmother's 91st birthday as requested. This is a great recipe. Takes a little more effort than other cake recipes, but well worth the outcome!"
"0","5","Not as complicated as some I've made. I don't know what chocolate wafers the author uses so I followed some other reviewers advice and used 2 cups of Oreo crumbs, no middle filling, 1/4c butter and 1/4c sugar and baked at 325 for 10 minutes. Used parchment on bottom and sides of a 9' spring form pan. I used the whole bag of Nestle' white chocolate chips, I guess it was close to 3 cups. I used raspberry jam diluted with cranberry juice cocktail so I could remove the seeds more easily and then cooked it down a little and it worked pretty well. Placed the cheesecake in a large roasting pan and added about 1 1/2 inches of boiling water, I always wrap my spring form pan with heavy aluminum foil, baked at 325 for 1 hour, turned the oven off, cracked open the door and left the cheesecake in for 1 1/2 hours. I then removed it from the oven and bath and placed on a cooling rack for a couple of hours and then put it in the fridge. It's 2:00 AM and it has been in the fridge for about 5 hours and it taste great. I was concerned about the texture because I have never added chocolate to a cheesecake before but the texture is comparable to other recipe's I've used in the past. No cracks, not one. If my cake cracked I would change something or use a different recipe."
"0","5","I am not sure how anyone could rate this negatively. I have made this recipe several times and always receive high praise from family and friends! Thanks Cindy Ann!"
"0","5","Perfect recipe. My kids love it..."
"0","4","Folks raved over this cheesecake. I personally thought it could use a little something more, so I may try doubling the white chocolate. I had no trouble with the amount of crust; no need to double. I didn't use Oreo's, I used the chocolate wafers - it needed about half a package. Since I had to grind them in the food processor, I just mixed all the crust ingredients in there and saved myself a bowl. I know some folks suggested using raspberry jam - I'm sure you could, but then you wouldn't have any sauce to spoon over. I could only find a 12 oz package of frozen raspberries, so I just heaped the other ingredients and it turned out fine. I used a food mill to get the seeds out; much easier than a mesh strainer if you happen to have one. The sauce is not sweet (there's enough sugar in the cake), which allows the raspberry flavor to really shine through. I baked for 1 hour and 15 minutes, which is more in line with most cheesecake recipes - it was definitely not ready after one hour. I generally don't care about the cracks on a cheesecake and never bother with all the advice out there. But in this one instance, the swirls on the cake might have looked better without the cracks!"
"0","5","I thought it was great! I will use the suggestion to leave in the oven for another hour because the center fell in. I also will use the cookie crust suggestion as well, because mine was kind of greasy."
"0","5","THE best!"
"0","5","This was the best cheesecake I have ever had! Made exactly as stated"
"0","5","A taste out of this world. I always make it and I always get amazing compliments. The only two modifications I do to the recipe are: 1. I add 1 tablespoon if flour to the cheese mixture white mixing it. 2. I use 3/4 of the raspberry sauce inside the cake. The last quarter I cook it again with a little bit water and some lemon juice. I serve this sauce beside the cheesecake to add a lovely velvet red color and a yummy yummy taste to the special dessert..... Thanks a lot for the perfect recipe!"
"0","3","Family loved it, so that was a plus. I was not impressed; wont make again."
"0","4","Solid recipe, and one of the better cheesecakes I've made. The only thing I'll change in the future is probably doubling the amount of raspberry sauce. The cheesecake itself could stand a bit more raspberry flavor, and the sauce on top was a great touch."
"0","5","This is a great recipe! It tastes just as good if not better than the $4.00 tiny gourmet cheesecake that my husband and I love. Thank you CindyAnn!"
"0","5","I made this cheesecake just as the recipe states EXCEPT...I did use 2 cups of cookie crust. My only suggestion would be to use a water bath (which I did not do, and it did crack a little on the top). But if your cheesecake does crack, its not a huge deal ! I served this to my co-workers and they thought it was amazing!"
"0","5","OH NO!! I should have read all the details before starting!! I added the creamcheese and sourcream and eggs,sugar and vanilla in the same bowl and then processed it :( No idea how this is going to turn out...."
"0","5","Absolutely delicious and well worth the work! Dinner guests raved!"
"0","5","This was only my second cheesecake ever… and everyone loved it and couldn't believe that I made it. I had trouble melting down the white chocolate in the cream, but other than that it went well… I might add like an extra 1/4 cup of the crushed oreos for the bottom. It was a bit thin..."
"0","5","Best cheesecake ever!!!"
"0","3","I love to bake and my specialty is cheesecake. I've made white chocolate raspberry cheesecakes on several different occasions using other recipes, but I thought I would try this one since it got such great reviews. I only used 12oz of white chocolate instead of the 16oz it calls for and it's still really over powering. The balance of raspberry to white chocolate flavor is way off. It didn't come out quite as firm as I like my cakes either and I chose to cook it slightly longer than recommended. All in all it was a pretty mediocre cheesecake, nothing special, and I probably won't ever make it again. I recommend you find a better recipe. P.S. If you want a really delicious chocolate cookie crumb crust, mix on a teaspoon of cinnamon. Delicious!"
"0","5","Awesome, 'nough said!"
"0","4","I agree that it tastes delicious, but I'm not sure if it's just my oven or if it's the recipe that required the extra extra long baking time. Which ended up in a burnt top. Overall it was fine, but the cake kinda fell into itself. But it's a keeper."
"0","5","delicious! little time consuming to prepare, but well worth it."
"0","5","I made this cheesecake for Easter and it was a big hit. As another person suggested, I used raspberry preserves instead of the frozen. I probably could have shut the oven off after 50 minutes of baking, as it baked quick. I also used a water bath which I do for all my cheesecakes because I get great results when doing this. I did leave it sitting in the oven with the oven off for an additional hour. I drizzled with chocolate syrup and garnished with fresh raspberries. Excellent!"
"0","5","This cheesecake is one of the greatest things I've ever tasted. I made it for christmas 2013 and I will make it again for my birthday next week. I can't wait!"
"0","5","This was the first cheesecake recipe I have ever attempted. I loved it. I did modify it slightly. I used 100g more of the creme cheese, roughly 50g less of sugar (overall) and 70g less of the white chocolate. It turned out wonderful. I also used the suggestion of another review of putting it in a water bath, worked wonders. It was one of those cheesecakes that if you take one bite, you want to eat the whole cake. And I almost did."
"0","5","Cheesecake is my specialty but this recipe puts all other recipes to shame!!! Thank you CindyAnn!!! Wow, amazing!!!"
"0","5","Sinful"
"0","5","BEAUTIFUL."
"0","5","A lot of work but well worth the effort. Can be difficult to totally deseed the raspberries but didn't seem to matter. Nice creamy texture, with the white chocolate really making this a spectacular treat. Absolutely yummy!"
"0","5","Great cheesecake! Instructions were easy to understand and follow. I brought it to a family function and EVERYONE loved it."
"0","5","Made this two times in four days This is a great recipes loved every bite and so did everyone else."
"0","5","I have made this recipe several times, ALWAYS to RAVE reviews...it is a staple in my 'Cheesecake Repertoire'."
"0","5","This is a really great cheesecake. I have made it a couple of times and always loved by those consuming it. :0 :)"
"0","5","This is an amazing story. So I was browsing online for something to enter in a cook off at work. Normally I do main dishes or sides for pot luck's . This time I decided to make a dessert. When I saw this was highest rating I had to try it. I made a trial one first. I followed the recipe to the T. No sad to say I'm not a fan of white chocolate or cheese cake, so I had some family members try it out. They loved it. When it came time to make one for work I did change one thing. I add the Oreo cookie crumbs with the cream center , 1 tablespoon of sugar, and the butter. This made for a better crust on the bottom. Because I had so many fresh raspberries I added them in with the frozen ones when making the sauce. When the cake was done spending over night in the fridge I topped it off with some fresh raspberries, white chocolate shavings and little dab of whipped cream. (Just to make it look pretty) I saw the judges at work tearing into it. I was so please to say I won the contest. Because there wasn't a lot to go around I have been asked to make another one for people to try. Thanks to the one that posted this recipe and for all the others that posted tips. Couldn't have done this without you."
"0","5","Tip - use a bacon splatter screen to strain the raspberries. You mush it through the screen with a spoon, catch the sauce in a bowl below and scrap off the seeds on top. Worked perfectly. I didn't have a strainer that seems to cut it and get all the seeds out. Overall it was Amazing!"
"0","5","This recipe is awesome!..my first time making cheesecake and the instructions were easy to follow thanks to the other reviews my cheesecake came out perfect no cracks,.will def be making again & again"
"0","5","I read the tips article before trying this recipe. It it the second attempt at cheesecake (a different recipe) and my first attempt was an epic fail. I beat the cream cheese by itself first until very smooth. Followed this recipe except I used semi sweet chic chip instead of white because it's what I had on hand. I baked at 325 for an hour and then cracked the oven door and left it for another hour. Then I let it sit on my counter top for an additional 30 minutes. Covered and put in the fridge over night. Delicious! Also this recipe had too much batter for my pan so I also made cupcake sized mini cheesecakes for my kiddos. I will be making this over and over. Advice for a newbie at cheese cake read the tips article! It will help you a ton!!! Let the cheese get to room temp"
"0","5","This was absolutely delicious! It was my first time making a cheesecake. The white chocolate added a nice flavor. I added a bit more than recommended. It is best to cook it in the oven with the spring-foam pan wrapped with foil paper and a rectangular pan filled with water so the sides do not burn slightly. It took 80 mins to cook.  Everyone loved it! We just could not stop eating it!"
"0","5","Perfect cake for Valentine's! Moist and delicious. I used Oreo crumbs for the crust and decorated with a whipped cream heart and fresh raspberries. My Valentine loved it."
"0","5","I make this every year for my son's school dessert auction. Every year more people fight over it. Last year it brought in $300! Cant wait for this year!"
"0","5","This has become my husbands FAVORITE dessert. Whenever I make one for someone, he demands I make him one too! This cheesecake is requested at all family gatherings."
"0","4","I should have cut back on the butter in the crust like so many of you did. Otherwise it was fabulous. I too, was looking for the Olive Garden cheesecake, and this is pretty darned close! To change it up after the initial servings, I topped the slices with chocolate ganache. Yummy."
"0","5","It's the perfect classy dessert for any occasion. I'm in love with this cheesecake. However, following the advice of another member I used raspberry jam instead of making my own raspberry drizzle and it was sublime."
"0","5","I've have made a lot of really good cheesecakes but this one is amazing!!!! I had some delicious homemade blueberry jam, so I used that in place of the raspberry. I also tried something from another recipe and that was place the cheese cake on top of muffin pans filled with water. It did crack just a bit, but not to serious. The blueberries covered it anyway. I don't have a lot of staples in my recipe box, I like experiencing with new recipes, but this has become one."
"0","5","Fabulous! I brought this to Thanksgiving dinner. Everyone asked me for the recipe and it was a hit! I will make this again for sure."
"0","5","Yum I've almost broken my mom from her diet with this delicious cake uh oh"
"0","5","Loved this recipe no issues! I always put a pan in the oven with water in it though keeps it from drying out and cracking. I make this recipe with out raspberries, like a regular cheese cake and have strawberries or blueberries so people can have there choice. This is absolutely amazing!"
"0","5","loved it!!! its delicious and easy enough to make :)"
"0","5","Very rich and tasty. My fiance LOVED it. I found that it was best served when I warmed the raspberry sauce and drizzled it over the top."
"0","5","this recipe is great i made it with a help of a friend for this thanksgiving and it tasted terrific im not a fan of cheesecake but this tasted actually good i got a whole lot of compliments from my relitives about it and encourage you to make this"
"0","4","Made it and used the seedless raspberry jam and oreos for crust like others suggested-it was good."
"0","5","I have made this recipe twice; they both turned out gorgeous and tasted even better! :)"
"0","5","I made this recipe exactly as written. Cheesecake just doesn't get any better than this! I made this recipe for a big family Thanksgiving and word got around fast that it was 5 star delicious! I had to slice it into small pieces so everyone could have a taste. No other deserts were wanted for Christmas, except the request that I make more than one of this heavenly cheesecake."
"0","5","This is my all time go to recipe for cheesecake. Creamy and rich. I have used some others tips and tweaked it a bit (i add an extra block of cream cheese, an extra egg, an extra cup of white chocolate chips, seedless raspberry jam, andpecan sandies cookies for the crust) but all in all, its a definite keeper!"
"0","5","Very good! Thank you for a wonderful recipe! I used the raspberry jam to avoid having to strain the seeds out. It was delicious. I also followed the water bath instructions. Baked for 60 minutes and turned off the oven and let it sit in the oven for another hour. Beautiful and delicious."
"0","5","turns out great every time I make it!!"
"0","5","ABSOLUTELY INCREDIBLE!!! The recipe is easy to follow and the final product is TO DIE FOR!!! My roommate who doesn't even like cheesecake thought it was delicious! It looked picture-perfect and was honestly THE BEST cheesecake I've ever tasted! So happy I found this recipe and decided to use it!"
"0","5","I am by no means a baker or chef but I decided to help ou this year and make a dessert for thanksgiving. this recipe was pretty easy and it tasted amazing!"
"0","5","I've made this many times and every time it turns out amazing!"
"0","5","Delicious!!! I made with a regular graham cracker crust instead of chocolate and it was still fabulous. Looked pretty and tasted excellent."
"0","5","This recipe is truly fantastic. I'm not a fan of cheesecake, but this is definitely the exception to the rule. I make this for every holiday and family occasion. I also give it as christmas gifts since it is such a crowd pleaser. Surprisingly simple as well."
