helpfulCounts,ratings,reviewText
"0","5","This is by far the best cake recipe I have ever tried. My husband is not a chocolate lover but he LOVES this cake. I usually put butter-cream frosting and strawberries between the cake layers and top with chocolate frosting...decadent!"
"0","5","I made this recipe as cupcakes with an extra 30 ml of flour and with a chocolate mocha whipped ganache frosting for the people at work. They were a big hit, one man asked to buy the leftovers and wants to order a dozen for his own birthday...lol"
"0","5","THANK YOU for sharing this recipe! I will never buy a box of chocolate cake mix EVER again! This is incredible - you can't taste the coffee, it just compliments the cocoa and makes it rich and decadent! This seriously tastes like cake from a fancy restaurant or bakery. If I could give this recipe 10 stars I would. Made yummy homemade peanut butter frosting to top it all off. MmmmMMM!!!"
"0","5","The best cake eeeevvvveeerrrrr!!!! Ive been making this one for a couple years now. Yummo. No changes for this gal and no complaints either. :)"
"0","4","Just a clarification the cake can use both dutch processed and regular cocoa becoz it has baking soda and buttermilk. Either ll give similar results. The reason cake is falling in middle might b the oven temp. Or if you use a very big pan without heating core. Try it with a heating core or a flower nail, it wont fall in the middle. Also you can use paper towels soaked in cold water and the wrung and folded and covered with aluminum foil. Use this to line the outside of the pans. This ll also help a lot.  The cake falls in the middle if the edges get heated faster than the center, so if u use cake pan liners, it ll help. Also type of man ll make a huge difference too."
"0","5","Was the first cake I ever baked, and it turned out awesome!"
"0","5","Great recipe. I used water instead of coffee, since this was for a 3-year-old's birthday party. I multiplied the recipe by 2.5 in order to have enough batter for a round wilton 6' 2-layer cake and a round wilton 10' 2-layer cake. I'm a decorating novice, but I was looking for a heavy enough cake to support 2 layers on a 2 tiered cake with butter cream (special butter cream frosting) and marshmallow fondant, both from this site, and this one did a great job. I also used wilton's cake realase and got a very nice crust from this recipe!"
"0","5","Incredible! I used this recipe last night and it was my first time making a cake, I was so nervous. Now after using such an easy, delicious recipe I feel much more confident in the kitchen so thank you! Tips and alternative ingredients:  I didn't use eggs, I used egg replacement powder. I don't usually drink coffee and therefore don't own a coffee pot to brew the required pot of coffee so I used a can of Mr. Brown (it's a pacific island thing, made in Taiwan). I couldn't find butter milk so I made some! Add one table spoon of white vinegar to a measuring cup, pour (soy in my case) milk to make one cup. Let sit five minutes then add to recipe. Voila!"
"0","5","I've made this cake twice now and it is a hit every time. After reading reviews, I was nervous about getting it out of the pans. I cut parchment to size and sprayed the parchment on both sides, as well as the complete interior of my baking pans, and did not have a problem. I needed an additional 5 minutes (total of 45) for my cakes to pass the prick test - maybe it's my oven? As other reviewers said, this cake is delicate after baking and is fragile to put together. I used a chocolate ganache to fill and frost this cake, and it was a delicious birthday cake! Everyone commented how moist and delicious it was."
"0","5","I made the cake. The recipe was fabulous. It is so moist and chocolaty. Everybody loved it. No one could resist. I didn't have buttermilk so i used skimmed milk in same quantity i was affraid dat it wouldn't taste good but it tasted fantastic. I will do it again. Thank u."
"0","5","very easy cake smell is good"
"0","5","We were having the super bowl party at our house and my plan was to make cupcakes and frosting them with the 'colors' of the team. I bought the special frosting; however, I forgot to buy the cake mix! I had the ingredients for this recipe, it had great reviews so I mixed it up. It turned out terrific. The frosting I purchased was pretty sweet and this cake worked perfectly with the frosting. Will be making this again. Thank you."
"0","5","So moist! I made it with white frosting for my son's birthday party and it tasted and looked a lot like an oreo."
"0","5","I have made this several times as cake or cupcakes and it turns out wonderful every time. I like to use the cinnamon frosting on this site with this cake."
"0","4","Super moist and did taste great. Not super chocolatey though."
"0","5","Oh. My. God. I recently made this for a birthday and it was OUT OF THIS WORLD good. The Birthday Boy requested almond butter-cream frosting, which was also amazing, but incredibly sweet and not for this cake. I think next time I'll use a cream cheese frosting or skip it all-together. This cake can definitely hold it's own without a frosting. Absolute MAGIC."
"0","5","Amazing cake! Truly one of the best I have ever made. Thank you for posting."
"0","5","By far, the most moist, decadent cake yet. My daughter wanted to bake something special for my father-in-law's birthday and it needed to be rich and chocolatey to appease his sweet tooth. At first I was concerned that with the creamy chocolate frosting we had made it would be too much but instead the cake is beautifully balanced. It is SO moist & flavorful without being too much. We added coconut flakes to mimic Almond Joy candy which is one of his favorites."
"0","5","Made exactly as written and I will continue to do so several more times. This cake is so moist and smooth flavored, nothing like a box cake at all. Why make a box cake when this is so easy? I used my own butter cream recipe and add peanut butter to it....doesn't get any better than this!!"
"0","5","This is AWESOME. Rich Flavor, Super Moist. This recipe will be a keeper for Chocolate lovers."
"0","5","(2)Update: made this again but made cupcakes; it made exactly 24. The batter is so thin that I poured the batter in a plastic cup and easily poured the batter. (1)Made this cake for a friend and unfortunately didn't get to try it, but it was a hit. I was told that it is very rich. I kept this simple and baked it in an aluminum pan. It fit a 9x13 pan perfectly."
"0","5","Delicious! Moist and chocolate, only change was 1 1/2 cup sugar instead of 2, plenty sweet."
"0","5","So good, moist and delicious! My boyfriend went crazy for this cake! I am now deleting all other chocolate cake recipes!"
"0","5","Great recipe. I used cake flour instead of AP flour for a more tender cake. For those of you who were unsuccessful with this recipe...you need to do the toothpick test for doneness...all ovens are different. I made cupcakes and found for my oven, 20 minutes was perfect."
"0","5","This recipe was very easy to make and tastes delicious. It is so moist and chocolatey. When I made cupcakes out of this recipe they did come out a little flat, so just beware of that. This is truly the best chocolate cake recipe I have tried."
"0","5","I have only made this once, but it will now be my go to recipe. After I mixed it up, like other reviews said, it was runny. I thought there was no way it would bake up. But it did. I wanted to taste before I served so I took just a small piece off the corner and it was dry. Really concerned at this point. When I served it...everyone LOVED it and so did I. It was very moist and not at all dry! Topped it with a simple chocolate fudge frosting....mmmmm....mmmmm good!"
"0","1","the cake fell like crazy and I have never had that happen in over 50 years of baking."
"0","5","Made this for my chocolate loving son's 12th (golden) birthday gathering. Everyone LOVED it! This one is a keeper. Thank you!"
"0","2","The cake was too heavy for my tastes."
"0","5","Magical! Delicious!"
"0","5","I made this cake for new year 2014 and everyone loved it! The cake came out beautifully! I didn't have buttermilk on hand so I used 1 tbsp lemon juice and rest milk (total 1 cup). Soft and moist, everyone said. This is one recipe I am going to keep and pass on kids some day!"
"0","5","THank you for another great recipe. I double the recipe didn't change a thing. It was a perfect 4 layer cake ! moist and chocolaty!! keeper for sure."
"0","5","fabulous!"
"0","5","It has been my favorite for years. I have made it so many times that many of my friends and family request this cake. It has become the “go-to” cake for birthdays. We always frost it with my mom’s cocoa frosting made with coffee instead of milk. Yummy!"
"0","5","Excellent cake, very moist with a deep chocolate flavor. This one is a keeper."
"0","5","This is by far the moistest chocolate cake i have ever tasted or made in my life! The only change i made was i stirred in 3/4 cup of mini chocolate chips in the batter right before i poured it in the 2 layer pans. I let it cool and frosted it with the 'Creamy Chocolate Frosting' recipe on this website. Sooooo good!!"
"0","5","The best cake I have ever made! My family loves it, its moist and just rich enough. I actually made a peanut butter icing for it. PREFECTION!"
"0","5","Tastes wonderful! My whole family loved it! Used the whipped cream cream cheese frosting from this sight!! Really came out good!"
"0","5","One of the best chocolate cakes I've Ever tasted!!!!"
"0","5","OMG ... this cake is so delicious. I topped it with the Cinnamon Coffee Frosting (also on this site). Talk about a delicious combo. If you like coffee flavors, this was great. It was the hit at my Thanksgiving table. Everyone raved about this and I had made a ton of other desserts, but this cake/frosting went first. Delish!!! Oh, one thing I did was add a small box of Jello Instant Pudding/Pie mix since I add a box to every cake I make (make them extra moist)."
"0","5","Very moist easy and tasty"
"0","5","Very delicious! I made a coolwhip/vanilla pudding mix filling and used the Satiny Chocolate Glaze from this site"
"0","5","i Loved this Cake it's Real Magic & Anyone can make this magic i loved it & it's tasty my family loves it!& i Love it ever Wondered why it's called magic cake well it's real magic!"
"0","5","OMG!!!! I made this recipe exactly as written for my niece's birthday party. I was nervous because I've never made a cake from scratch before. So nervous in fact that I took a 'back-up' boxed cake with me. Although it didn't rise as much as I thought it would,the cake was moist and delicious. I topped it with the fluffy peanut butter frosting from this site and it was a HUGE hit!!! I did add chopped pb cups to the top for decoration. Thank you for sharing. Definitely a keeper!!!!!"
"0","5","Absolutely amazing!"
"0","5","I have finally found a wonderful, moist and tasty chocolate cake. This was easy to make and with the chocolate butter cream frosting a big hit with my family."
"0","5","This was easy/ fast to put together, using mostly on-hand ingredients (except the buttermilk). Cake wasn't 'amazing' tasting, but it was a good moist chocolate cake. I had higher hopes for the final product since the batter tasted really mocha-ey, but I guess the coffee dissipated a bit during baking, because I couldn't taste any coffee/mocha after baking. Might try a stronger coffee next time. I frosted using 'creamy chocolate frosting' from this site, and the result was a tasty snack cake. THe cake itself wouldn't really have stood on its own that well flavor-wise, but the two together worked well. I have a more 'special occasion' chocolate cake that takes more time, but this is a nice option for a quick/easy cake that's still very good."
"0","3","I made this cake to try to use up some leftover milky whey after making ricotta! So for the cup of buttermilk, I put 1/2 cup whole milk and 1/2 cup of my leftover whey. So I didn't follow the recipe entirely but the cake turned out pretty good. Nothing spectacular but it was easy enough, so I suppose I could make it again sometime."
"0","5","Thank you! Best chocolate cake. I've used it for my daughter's birthday cake for about 5 years now, usually filled with whipped cream and fresh raspberries, and topped with chocolate ganache!"
"0","4","terrific. probably the first scratch cake i have made that turned out really well. did not use buttermilk, used cream and it worked fine. would make again."
"0","5","Absolutely loved this! Easy, moist, delicious. I topped with a simple whipped milk chocolate frosting, and some fun decorations. Our new favorite treat recipe. I'll be taking this to family get-togethers!"
"0","5","The best chocolate cake.Friends already asking for recipe for it. Moist and chocolaty. It's a keeper"
"0","3","Unfortunately, I was very underwhelmed by this recipe. I followed it to a T but it sunk in the middle, stuck to everything and fell apart. I was also hoping it would taste much chocolaty-er. Sorry for the unhappy review :("
"0","5","WOw this will be my go-to chocolate cake from now on! Great choc flavour& you cant even taste the coffee, which i am glad, that part of the recipe made me nervous, but it really back up the chocolate to intensify it. amazing& easy!"
"0","5","I have made this many ,many times and still my favorite I use self rising flour instead. I removed the baking powder and soda, salt. Added a stick of butter instead of the oil. Used the dark cocoa. Topped it with vanilla icing.."
"0","5","This is a recipe that i have used over and over for the last two years thought that it was about time I posted a review. It is incredibly moist cake that is a treat with either whipped cream or ice cream. The kids love it. I do agree with some of the reviews posted before than it is an incredibly sweet cake so I switched to brown cane sugar instead of whit and I have been measuring it to a little under a cup measurement so that it is not quite 2 cups of sugar. Also because I don't want it too become bitter especially for the kids I make a more of a weak to medium strength cup of coffee. however the first few times I followed the recipe exactly and made changes as i went along, its a foolproof recipe that works every single time."
"0","5","my cake fell a bit after baking but was sort of like a fudgey brownie... which no one minded!"
"0","5","This is my 'GO TO' chocolate cake from now on; simple and SO moist and delicious! I filled it with a whipped cream chocolate frosting and then covered the outside with chocolate ganache! SO GOOD! My husband requested something chocolately for his birthday cake this year and this is truly worthy of a celebration!"
"0","5","I've made this cake several times now. The first time I made it, I didn't make any modifications, but the second and third times, I added one small packet of Cook and Serve Chocolate Pudding mix to the batter. Cake is awesome with or without the modification tho."
"0","5","Black Magic Cake fanatastic WOW love it"
"0","5","I thought this cake was fantastic! This is the first time though where I thought my cake was a little 'salty'. Weird, but I think it may have something to do with the baking powder. This recipe is definitely at the top of my list, although I will use aluminum free baking powder or maybe decrease the salt to 1/2 tsp. I have never noticed that taste in a cake before."
"0","4","This is so good!!!! I made the for my parents anniversary, I toped with boiled icing and sprinkles. Anyone who is looking for a really good chocolate cake recipe should really try this"
"0","5","I've tried it once and I would make it a 1000000 times more because its soooo gooodd !!!!!!! LOVE IT"
"0","5","I made this for my son's birthday and it was DELICIOUS. Will definitely make this again."
"0","4","This was very easy to make and tasted great. Will make again and will be my 'go to recipe' for a chocolate cake. Thanks for sharing!"
"0","5","Best chocolate cake recipe ever! So easy to make. Super moist. I frosted it with a lite layer of peanut butter frosting and it was a big hit. Will definitely be adding this recipe to my collection!"
"0","5","Super moist & Chocolaty.....easy to make & kids LOVED it! I used soured milk instead of buttermilk & made into cupcakes - 18min & done although shiny & wasn't sure...unfortunately they fell after taking out of the oven..Im blaming the Lynyrd Skynyrd music I was blasting at the time...built them back up with lots of fluffy frosting & they were still a hit :))))"
"0","5","I've tried this recipe and it was wonderful and so delicious."
"0","5","Wonderfully moist cake! Made this for the first time tonight and it exceeded my expectations. This will be my go-to chocolate cake recipe!"
"0","5","The best chocolate cake ever! I made it in 2 9' round pans and frosted with 2 recipes of the Creamy Chocolate frosting (http://allrecipes.com/Recipe/Creamy-Chocolate-Frosting/Detail.aspx?event8=1&prop24=SR_Thumb&e11=chocolate frosting&e8=Quick Search&event10=1&e7=Home Page) and it tasted like it was from the bakery!"
"0","5","This cake was AMAZING. I was planning on frosting it with a cream cheese mocha frosting, but this cake was so moist and delicious, it didn't need anything. It was a huge hit at the BBQ I attended. The only problem I had was that I didn't make enough!"
"0","5","Very moist and quite light! Loved it."
"0","5","Amazingly moist, perfect chocolate cake! Used regular milk since I had neither buttermilk or vinegar to create buttermilk and it tastes amazing! I don't know if I'm missing anything by not using buttermilk but I can't imagine. This is the perfect chocolate cake!:)"
"0","5","This cake was awesome! I had to bake it an extra 10 min though."
"0","5","I made this and took it to work... they devoured it. One lady told me it was the best chocolate cake she ever had, (I have to admit I agree). Everybody raves over it. May I suggest a simple chocolate frosting recipe."
"0","5","For a change, we made this cake for a birthday instead of buying the normal ice cream cake from a popular chain store, and lets just say, we weren't disappointed. We made this along with the 'Creamy Chocolate Frosting' recipe and together the cake was amazing. The coffee enhances the chocolate flavors and the cake is perfectly spongy/moist. Even 48 hours later there was no change in how moist the cake was."
"0","5","The cake took 35 minutes to fully bake. Make sure you cool it to room temperature or lower before removing it from the pan. It is very most, soft and delicious ! Thanks for the recipe, my husband loved the cake ! I filled it with mocha whipped cream filling and chocolate ganache on the top."
"0","5","Very easy to make and very delicious recommended for any level of cooking. Made my own icing to add to it made it even better."
"0","5","This was an amazing recipe!!! it was moist it just melted in your mouth.... I added a raspberry filling in the middle with raspberry chances and made my own chocolate frosting. Just delicious saved the recipe and will make this always.:)"
"0","5","PHENOMINAL! Best chocolate cake recipe ANYWHERE! This cake comes out so dark, so moist, so delicious and perfect I'll never buy boxed again! It looks really runny when you pour it in so don't be afraid...that's normal! It comes out perfect still though and is seriously, the best thing I've ever eaten. I made a home-made chocolate mint frosting that just made this thing divine!!!"
"0","5","This cake is better than a 5-star recipe! I haven't always had the best results with cake from scratch before, so I braced myself for not-so-stellar results when I tried this for my daughter's 5th birthday. Not only did this cake mix together almost as fast as a boxed cake mix, it baked up beautifully and tastes AMAZING!! It is fluffy, moist, and the best chocolate cake I've ever eaten - the whole family agreed this was absolutely delicious. I frosted this cake with the Special Buttercream Frosting from this site, delicious! My youngest daughter, who just had a birthday last month, has already requested it for her next birthday! I think the highest compliment though, was from my 5-year-old who NEVER eats the actual cake, but rather just the frosting. Not this time though - she cleaned her whole plate and said it was the best cake ever."
"0","5","So moist and delicious, will definitely be making this again!"
"0","5","This cake was absolutely delicious...tasted like a Hostess Suzy Q, only better! I added an extra egg, teaspoon of vanilla, and teaspoon of baking powder. Frosted with a home made vanilla frosting. This cake was super moist. This is now my go to chocolate cake."
"0","5","Easy & delicious!"
"0","4","Love it. I add in chocolate chips to the batter before baking. I follow it exactly as written, no changes. I love it as it is."
"0","5","I made this recently for a birthday. I don't like using boxed mixes and this one is quick and easy. It came out dark and moist. I had no problems with removing from pans or handling. Got rave reviews."
"0","4","This cake has quickly become a family fav!"
"0","5","This is my favorite from-scratch cake recipe. I use it with all kinds of frosting variations. Great with Oreo Frosting (Cream Cheese/Cool Whip with Crushed Oreo's mixed in!)"
"0","5","Great chocolate cake! This is my go to recipe chocolate cake! My brother was concerned it would taste too much like coffee, but you couldn't taste it at all, it just enhanced the chocolate flavour!"
"0","5","This cake is so delicious! Exactly what I was craving :)"
"0","5","I made this cake for my husbands bday and it was amazing, not too sweet because it has a dark chocolate flavor, I used the chocolate ganache recipe from this site for a filling between the cakes and then made the creamy chocolate frosting also from this site to top the cake, It was really good, and not overly sweet :) thanks for the amazing recipe."
"0","1","tasted terrible and came out moist but didnt taste like chocolate at all"
"0","5","This recipe made delicious cupcakes. I halved the recipe and it was plenty for a dozen moist chocolate cupcakes. I do want to confess to my disastrous attempt at using this recipe for cakes, not to the fault of the person who submitted this recipe which is why it doesn't reduce the stars I'm giving it. I didn't pay attention and baked my cakes thinking I was going to use them and make Black Forest Cake. I cannot stress enough how important it is to remove those cakes from the baking pans after cooling for ONLY 10 minutes. I left mine for several hours without thinking anything of it and they wouldn't come out at all. My husband said it was so depressing to smell chocolate every time he lifted the trash lid! LOL!! So, I'm going to attempt that again and don't anticipate any problem."
"0","4","I always take things five minutes out of the oven before its required cooking time. And its a good thing I did. It came out perfect at 25 minutes at 350 degrees Fahrenheit. It was moist and not too sweet. The coffee was a great addition to the flavor. The next day however, the 'muffin top' became a bit dried up and chewy. Since the edges are the first thing you bite into, it kinda takes away from the cupcake. The middle part is still very moist and delicious. The next time I make it, I'll make sure to not fill the cups as much. Other than that, it was very good."
"0","5","I made this cake tonight for the second time. I learned a trick from Joy the Baker that helps make sure you get cakes out all in one piece - grease the pans, then put a piece of parchment paper on the bottom of the pan, grease the bottom again and then flour the pan. It's extra security, and it's worked great for me so far. I have noticed that this cake tastes better after sitting for at least a day - preferably two or three days. I don't particularly care for the taste much when it's fresh, but as it ages the coffee mellows and the chocolate deepens, resulting in the best chocolate cake I've found yet. Both times I have used milk soured with vinegar instead of buttermilk - this time I used goat's milk. I am curious as to how other people have stored the cake. Last time I made it into a layer cake and frosted it, and kept it in the fridge covered with plastic, but we decided that we prefer it plain and made ahead of time, so I'm wondering how to store it for the next two days until I need it."
"0","5","This will be my go-to chocolate cake from now on! Super moist but light and great intense chocolate flavour! Use Ghiradelli cocoa and increase to 1 cup like other reviewers recommend. Soooo easy for cupcakes since the batter is so thin and pourable. My cupcakes had fresh orange curd filling and orange buttercream... everyone who tried them just raved!!"
"0","5","Incredible chocolate cake, hands down the best from scratch chocolate cake I've ever made. Moist and rich with chocolate flavor; good enough to eat on its own or frost (as I did) with fluffy PB frosting from this site. When I started making the cake, I went to add the sugar and didn't realize I was 1/2 cup short. I still decided to forge ahead and the results are STILL amazing even with the reduced sugar. Highly recommended recipe!! Thanks for sharing :)"
"0","5","These are so moist... maybe one of the best chocolate cupcakes I've ever had and I was proud to say that I made them! Very easy... and quick and I topped them with the creamy peanut butter frosting from this site!"
"0","5","My absolute favorite chocolate cake recipe. Perfectly moist!"
