helpfulCounts,ratings,reviewText
"0","5","I've made this recipe a few times now and I always tastes good! As was mentioned before, the 1 tsp of baking powder gave the top a more cake like consistency. I only put in 1/2 tsp of baking powder and it turns out just fine but not so much like cake. On the top I put a bit of cinnamon and sugar along with some allspice and it tastes quite good. I have also found that this recipe can be used with other fruit as well. More recently I have made a strawberry and peach cobbler. Overall, very nice recipe!"
"0","1","Sickeningly sweet!"
"0","5","This cobbler just came out of the oven and I'm in LOVE! It is, by far, the best cobbler I've ever tasted. The flour mixture is just sweet enough for me. (I don't like biscuit-like cobblers, so this being sweeter is perfect.) It doesn't need ice cream or whipped cream--just serve it up with a glad of milk and you'll get rave reviews!"
"0","4","My family loved this recipe. The only thing I would change is to double the topping as there wasn't enough to cover the entire top and it was really delicious with the peaches. I used some ripe and some less ripe peaches and it turned out fine. I will definitely make this again."
"0","5","Yum"
"0","4","I'd never made cobbler before and this turned out great, didn't change a thing!"
"0","5","Absolutely delicious! I made two small changes. My peaches weren't quite ripe, so used an increased amount of sugar and cinnamon for the mixture that I used to coat the peaches. I used 1/2 cup of brown and white sugar instead of 1/4 cup of each, and I used 3/4 tsp of cinnamon instead of 1/4 tsp."
"0","5","This was a very simple and yummy recipe."
"0","4","This was good but the topping is not my favorite. Next time I will utilize the brown sugar with the write sugar with my normal recipe. Like the brown sugar addition."
"0","5","This cobbles was goooood"
"0","4","This was my first time ever making peach cobbler. My husband really enjoyed it. He loves sweet things but I could actually use a little bit less sugar than the recipe calls for. I liked the crust and would like more of it. I'll definitely be making this recipe again with the slight sugar adjustment. Thanks for the easy recipe!"
"0","5","This is so good that I have to hold back from eating the whole thing myself. This with some nice fresh whipped cream is heaven :) Thanks for sharing"
"0","5","This recipe is so delicious!!! I added an extra two peaches, because mine were on the small side. I also added extra cinnamon and nutmeg to the recipe as well. I will most definitely be making this again."
"0","5","Really great and simple recipe. I happened to have some peaches in the kitchen and decided to try this. Fresh peaches are key!!! This was devoured in 24 hours!"
"0","5","Made with blueberries, very good!"
"0","5","Awesome! Made this for dessert over the weekend and it was a smash hit. Everyone loved it; best to use ripe yellow peaches (we had some white peaches mixed in which also worked well, but I wouldn't try this with only white peaches). I added a small amount of freshly grated nutmeg in the peaches and it really 'popped'. This is definitely a keeper."
"0","3","Okay, will not be one I go to. Not sure if it was peaches to cobbler ratio or not. Maybe my 8 peaches larger then what recipe calls for."
"0","5","amazing"
"0","5","I just came into a whole bunch of peaches and this recipe looked easy enough to try! I'm so glad I did!!! I made it as written and it was great!! I only put about half of the cinnamon sugar topping on over the crust and that was plenty for me!! Great with vanilla ice cream!"
"0","5","Super yummy. Double the topping."
"0","5","This is the best Peach Cobbler I ever made. My husband loved it. This receipt definitely goes in my receipt book. I will use this over and over again. I wouldn't change a thing."
"0","5","I've made this three times & each time it is incredible. I wouldn't change a thing about this recipe."
"0","5","Delicious! I use a little less sugar in all stages and whatever seasonal fruit I have like pears and will even mix like with nectarines! I especially like that it's almost a one bowl dish. Only problem is that it doesn't last long!"
"0","5","Wow, this came out really well. Our home-grown peaches are tart, so the sweet, crunchy crust was just the right balance. I served it warm with vanilla ice cream, and my husband and I couldn't stop raving about it. If I ordered this in a nice restaurant, I would be completely satisfied. I noted comments about baking powder taste and used just a smidge less than a teaspoon, but I didn't notice any lingering taste."
"0","5","Just made this peach cobbler tonight exactly like recipe. Not a bite left. Best cobbler I have ever tasted and very pretty. Tks for the great recipe !!"
"0","5","Great"
"0","4","Really good! Just what I was craving. I think it could use more cobbler though, and would likely double that next time. Also, I left out the salt, as it is totally unnecessary, I used gluten-free flour, and I left out the cinnamon sugar topping, because I thought the recipe had enough cinnamon already. I really liked this, and made some for a gluten-free friend, who loved it as well!"
"0","4","So easy! Quite delicious, too ."
"0","5","I've made this twice - both times it was amazingly delicious. Easy to follow recipe and a fresh summer treat in no time. I omitted the last step sprinkling with sugar and cinnamon - it's tasty enough. Once dished I added a spoon of frozen vanilla yogurt. YUM thanks for sharing"
"0","5","Yummy!!! It was soo great!"
"0","5","I am 49 years old, born and raised in Georgia and about to lose my 'southern girl card' because I had never made a peach cobbler. I am SO glad I chose this recipe as my first attempt. So good!!! My picky husband and 20 year old man-child loved it. I made it exactly as instructed, no changes needed for us."
"0","5","Made this with fresh peaches grown locally! It was delicious and I didn't alter a thing. It is a wonderful recipe."
"0","4","It would have received a 5 star, if it had not used nutmeg. I am not a fan of nutmeg."
"0","5","Doubled the recipe and made this with some very juicy peaches. Peaches were cooked for 10 extra minutes because there were so many. I was worried it was going to be soupy and to sugary. I was wrong! After it cooled for a couple hours on the counter we had some and it was delicious! Didn't use nutmeg and added a teaspoon of vanilla. To die for..."
"0","5","Best cobbler I have ever made. :)"
"0","5","Very easy recipe!"
"0","5","Best peach cobbler I have ever made. I doubled the recipe but used a little less brown sugar as other reviewers suggested. I used very ripe seasonal peaches. My guests raved about it. Bonus... Very simple to make."
"0","5","This cobbler is delicious. I cut thick slices of peaches because I like my cobbler chunky. I made the topping with the same spices and sugar that I put into the filling. The only thing I didn't add to the topping was the cornstarch. Will make this again and it didn't last long in my home."
"0","5","My peaches were fresh from my peach tree so fairly small. I used 16 for one cobbler"
"0","5","Excellent recipe. My only change was to NOT cook the peaches ahead of time. I do not like mushy fruit dishes, and by using ripe peaches, slicing thinly, and not baking them first they were absolutely perfect and juicy when the final product came out of the oven. I used a 9x11 pan and had to double the topping because the amount given didn't cover the peaches much at all in that sized pan. Oh darn! LOL It's juicy but not runny and the flavor is wonderful. The topping baked up nicely and had a slight crunch on top from the sugar sprinkled over it. I had some with whipped cream and it was delightful, but I bet ice cream does it proper justice."
"0","5","I'm not a baker but have a peach tree and too many peaches so needed to do something different. This was easy to follow recipe. Only change, I used regular butter since I didn't have unsalted on hand. Would definitely do this again. Very yummy and perfect served with a scoop of vanilla ice cream."
"0","5","I made this and took it to our Church picnic....there was nothing left, all of it was gone! Now that says a lot! I'm making it again right now!"
"0","5","First time ever making Peach Cobbler! This recipes was a hit for our July 4th Party. Very good!"
"0","5","I have tried numerous recipes for peach cobbler and this one is the best I have ever made. It was gone in minutes. It was just right in every way."
"0","5","Served for the 4th of July and received rave reviews :)"
"0","5","I've never made cobbler before but living in GA decided nothing says July 4th like a fresh peach cobbler. It was a huge hit. There were several cobbler snobs in the room that said it was some of the best they had ever had. It's a keeper! Also I cut up all the beaches the day before soaked them in iced lemon water for 10 minutes then refrigerated in a ziplock. Kept them fresh and peachy and saved me tons of time the next day."
"0","5","Made this for July 4th. One of the best peach cobblers I've ever tasted. Didn't change anything. I used an 8x8 glass baking dish and everything fit perfectly. For the topping I broke off small pieces of the dough and sort of flattened it slightly in my hand and layed it around to fit. I also didn't use all of the sugar cinnamon topping. Your house will smell wonderful while this is baking!"
"0","5","I made this with gluten free flour for a friend. It still turned out great."
"0","5","Delicious, although more like a peach crisp than cobbler."
"0","4","Although I prefer a pastry crust on cobbler, this was very good. ."
"0","5","Thanks for sharing such a great recipe, aeposey! I was finally able to get some fresh peaches to make this cobbler. What a treat! The spices were perfect for this luscious fruit and it was relatively easy to make. Everyone loved it. Cheers!"
"0","5","First tried this at a graduation party. Best peach cobbler. Make it everytime peaches are on sale."
"0","5","Excellent as written! I prefer more peaches, but it's just like moms :)"
"0","5","We loved this cobbler! The top got quite dark but didn't taste burnt at all, so don't be discouraged when you pull it out of the oven."
"0","5","It tastes amazing. I made it for my niece and everyone loved it. So much in fact my mom requested it for her birthday instead of cake :)"
"0","5","This recipe is delicious and very easy to make. I used canned peaches in lite syrup to cut the preparation time and a little more cornstarch mixed with water to thicken it up. I cut the sugar used to go in the peaches because the lite syrup is sweet. The crust browns up nicely. I served it with vanilla ice cream and everybody asked for seconds."
"0","5","I absolutely love this recipe! Best peach cobbler ever!"
"0","5","My peaches were not as ripe as I would like but everyone loved it just the same. Great recipe, thanks for sharing."
"0","5","This was super tasty. I made extra crust and it was perfect!!!"
"0","5","I used a large can of peaches & substituted the juice for the water (I used all the juice in the peaches). I also used a stick of real butter. It turned out delicious. Will make often."
"0","5","This cobbler is my go to if I want to impress. I hate a mushy cobbler and this one has an excellent consistency. The fresh peaches play a big part in that so definitely don't go for canned. Perfect cold with whipped cream or hot with icecream. Yum Yum Yum."
"0","5","Always get compliments"
"0","5","Easy to follow, I added blueberries in with the peaches, which since its not quite peach season yet, I used bottled peaches. Sweet and tasty, will be my basic go to recipe"
"0","5","Easy to make and tastes great too"
"0","5","Can I prep this ahead of time, like the night before, and pop it in the oven while guests are eating dinner the next day? I'd like this to be warm when we eat it, so I'd prefer not to bake it ahead of time....Please let me know if this would work..Thanks!"
"0","5","This was very, very good even though I didn't use peaches. I thought I had some in the freezer - nope - only cherries. Used approx. 5 cups cherries and tapioca instead of cornstarch. Cooked on stove top first instead of the oven (I didn't think 10 min. in the oven would thaw the cherries)and then added the batter. Baked for 25 min and covered with foil for the last 10 min. Didn't use the sugar topping. It was plenty sweet. I will make again with peaches and probably try apples or combinations of fruit too. Thanks for the recipe aeposey!"
"0","5","So easy!So Delisious!!!! Never even made it to the plates, my kids and wife ate it all up as soon as the could bear the heat! I didn't have fresh peaches so I used Canned and added 1\2 teasoon of chia seed to help with extra moisture, and ground the cinnamon fresh."
"0","4","This is delicious! We didn't have fresh peaches so we used the ones canned in fruit juice and it worked very well. We also had some passion fruit on hand and it gave it a very nice flavor. I'll definitely make it again!"
"0","5","I didn't change anything. The crust was delicious. I don't like a cake-y cobbler."
"0","5","WOW is all I can say! This recipe is SPECTATULAR! Every year, I buy a bushel of peaches and can my own peach pie filling. This recipe is definitely worthy of my home-made filling! Thanks so much for sharing it!"
"0","5","This was awesome and pretty easy. It took 30 min to bake, as stated. One reviewer said to"
"0","4","We liked this dessert but very much like an English crumble but with more butter. Good base for all kinds of fruit fillings."
"0","2","I baked it as directed yet the dough.did not cook completely (maybe because i.used canned peaches and did not drain them completely), taste was very good"
"0","5","Yummy! The crust was just unbelievable delicious! And the recipe was so simple. Enjoyed baking and eating it."
"0","5","Loved it! I made this yesterday and it was a hit."
"0","4","I've had better, but this is good!"
"0","4","Really good desert..not time consuming at all. Pairs well with vanilla ice cream and Reddi whip"
"0","5","This Peach Cobbler was simply amazing. I only used 6 peaches and that was enough. It wasn't too sweet, it was light, it was delicious!"
"0","4","This recipe was pretty good. I did however alter the dough part adding nutmeg and cinnamon so that both dough and compote would merry properly. It tasted exactly like Moms."
"0","5","OMG..I made this cobbler and everyone from my family and friends to my barber were jaw locked. They loved it, and many requested a whole cobbler. Im a dessert baker amongst my circle a nd this recipe is a newly added favorite. It compares to my Great Grandmas'. The topping is delicious"
"0","5","I love this recipe, its not peach season so I used home canned peaches and they were amazing. I added extra cinnamon to the flour mix and a dash of nutmeg so the flavor carries through the whole thing. My boyfriend and I just LOVE the flavor.. there is no such thing as leftovers with this."
"0","5","this was an absolute HIT in my family....they are begging for more...."
"0","5","Made this recipe for my husband. He absolutely loved it! Will making again very soon."
"0","5","Excellent. Very easy to make."
"0","4","Very good cobbler recipe that got the approval from the worst critics (my friends & family). I did however have to double the batter recipe. I also cut down the cinnamon & nutmeg in half because I'm not a big fan of cinnamon and nutmeg. Other than that, it was amazing! I will keep using this recipe!"
"0","5","Made this using can peaches. Wonderful recipe. Everyone loves it each and every time."
"0","5","I've made this a few times already and am about to make it again for Christmas!! I follow the directions to the tee and I love, love, love it!!!!!!"
"0","5","This is my go-to peach cobbler recipe.It's gotten the stamp of approval from my family, and that is very important to me :)"
"0","5","Incredible...the crust is crispy throughout, not just at the sides. Flavorful and full of yummy!"
"0","5","My family loved this recipe! Especially my mother-in-law. She went to the farmers market and bought two huge boxes of peaches just so I could make more. It's such a popular dish in our family now! I did add 1/2 of tapioca to help it from running when you serve it."
"0","4","I always try to stick to a recipe as closely as possible the first time around, however I had to substitute canned sliced peaches instead of using fresh. I used two (large) 29 oz. cans. It made quite a bit of filling, just right actually. I drained all of the juice out of the cans and pressed as much as I could without squishing them. My review: This was a delicious cobbler, it had great flavor. I did my best to drop & spread the dough by spoonfuls and got pretty good coverage. My husband was disappointed because he was wanting the 'crust' to be more like a pie crust. This turned out to be more like an inch thick layer of cake. Really good, but not what I was looking for. Oh, and pretty sweet. I LOVE sweet stuff. You could probably cut back on the sugar and be ok. Please be sure to use an 8x8 pan. This recipe isn't written for a 9x13."
"0","5","I have made 5 of these in the last 2 weeks they get gobbled up."
"0","5","Made peach cobbler for the first time using to recipe. It was perfect!!! I can't wait to make it again."
"0","5","Made this tonight and it came out great. I did use a pie crust to bake the peaches in - didn't change otherwise and it still tastes wonderful! My 6yr old even helped."
"0","5","THE ABSOLUTE BEST PEACH COBBLER RECIPE. thank you aeposey!"
"0","5","Delicious"
"0","3","The topping of the cobbler however was excellent, it was the inside of the cobbler that didn't taste too great. I baked the recipe just as it's written; no changes."
"0","5","everyone loved this.. I did not change anything"
"0","5","Delish delish delish!!! Wow this was great! I couldn't stop eating it! My peaches were not that fresh and they were on their last legs. I salvaged all I could for this recipe cutting out parts that weren't good anymore. And the recipe was still delicious! Yum!"
"0","5","It was great! Easy to make. Not the traditional crust I am used to for southern cobbler, but delicious."
"0","4","Very light and fluffy crust! I used 4 very large peaches and it made two dishes worth. Yummy! I kept my skins on the peaches, but I might peel them next time. For the topping, I needed to add more boiling water so that it would incorporate. I also sprayed my dishes before putting in the peaches. Finally, next time I will only bake it for 20-25 minutes. My crust was a little too dark, but still very good."
"0","4","It was close, but not quite the cobbler I was imagining. Taste wise, it was good ( even with the 29 oz. canned peaches I wanted to use up). I did up the cinnamon because I love it in cobbler, and per popular suggestion, I increased the topping, which resulted in a more biscuit-like, crunchy topping. I was hoping for a more cake-like texture. It was good, just not exactly the 'it' peach cobbler recipe I was looking for."
"0","5","I have never made a peach cobbler so my inexperience may sway my review but this recipe turned out great. My family loved it and it was so easy to put together in a short amount of time."
"0","5","This recipe was perfect! Peaches are not in season right now so I couldn't use fresh, so I had to substitute with two large cans of sliced peaches in heavy syrup. Because I didn't use fresh I cut the sugar back to 1/8 cup in the peach mixture and drained one of the cans of of peaches and omitted the lemon juice. Everything else I left the same. Based on other ratings I used 1 1/2 times the amount of stuff for the topping! It tasted great and my family loved it!!"
"0","5","Great cobbler recipe! My husband and I both agree it's awesome. I would definitely make this again and probably with other fruit too. We didn't find it too sweet, and I followed the recipe as is, although I was short a couple of peaches."
"0","5","This was the most delicious Peach Cobbler I have ever eaten and it was simple to make."
"0","5","Loved this recipe. I made it exactly as it instructed and I wouldn't change a thing. Simple, fresh and delicious."
"0","5","It's really easy to prepare. Had only 6 peaches and that was enough. Maybe next time it's better to reduce the amount of sugar mixed with peaches. Want to try this batter with canned apples and plums."
"0","5","Best cobbler ever. Best recipe I have made. I added some oats to the topping and sliced the peaches into big slices. (Just my taste.) We all loved it!"
"0","5","Absolutely delicious! This was easy to make, and was a hit. I served this as dessert after a very 'autumn' dinner and it went perfectly. I put extra cinnamon and sugar on top and cooked it about 35 minutes until it got nice and dark on top."
"0","4","This is definitely worth another attempt, but overall it was what I was looking for. Be careful not to overcook! I found that even an extra 5 minutes makes the topping a bit hard and began to dry out the dish. Also I would NOT recommend blanching the peaches in order to peel them. However even with my user-error, the taste was right on the money!"
"0","5","Tried this recipe on the grill to keep the kitchen cool. Mixed the peaches (in larger chunks as 1 reviewer suggested) with a few left over raspberries and tossed in ingredients mentioned in step 2. Covered in foil, then put on the top rack of grill while husband grilled chicken for dinner. Grill was about 300 degrees. When dinner was served, mixed topping then placed back on top rack of grill (300-325degrees) and let it cook while we ate dinner and cleaned up. After about 45 minutes, it had simmered and reduced to make a yummy, crispy topped dessert. Served with vanilla ice cream- the whole family raved."
"0","3","it was delicous not a good crust i improvised with oat meal"
"0","5","I've tried MANY recipes and this was the BEST!!!"
"0","5","Amazing peach cobbler, it was a hit with everyone"
"0","5","Wow! I am not a fan of fruit desserts but this has made me think twice! Made it for a family gathering this summer and everyone was so impressed. The only thing I wish I had was vanilla ice cream! Oh well, maybe next time because I will be making this soon!"
"0","5","Wonderfully adaptable! We substituted GF flour blend and sucanat ilo sugars and everyone loved it! For a family who very seldom gets sweets this was wonderful!!"
"0","5","This has to be THE BEST peach cobbler recipe ever! I used the jumbo peaches from Costco, which were slightly overripe. Didn't matter. The cobber just perfect in every way. My kids, that can't stand peach cobbler, wanted more! It was just awesome. Can't wait to make it again next summer."
"0","5","Made this with my fresh frozen peaches I put up last year, and it was excellent. I did add more cornstarch due to the fact there was more liquid than normal since they were frozen and thawed. Everyone loved it!!!!"
"0","5","We made this gluten-free, and it was great. I had 7 or 8 LARGE Colorado peaches, so I'm glad I went with a 9x13 dish. After doubling the topping, it still overflowed and made a bit of a mess in the oven. We used King Arthur All-Purpose Gluten-Free Flour, and I used about 1 1/2 of the cinnamon sugar topping, and the amount of peaches to topping, baking time, temp, sweetness- everything was perfect. I will definitely make this again. Thank you!"
"0","5","Taste great"
"0","5","I made this for my local firefighters on 09/11 and they loved it! It's all gone. I followed the recipe except for the white sugar and cinnamon topping on the crust. I lightly sprinkled the top with sugar and cinnamon. I also added a bit of vanilla to the topping. I served it with vanilla ice cream, and it was a hit!"
"0","5","This 'crust' is what makes this so awesome. I omitted the nutmeg, added vanilla and only used Brown sugar and doubled the topping on a suggestion of another review, came out divine!!!"
"0","5","This was soooo good. I took the advice of another reviewer and made 1 1/2times the amounts of the batter mix. It was just the right amount. I agree with cutting the peaches in chunkier pieces! Also, I did not put the sugar mixture on top. It's just extra sugar that isn't needed - especially with a scoop of ice cream on top. :) YUM!"
"0","5","I made this for my mother-inlaw, who is famous for her peach cobbler, and she said it was better than hers! It was a hit and we have made for the second Sunday in a row. Delicious! ( the only change I made was doubling the recipe and I added 2 tsp of vanilla)"
"0","5","Delicious and easy. Followed the recipe exactly as written. I served with sweetened whipped cream that I had added a little vanilla to. Everyone loved it!"
"0","5","Absolutely loved this recipe. No need for adjustments its perfect. My husband isn't a desert guy buy pushed people aside for seconds of this. Only thing I would change is I would serve it with vanilla ice cream next time."
"0","5","Amazing! Have made it twice so far. You will be eating it out of the pan it's so good."
"0","5","Best peach recipe for this summer!!! My oven runs hot so down to 25 minutes. Did not change any proportions and mixture of brown and white sugar was right on. Perfect with a scoop of butter pecan ice cream! Thanks aeposey"
"0","5","I used canned peaches in light syrup, and sugar in the raw. This is definitely a family favorite!"
"0","1","I had to scrape the topping off and add more sugar . It was sour. I won't make it again. I fixed it and put a differant topping on it."
