helpfulCounts,ratings,reviewText
"3","5","i absolutely love this. I use OREO cookies for the crust, which i usually double because i find one recipe of crust is not enough for me. Other than that this recipe is perfect!"
"3","5","The absolute best cheesecake. I have had nothing but rave reviews about this dessert. It will be one I make again and again."
"3","5","I made this for Christmas. My first attempt at a cheesecake and it was fabulous!"
"3","5","Delicious! I made mini cheesecakes using muffin tins to make individual desserts and they were a definite hit!"
"3","5","ABSOLUTLY AMAYZING!! The first cheesecake I have ever made and it was the best I had ever tasted. I followed the directions exactly and made it for Christmas. Everyone loved it."
"3","5","I've made cheesecakes for years and have to admit this one was a standout. I made a few modifications. I used a full bag of Ghiardelli white choc. chips and had 2 squares of white baking chocolate that I added as well. Super rich flavor. I did not have frozen rasberries, so I used Polaner seedless blackberry jam. Everyone RAVED over this. The blackberry and white chocolate flavors combined were absolutely decadent. I will definitely be making this one again. I've already had several requests for it."
"3","5","I made dozens of these for Christmas gifts and everyone loves these."
"3","5","Absolutely delicious and worth the time and effort. The only thing I changed was to strain the raspberry seeds before cooking as others had suggested."
"3","5","This was AWESOME! I have been looking for a good cheesecake recipe for ages but always seem to find the ones that have a citrus taste. I followed the directions exactly except for the use of Oreo's for the crust; if you do this cut back on the butter the Oreo filling will help hold it together. I probably won't add the filling in the middle next time, it didn't seem that important. I used frozen raspberries, but will probably use a preserve next time to save me the effort. Overall, I'm totally going to make this again...soon!"
"3","5","Amazing! Very good tasting and very beautiful and attractive. I suggest covering the bottom of your spring pan with two pieces of tin foil and placing the pan in another pan that has water in it to bake the cheesecake evenly. Also, I would suggest making more raspberry sauce then indicated in the recipe for topping when serving."
"3","5","I made this for my husband work and he called and asked if I could make him another one becasue they loved it so much."
"3","5","I was very happy with the results of this dessert, and had many people request the recipe."
"3","5","my mother in law has made this recipe on several occasions, most recently this Christmas! And it is by far, the best cheesecake ever! :) I will be making this for my husband probably the rest of our lives."
"3","5","I have made a few cheesecakes from this site, and this was by FAR the best, lapping the others even. Firstly, I use all the tips from this site, including water bath, and then the article on how to mix the ingredients to obtain the perfect consistency. This is important info. USE it. Also, always use the oversize Reynolds heavy Duty aluminum foil when using the H2O bath. Dont skimp unless you like cheescake smoothie. I used seedless rasperry fruit spread and maybe it's denser than than when you actually make the reasperry, because it sunk to the bottom of the cake and it refused to swirl. I did nuke it and drizzle it over the top when I served the cake. best cheesecake I've evermade from this site, hands down."
"3","3","I followed the advice from previous reviewers and doubled the cookie crumbs for the crust - this is necessary. Crust was very good. You may also want to try the crust from the 'Basic Cheesecake' recipe on this site. Other than this, I followed the recipe exactly. The cheesecake was very easy to make but the end result was far too sweet for my taste. I may attempt again with one alteration - reduce to 1 cup of white chocolate chips and cross my fingers. Avoid cracks in your cheesecake by using a water bath - works every time."
"3","5","This was easy, and everyone loved it so I am making another one for new years eve. I wish the recipe was clearer on how to do the rasberry middle, but it is still 5 stars for taste and presentation. I used a regular graham crust, but think if I had done the chocolate cookie one it would have had more of an chocolate flavor and I will next time. It was yummmm..."
"3","4","I used double chocolate oreo cookies, and 1.5 TBS sugar for the crust, and then made exactly as directed. I loved it, and have no complaints however many of my family members have commented that it is a bit too sweet for them."
"3","5","Mmm, very very good, just what The Man requested for his birthday treat. I too used jam but didn't melt it all the way liquid and it kind of sunk to the bottom of the crust: still delicious, but not quite the presentation I was hoping. I wish I could share with you all my tricks for perfect cheesecake, but I'm learning to accept and love my cracked brown cheesecakes. The texture and flavor was spot-on, thanks so much for sharing!"
"3","5","Make sure you leave your butter and eggs out for atleast 30 minutes before baking. I substituted blackberries for this last time I made it and it was just as fantastic! To keep the fresh berries standing on end like the picure, melt some white chocolate almond bark and dripple on to cheeescake. It keeps the berries in place much better (especially if traveling with cheesecake.)"
"3","5","This is an EXCELLENT cheesecake. I followed the recipe (with the exception of the raspberry sauce recipe, just used smuckers seedless jam and microwaved it) and it came out perfectly! One of the easiest and yummiest cheesecakes i've made. Everyone loved it!"
"3","5","I did a variation of this recipe and the mini cheesecakes recipe. I changed the servings to 6 so that they would fit in 12 cupcake cups. It was perfect and delicious. I also decided to use regular graham crackers instead of chocolate. The hubby loved them! :)"
"3","5","I made this last year for a Progressive Dinner Party. It was my first time ever making a cheesecake and I was scared to death. Turns out, I had nothing to worry about. It's great (and easy)!!"
"3","5","Awesome to come home to this beautiful recipe cooked by my son. He is so creative and as the cupboards did not have white choco chips or frozen raspberries he had to improvise. What turned out was sooooo soooooo very incredible and can't wait to make again with your exact ingredients. (or hopefully he will cook again as he puts me to shame) He used semi-sweet chocolate chips and frozen boysenberries. Oh, and I forgot to say I did not have chocolate cookies. He made the Chocoate Mint I cookie recipe in this site but left out the 36 mints. Sounds crazy to go through so much effort, but I would pay huge for a single slice at any fine restaurant. Thank you for inspiring him and I wish I would have thought to take a picture. The marbled top was beautiful even before adding the super syrup. Again, thank you and it is soon to be repeated word for word!"
"3","5","This is a definite 5 star recipe! It tasted as good as it looked. I used the advice of a previous review and baked the cheesecake with foil around the bottom. I put it on a cookie sheet and filled the sheet with water. It baked for an hour and then I turned the oven off and let it sit for another hour before putting in the fridge for the night. It did not sink or get too brown and there were no cracks. The top was perfectly swirled and beautiful. I have made many cheesecakes over the years and this one is by far at the top of the list!!"
"3","5","this was amazing - we took it over to a friends house, it was described as 'epic' wow!! I didn't have half and half so used a little bit of 1%, which was fine, next time (which will be sooner than later) I will probably add a few more raspberries. YUM! Cant wait to eat this again!!"
"3","5","It was delicious! However, there was too much raspberry sauce left over. Though, thats not that bad of an issue as I just made raspberry mojitos with it."
"3","5","Best cheesecake ever! This was my first time making cheesecake and everyone loved it! If you are looking for a little less work, you could buy a premade chocolate crust. I didn't strain the seeds out and everyone who tried it said that it's much better with the seeds! Delicious recipe."
"3","4","A great cheesecake! I had to stop myself from eating the batter!! Only 4 stars, though, because it came out a little flatter than my usual cheesecakes, but excellent in taste!!!"
"3","5","AMAZING and so easy to make! I cook, I never bake, but this was so easy not even I could mess it up! I made it for my mother's church potluck and they ALL wanted the recipe. Next time I think I'll make it with dark chocolate chips instead since I really like the combination of dark chocolate with raspberries."
"3","5","I'm known for a mean caramel apple cheesecake but that's about to take a backseat! As a cheesecake enthusiast I've been known to be very particular about CC recipes. This one is a keeper. My family isn't particularly fond of raspberries so I substituted strawberries. I also took another reviewer's advice about purchasing jam(strawberry in my case) and microwaving it for a few seconds. Amazing. I wish that I'd taken a pic of the cheesecake fresh out of the SF pan or after slicing because it looked great. I also used whipped cream which melted and spread across the surface and down the sides of the cheesecake so evenly that others swore that I'd done it myself. The added vanilla from this enhanced it beyond anything we'd imagined by adding a nice contrast."
"3","2","Way too sweet!!!"
"3","5","Even though I have not yet tasted this cake I can already tell it's a 5 star. It is baking in the oven now and smells so delicious. It is a little time consuming, especially when you have to strain the seeds from the raspberry sauce. Leave the cream cheese out beforehand so that it is room temperature when it comes time to mix. I also took the advice of another reviewer and wrapped the bottom of my pan in tin foil and cooked it on a cookie sheet w/ water. Don't over beat the cream cheese as it adds bubbles to the surface of your cake. White chocolate = YUM!!!"
"3","5","I have made this SEVERAL times and I wow people with it each and every time! It is very similar to the cheesecake they have at olive garden. Soooo good!"
"3","5","OH MY GOSH!!! I never cook...I LOATHE cooking simply because I have three kids (2/4/6) that are always under my feet but i had an afternoon off and a husband that loves cheesecake so I thought I would give it a try.....HOLY COW!! this cheesecake is AMAZING!! My husband couldn't get enough of it and my friends that I made try it said that's they would pay money for it!!! WOO HOO!!! Thanks all recipes from someone who doesn't like cooking you've shown me what i really can do!! I just made this the night before and they're already requesting another one and another one and another one...."
"3","5","Great, everyone loved it, but it is a little sweet for my liking. Make sure to bake in a water bath!"
"3","5","This cheesecake is soooo YUMMY!!! I made it for my husband fo Father's day. Everyone loved it. I will definetly be making this again. I didnt change anything."
"3","5","'That was the best cheesecake I've ever had!' was a comment I received after making this! And I have to agree - I made it for a baby shower and there were plenty of leftover desserts, but the cheesecake was all gone! I took the advice of someone else here who said they doubled the amount of white chocolate morsels used, as well as using a 10' springform pan. Not only did the cheesecake taste wonderful, but it was very 'pretty'. A dab of homemade whipped cream w/a raspberry on top and white chocolate shavings made the cheesecake 'look like a gourmet dessert' (another compliment!). I've already had people tell me they want me to make it again and I can't wait! The extra prep required by this cheesecake compared to regular cheesecakes is well worth it. It was a crowd-pleaser!"
"3","4","I made this for a Memorial day bbq. I had every intention of having a slice, but it was all gone by the time i got to it. From what I was told it was really good. I used raspberry preserves heated in the microwave, I also used oreos with its cream filling for the crust but added no sugar. I was able to melt the WCCs with a little milk (had no half n half) and touch of butter in the microwave. When cut, the crust just crumbled right off, didnt hold to the cake, dont know why. i'll try some other cookie next time or prebaking the crust."
"3","5","Delicious!! Divine!! Made for my son's birthday. I do agree about 2 cups for the cookies, because it makes a nice layer of crust for the bottom and then only add 1 Tb. instead of the 3 of sugar. I will make this recipe again. I did not use a water bath. I just put a pan of water in the oven. My cheesecake did not crack."
"3","5","My husband doesn't like cheesecake, but he said this is the best he's ever tasted. I followed the advice of some other reviewers and used two cups of oreo crumbs and reduced the sugar to 1T for the crust. I also followed the advice to blend the raspberries and water together, sieve, and then make the sauce. I only used 1 T sugar in the sauce instead of 2. I melted the chocolate with the half and half in the microwave. So very good and worth all the effort to make!"
"3","5","This is a very rich cheesecake!! It is creamier and thicker than say Cheesecake Factory cheesecakes and smoother and moister than traditional NY style cheesecake. I followed the advice of another reviewer and double the chocolate cookie's used for the crust. I used actual chocolate wafers and would definitely NOT reccomend using Oreos, they cannot give the same effect. I also followed someone else's advice and used seedless raspberry jam. I heated it in the microwave so it was like syrup and used almost a jar - I really like fruit with cheesecake and that amount was not overpowering. I also used fresh raspberries on top and whip cream. This dish was excellent but too rich to make regularly. Also, I read other reviews in which people said that the white chocolate was overwhelming...I couldn't really taste it. Just a rich cheesy cake."
"3","5","I used chocolate Teddy Grahams for the crust"
"3","5","I made a few minor adjustments just for my own taste and ingredients that I had on hand. I didn't have white chocolate so I used reg chocolate chips and I didn't want the chocolate throughout the cake so I just added the chips to the batter once it was all mixed. I left the berry mixture unstrained and the berries whole so when you bite into the cheesecake you get little chunks of berry and chocolate intermingled! Instead of the half and half used for melting the chocolate I added sour cream to the batter. This cheesecake looks and tastes very impressive. Thanks!"
"3","5","I have read time and again to avoid using non fat cream cheese in cheesecakes, but I can't help watching the calories, and it still turned out AMAZING! I followed the cheesecake tips about putting it in a water bath. Great recipe!"
"3","5","This is a fabulous cheesecake. It looks so pretty and I've played with the swirls on top to make different designs. Just remember to let your creamchz soften for a little bit before you start, and be sure to use the water bath while baking and leave it in the oven after it's done for about an hour. I always make the raspberry sauce by hand and it's WORTH IT! That's the part everyone raves about the most. It's really not hard at all. It's a hit every time!! Thanks!"
"3","5","This turned out perfect and I have never tried to make a cheesecake before...I did follow some tips from other reviewers and didn't beat the mix too much, put aluminum foil under the springform pan and placed it in about 1/2' of water. I also let it bake for the full time and then left the door open as it cooled. It really didn't look done so it was tempting to keep baking it., but so many people said to just let it sit. However, it turned out perfect with no cracks and everyone loved it. I am passing around the recipe."
"3","5","This was wonderful. I followed other peoples advice. 1) I used 2 cups of oreo crumbs for the crust. I used 18 oreos for this. When putting it on the bottom, I pressed it up the sides about 1/4 inch so it would come out of the pan easier. 2) I used seedless raspberry jam. Doing this saved a lot of time. ***note when pouring on the second layer of batter, the raspberry jelly gets lost into the batter. When you cut it you will not see the raspberry jam. However, you do see it on top of the cheesecake. It does make a very pretty presentation. 3) I used a water bath method. Cooked for 1 hour, left it in the oven for 1 hour, cooled it in the fridge (with plastic on the surface) overnight. The next day, I removed the rim and the plastic wrap as per instructions. Hubby and kids said to add it to the regular rotation. I did not serve this with more jam on the top, it is sweet enough."
"3","5","This was heavenly! My tastebuds were definately in love! YUM! I did double the crust portions according to suggestions offered, and I thought it was great! Family loved it! My dad didn't even know I made it, he thought I bought it!!"
"3","5","Excellent! Everyone in my family absolutely loved it! Looked and tasted like it came from a restaurant. I did add about a cup more white chocolate chips and 3/4 cup half and half instead of 1/2 cup. Turned out great!"
"3","5","I LOVE this recipe and have made it for every holiday for the past few years (by request). After the first few times of using the frozen raspberries I used someone's suggestion about getting the jar of seedless rasp. jam and it was a HUGE time saver without any mess. The only other thing I change is using Vanilla Wafers instead of the chocolate cookie crumbs. Thanks so much for the recipe!!"
"3","5","Wonderful recipe, I followed it to a tee except for one detail. The key word when making the raspberry sauce is 'thick'. If you add the cornstarch to start, it's way too thick to go through the mesh. I added 1/4 cup of water to the raspberries, brought them to a boil, mashing as it went to make sure all the juice was combined, and then strained them. Returned to the pan without a single seed, added the cornstarch, and it almost immediately thickened up."
"3","5","Jeline made this for Thanksgiving and it was excellent! A bit of work but worth it."
"3","5","Third time making, forgot to add the half&half to the white chocolate and it still turned out delicious and great creamy yet firm texture. Oreo crust, raspberry preserves, double the recipes and - Croud pleaser."
"3","5","I made a total of ten cheesecakes for my husband's 50th birthday party last night. I can't thank Allrecipes.com enough! I made this cheesecake (by far the most popular), along with Caramel Chocolate Pecan, Eggnog, and Chocolate Khalua. I prepared one at a time in advance and froze them all. Every one presented beautifully. Having never made cheesecake before I trusted every recipe & review here. Everyone thought these were store bought! I think I'll make these for Christmas gifts. Use water baths with the pan wrapped well in foil & a roasting bag. Cook for 80 minutes then turn the oven off & crack the door to set for 4 hours. Chill, then lift to a tray to wrap & freeze."
"3","5","Fantastic recipe. This was my first attempt at cheesecake as I was given my first set of springform pans for my birthday. It was a big hit. My only suggestions follow along the lines of what others have suggested. You can get by with a cup of crumbs on the bottom (expect them to be VERY thin with a few uncovered spots), but I would suggest a cup and a half - two cups instead. For anyone else attemtping a cheesecake for the first time I would really recommend the tips section and reading others reviews for helpful advise. I covered the bottom of my pan in foil and sat pan into another pan with about an inch of water. I turned off the oven after an hour and left to sit in the oven for another hour. It turned out flawless."
"3","5","Delicious. Used an Oreo crust. Baked an hour on a cookie sheet with water & the spring pan wrapped in foil to keep the water out, then shut the oven off and left it in there one more hour. I mixed raspberries with sugar (set an hour) & placed it in a bowl for people to spoon it on if they wanted. This made it unbelievable."
"3","5","Wonderful company recipe! Give yourself enough time when you make this. I didn't think I'd like the white chocolate but it rounded out the cream cheese flavor nicely. A 'hint' of almond extract in the cheese/white chocolate mixture is also good. Don't shortchange yourself - the raspberry sauce as written is well worth your time. A bit extra (1 1/2 x ) gives you enough to drizzle an attractive and 'tasteable amount' on top of each slice you serve. If you make the cheesecake a few days ahead it will be even better. Belle's Mom (5/11/09) gave good advice on this recipe regarding ingredient temperature and mixing time. My crust did stick to the pan a bit; I'll try a different flavored crust next time for variety - maybe Capn Matt's (2/18/09) or Dawn's (12/5/07) crust. My opinion is that if the top falls in a little it's not an insurmountable problem - you get a rim inside which you can place berries,almond slices, the raspberry sauce, whipped cream, etc. TUVM"
"3","5","YUM! A little bit time consuming but so worth it. I doubled the oreos for the crust and baked it in a water bath. Turned the oven off after an hour and left it overnight. So so so delicious and so worth the effort!"
"3","5","This was absolutely fantastic! Definately worth the trouble of making it. The only thing that I changed about the recipe was doubling the cookie crust. I also wrapped the bottom of the pan in foil and set it in a cookie sheet full of water while I baked it. Make sure it has enough water that it won't evaporate during the baking process. I baked it for an hour and then turned the oven off and left it in with the door cracked for another hour."
"3","5","Oh my. This was unbelievable. I don't like sweets and never eat dessert, but, when I was making this it smelled so good that I tried a little piece when cutting it. This recipe could make me a dessert lover. I made this for friends who came over to dinner and even after eating 2 appys and ribeye steak and shrimp with twice baked potatoes, they inhaled this cheesecake. A definite winner. Thank you so much for posting the recipe. BTW I made it exactly as written"
"3","5","I've made this cheesecake 3 o 4 times and everyone just loved it!!!! The first time didn't turn out as good, it browned more than I would have liked and it was too sweet for my taste, but the second (and rest) went great. I did use half the white chocolate and I kept it in the oven at 325 for 10 minutes and then at half that temperature until done. Absolutely wonderful cheesecake!"
"3","5","This was an outstanding cheesecake! I did alter a bit, by using regular graham cracker crumbs and omitting the whole raspberry part of the recipe. I needed a good basic cheesecake recipe - the melted white chocolate was a nice twist on the same 'ole NY Cheesecake. This was my second cheesecake I've ever made (the first one was morbidly over-baked)... I followed the directions of many others by using a waterbath, only baking an hour & then leaving it in the oven to cool for an hour or two and it came out terrific!! Many compliments from all who tried it! I mixed it up by topping with a homemade mango topping in the recipe for 'Trini Mango Cheesecake.' Delish!! Thanks so much for the recipe! (I'll be sure to eventually bake the original recipe someday...)"
"3","4","This is a delicious cheesecake. Only four stars though because it is one of the most time consuming and messy recipes I've made (and I cook a lot of gourmet foods) and I ended up with a lot of extra 'batter'. I hated to waste it, but that's what ended up happening. The end product was great though, and I would love to have this again."
"3","5","choc gram crust - no extra sugar. Water bath... cook 60 min; turn oven off and leave."
"3","2","I am soo sorry to give this a low rating. I wanted to love it, I really did. I followed the recipe exactly and even used the water bath method(no cracks at all!) and the cheesecake came out like a pudding rather than a cheesecake. The texture of this cheesecake was actually pretty gross. I do not know what I did wrong, or if this is just one of those kinds of cheesecakes. I love for mine to be smooth and creamy, but NOT pudding! The flavor of it was just alright as well. All the great reviewers must not have had some better cheesecakes. I should stop comparing every one I eat to the cheesecake factory. There is NO comparison. It did look very pretty though. Sorry."
"3","5","Amazing!!!!!! This was by far the best cheesecake I have ever had. It turned out wonderfully as is. I didn't change or alter the recipe at all. I would recommend this recipe to anyone. Also, it seemed a lot of people had trouble with the raspberry sauce, but if you cook it long enough it will become thinner and easier to strain."
"3","5","The best cheesecake I have EVER had. It was really pretty too! I added 1/4c cornstarch to the batter so that it wouldn't crack, b/c I didn't have a pan big enough to fit my springform pan in. Turned out great."
