helpfulCounts,ratings,reviewText
"1","5","I'm by no means a baker nor am I a cook. I'm very much a novice but I felt adventurous and decided to give this recipe a go, so glad that I did! This cheesecake is soooooooo good! I can't believe my very first cheesecake (that I made entirely on my own, might I add) came out so unbelievably scrumptious! Family and neighbors gave it high reviews. We even argued over the pieces, yes it's that good! This cake is smooth and rich, melt-in-your-mouth goodness. It tastes and looks beyond professional. I've already made it twice. I'll have to start making 2 at a time to ensure I have enough to go around and share.   Definitely bake this in a water bath as recommended by other reviewers. Wrap your springform pan in a double layer of foil, place it into a roaster pan or a jelly pan, then pour hot water around the springform pan, enough so that the water covers the sides of the springform pan halfway. Cook for an hour then turn your oven off and keep your cake in the oven for an additional hour before removing.   If your thinking about switching out the chocolate cookie crust for a grahm cracker crust, I'd recommend keeping the chocolate cookie crust as it more so compliments the taste of the raspberries and cheese and looks more visually appealing in my opinion. Also make sure to double the amount of crust.   I can't think highly enough of this recipe & cake, it's beyond any cheesecake I've ever had! I'm most proud that I made this entirely on my own & that it came out so smashing!"
"1","5","I have made this recipe more times than I can count! My friends and family absolutely love it. The only changes I have made are slightly shorting the cooking time, increasing the amount of crust and adding more vanilla extract. Use a sieve for the raspberry seeds but you will have to stir as the juice drips to move the seeds out of the way. Lastly, you can microwave the chocolate chips to avoid the hassle."
"1","3","I didn't love this as much as everyone else. I followed the recipe EXACTLY and it didn't have a lot of raspberry flavor, and wasn't nearly as pretty as a lot of the posted pictures. It was ok, but I've had much better luck with other cheesecake recipes from allrecipes."
"1","5","Our absolute favorite Cheesecake! This delicious cake never lasts more than 1 day. Make the recipe as directed, you won't be disappointed :-)  Tips: bake in a water bath-I cover the outside of the springform pan with foil and place it on a cookie sheet that I fill partially with water. Once the cake is done, turn off the oven but don't remove the cake for an hour."
"1","5","I have not made this recipe but my Son , who has NEVER made a cheesecake before did ! It was wonderful, I would even say it's the best I have had and can't wait to make this one myself.My Son told me of all the steps he took and it was a success. He did not have a hand mixer and was afraid it was not smooth enough but it was fine.The flavour, taste and texture were all perfect for cheesecake.this is a keeper !"
"1","5","I made this, but changed the reduction to a blackberry reduction. Ooos and ahhhs from everyone."
"1","5","I tried this for the first time last week, took the leftovers to work, and it was gone within an hour!! I made this recipe to exact specifications and it turned out perfect (perfect consistency). I did not strain the raspberry seeds as I had nothing available, but it was still great and no one complained. I will make again, but with more white chocolate chips to bring out the flavor a little more and try to get a strainer. I feel putting seedless raspberry jam like some viewers, instead of real raspberries just takes away the fresh flavor of the raspberries and is not an option for me, the seeds did not hinder anything."
"1","5","Everyone loved this when I made it for the past Christmas holidays. My sister brought in a Japanese cheesecake from a well-known baker. They both tastes different (Japanese cheesecake is more softer) but everyone liked the one I made more, because it was very flavorful and rich! Will make again"
"1","5","Absolutely heavenly! I followed the directions as written and we loved it. Based on other reviews, I did ensure that I did not overbake and left it in the oven to cool. I am a bit of a health freak and rarely indulge in such decadent desserts but I will be making this again. Thank you so much for sharing!"
"1","5","I followed the recipe exactly and it turned out great! It was my first cheesecake so I didn't know what I was doing, and it ended up with two huge cracks in it. I covered the cracks up with sauce and no one could tell! I found out by researching later that if you overbeat the eggs or don't let the cheesecake cool GRADUALLY (and don't open the oven while its baking!) you can avoid cracks. Also I forgot to grease my springform pan, so there was that as well."
"1","5","Don't freak out over all the tips/changes posted by other reviewers about cracks, etc. After this cheesecake 'turns' in the fridge overnight, it will be heavy, dense, and creamy. Absolutely fabulous! This will be my go-to basic recipe for all future cheesecakes. Follow the recipe exactly the first time and make any changes next time.....there will be a next time."
"1","5","This was the first time I attempted making cheesecake but it was easy to make. I used raspberry jam instead of frozen raspberries and it tasted great! My family loved it and so did my teachers. Great recipe :)"
"1","5","Best ever cheesecake! Got huge raves!"
"1","5","This is so good and I always get asked for the recipe. Transporting a cheesecake isn't exactly easy so in order to make it more portable I use the premade chocolate cookie crusts. This recipe will make two cheesecakes of that size. I bake them in a water bath at 325 for about 50 minutes and then turn the oven off let them set for about an hour. Thanks so much for the recipe!"
"1","5","Fantastic! Do not change a thing. Thanks for the recipe Cindy Ann."
"1","5","I bake often, but have never made a cheesecake before this one. I used Oreo crumbs (suggested in the comments) for the crust, and it was the BEST dessert I have ever made/tasted! I am a huge milk/dark chocolate and peanut butter lover so I was not expecting this to be on my top list, but it is definitely my new favorite!"
"1","5","Awesome recipe! I have made it several times. My plan is to bake a smaller version of the cheesecake for each widow in my church who has lost their husband in the past calendar year. It will be a Valentine's Day treat for those lovely ladies to show our love and appreciation for their lives."
"1","5","This was actually the first cheesecake I've ever made. It wasn't as difficult as I thought it would be and it turned out great. I made it for my mom's birthday and it ended up being one of the best cheesecakes I've ever tasted! I would definitely recommend and I'm sure it will become a new favorite at my house."
"1","5","I think this is so good. Like a restaraunts even. But I thinks the raspberry sauce should be doubled maybe bc when it is ready to eat there is not much left to put on top. But still a GREAT RECIPIE!!!"
"1","5","Rich and creamy. Delicious."
"1","4","Mine needed a full hour in the oven. I put it in a water bath and kept it in the oven for another 45 mins after I shut the oven off, with the door closed, to keep it from cracking. Also used 6 TBSP jam instead of making raspberry sauce... Much quicker and very good!"
"1","5","I made this tonight, and one of my pickiest friends said 'this tastes like heaven'. Bit of a pain in the rear, but very much worth it. I read some reviews and followed with the x2 cups of Oreos. Also, added 3 cups of white chocolate chips instead of just 2. Wonderful recipe. This was my first cheesecake attempt, consider it a success! Not one bite is left (and I only had one piece)."
"1","4","Great recipe. I will make this again. I had to up the crust portion to easily fill the bottom of pan. Next time I will double the raspberries as I ran out prior to glazing the top. Turned out great and tasted great. Thanks!"
"1","3","The cheesecake didn't turn out as what I expected. It was too rich and sweet for me. I used two cups of OREAS without the cream fillings. I also used 6 tablespoons of seedless raspberry jam. I acidentally used a 8 inch springform pan instead of a 9 inch so the batter was filled up to the top of the pan. I shouldn't have poured all the batter into the pan but I was too greedy. I baked the cake for an hour in a water bath and the cake rose 2 inch higher than the top of the pan. I let it sit in the oven for 2 hours after baking and the cake fell back down. The top of the cake turned brown, I guess maybe I overbaked it? There isn't a lot of cracks just where the raspberry swirl is seperating. I think I put too much cream cheese and too little raspberry sauce. I was going to make this cake for Halloween Party. I am glad that I made this yesterday and not the day before Halloween because it doesn't look good and it tastes too sweet. Next time, I have to make sure I use a 9 inch springform pan, right amount of cream cheese, more raspberry sauce, and less sugar. Hopefully it will turn out as good as the one in the video."
"1","5","Looks great! Can't wait to make it! It got such great reviews!"
"1","5","I have made this dozens of times. Slight changes, I use an Oreo crust, I melt my chocolate in the microwave for exactly 1 min., I add all my eggs at the end and all at once (I do this with every cheesecake!) and I microwaved seedless rasp jam and swirled that throughout. Awesome!"
"1","5","This cheesecake turned out heavenly. Absolutely perfect with no changes."
"1","5","This recipe is GREAT!! Makes the best cheesecake. I used strawberries and it was wonderful!!"
"1","4","Have made this a few times now. Still working out how to make it look good though...keeps on cracking, which is probably my technique and not the fault of the recipe. Followed instructions on must helpful comments re raspberry jam and the amount of sugar in the crust."
"1","5","Yes, it is one of my husband's favorites. Cheesecake takes practice. They get easier the more you make them. I use a very small strainer to leave the seeds out. The seedless jam just doesn't taste the same as cooking the raspberries."
"1","4","This was a good cheesecake and I give it 4.5 stars. The only thing that keeps it from being a 5 star cheesecake is there is just not enough white chocolate flavor. The next time I make it, I will 1.5-2.0 times the white chocolate. I used 1/2 white chocolate chips and 1/2 Godiva white chocolate with vanilla bean. Sort of a high-low combination. Yet, it still was missing that good white chocolate flavor. As far as the technique and outcome of the cheesecake goes, I did have some cracking around the circumference, but no major cracking in the middle. I even put a pan of water in the oven with the cheesecake to help avoid this problem. I didn't think it mattered anyway because the raspberry sauce drizzled over the top hides everything. Didn't have the problem of leaking butter that many complained of and I think it's because I used chocolate graham crackers for the crust. They tend to be more absorbent. If you are using crème filled cookies (like Oreo), you should cut back on the amount of melted butter and that should solve the problem. But just to be sure, put a piece of foil on the bottom rack to catch any drippings. Better safe than sorry! Also, I used the tip of putting parchment paper on the bottom of the springform pan and had no problems getting each piece off."
"1","5","5 stars, enough said."
"1","5","This cake was heavenly! A few family members turned down a piece because they were on diets, but they all gave in by the end of the night. They didn't regret it!"
"1","5","This cheesecake presents a WOW factor. It's just that good and sometimes I have a hard time waiting hours for it to settle or cure but it is necessary. I've found that you won't find frozen raspberries in every store so I have used raspberry jelly in it's place. The only problem with jelly is that it will make indentations when it bakes and makes the final appearance look bad with jelly fissures. Plus it alters the taste with the brand of jelly you choose.   Altogether this cheesecake is heaven in every slice and you would expect to pay $6 or more per slice at a high end restaurant for sure."
"1","5","This cheesecake is phenomenal. It is my husbands birthday cake nearly every year, but it is not for the faint of heart. There is a lot going on all at one time, so familiarize yourself with all the steps well ahead of time. Definitely worth the trouble. Also, the video tutorial on cheesecakes is very helpful."
"1","5","After I boiled the raspberry mix, I poured it into my Vitamix and just blended it,instead of straining out the seeds. That way it remained a nice consistency of a sauce and not so runny. I followed everything else thoroughly and it tasted wonderful! The family was impressed.:-)"
"1","4","great"
"1","5","I love this recipe but can I know what's half and half cream? Couldn't find it in Singapore :("
"1","5","Wow!!!! First time making a marbled cheesecake and everyone loved it! Long to make but totally worth it! I left it in the oven when it was done baking for another hour to cool down and avoid cracking, it cracked a bit anyway but it was delicious! Best cheesecake :)"
"1","5","I made this cheesecake for my dad's birthday. He loves cheesecake and I never made a baked cheesecake before. This recipe was a BIG hit! He loved it and so did the rest of my family. I'm not a sucker for cheesecakes but it tasted delicious. Followed the recipe to the T, only added some more raspberry sauce to the cheesecake batter. Baked it for 60 minutes at 160c in a fan-forced oven. It was perfect."
"1","4","Mine is currently in the oven, looks great, but I would add that you need to fully line the tin. I only lined the base, and it's now dripping melted butter into the oven..."
"1","5","My kids loved this."
"1","5","Fabulous!"
"1","5","Enjoyed this very much, changed the oreo crumbs to graham cracker and it really made a difference."
"1","1","This cheesecake was far too sweet, but the bizarre thing was, it took nearly 2 hours to cook in a 9' pan."
"1","5","I am a terrible cook and it still turned out wonderful! Everyone complimented me on it. It might not look the best but it tastes wonderful. I also used 2.5 cups of crushed chocolate chip cookies for the crust."
"1","5","This is an awesome cheesecake! I made it for my mom's birthday, and everyone loved it. The trick to getting the cheesecake to not be too sweet is using good quality white chocolate. I don't recommend using white chocolate chips, they are far too sweet, spend the extra. I used frozen raspberries, and made a bit extra, which I spread on the top of the cheesecake after it had cooled. (we used the excess raspberry in the strainer and made raspberry daiquiris) I have a convection oven, which is the best for baking. I baked it for 55 minutes, in a water bath, then let it cool in the oven with the door open. It didn't crack or hill. My family said it was my best cheesecake yet. I will definitely make this again.  Update, made this again, and got rave reviews, it is the creamiest cheesecake I have ever made, rich and not too sweet. I doubled the crust ingredients and omited the sugar."
"1","5","Very good! I also used 2c. of Oreo cookie crumbs and substituted raspberry jam. Hubby and the kids love it! I am not a big cheesecake person but I think it's good too, so that is saying a lot. :)"
"1","5","To avoid a trip to the store, I omitted the raspberry sauce. I think this is why it turned out so great. After making it, I saw that others had mixed results getting theirs to set. Mine was perfect--the chocolate really gave it a nice dense texture. Hubby said it was best he's ever had. Next time I am going to make the raspberry sauce, but I plan on keeping it on the side. Oh, and I cut the sugar for the crust by more than half. Just personal preference but I thought that was plenty."
"1","5","I just made this cake for a get-together and everyone thought it was great, not a crumb left on any plate. While it was cooking I read some of the negative reviews and got a bit worried! The only thing I would say is that I did have a small issue with the cake not setting. I turned up the oven to 350 and let it cook an additional 10 minutes which seemed to do the trick. This does not have the texture of a traditional cheese cake but as a white chocolate/raspberry dessert it was great. Also many reviews complained about the white chocolate, I used inexpensive Nestle morsels and they worked great. Bought higher quality for shaving on the top."
"1","5","love it."
"1","5","I made this last night as a late Valentine's Day dinner dessert. I couldn't find chocolate cookies so I used regular graham cracker crumbs for the crust. I took advice from the other reviews and doubled the amount of crumbs to 2 cups. Other than the crumbs, I followed the recipe to a 'T'. I also did the water bath that was mentioned in the 'Perfect Cheesecake Article' found on this site and instead of pulling the cheesecake out when the timer went off, I turned the heat off and let the cheesecake sit in the oven for another hour. My wife almost had a heart attack when she took her first bite and did everything just short of singing praises. After posting a completed picture of the cheesecake to Facebook (yes, I'm THAT guy) I was quite the talk for about 6 hours. All credit goes to the original poster of this recipe!!!!! This is now a staple in my 'in-the-doghouse' tool box."
"1","5","For my first attempt at making a cheesecake, I was very happy with the results. The flavor was incredible. It did not firm up like cheesecakes I've purchased or eaten at restaurants, but I think I many not have cooked it long enough. I did wait the recommended 55-60 minutes, but I use a small oven, so maybe it did not get to the correct temperature."
"1","5","Amazing taste and so beautiful. Even if it cracks, just pile fresh berries on top and drizzle with white chocolate (I couldn't make the curls work)."
"1","5","This is wonderful. My husband loved it; my family loved it; and company loved it. I made it last night, for our New Years Eve party, and I followed the recipe to the T. Having read all the bad reviews first to see exactly what people were having trouble with, mostly with it not setting correctly in the middle, I prayed and prayed that my Cheesecake would set. Thankfully, it did, but there were some cracks in the surface. Once the cheese cake was done, I turned the oven off and opened the door and let it set for a while until some what cooled, then I took it out and let it cool even more so I could chill it. I chilled it for about 20 hours in the refrigerator, took it out and spread the raspberry sauce on top, which covered the surface cracks, and I melted some left over brown coating chocolate I had and piped it on.  Next time I will try the water bath method, and maybe decorate with white coating chocolate and fresh raspberries and whipped cream."
"1","5","This was an immediate hit. I adjusted the amount of cookies used like other comments suggested by doubling it and it was a good idea. I also didn't remove the seeds from the raspberries. I was afraid people wouldn't like the seeds in it but everyone thought that it gave it good texture and made it feel more fresh. I added cornstarch to the mix to prevent cracking and it worked. There were no cracks and it did not alter the taste. I also doubled the amount of raspberry sauce. I used the entirety of what the recipe called for in the batter and then used the other half as a drizzle on top. One thing to note for anyone unfamiliar with making sauce like this, it will not thicken all the way while it is on the stove. Once pulled off and gets cool, it will finish thickening so don't over cook the raspberries because you are waiting for it to get thick in the pot. Happy baking."
"1","5","Made this recipe for my sons bday. He requested cheesecake for dessert. It was delicious! Turned out great! I will use parchment paper on the bottom next time to easily move to a serving dish. I am making this for our Christmas gathering. It's so amazing! I do agree that it needs a little more crushed Oreos for the bottom because it barely covered but, worked fine."
"1","1","I don't know what all the fuss is about. I followed this recipe to the T. I knew after blending all the ingredients together that it was too thin. I cooked the cake for 55 minutes at 325 degrees and then let it sit for 45 minutes with the oven off. The batter was still wet in the middle and it rose to over the pan."
"1","4","I give this recipe 4 stars, because I change it quite a bit. My husband loves a dark chocolate raspberry cheesecake which he orders at our favourite restaurant. I went looking for a recipe for it, but this was the closest one I could find. So, I use it with these alterations: instead of white chocolate chips, I use dark chocolate chips (50% cocoa or higher); I also make double the raspberry sauce and mix half of it right into the batter with the chocolate and reserve half of it for garnish - I don't swirl it at all, although I'm sure that would taste good as well. Oh, one more thing - I leave the sugar out of the crust, as it tends to make it taste grainy. It's sweet enough without having to add sugar. Thanks for the great starting point to make this awesome dessert!"
"1","5","I am 44 years old and did not like cheesecake until I made this and tried it! I have made it about 5 times since and it is a HUGE hit! Well worth the work involved and I will be making it for Thanksgiving - by request. Thanks for sharing!"
"1","5","Should have read the comments about crushing the oreos in a food processor/blender - this cake is unbelievably good but i've never gotten the crust quite even - next time!"
"1","5","I made this cheesecake for my wife to take to work with her! She said that this was the popular dessert on the table and her coworkers were asking who made this! When she told them that I made it, they were asking when was I going to make another! This one will be in the books! No question about it."
"1","5","This was my first attempt at any kind of complex dessert, and I was nervous going into it. After chilling overnight, it turned out AMAZING. It's not puffy around the edges, it's perfectly fluffy and delightful. Only things I'd recommend for anyone wanting to make this is to spray the bottom of the pan (I always forget this step) before putting in the bottom crust, because I had to scrape at the crust with a knife and it made it look ugly and sloppy. Crust tastes great though. Another thing, DON'T skimp on the getting out the raspberry seeds thing. Was feeling a bit lazy, and left the seeds in, and they're almost annoying. The raspberry tastes good but I wish I had strained out the seeds. And the last thing is that next time I will probably make more of the raspberry sauce, because I barely had enough to make a few swirls; maybe double or triple the amount it says to make if you want it to cover the top like in the picture (that's what I was shooting for).  Overall a fantastic recipe, even for someone not totally comfortable in the kitchen like me. I will definitely be making this again."
"1","5","I have made this recipe countless times, and it turns out amazing each time! I've perfected my cheesecake techniques, and this turns out smooth and creamy, not at all the 'pudding' texture I have read in other reviews. I have been asked for this recipe countless times! I have adapted the raspberry swirl into whatever berry or fruit you would want, as well as a delectable milk chocolate swirl. I have never found it too sweet, or been unable to taste the swirl, or had the white chocolate overpower the 'cheese' taste."
"1","5","Absolutely delicious cheesecake - the tart raspberry sauce compliments the rich cheesecake beautifully. Followed Eliece's advice to cook for less than the proscribed hour - very glad I did as it was perfect once cooled. Do not hesitate to try this recipe - you won't be sorry!"
"1","5","I made this for my in-laws and it was a complete hit (as everyone has already mentioned). This was also my first time making a cheesecake, and it was completely doable. Bringing everything to room temperature first does make the process a lot easier. Also, I used real raspberries, and it was a pain draining out the seeds; however, the sauce was so amazing, and that was basically (no pun intended) the icing on the cake. Everybody was raving about how great the white chocolate flavor coincided with the sweet and tart flavors of the raspberry sauce. Everyone in the family went back for seconds, and some even went back for thirds! I would definitely make this again. Actually, I would make two for any occasion because this cake goes so quickly!!!! And before I forget, for the crust, I used Peppridge Farms Captiva Chocolate Brownie cookies for the crust. :)"
"1","1","It wasn't so much the taste I didn't like it was the texture. It was like eating a solid block of flavoured cream cheese. Far too thick for my liking, I couldn't eat it."
"1","5","Im not sure if I should actually rate this recipe or not- I used it as a base but I changed so many things that its hardly the same cheesecake any more. I didnt have white chocolate chips so I used regular chocolate- I prefer chocolate over white chocolate anyways. Rather than making it a full chocolate cheesecake I reserved some of the batter and left it vanilla and made it into a marble raspberry swirl cheesecake. I read the other reviews and just used raspberry preserves instead of making my own and that worked really well. I didnt use all the butter for the crust, it got a bit soupy after about half."
