helpfulCounts,ratings,reviewText
"1654","5","I've done quite a lot of baking in my life, which has included more cakes than I could count. This chocolate cake is one of the best I've ever made. Moist, fragrant,dark and with a rich chocolate flavor. It will become a classic go-to recipe for me. No reason to search for a better chocolate cake."
"673","5","This is truly a black magic cake. The batter was so thin that i wasn't sure how the cake would turn out. I had used two 9inch round pans. The cakes were perfectly done in 30 mins. I made a delicious frosting with whipping cream, cherry liquer, vanilla essence and powdered sugar. I also filled in lots of canned pitted cherries. I've never decorated a cake before so i think i didnt do justice to how it tasted. Absolutely delicious....tasted like a very authentic German Black Forest cake. i'm just posting a photo since there is none after so many reviews."
"630","5","I have had this recipe since 1979 where I got it off the back of a Hershey cocoa can. It has been a family favorite ever since! I was glad to see it on all recipes with all the different frosting ideas. I use a 7 minute frosting and fold in about 1/2 cup of semi-sweet chocolate chips and let sit just until they barely start to melt. Spread onto cake carefully as to not completely blend in the chocolate chips, then chill. You have crunchy ribbons of chocolate mixed into the frosting. It is wonderful!"
"528","5","For those who had problems with the cake rising, I found this explanation of Dutch process cocoa which can make difference in the results:  When it comes to baking, be sure to use the type of cocoa specified in the recipe. Those that are leavened with baking soda require natural (non-Dutch processed) cocoa so that the alkalinity of the baking soda can neutralize the acidic cocoa. Recipes leavened with baking powder require Dutch-process cocoa to maintain the neutral pH of both. I used parchment paper in the bottom of the cake pan and up the sides to lift out the cake (8x8pan). The rest I made as cupcakes. The cupcakes cooked more evenly in less time."
"306","5","Ok, I have made this a few times and it is truly one of the best chocolate cakes ever. It is so moist. So moist in fact, you may have a bit of a hard time 'working' with it, so I do recommend placing the cooled layers in the freezer for a bit (20 min. or so) before frosting and filling. This will make it much easier!"
"212","5","I decided to make this into a bundt. I used a silicone bundt pan & baked the cake for 45 min. I also added a 1/4 cup of Kirsch (cherry liqueur) to the batter instead of the vanilla extract. My husband (who is rather picky about cakes) loved this. I'll be making this one again! UPDATE: I have made this one dozens of times since & I've added pretty much every liqueur to it. I've also made this into a two layer w/ seedless raspberry jam in the middle and a buttercream frosting. Heaven!"
"203","5","This cake is so, so moist and tasty. I frosted the cake with yellow frosting (I used food coloring) and then made black sugar bats all over the cake. I have a bat cookie cutter, so I placed it on the cake in several postions, and sprinkled black sugar within the cutter. I used little, round, red candies for the eyes. It looks like black bats flying in front of a full moon!"
"158","4","I made this cake for a birthday and it was a huge hit! Everyone loved it. It does require the entire 40 minutes to bake even though the toothpick came out clean after 30 min. It was a little hard to get out of the pan and did fall apart easily, but it was so good that if you are gentle with it, its well worth it. VERY TASTY!!!"
"109","5","Okay, this is definately a 'throw together and toss in oven' success! Very easy, very moist, very popular!!! I made coffee butter frosting to go with but, you almost don't need frosting at all. Needed to cook for the whole 40 minutes."
"94","5","This cake is so moist and tastes soooooo good. I would recommend anyone and everyone make this cake."
"91","5","For those that have given this a low rating i have to ask...are you sure its not just you. this is absolutely fabulous. I made it for my son's 8th bday with the chocolate icing found on the berry glazed chocolate cake recipe on this site. Everyone at the party (the adults especially) asked for the recipe. Most are not cake fans but even my dad said it was so good he finished the cake before his ice cream. I will make this over and over again--in fact I am making cupcakes today. MMMM! ***I forgot to add that we don't drink coffee so I used Mexican Stephens Hot Cocoa instead and it gave it a nice flavor- I imagine you could use any flavored hot chocolate and it would add a nice flavor. I also used 2 tsp of vanilla - I am sure you could use different flavoring too. I love this recipe. ADDITIONAL COMMENT: I have made this several times since my first time and was even asked to bring it to my sisters 30th birthday-her request. It is the best cake recipe- I make bundt cakes and sprinkle powdered sugar and I make mini bundts and cupcakes- time is a little over half the time as a cake- 20-25 minutes. they melt in your mouth. This time I didn't have milk so I added powdered with the dry and water with 1 tbsp vinegar. It was fabulous I won't make another. UPDATE: ok so I have made this again for the umteenth time and it turns out great everytime. I have used Pero in place of coffee and the satiny chocolate glaze is amazing..."
"70","5","Wow! Amazing recipe! I used the batter to make cupcakes, and they turned out wonderfully; so moist and chocolatey. I followed the recipe exactly, and took another reviewer's tip to put the batter in a spouted measuring cup, which made filling the cupcake cups easier. The recipe yielded 24 medium-sized cupcakes, and took exactly 22 minutes at 350F to bake. I watched them closely, and even though they looked a little shiny on top, they were cooked through - so they can be deceiving! If making cupcakes, do not fill the cups more the 2/3rds, as they rise pretty well. They kept well in an air-tight container for at least 3 days. Overall, a delicious, wonderful recipe that I am sure I will use again and again!"
"60","5","I rarely EVER write reviews on any recipes but felt this was the BEST cake I've ever made or have eaten! Have been a professional baker/cake decorator for 14 years and have made my share of cakes. Don't substitute anything in the ingredients! DO either use parchment, or generously grease your pans. Also the suggestion of placing the cake in the freezer for a bit for ease of handling is recommended. I've always 'worked' with a partially frozen cake to make decorating easier. I used bakers one bowl frosting to which I added about 2 TBSP cocoa for a more intense chocolate flavor but this cake stands chocolaty enough on it's own and NEEDS nothing!"
"49","4","I made the Black Magic Cake last night and was happy with the results. Now, for the bakers who posted & had miserable results with 'raw' batter, impossibly stuck cake bottoms - there is nothing more frustrating than following a new recipe exactly and having it NOT turn out! Two suggestions: 1) coat pans with flour/grease AND cover bottom of pans with good ol' wax paper to eliminate sticking. 2) For the batter that never bakes (raw), the culprit is your oven temperature. The oven temp. display might read '350 degrees', but inside the oven might only be 300 degrees (my case). Even though my oven is new, I bought an inside oven thermometer - for inside temp to be at 350, I must set the outside display at 375. . . I do hope this helps. Keep Baking!"
"39","5","My youngest son and I used this recipe to make chocolate cupcakes together. We made no changes or substitutions. We didn't actually get 24 cupcakes out of this recipe, we got 18. We baked our cupcakes in greased cupcake liners at 350* and they were done at exactly 22 minutes. The cupcakes really baked up beautifully. High and they looked like bakery cupcakes right out of the oven and they kept their shape even as they cooled--NO FALLING! I was quite impressed with that. We frosted them with a canned frosting (I know, but it was his request). My husband, kids, aunt and cousin all give double thumbs up. GREAT recipe.......even for cupcakes. My oldest boy says 'just the right amount of chocolate goodness!' I'm SO using this recipe again."
"32","5","This is a pretty good chocolate cake. It's moist and flavorful. Very similar to the 'One Bowl Chocolate Cake III' on this site. I didn't have buttermilk so I soured regular milk by adding 1 tablespoon of white vinegar to the milk. I made this into a 'candy barrel' cake for Halloween. I baked the cake in two 9-inch round pans for 35 minutes and cut off the tops to make them even. I put a very thin layer of frosting between the layers and then frosted the outside and top. I placed 22.5 (45 wafers) snack size Kit Kat bars around the outside and poured a 10.5 oz. bag of Reese's Pieces on top. I finished it off by tying a ribbon around the outside."
"32","5","Soooo good and surprisingly easy. Cake was moist and super satisfying. Baked in a greased and 'floured' (I used cocoa) bundt cake pan for 45 mins and it came out perfect. For the frosting I melted semi-sweet chocolate with a little butter and drizzled it over the top then placed it in the fridge to cool. Fantstic cake, adding a picture :)"
"29","5","Fabulous cake! I followed the recipe exactly! It was moist, delicious, and full of chocolate - there was none left!"
"27","5","Well I feel the extreme need to find whoever posted this and shake their hand because after making this cake I am sure I will never use another chocolate cake recipe ever again. It was almost like a giant moist brownie, it was absolutely perfect. I have been avoiding making desserts with chocolate cake in them because I have never been a fan (always too dry, not chocolatey enough, etc) but this recipe has changed everything. I iced it with a coffee icing and it was just to die for. Thank you so very much for posting this recipe, it was fabulous."
"27","3","Meh, I was a little disappointed because this was rated so highly. Moist, but not chocolatey... Good basic recipe, but I wasn't blown away."
"25","4","This was really good but quite frankly, not the best I've ever had. Moist yes, tasty yes, but a recipe I will mention to friends and family? Nope. I didn't have buttermilk so I just made my own by adding 1 tablespoon of vinegar to my liquid measuring cup, then added milk until I had the specific amount of milk called for. Let it sit for 10 minutes, stirred, and voila! Homemade buttermilk. To make strong coffee I added 1 c of water (measured in a liquid measuring cup) to my coffeemaker (which is 2 cups according to the coffeemaker) and added 3 Tbls of coffee. I let it cool, then added it to the ingredients. Make sure to scrape down the sides of the bowl while beating so everything is mixed well. You will need to bake the full 40 minutes, and the batter will be very thin, thin like water so don't be alarmed. When you remove from the pans, be SURE to line the racks with parchment paper or you will lose half of your cake on the rack! I frosted with a chocolate buttercream."
"24","5","WOW! This cake is deliciously moist, and full of chocolate flavor. My kids and I are self-admitted cake snobs, but this cake meets our high standards. The cake is 'sticky' once baked, so I can imagine that it wouldn't make the best cupcakes (if using liners) as most of it would be wasted by sticking to the liners. However, it makes a scrumptious cake. I always use Wilton cake magic to grease my pan, and have never had a problem with a cake sticking. However, this cake stuck slightly even with that. Therefore, grease your pan liberally, and dust with cocoa (this way your cake doesn't have a white powder film). We ate the cake without frosting and enjoyed every bite. I am not a coffee drinker and can taste the 'strength' of the coffee coming through. I think next time I will just use boiling water, as I think coffee leaves a slight bitter aftertaste for non-coffee drinkers like me (I didn't notice this on the first day). One last note, it's been 4 days since baking the cake, it has not been frosted but stored in Tupperware, and it's as moist and fresh as the first day we baked it."
"20","5","Super good moist cake!!!! I did use hazelnut cream strong brew coffee and followed the 'rules' of high altitude baking, shhhhhhhhhhhh took a few bites out of the bottom of one of the layers for granpas bday cake, taste tested this and its AWESOME and sooooo moist!!!! The crumb and texture is amazing!!! I always make my cakes the night before (in silicone pans) I need them, cool, then put in the freezer overnight. That way they are easy to remove from the pan and also do not require such a meticulous crumb coat (learned this from working in a bakery where all of our cakes were decorated while still frozen). I had no issues with my cakes falling in the middle as I do with some other recipes."
"19","5","I have this recipe and it's one of my favorites! One day I didn't have any buttermilk nor vinegar to make sour milk to substitute. Instead I used yogart and it was even better if you can believe that!!"
"16","5","No idea how anyone can fail to be impressed with this easy, perfect cake. It's the standard by which all should be judged, the quintessential American-style chocolate cake. The flavor is robust, with a depth and complexity owing to the coffee. Just as an aside, I detest coffee, but no problem, because you never taste it in this cake. The taste does not even have so much as a hint of mocha, only chocolate. If you are a chocolate fanatic, Dutch process cocoa increases that quotient. When doing so, you can cut back the soda to 1-1/2 tsp, because Dutch process cocoa is pre-alkalized. Success is ensured by sifting your flour to aerate, and mixing as little as possible, just to incorporate everything until smooth. Remember that the more you work your batter after adding the flour, the greater gluten formation you encourage. Gluten is the protein in the flour that gives baked goods structure. It contributes the opposite of tenderness. As an example, it's what gives yeast doughs their elasticity. That's something you don't want here, so mix as little as possible after adding the flour, and the result will be an exquisitely soft cake that just melts in your mouth. I find the best complement to this cake to be Italian meringue buttercream that just increases that meltingly soft quality. Truly the best you can make."
"16","5","I used French Roast from Starbucks Coffee for the one cup of strong brewed coffee called for in the recipe. I followed the recipe to a “T”. The batter was easy to make and I noticed that it appeared runny and liquidy. I filled each cupcake 2/3 full and baked 21 cupcakes at 350 degrees for 22 minutes. The cupcakes rose up forming a nice round top while a chocolate-y aroma filled up my house. I let them cool completely for about an hour. It was wonderfully moist, spongy, dark colored with a rich chocolate flavor. The coffee enhances the chocolate flavor nicely. I couldn’t taste the coffee at all and would have never known it was in there. I love that this recipe includes buttermilk as it almost always guarantees a tender cake and veg oil helps produce the signature moistness. I frosted these with, “Rich Chocolate Frosting,” also from this website. It was a perfect match! I even topped the frosting with Halloween icing decorations (See my picture). I made these for my teenager and his friends to share at the Halloween school dance tonight. Needless to say it was a hit."
"16","5","I also got this recipe off the Hershey's cocoa can, around 1970-1972. I got a blue ribbon at the fair with this cake! I recommend if your hands are shakey that you put your pan on the oven rack, then pour in the cake batter. It's thin, and if you're not steady it can slop on the sides."
"15","5","Made this for my friend's birthday with mocha frosting ... RAVE reviews. Did not change one thing about this recipe. I'd recommend not using a mixer, though ... the cake batter is so thin that it sloshed everywhere and got all over my shirt. A whisk would be fine.  So, so good. Magical, in fact."
"13","5","I've searched and searched for a scratch chocolate cake that actually tasted good! And yes, this cake is SUPER soft and hard to work with, but it is also de-freakin-licious!"
"13","5","I've been searching for this recipe MY WHOLE LIFE, I'm so happy I finally found a perfect chocolate cake, perfect moisture, perfect taste, just perfect."
"13","4","A nice, moist chocolate cake. Flavor was a bit bland. I cut the sugar to 1.5 cups and used soy milk with 1 T. vinegar instead of the buttermilk. It bakes quickly so keep an eye on it."
"13","5","When I read the reviews for this recipe one thing I saw over and over was how moist this cake is...boy are they right this cake is MOIST in a big way. I now have a new favorite chocolate cake recipe, I can't say how many compliments I got on this cake. The coffee amplifies the chocolate flavor nicely while the buttermilk tenderizes and veg oil helps produce the signature moistness. I did have to bake it longer than suggested though so do keep an eye out for that and tip to anyone who doesn't happen to have buttermilk in the fridge or doesn't want to purchase it just for one recipe, just add 1 tbs of lemon juice or white vinegar to 1 cup milk or plain yogurt and voila!"
"12","5","So moist!!! I used spring form pans after I read the reviews about how delicate the cake was. I used the coffee butter cream frosting, one reviewer recommended it and it was a delicious combo!!"
"12","5","This recipe is heaven sent! Followed it exactly except i did not have buttermilk or regular milk so i put 2 teaspoons of apple cider vinegar in a cup of soy milk and 5 minutes later i had dairy free buttermilk! This cake was extremely moist and didn't have a bitter coffee taste. The coffee only enhanced the chocolate so you wouldn't even know it was in there which i was thankful for! I can never get a cake out successfully with my old cake pans so i foiled them & buttered and flowered them and the baked cakes came out with out the slightest of problem. This cake was amazing and i was so proud to bring my dad (the chocolate cake king) over a huge hunk of it! He said he's never tried a cake so moist! Not even store bought =] Thank you so much for this recipe! Will definitely make again & again."
"11","5","I am gluten intollerant and I have used this recie for years to make the BEST chocolate cake. I cut the sugar to 1 1/2 cups. I use ONLY the gluten free pantry flour (french bread and pizza mix flour).I also switch the baking soda to 1 tsp and the baking powder to 2 tsp. People who can eat wheat even gobble this cake up when I make it! My favorite chocolate frosting recipe came from this site. It's your chocolate fudge buttercream. I use Dove's dark chocolate ice cream topping in the Rx to make it really sinfull!"
"10","5","Loved this cake! I have made it twice now. It has such a rich dark chocolate flavor. My only suggestions is to use a good quality cocoa because it really makes a difference and line your pan with parchment paper. The cake is so moist it falls apart easily and is hard to get out of the pan. But by far the best homemade chocolate cake I've had!"
"10","5","Whenever I need a cake chocolate cake, this is always my go to recipe!!! No changes need, fantastic recipe! The cake doesnt taste of coffee, the coffee simply intensifies the chocolate! Amazing! I always cover with a butter cream icing and call it done!!"
"10","5","What a great pleasure to find this recipe posted, true to the original ingredients!   In 1985 I first found this recipe on the old fashioned cans of Hershey's Cocoa, back when one had to use a screwdriver to pop off the lid. The can was in the pantry of an older woman who had saved the empty container from years back. How times have changed.   This is an excellent cake that is unbelievably moist. I've made it on many occasions over the years, turning out so well each time that several people have doubted I actually made it. It is that delicious.   For those experiencing difficulties such as sinking and sticking, I would be curious to find, perhaps in a poll, how many used true buttermilk vs. vinegar + milk, as well as results for anyone who used chilled coffee, room temperature coffee, or hot coffee. Just a thought.   Thank you for sharing this recipe!"
"10","5","OMG!!! This is wonderful! It's light, flavorful, and perfectly moist. The hubby has pronounced it his favorite cake ever. I used Hershey's special dark cocoa for the cocoa (the cake is really rich and black). I also used a packet of instant Columbian Starbucks in a cup of hot water for the coffee. I've made both cake and cupcakes which have turned out wonderful with this recipe. For cupcakes, bake about 22 minutes (but still do the toothpick test to be sure). I'm so happy that I'll never have to resort to the box again.  We're still debating frosting options (even though we both agreed we can eat the cake by itself)... Which frosting did the rest of you use?"
"9","5","Excellent cake! No tweaking, just as it is written. I made this twice now, once for my daughter's teacher for her going away maternity party and the teachers kept the leftovers for the teacher's room, we didn't get it back, lol. I tripled the recipe and made three tiers, it was divine. After that I had to make it for my family because we knew how well it went at our local school. You must try it. Moist and tasty, it's really good. Just make sure the coffee is strong, that's where the magic is."
"9","5","Seriously the best cake I have ever made. Delicious, rich chocolate flavor, perfect for birthdays, holidays, any occasion! I use a chocolate fudge buttercream or a simple store-bought cream cheese frosting - yum! Thanks!"
"9","1","I baked this last night. Am only giving it a one star because guys at work said it tasted good. I followed the recipe EXACTLY. It sank in the middle and was very crisp around the edges. Definitely will never make again! Actually threw the recipe away that I printed."
"9","5","I have been making this cake for over 25 years and this by far is the best chocolate cake I have ever had. But, you must follow the recipe exactly. Do not make any substitutions. Also, sift the dry ingredients before adding to mixture. If you do this, you will have a great cake. It is the cake my husband requests every year for his birthday. And it is gone by the next day. :) !!!!"
"8","5","This is a super cake that really comes out perfect and full of great flavor. My only suggestion is NOT to beat for 2 minutes as you could over beat and the cake will sink when baking...I have made it a few times and I mix only until all is blended then I stop, pour the mixture into the pans and pop them into the oven...they rise perfectly and fluffy. As for cupcakes they also come out great;)"
"8","5","This cake came out very good- Not super sweet, a good 'grown-up' chocolate cake. I made a whipped peanut butter frosting and it was quite good. All it needed was a glass of milk!"
"8","5","This cake was absolutely amazing, perfectly moist and the coffee seems to really have brought out the taste of the chocolate.Everyone thought it was a dark chocolate cake even though it was just cocoa powder. The changes I made were: 1. Used 1.5 cups of sugar- 1 cup white and 0.5 cup brown sugar. 2. Used 3 tsps of instant coffee dissolved in 1 cup water. 3. Used 2% milk and vinegar instead of the buttermilk. I filled and topped the cake with a dark chocolate ganache using the recipe for this site. Absolutely divine, this cake goes down well with some vanilla ice cream."
"8","5","What I can I say? This cake has got me flabbergasted!! It was moist, had the perfect sweetness, and it was SCRUMDIDLYUMPCIOUS. It was really cool to make something this wonderful. I made 12 cupcakes with 1/2 the recipe. Since I don't really drink a lot of coffee, I simply microwaved 1/2 a cup of water and a little bit over a teaspoon of instant coffee for a minute and a half. It only took 15 minutes to bake it in the oven and it was astounding to see the quick, beautiful, and tasty results. I paired it with some dark chocolate ganache and my whole family absolutely LOVED it."
"8","5","Although the cake looks dark chocolate, it was not as rich as I thought it would be. But it was very moist and easy, and still tasted great! I had no issues with sticking because I greased and floured the pan. I used ganache to top my cake. **I had given this a 4 start last night. But I had a slice today and it is so good! Not sure if it made a difference from having the slice warm vs cold. But the chocolate flavor was much more rich the next day with a cold slice. I will be making this cake for a birthday cake I am doing soon."
"7","5","Super moist. I'm so happy with this recipe. I didn't have buttermilk so I substituted it with 1 tablespoon of white vinegar and filled it up to one cup with milk.  I was a bit nervous about adding coffee, but my fears proved unfounded as the coffee was unnoticeable."
"7","5","A perfect cake for a novice baker. Easy & stright forward. I didn't have buttermilk so I added a tbsp vingar to the cup of milk and let it sour for 5min. It didnt puff up in the middle, making it easy to shape. I used a square tin and a glass round pan(was making a heart shaped cake) the tin pan was done in 30 min, while the glass was done in 40min. Make sure to cool in pans for 10min or longer if not it will fall part. A piece broke off the bottom but with a spatula and some care, was able to fit it back and it formed together while on the cooling rack."
