helpfulCounts,ratings,reviewText
"1","5","I made these for my class and they absolutely loved them. It made quite a bit so I had a few left over to offer some adults I teach with and they all demanded the recipe. Excellent."
"1","4","These were delicious but a bit too sweet for my taste. Next time I will add half the amount of sugar to these."
"1","5","Everybody loves these! They're like brownies and cookies at the same time. Don't overcook..."
"1","5","These cookies came out really well. I got the best results when I took the cookies out of the oven appearing slightly underbaked. They were still soft for a few days in an airtight container."
"1","4","I realized half way through making these that I didn't have any cocoa powder. I left it out and they still turned out like perfect chocolate chip cookies. I'm impressed!"
"1","5","Read the reviews and had to make them. Wow!! What a powerful punch of chocolate in a small cookie. It's a great turn on the traditional chocolate chip cookie."
"1","5","So good. They were fluffy and chewy, just how I love them. I did 1/2 c butter flavored shortening and 1/2 c butter just for fun. I am sure they would have been fabulous even w/ just butter, as in the original recipe."
"1","5","Very good cookies. I deviated from the reciple a little; used 1 C sugar and 1/2 C brown sugar, omitted the nuts, and used some very pretty mint chocolate swirled chips. They were quite good, soft in the middle and a little crunchy on the edges."
"1","5","My husband said these were the best cookies he ever had! Need I say more? I would give these 10 Stars if I could. I like to use the chocolate chunks instead of chips. Also very good with peanutbutter chips or white chocolate chips & macadamia nuts! Be sure not to overcook."
"1","3","I followed this recipe exactly and they baked nicely, great texture and great flavor but after a couple of days of being stored in a zip lock bag they became very dry and crumbly. I threw out half of the batch, they were falling apart."
"1","5","Perfect! So glad I made these....kids love them, I love them, husband loved them. I would not change a thing! Perfect!!!"
"1","5","These are without any doubt the best chocolate chip cookies I've ever had. And they stay soft too! I skipped the walnuts. The cookies taste great without them."
"1","5","I made these for my husband's coworkers, and they LOVED them. I personally thought they would be more chocolatey. I substituted half brown sugar and half white like many had written, maybe that's why I thought it wasn't sweet enough. I'll try it the regular way next time. These are great with a tall cold glass of milk!"
"1","5","These were delicious!! It was like chocolate decadence!! I did use white and brown sugar instead of all white like others suggested. I also use 1 cup of cocoa, sweetens them up just a little more. I baked for only 8 minutes and let them stay on the cookie sheet for 2 minutes before removing them to cooling rack. They came out perfectly, not burned on the bottom and very moist. Kept them in a sealed plastic tub and were still fresh 5 days later!! My son pops them in them in the micro for about 10 seconds to get them warm again and eats them with a cold glass of milk!! Delicious!!!"
"1","5","So good, i was looking for a cookie like this one that was soft and gooey. My family loves them, i baked them for the holidays and my husband keeps taking them to work and i have had to make 2 more batches! Thanks so much for the recipe!"
"1","5","yummy cookies. I leave out the chocolate (its too sweet) and use half shortending and mostly brown sugar and butter)"
"1","5","This was delicious! However, I added 1/2 cup of brown sugar and only 1 cup of sugar."
"1","5","This recipe is wonderful!! I actually lost it for awhile and couldn't remember the recipe's name. I used other similar recipes and nothing came close to this one. Everytime we make this, we get requests to make it again!"
"1","5","I was looking for another cookie and came across this one. It is delicious. So chocolaty! I will absolutely make this one again!"
"1","5","Very good! I added some peanut butter as well; like a brownie in the form of a cookie :)"
"1","5","These are really delicious! I did as others said on their reviews to use half granulated sugar and half brown sugar. I will definitely make these again!"
"1","5","I made these for my daughter's fund raiser and they SOLD OUT!! Everyone LOVED them! I have another fund raiser this weekend so this is for sure on my list of items to bake! Thanks!"
"1","4","This was a nice soft cookie, however not as much chocolate taste as I expected."
"1","5","I also made this with half brown sugar and half white sugar. Also, peanuts make such a great addition to these cookies! I was bummed to pull out my walnuts to discover they had gone rancid. I desperately wanted nuts in my cookies, so I searched my pantry for any type of nuts I could find. The only thing I had was roasted salted peanuts, so I rubbed as much salt off as possible and added them to my cookies. I got rave reviews at my church picnic!"
"1","5","these are the best chocolate chocolate chip cookies I've ever had. They were a big hit with my family and coworkers. Thanks!"
"1","4","this cookie was not as 'rich' as everyone made it out to be, as a chocoholic I was hopeing it was going to be as rich as a brownie the way people talk. and its not.. but they still tasted good I saw many people say that they dry out fast, if you store them in an air tight container they will stay soft and moist for DAYS!!!!!!!!"
"1","5","Oh my goodness are these ever GREAT!!!! If you are a chocoholic you will love these. Thank you for the recipe Kathy...I will be making these often Im sure!"
"1","5","I really like this cookie. But I used half sugar/half brown sugar, like my traditional c.c. cookie recipe. I also baked them at 375 degrees instead of 350, as I do not care much for chewy cookies. Will definately be making these again!"
"1","4","So yummy! Very very rich but very tasty. Best right out of the oven! But definitely halve the recipe -- this makes SO MANY COOKIES!"
"1","2","texture was nice but not as chocolatley rich as i had hoped. plus these cookies go stale VERY fast! eat same day as you make them!"
"1","5","Excellent recipes. VERY chocolatey. My kids loved them, and I loved them. My husband said they were 'too' chocolatey (as if!!). He thought they would be good with peanut butter chips in place of the chocolate chips.  I left the cookies in for 9 minutes and they were perfect. Chewy and soft!"
"1","4","Cookies stayed soft and chewy. Very chocolatey. Thank you for posting."
"1","5","We LOVE these cookies! We think they are WONDERFUL! My Dad isn't a cookie fan, but he LOVED these!"
"1","5","wow!!! absolutely SCRUMPTIOUS!! best cookie i've ever had!  looked undercooked out of the oven, but real nice, moist and thick after cooling. add some mint chips for a nice twist. :)"
"1","5","This is one of my most favorite cookie recipes!! Thank-you! I used pecans instead of walnuts and baked the cookies for 13 minutes. They were delicious! My kids and husband ate them as fast as they came out of the oven."
"1","5","They came out very soft and fudge-like. They will satisfy your chocolate cravings! I had to send them away with some people because my chocoholic husband kept eating them."
"1","3","I used half brown and half white sugar and might have used a bit more cocoa powder than needed. They were a real chocolate bomb, so rich even I couldn't eat more then one in one go. My friends ate them, but said they were just ok"
"1","5","So yummy and soft a huge hit in this house"
"1","5","great cookies i reduced the cocoa to 1/3 cup and used 3/4 cup brown and 3/4 cup white sugar and used smarties instead of chocolate chips they turned out very moist and chewy-just the way our family likes them-yummy!!"
"1","5","These were delicious! My 13 y.o. daughter, who never tries to cook ANYTHING came home one afternoon and wanted to bake storebought cookie dough, only to find out that it had been in the fridge too long, and gotten dry. She asked for a recipe. I found this one, printed and gave it to her. She made them all by herself. I was really worried about how they would turn out because she wasn't worried at all about being precise with the amounts! LOL! I really believe this is the first time she has EVER made anything with a recipe by herself! They came out wonderfully and she was SO proud of her cookies! Thanks!"
"1","3","These cookies were a little dry and the chocolate flavor was not great - I used Hershey's cocoa."
"1","4","In an attempt to soften the butter, we melted it. We used it anyway and just added a little more flower to compensate. The cookies actually turned out really good. Soft and chewy. We used white chocolate chip cookies."
"1","5","inspiring"
"1","4","Another hit at the fire academy! The recruits ate them all, and the only complaint my husband heard, was that he didn't bring enough! Next time, I'll make them a bit larger, though - I dropped them onto the cookie sheet with a rounded teaspoon - and they came out 'bite sized.' Next time I'll add a little extra dough!"
"1","5","One of the BEST cookie recipes I have ever made. I used only 1 cup sugar instead of 1 1/2 cups. I used 1/2 cup white and 1/2 cup brown like other people suggested. Instead of nuts I added coconut. I also store mine in a tin instead of a Tupperware container. If there are any leftovers to store that is. These will sure dissapear fast!"
"1","5","We couldn't stay away from these. After their first bite my kids said this is to die for. Thank you for a wonderful and easy recipe!"
"1","4","Great cookies. everyone loved them! They almost have a brownie like consistency. Thanks!"
"1","5","This is a fabulous chocolate chocolate chip recipe! I make it frequently.   The only change I make on a regular basis is to substitute 1/2 c. of the white sugar with brown sugar. I think this give it a little more rounded-out flavor.   I also usually use 1/2 white flour and 1/2 wheat flour and don't notice any change in flavor at all (this is an easy way to add nutrients to any dish).  It's great as-is though, the whole family will love it! Everyone in the house thinks these are great cookies."
"1","5","These cookies are delicious! I substituted mint M&Ms in Christmas colors and they were the favorite cookie this Christmas."
"1","4","MUST LOVE CHOCOLATE!!!"
"1","4","realy chewy and moist"
"1","5","Love this recipe. Didn't taste the best right out of the oven and I thought they were too doughy. I added about 4 minuits to the time and they turned out fantastic. just need to let them cool."
"1","3","After baking half of the cookies, I decided to add flour since they were so flat. Next time I will add 1 cup to the whole batch. The second half was much better. These were good, but the I actually like the recipe I had better. If I had nothing to compare these to, they might get a better rating."
"1","5","These are awesome!! I didn't have any nuts to put in them but they were still really really good. I am a chocoholic and these really hit the spot. Defintately need a glass of milk with these."
"1","5","Wow these were phenomenally good! I didn't have chocolate chips but was craving chocolate big time. I used vegetable margarine for butter and egg replacer for the eggs because I'm adopting a vegan diet (although I did use white sugar) and rolled them into balls flattening with a fork and they taste great! I ate 7 today! My two male non-vegan roomies loved them too! Thanks a bunch! :)"
"1","5","I really enjoyed these cookies. I used milk chocolate chips as that is all I had. Everyone enjoyed them! Thanks for the great recipe."
"1","5","easy to make and really good"
"1","5","This is a great cookie recipe if you LOVE chocolate. It was fantastic. I did use milk chocolate chips because my husband doesn't like semi-sweet. I didn't think it was too chocolatey. I had to bake the whole 10 minutes and I let it cool on the baking sheet a couple minutes before transferring to cooling rack. It made 3.5 dozen cookies for me."
"1","5","These are wonderful! I cooked the 1st batch a little longer before i realized they needed to cool, to crisp up. I will make these again for sure :)"
"1","5","I only used 1 1/4 cup sugar and left them in for 10 mins and they still turned out super. Next time I'll take them out at 8 mins so they're not as dry. Somehow half the tray was gone b4 my kids got home from school!"
"1","5","The recipe I've been looking for! These were delicious - soft, a bit chewy, very chocolately without being bitter. They weren't overly sweet, and they did a great job carrying milk chocolate M&Ms. They do seem a little sensitive to baking times, though, because a little too long and they get dry. Take them out when they're set but still soft for them to be perfect.  Will make this again and again! Thank you!"
"1","5","What can I say.....AMAZING!! I always use the 'old stand by' recipes but wanted something new. Well these will be made a lot!! Only thing I did different was I changed the chocolate chips to 1 1/2 cups and added 1/2 cup peanut butter chips. I didn't have enough chocolate chips on hand lol! BRAVO!!"
"1","5","very good! We used Halloween chips (had orange colored white chocolate and chocolate chips) and they tasted great. I can't help but wonder how the peanut butter chips or the new mini mini peanut butter cups would taste...i am thinking yummy!"
"1","5","My 8 year odl daughter and I cannot get enough of these! They are especially devine if you eat them while they are still warm! We did leave the mini M&MS out because there was already so much chocolate and they turned out amazing."
"1","5","These cookies are SOOOOOOOOOOOOOOOOOOOOO good!!!!! My new favorites, for sure! They are soft and chewy and just plain delicious! Highly recommend! I cut the sugar to only 1 cup, and they are GREAT!! Thanks so much :)"
"1","3","Made the recipe as stated, scaled it to make half. Nice dough. Did not care for the flavor though. Too much vanilla falvor & over all they were way too sweet. Would not make again."
"1","2","I am not sure if the consistency was right. I switched the recipe to bake half and it came out too runny. It sounded like a great cookie, I might have to try again for the full amount."
"1","5","I almost ate the whole bowl of batter before I baked them! YUMMY!!!!!"
"1","5","This cookie is quickly becoming one of my most requested recipes. I've made it for a girls' softball team, bake sales and family get-togethers. It tastes like a brownie. Make sure to bake them long enough otherwise they fall apart. I always add Mini M&Ms as well as the chocolate chips! Absolutely sinful!!!"
"1","5","Absolutely the cure for PMS! You can never have too much chocolate in my book. I added mini m&ms instead of nuts! Thanks a bunch!"
"1","5","Great cookie! I used whole wheat flour and didn't add the nuts. They turned out great! My children ate them up! I will make this one again!!"
"1","5","THESE COOKIES ARE THE BEST CHOCOLATE COOKIES EVER!!!! i'm allergic to nuts so i don't put in any nuts but these are the best!!! I HIGHLY RECOMMEND THESE!!!!!"
"1","4","this recipe was fantastico... i eat them when i where a banana on my head. these cookies inspire me to wear a bathing suit. i hope you are inspired by these cookies!"
"1","5","The best double chocolate chip recipe I've tried. Cookies come out moist and chewy and they don't thin and flatten out too much like some other cookie recipes. A keeper for sure."
"1","5","Our favorite from now on. Per other reviews I used 1/2 butter and 1/2 butter flavored Crisco, 1 c. white sugar and 1/2 c. brown, decreased the cocoa by 2 T. and baked 8 min. with 2 min. to cool on the sheet. They were gooey and soft. Did flatten out some, just what we wanted. We don't care for the more cake type that are mounded. These won't last long, thanks Kathy."
"1","2","I followed the recipe except for substituting some cocoa powder for chocolate powder.   The mixture was very very sticky but not dry. When baking, the cookies starting expanding and deforming and soon all of them were stuck together. I find the cookies quite tasty but way too sweet and they're very flat and chewy like cake =("
"1","5","We renamed this the PMS cookie. Excellent for the chocolate craver or lover. To those who are finding the cookie dries out, the secret is to bake them the least amount of time and then to immediately put them in an airtight container as soon as they are completely cooled."
"1","5","I have been reading the reviews of this cookie recipe and can't believe some people thought they were dry. I did have one problem when making them -- they were sooo soft when they came out of the oven and I tried to take them off the cookie sheet before they were cool. Not a good idea, because they were too soft. I found that I had to bake them a little longer than the 8-10 min. suggested, but every oven is different. I was afraid they would be too chocolaty so cut down on the cocoa powder by a tablespoon or so, but otherwise followed the recipe exactly. Next time I'll use the full cocoa powder amount, as they were not too chocolaty. They were very easy, very moist, and were absolutely delish!! This recipe is definitely a keeper!!"
"1","5","Excellent cookies. The only alterations I made were to use 1 stick of butter plus 1 stick of Nucoa margarine and substituting brown sugar for 1/2 cup of the sugar called for. These have a nice chewy/crisp texture - very rich."
"1","5","these ROCK!!! when you need chocolate, these are it! i usually make them small, so i can justify eating a few... ;0)"
"1","5","These were great! I didnt think id like them, i usually dont like cookies, but these came out soft and chewy, aven after being in the fridge for a whole night. I added a 1/4 cup of brown sugar (my son insisted), and left out the nuts- were not big on crunchy cookies. I only make a dozen at a time and keep the rest in the fridge, its kept for 4 days very well."
"1","5","These are wonderful! I used 1/2c margarine, 1/2 butter shortening, as well as 1/2 cake flour since I ran out of all-purpose. They are such an indulgence! Great recipe!"
"1","5","I copied this recipe yesterday and then made them today. I read quite a few of the reviews and decided to use 1/2 c butter & 1/2 c butter flavoured shortening, as is my practice when preparing regular chocolate chip cookies. I also used 1/2 c packed brown sugar and 1 c white sugar. I remembered reviews that these cookies can be dry when I had finished mixing the batter and realized that even the batter is stiff and dry. I decided to add a heaping tablespoon of liquid honey, which I made sure to incorporate well. I was worried but OMG these cookies were excellent. I always get complements on my cookies, but just as Kathy reported, people said I should sell these!! Thanks Kathy!"
"1","5","Terrific chocolate cookie. I made them for a group of friends and there were none left over. Easy and delicious recipe!"
"1","5","I made these cookies for my boyfriend's office, and they were a HUGE hit. They wouldn't stop praising him (he lied and said he made them). They have an amazing brownie-like texture that stays moist. Simply delicious.   When I made them, I ran out of bittersweet morsels, so I used up some peanut butter and butterscotch morsels I had. I would not recommend using the butterscotch because it was too sweet for such a rich cookie. Next time it will just be the bittersweet chocolate and some nuts. Also, be sure to let them cool completely before you move them around too much. They are very, very soft and prone to breaking apart when they first come out the oven. 9 minutes was perfect for my baking time."
"1","4","Made over the weekend for tins as Christmas gifts. I like these well enough, made them exactly as written. I doubt I would be in a giant rush to make them again though. But thank you."
"1","5","These cookies are terrific. I have tried adding dried cranberries and white chocolate chips, which turns makes a somewhat sophisticated cookie, as well as reeces pieces and white chocolate chips - also very yummy!"
"1","5","These are the best cookies ever! I have stopped my cookie search here. Thanks for the great recipe. I havent let my kids try them yet because I want them all for myself. :) But I am sure they will love them as much as I do!"
"1","5","These cookies are wonderful! I will DEFINITELY make these again."
"1","5","Excellent cookies- Easy to make and delicious! Thanks"
"1","5","Great cookies! I made them with peanut butter rather than chocolate chips and they turned out wonderfully, despite using 1/2 c butter and 1/2 c vegetable oil spread (I'm a butter snob usually!). Will use again."
"1","5","loved these cookies. Substituted 'Andies' mint chips for the chocolate chips and left out the nuts. Yummy."
"1","5","I added white chocolate chips as well. Dee-lish! Very easy and quick to make."
"1","5","these cookies are like moist, gooey brownies. Delicious!"
"1","5","Per previous suggestions, I used 1/2 c. butter-flavored shortening and 1/2 c. butter to try and retain moisture. I also used 1/2 c. brown sugar and 1 c. white sugar. The cookies turned out great - wonderful taste! Be careful not to overbake (8 minutes was definitely enough). Also, eat quickly; they get just a little dry in the days after they're made - even if they're sealed up."
"1","5","The BEST chocolate chocolate chip cookies I've ever had. Not too sweet, just perfect!"
"1","4","Being in the UK the ingredients differed slightly. I used a salted butter and ommited the salt. Then I had 50% more butter and then they were perfect. Soft and chewy! If any English people make these cookies I suggest you use anchor butter and cut chunks of bournville  I found that worked well! I will definately add this one to the recipe book."
"1","5","Very good - simple easy to follow recipe. Delicious chocolatey cookies, crisp on the outside and soft on the inside - will definitely make again. I am freezing these for use in school lunches."
"1","5","Very, very good! They were cake like and very moist. If you don't like an all chocolate and soft cookie then these are not for you. If you can't get enough of chocolate like me then try these. Easy to put together in no time. Next time I want to try adding peanut butter chips!"
"1","5","Fabulous recipe! Everyone raves about them at gatherings and they are super easy to make."
"1","5","I added Peanut Butter chips and they were delicous!! I took the chocolate chips and put half of what it says and added the other half left for peanut butter chips!"
"1","4","Good soft cocoa-chocolate chips cookies. They're very quick and easy to prepare."
"1","5","This is an excellent cookie recipe for chocolate lovers! My 1 year old is a picky eater and absolutly loved it! I added 1 cup chocolate chips and 1 cup of peanut butter chips for a different twist. (Instead of 2 cups chocolate chips.) Thanks for a fabulous recipe! We will be making this cookie recipe again!"
"1","2","These cookies didn't meet my expectations. The were 'ok' when they first came out of the oven, but after a few hours, they just weren't that tasty. I will not be making these again and continue searching for the best cookie recipe."
"1","5","Funny story behind this... Being new to cooking from scratch, I'm not yet familiar with what you can (or can't) substitute in terms of ingredients. When I first tried this recipie, I didn't have cocoa powder, so I figured I'd use some vanilla malted milk instead. Ouch. I'm sure all the experienced cooks out there are rolling their eyes at my mistake. For future refrence... don't use malted milk in cookies. I then tried the recipie again when I got some cocoa powder and WOW! Super soft, chewy, melt in your mouth good! I love this recipie, especially now since I have a funny story to go with them now! lol I have since used powdered chocolate Ovaltine in place of the cocoa powder and it was equally as delicious. YUMMY! Thanks :)"
"1","5","wouldnt change a thing! i did bake them the full 11 minutes at 350 and my oven tends to be true."
"1","5","These cookies were 'melt in your mouth' gooey right out of the oven. They were best the first day but were still tasty the second. They were a definite hit with my husband and kids. Next time I will try milk chocolate chips."
"1","5","I used 1/2 cup brown sugar in place of 1/2 of white sugar and melted the butter. I added 1/2 cup of mint chocolate chips. This is a great recipe. My boyfriend loves them."
"1","5","Excellent! Chocolatey and delicious. Great for days afterwards. Stayed chewey and tasty! Great work!"
"1","5","This recipe was YUMMY!! The cookies tasted like soft chocolately brownies. I added milk chocolate candy bar (chopped) instead of walnuts. I will definately make again and again!"
"1","5","MMMMM GOOD! These cookies are so incredible. So rich and lucious. They are very soft and gooey. I added even more chocolate chips for some extra mmmmm! I would recomend this recipe to anyone who loves chocolate."
"1","5","Wonderful cookies! They hardly spread at all resulting in a chewy, rich, thick, perfect cookie. I used half butter, half margarine and they turned out great."
"1","5","excellent"
"1","5","These are great. I had no chocolate chips, so did them without them and powdered them with confectioners' sugar when they were done. Looked nice and Christmassy :) A friend said they could have been sweeter and that he'd have added more powdered sugar to the batter, maybe that is worth a try -- I kind of liked them as a more dark-chocolate flavour though. Keeping this recipe, may try it with white chocolate chips some time."
"1","5","Perfect in every way. They are the best!!! We left out the nuts and used gourmet cocoa. Man are they good!!"
"1","5","yummy yum yum... they were easy and my kids could help, finally a recipe w/out having to melt chocolate! Thanks"
