helpfulCounts,ratings,reviewText
"0","5","Love it! I used 2 cups of brown sugar and omitted the white sugar. delicious, I also dipped half the cookie in dark chocolate. Talk about heavenly!"
"0","5","We love these! Substituted 1/2 c. Coconut oil for 1/2 the butter. Also added 1/4 c oats. Love, love, love them!"
"0","5","Nice, perfectly round cookies. My cookies rarely turn out the way I want. These ones look amazing and taste just as good. I added a bag of mini chocolate chips."
"0","5","I often make cookies for the small office where I work. There are only 8 of us. Usually cookies take a few days to disappear. These were gone by 3:00pm the day I put them out.   They are light, crispy and crunchy with a perfect peanut flavor. There's nothing cakey or too dry about this cookie. I added chocolate chips because who doesn't love chocolate and peanut butter? This recipe is by far the best Peanut Butter Cookie recipe I've come across."
"0","4","OH MY GOODNESS! It's really great! Pros: It's really good and it lives up to its name. The peanuts can really be tasted and the texture's good. The servings really big too! :D Cons: I am a beginner too so it was a bit hard using the mixer, I think I over mixed it making it dry. I added another egg because my eggs were a bit small and half a glass of water because it was a bit dry. You also have to bake it 2-3 times before you get the hang of it, especially timing the cookies when their perfect. You need practice or experience to really get it perfect the first time but it's not impossible.  I followed other comments, so I added 1/2 cup of flour and 1/2 cup of peanut butter. Fantastic.  Thank you for sharing the recipe! :D"
"0","5","I have used this recipe for my church- and all reviews have been positive!!"
"0","5","I made this recipe last night. I increased the flour to 2 3/4 cups and used 1 1/2 cups of peanut butter. I also baked them at 350 for 10 minutes and they were PERFECT!!!!"
"0","5","Great recipe. Next time I will cut back on the white sugar by half."
"0","5","These turned out great! I added extra peanut butter and flour,as suggested by the other reviewers, plus some peanut butter chips. I put the batter in the fridge overnight and I cooked them for about 9 min and 30 seconds in a 375 degree oven. I prefer my cookies a bit chewier but if you prefer a crispier cookie, I would probably add an extra minute or two in the oven. This recipe is a keeper."
"0","5","Followed the recipe exactly and came out perfect! I was worried when I read the other reviews after making the dough. But as it turns out, not a single change was needed. I think another reviewer might be spot on when he suggested you really do refrigerate the dough for a full hour. I did and had zero problems. Crisscrossed the top and all! Delish!!!"
"0","5","This is the best PB cookie recipe I've made. I added the 1/4 cup extra flour and pb along with the 1 tsp vanilla suggested by other reviewers. I didn't smash my cookies too much and baked them for 9 minutes at 350. They are so soft and good! Thank you!"
"0","5","cookies were amazing, though mine came out pretty flat......is that supposed to happen??"
"0","5","Made these with chocolate peanut butter and put Reese's Peanut Butter chips in. Yummy. They went really fast."
"0","5","These are by far the best peanut butter cookies. I used this recipe for the Hershey's kisses Version and they were perfect. Baked it only eight minutes."
"0","5","easy and so yummy"
"0","5","I just finished making these cookies for a church event I am going to. The cookies were perfect and so Delish!   I used smooth almond butter because I wanted to use up what I had in the pantry, and it tastes just as good as peanut butter. I used about 1&1/4 cup of the almond butter. I used 3 eggs and added 1/2 cup more flour & the consistancy was perfect. I used a stainless steel mixing bowl and put the dough in the freezer for about 15 minutes and the dough was easy to handle. I have a cookie scoop (like a small ice cream scoop)and the cookies are uniform in size that way, not to mention faster and easier to scoop up. I always dip my fork in flour before I make the criss cross design, then redip it for the next cookie. The fork never sticks to the cookies that way.    I have two large cookie sheets and only bake one sheet at a time. I line the sheets with heavy foil, dull side up, and let the cookies cool completely on the foil (after I slide it, cookies and all, off the pan) then I can reuse the cookie sheet. 12 minutes in my oven was just right. This recipe yielded 4 dozen & 8 cookies, about 3 & 1/4 inches across.  I had some chocolate kisses in the pantry so I unwrapped them while the cookies baked and when they came out of the oven I put a kiss in the middle of each hot cookie and pressed down a bit. They melted just at the bottom, enough to hold them in the center of the cookie after they cooled.   I will make these again with my grandchildren next week!"
"0","5","SUPER delish. I added 1/2 C flour and they were perfect. Also, I didn't have crunchy peanut butter and they are still amazing! Thanks for the recipe!"
"0","5","I've made this recipe several times now, and the cookies are delicious and always a hit. I've used both crunchy and creamy peanut butter and both work well. I do typically add an extra 1/4 - 1/2 cup peanut butter and I like to add peanut butter chips, too!"
"0","5","I used 'all-natural' peanut butter (the kind that is naturally oily) and suspected less than perfect, but the recipe turned out flawless somehow. The family loved it!"
"0","5","Added 1/4 more flour & 1/4 more peanut butter also added 1/4 teas of cinnamon very yummy"
"0","5","Oh Yeah! these are exactly what you want a peanut butter cookie to taste like. Didn't change a thing."
"0","5","I used smooth peanut butter and 3 cups of flour, everyone LOVED them!!"
"0","4","I agree...flour needs to be increased. I increased to total 3 cups. In doing so, the peanut butter must be increased as well. I used 2 cups. Other than that, this recipe is golden. Tastes great, bakes evenly, and does NOT last long so eat some while you can!!"
"0","5","Loved these cookies! tweaked it a bit. This is def a keeper!"
"0","1","These were the driest cookies I have ever made. The dough was ao dry it looked like flour! Way too much flour. I had to add 1/3 cup of Milk to even be able to make these in a ball! Dissapointed."
"0","4","So good! I love that everyone tweaks these recipes to make them their own. Here are my tweaks: First of all, I used all ORGANIC ingredients, that makes all the difference in the world. I added 1/2 tspn of vanilla extract, added butterscotch chips, used salted butter, 1 tspn of salt instead of a 1/2, added a dash of nutmeg, and substituted pure honey & real maple syrup for the white sugar. I almost didn't finish these cookies because I couldn't stop eating the batter! If I could name my version of this recipe, I would call it Salted-Honey Peanut Butter Cookies. :)"
"0","5","These cookies are delicious!  I took the advice of other reviewers and increased the peanut butter. I was 'loose' with that and added approximately 1/2 c. more. I also added a full (exact) 1/2 c. of flour knowing I liked a dryer outside texture for my cookie.   I used natural peanut butter (the kind you stir because the oil separates); a 50/50 mix of white and wheat flour; salted butter since I had no unsalted in the house (I omitted adding any additional salt to offset its content); and powdered egg mix (placing the water in the moist batter and the powder in with the flour).  The result was a beautiful cookie in appearance, texture and taste."
"0","5","THE BEST PEANUT BUTTER COOKIES I HAVE EVER HAD!!!!! I did what Natalie66 did and they are so amazing. I will keep this one in my book!!!!"
"0","5","I've never found an enjoyable homemade peanut butter cookie recipe before this one. Needless to say, I was very impressed. I took JENNIFERC77's advice and added the extra 1/2 cup of flour, peanut butter, and teaspoon vanilla but also included a 10 oz. bag of peanut butter chips. Good Lord, they were decadent."
"0","5","Tasty and simple! Made them exactly as per the recipe and had no troubles with flat cookies - maybe it depends on the kind of peanut butter you use?! Also, I just pressed them with the fork enough to make the criss-cross pattern - not actually 'flattening' them. Will try adding vanilla next time."
"0","5","Wonderful recipe - perfect texture!!! It's so hard to stop eating these cookies! I added a tsp of vanilla and more peanut butter (a bit more than 1/4 cup), and family and friends LOVE these cookies.  Thanks so much for posting this recipe!"
"0","5","Add a chocolate kiss to the center to create another layer of goodness -- or just enjoy this really great PB cookie recipe on it's own. I took the advice of other reviewers and added 1/4 cup flour, 1/4 cup PB, and 1 tsp vanilla. Wonderful texture and taste!"
"0","5","I added reese's pieces and dropped on cookie sheet (no criss-crossing). Delicious!"
"0","4","First, I must tell on myself. I am a very seasoned baker, but like all I have my oops moments. I made this recipe to the exact measurement, except I forgot the brown sugar!! They weren't that bad, very light in color and flavor, but the kids loved them!! Once I discovered my mistake (two pans in) I added the brown sugar and they turned out great!"
"0","5","I followed this recipe exactly and it came out perfect! They came out crunchy outside and moist inside......needless to say PERFECT! I also made a batch with chocolate chips that were just as delicious. If you have problems with this recipe it may be your baking soda or that you are handling the dough for fortoo longand letting it get soft in your hands. Try putting them back in the fridge for bout 10 minutes once you have them rolled o to your cookie sheets, then straight to the oven from there!"
"0","5","We loved these cookies!!!!"
"0","3","I followed the recipe exactly, and the cookies all spread out and came out too thin. They were not very flavorful either. I won't be making this again."
"0","5","My fianc was bragging for days about these cookies that I made him. Even his boss couldn't eat enough of them! Really are quite delicious and simple to make. I used creamy PB and salted butter."
"0","5","I loved this recipe all I did was add some Butterscotch Chips to it. These cookies were chewy and delicious. :)"
"0","5","I made this recipe for my hubby. I followed it to a 'T' mostly, but I cut all ingredients in half for a half recipe. I also omitted the salt (I never cook or bake with any salt). I had no problems of the cookies 'melting'. They came out looking delicious!"
"0","5","I am making this recipe for the second time today and both times they have turned out amazing. This recipe makes 3 dozen cookies and the last time I made them, they lasted 2 days and then they were gone. This timed I added chocolate chips to make them kind of like a Reese's and they are amazing!"
"0","5","Hello Bakers: I too read the helpful reviews for this recipe and decided to add a twist to it!!!! I added 3/4 cup of coconut, 1 teaspoon of vanilla flavoring, extra 1/4 cup of flour and peanut butter. The consistency was perfect for rolling into perfect balls for baking. I sprayed my cookie sheet with non-stick spray for easy removal. My husband was asleep in his recliner and the aroma awakened him and he was my sampler. His response: These are great!!! This recipe is definitely a KEEPER! Thank You. Terri Woods"
"0","5","These are the best peanut butter cookies I have ever made. The only think I did different was before putting on the pan I rolled them in sugar then put them on the pan and criss crossed them. Most excellent and I will be making them again and again. They are awesome!"
"0","5","Just made these last night and had added vanilla since it did not call for it as I've always added it to my PB Cookies and extra peanut butter (bit of a fan). It was not until after making them reading the reviews while baking to find out that a few others had made the recommendation. Thank you to those that did. Other than that these turned out really cook as dad made a comment about them being really good (prefers chocolate over PB). This says something in my world. Thank you for the recipe Shirley."
"0","3","Too crumbly...needs butter."
"0","4","As written, I tasted more butter than peanut butter. I upped the peanut butter by 1/4 cup and decreased the butter by 1/4 cup. I like the new flavor."
"0","5","I have struggled to find soft peanut butter cookies for years and FINALLY! These are just the right mix of crunch and soft. My oven cook time took 12 minutes and not ten. But everything else was perfect!"
"0","4","Good cookie with a rich wonderful taste but it flattens out way too much. Would be bester if it keep more of it height but all in all it's still worth making."
"0","4","While the cookies come out almost perfectly round and acceptably good, they really need more peanut butter. Either that or a few chocolate chips. Or both. Because they just have a hint of peanut butter, not an 'in your face' peanut butter that both of us like.   Note: The cookies came out perfect. And I didn't refrigerate them at all."
"0","5","yum! love the cookies"
"0","4","I loved this recipe. The only reason I gave it four stars instead of five is that it was not the best one that I've come across. I had to bake the cookies for about 13-15 minutes instead of the 10 otherwise the cookies were doughy and just fell apart. Other than that, the recipe was good and my friends enjoyed it (they were attracted by the delicious smell and begged to try some)."
"0","5","These are SO good, that my husband will make them! He wants them THAT bad! lol PS. sometimes we add chocolate chips too :)"
"0","5","Yummy, 10 min at 375 in a convection oven is about 30-45 seconds too long."
"0","4","I really liked these. Like the others, I added 1 tsp of vanilla, 1/2 cup of peanut butter, and 1/2 cup of flour and they turned out great C:"
"0","5","This is my 'go to' recipe for peanut butter cookies. This recipe makes a PERFECT, classic peanut butter cookie. I did as other suggested and added more peanut butter and also added some M&M's. I always half the recipe and it makes enough for my little family of three :-)"
"0","5","Delicious! Didn't change anything. I had a bit of leftover chocolate butter cream in the fridge and made sandwiches with a few. Not for the faint of heart or will power."
"0","5","Wonderful recipe, only change was double peanut butter."
"0","2","Too much flour. Add some vanilla, cut the flour in half."
"0","5","VERY GOOD"
"0","4","i loved this recipe! all i did was decrease the baking time to 8 min. and i used a plastic fork to press the cookie down. they looked just like the picture."
"0","5","I loved these cookies. Like other reviewers I added vanilla (1/2 tsp since I made a half batch) and cooked the cookies at 350 degrees for 10 minutes. The cookies turned out both chewy and yummy."
"0","4","With the suggestions from other reviewers these cookies were perfect. Add the extra peanut butter and flour as suggested."
"0","5","Simple and perfect"
"0","4","Delicious cookies. I added vanilla to the batter but other than that they were great."
"0","5","Great, simple recipe! My eldest teen makes these with ease. I substitute Crisco for the butter and they come out light and crispy every time. Give each dough ball enough room to spread on your cookie sheet - these do expand quite a bit."
"0","4","These had great texture and good flavor. I would've liked a little more peanut butter flavor so next time I might add some more peanut butter. I followed the recipe minus putting the dough in the fridge and I added chocolate chips."
"0","5","These cookies are so tender. Awesome! Make sure you refrigerate the dough because it was hard to handle being room temp. These are the best! I baked them 9 minutes and used creamy peanut butter."
"0","4","These cookies are very, very good. I've tried making them with smooth pb and crunchy. Crunchy is the best."
"0","5","These are very good, they are chewy, soft and easy to half the recipe (which I did). I did not find it necessary to add additional flour and/or PB which would throw the additional ingredients out of proportion. I used JIF smooth peanut butter so the taste was mild. If you use a natural PB, the taste would be bolder."
"0","5","These were yummy and I don't even like peanut butter very much. I followed another reviewers advice and added more peanut butter and they still came out fantastic. I have made several batches of these things and they are always consumed quickly by friends at parties. Love these"
"0","5","These weren't as dense as the cookie batter I remember, but were excellent when baked. Make sure to really squash the fork into the cookie before baking or you will lose the indents that a classic peanut butter cookie must have. Will make this one again."
"0","3","They are ok."
"0","5","Love this I used creamy peanut butter instead of crunchy. I ran out of vanilla which I always put in baking even if the recipe does not call for it. So I added vanilla coffee flavoring this was so good. My hubby took them to the office and brought back an empty bowl. Awesome"
"0","5","We also added 1/4 C. of both peanut butter and flour. They are perfect! Remember not to over bake. We've also tried adding 1/2 c. chocolate chips. The whole family loved them."
"0","4","One of the best peanut butter cookie recipes. I did cut the cooking time down to 10 minutes and cooled on the cookie sheet for no more than 2 minutes before transferring to a wire rack."
"0","5","The mixture was all dry and crumbly and I kept re-reading the recipe and realized i had only put in 1 stick (1/2 c.) of the butter... so I pulled it out of the fridge and blended in another stick of butter and the mixture was perfect consistency. These cookies are awesome!!!"
"0","5","Really yummy and easy to make. A little crumbly, so not great for packing, but they were perfect with milk on a snowy day!"
"0","5","Fantastic!! Added 1/2c more flour, 1/4c more PB, 1/2 tsp vanilla and even put a few choco chips in some of them!! Delicious!"
"0","5","Really good cookies, not too sweet. We have peanut allergies so substituted soynut butter for peanut butter and it worked great."
"0","2","These cookies were too thin and not peanutty enough. It was a like flat butter wafer. Not impressed."
"0","5","Great recipe... I used shortening instead of butter though. They were yummy!"
"0","5","I just finished making these cookies... They are great!!!! You do have to add 1/2 cup extra of Peant butter and of Flour, I added 1 teaspone of vanilla.... they are great.... My husband said he does not eat peanut butter cookies and ended up eating 4 :o)"
"0","4","Just made these today. Followed the advise of other reviews, and added 1/4 of cup more flour and used a whole jar of peanut butter (we LOVE pb). I also added 1 cup of peanut butter chips, and 1 cup of chocolate chip. Kids gobbled them up. Thanks for a great recipe!"
"0","5","I made these vegan by using 'no Egg' egg substitute and earth balance in place of the butter... Then I made them gluten free by using a 50/50 of almond and oat flours. Chewy, perfect!!! Thanks for the recipe!"
"0","4","very nice recipe, chewy and crunchy, you all have to try it"
"0","5","Perfect"
"0","5","This was my first time making them, they were a hit. Baked them for exactly 10 minutes, all our kids loved them. Great, simple recipe."
"0","4","I used salted butter and omitted the salt. I cooked them at 350 since my oven runs high and cooked them for 9-10 min. They came out a little on the thin side but they were still good."
"0","5","Love these cookies made sugar free even! I don't do sugar so I substituted with Splenda white and brown. Very easy to put into the stand mixer and let it go. I must admit that I don't wait an hour to let the dough chill in the fridge because when I want a cookie, I want a cookie. These hit the spot with perfect texture and very moist."
"0","5","I have been experimenting with Domino Light Sugar and Stevia blend. It equals twice the sweetness of sugar so I used 1/2c. and used the 1 c. brown sugar. I used the suggestions of other reviews and used 2-3/4 c. flour and 1-1/2 c. pb. I made 1 ounce balls, and they took 13 minutes. Woowie kazowee-they came out so good I could eat them till I get sick, because there is less sugar-right?"
"0","4","These cookies were super easy to make and they made wonderful cookies that everyone liked."
"0","5","I usually use creamy peanut butter rather than crunchy, and I generally add an extra 1/2 cup for a stronger peanut butter flavor. I also chill the dough for at least three hours, and I take just enough dough out of the fridge to shape *one* batch before it goes in the oven, so the remaining dough never gets too warm and soft (which happens very quickly, especially after you shape it with warm hands); I take the next bit of dough out of the fridge for shaping about two minutes before the first comes out of the oven. I prefer a chewier cookie, so I cook mine for 13-14 minutes at 300 F, and allow them to cool for several minutes on the cookie sheet before transferring them to a wooden cutting board (otherwise they are too soft). Another reviewer mentioned not to flatten them with a fork, and that they will seem underdone when you remove them from the oven. I *always* flatten them with a fork just a little bit, but they do spread a little so don't go crazy with it; I usually do only eight per cookie sheet if I'm using my smaller pan, just to be sure they don't touch, but I have never had an issue with excessive spread. I do agree that you will likely think they are underdone when you take them out. They will flatten, harden and even darken just a tiny bit as they cool. This recipe has a large yield so you can always do a couple of test cookies to get the timing perfect for your oven. :)"
"0","5","Absolutely delicious! I made those yesterday (only 1 dozen) and they came out perfectly chewy, sweet and peanut buttery. I had no butter so I used the same amount of vegetable oil, but the taste is still fantastic. Just note that if you use oil they'll need to set for a couple of hours or overnight in an open jar to get the proper texture and aroma. Five stars without hesitation!"
"0","4","These are very good, but VERY rich! I can barely make it through one cookie! They have a great flavor and were definitely easy to make."
"0","5","I made this recipe exactly, without making any changes, and the cookies turned out wonderfully! They were a little difficult to get off the spatula, and would fall apart if you tried too hard to get them to come off on their own. (I only have one cookie sheet, so I don't have time between batches to wait for the cookies to cool on the sheet) I found that using a second spatula to push the cookie off the first spatula used to get the cookie off the baking sheet worked well enough. After cooling for a few minutes on waxed paper they held together just fine. I store my cookies in air tight containers with a piece of bread to keep them soft. :)"
"0","5","I have been using this recipe for 2 years and it is scrumptious!"
"0","5","These cookies were great! I am a fan of thinner, crunchier cookies. I may add a little more peanut butter next time."
"0","5","These are perfect"
"0","1","My batter came out all crumbly and unmanageable. I tried to bake them and they got even worse. I thought that with it having such good reviews I must have done something wrong. So I looked over the recipe again. Nope, I did everything correctly. SO I looked up another recipe for peanut butter cookies and found out the problem: this recepie HAS NO LIQUID!!! I took out my milk and vanilla extract before starting everything and when they didn't call for it in the ingredient list I thought it was a little bizzar, but followed the directions. BIG MISTAKE! Just go with another recipe in my opinion."
"0","5","Phenomenal! I've been searching for the perfect peanut butter cookie recipe and this one rocks! I think refrigerating the dough and using baking powder makes all the difference! However, I never met a recipe I didn't tweak. I made a batch and a half, using a full 16.3-oz. jar of peanut butter and 4 cups of flour. I used a small cookie scoop and baked 7 1/2 minutes. The search is over!"
"0","5","Even though I revised the recipe I feel it deserved 5 stars. I added 1 ts. of vanilla, an additional 1/4 c. peanut butter & flour, as stated in other reviews. I only had salted butter so I omitted the salt. Excellent cookies. The best I have ever made."
"0","4","Yummy."
"0","5","I tried this mainly due to the positive reviews~ and I was NOT disappointed The cookies came out delicious and I followed the instructions exactly . I did add the Hershey Kiss at end for Christmas cookies. This recipe is definitely worth keeping :)"
"0","5","These cookies were absolutely delicious. I managed to get exactly 24 1-ounce cookies. I would be interested to know how these would turn with all natural peanut butter. I also used a silpat to bake them on which made them spread out a bit more. Overall Excellent! Thank you Shirley!"
"0","5","I followed this recipe exactly and they came out perfect! I made these for Christmas, so I put Hershey kisses in the middle. NOTE: I baked these for 8min and 50sec and they were PERFECT! WARNING: These cookies are extremely addicting! Enjoy! :)"
"0","4","the cookies were a little to thin but other than that they were great soft and chewy my family like it..."
"0","5","loved this recipe. the cookies came out perfect."
"0","4","Really good. I doubled the recipe and it came out great. They bake better when the dough is really cold. If the dough was not cold, the cookie tended to flatten out more and burn a little. But the flavor was great! House smells so wonderful."
