helpfulCounts,ratings,reviewText
"1","5","WOW. I love baking and chocolate chip cookies have always been my go-to. This is definitely my new go to cookie recipe!!  So chocolatey and delicious, they are by far the biggest temptation to me out of all the things i bake. Soft, rich, and not super fluffy but not flat, just right! The only thing i did differently was just to refrigerate the dough for an hour as another reviewer suggested. Wouldn't make a single change to the recipe otherwise, they're PERFECT. For further info, i didn't put in walnuts, didn't change the amount of sugar, and used the full cup of butter softened but not melted. I baked them for about 8 1/2 minutes so they would still be soft, and it turned out great that way. The perfect soft dark-chocolatey cookie. This is a winner!"
"1","5","If I have ever made a better cookie I can't remember when. They were so good I felt compelled to say it after 3000 others have already. I made no substitutions aside from one cup semi-sweet chips and 1 cup white chocolate because my daughter insisted they were too brown. Who can argue with a 4 year old, I mean, really who can?"
"1","5","This was a great recipe and it tasted great! one of the problems that I had was the fact that it was too dry, but I solved the problem by adding a little bit of milk and the problem was solved."
"1","4","This is a awesome recipe so easy anyone can do it even kids :)"
"1","5","These cookies are absolutely heaven. The only change I made was 1 c. white sugar and 1/2 c. brown. Even my daughter loves them and she's not a cookie person! I do put a piece of bread in with the cookies in an airtight container and they stayed soft and delicious until they were gone. Making them again tonight......thanks for a wonderful recipe!"
"1","4","this so hit the spot! i had been craving something sweet since yesterday and luckily found this.. i scaled the recipe down to 12 servings, worrying if i made the full yield i'd eat the entire thing in one sitting [i think i've eaten 4 or 5 so far!].. i used a full egg instead of 'half' and used half white sugar and half brown sugar.. this came out light and fluffy rather than dense and chewy or crispy.. i'm sure bf [who isn't much into sweets either] will enjoy these when he gets home [if there's any left ;) ].. ty for the recipe"
"1","5","I take this recipe, and double it.  Half gets Hershey's Special Dark powder, and the other half gets milk chocolate powder.  Into a container goes 2 chopped up bars of baking chocolate (I use 1 bar Baker's semi-sweet and 1 bar Baker's German), and up to 5 full 12 oz bags of chips. I mix my brands, as each brand adds a different flavor. Ghiradelli white vanilla chips give a nice counter note as well. Shake them up REALLY well. You should end up with 8 cups of chips.  Put half into each batch of dough. You'll want to mix in this many chips by hand, as most mixers can NOT handle something this dense, even when using dough hooks. Use a spatula you don't mind breaking if you don't want to hand mix. I have learned these lessons the hard way. :P  Spoon onto cookie sheets (I let them sit covered in the fridge for a day or so, but that's me), sprinkling each cookie with a pinch of cinnamon. Depending on the number of chips, you may have to bake a couple half-dozen test batches first. I start with 8 minutes, then work my way up to no more than 15. These cookies will go from done to burnt VERY quickly!  These end up being incredibly rich, incredibly chocolaty cookies that melt in your mouth. They've been described as more chip than cookie. Thank you, Kathy, for an excellent base recipe!"
"1","5","Perfect recipe! Dough will be stiff when all flour and cocoa are added - need lots of muscle to finish the mix. Refrigerate for an hour. Used a 2' cookie dough ball scoop - made perfect size for a holiday party."
"1","5","I didn't use any walnuts, and used 1 1/4 cups of dark chocolate chips and 1 1/4 white chocolate chips. I also did heaping two-tablespoons and increased the time to 13 minutes. I would also suggest the use of parchment paper, as they tend to fall apart when they have so many chips and are so large! The parchment allowed me to slide them off to cool completely (whilst on the parchment paper) on a wire rack. I sent them to work with the husband and his office gobbled them up!"
"1","5","This recipe was great! I subtracted half a cup of sugar so it wouldn't be too sweet and the cookies still tasted perfect. The cookies were a bit cakey and thick, even though I didn't refrigerate the dough."
"1","3","I thought the recipe was OK. Other reviewers suggested it was the perfect fix for a chocolate craving, but didn't do it for me. It was a nice idea, but the only difference between this and my favorite chocolate chip cookie recipe is pretty much just the addition of cocoa powder. I thought it was a little overpowering in the cocoa department and had the powdery aftertaste. Wouldn't suggest for use as a chocolate craving fix."
"1","2","They were very cakey. They may be taste with some ice cream though."
"1","4","Made 56 small-ish cookies. Followed the changes suggested by user TIAAKE and other reviewers. They look really nice, but mine ended up being soft and not chewy at all. Not too sweet, which is nice."
"1","5","I was looking for a really good chocolate chocolate chip cookie recipe, and wow! I found it! These cookies are fantastic! My kids Loved them, and said I was the best mom ever in the entire world lol, better than anything from the grocery store, and so delicious! they added. I followed the recipe to a T, and they came out perfect. Thank you for the recipe, I'll most definitely be making these cookies again:)"
"1","5","Fantastic recipe! I did what others suggested and used 1/2 shortening 1/2 real butter (no margarine in this house!) and 1/2 brown sugar and 1/2 white sugar. So soft and chewy. Next time I will use different flavored chips, maybe mint chips for the holidays. Thank you for the recipe."
"1","5","Excellent recipe. Added an extra 1/2-cup of chocolate chips. Made sure to beat the butter and sugar for about 4 minutes with a hand mixer so it was extra light and fluffy. Chilled the dough overnight for ease in scooping. Will definitely make again."
"1","5","these cookies are the best!! i used dark chocolates on my first try because i dont have semi sweet chocs and the outcome was super awesomeeee!"
"1","5","Yes,I love these!!! my GF thinks I am the worlds greatest baker :) So please dont tell her how easy these are ;) lol"
"1","5","We don't often make cookies at all. Or any kind of sweet. But I really wanted cookies... these turned out amazing. Mykids were able to help make them, which is always good. The dough was a little wet looking so we added about another quarter cup flour and a bit more cocao powder. Used Andes mint pieces instead of chocolate chips. They are chewy, soft, and full of flavor. Thanks for the great recipe!"
"1","5","We felt like eating choc choc chip cookies tonight and found this recipe with so many great reviews. Excellent recipe. Very rich chocolate flavor and chips add to the whole chocolate experience. I try to cut down on sugar so I used about 3/4 cup of white sugar and 1/4 cup of brown sugar. I usually make my choc chip cookies with more chips than batter but in this case, I reduced the chips to 1 1/2 cups. Cookies turned out perfect for us. Melt in your mouth drops of chocolate. Next time,I might reduce sugar a little bit more though the salt might have to be nixed as well to balance. The chocolate flavor is more accented then and the chips really pop. Definitely a cookie recipe to keep. Thanks."
"1","5","AWESOME !!!!!!!!!!"
"1","5","If you put baking powder in like I did and use half brown sugar with half white sugar, it makes for the PERFECT texture. Also, I found no need for chilling the dough before baking. The end product was fabulous."
"1","5","I make these cookies all the time my family loves them. We love walnuts so I use a full cup of largely chopped walnuts instead of a half a cup. I use organic & all natural ingredients like Ghirardelli semi-sweet chocolate chips & Valrhona cocoa powder. I follow this recipe exactly & the cookie dough has the thickest consistency I've ever seen. The cookies don't spread out too flat they stay a bit puffed up beautifully. When we want to change it up a bit I add 1/2 cup to a whole cup of dried cherries...mmmm so good. Love this recipe it will always be a staple in our house. Thanks for the great cookies."
"1","5","I loved the cookies they were really easy.forgot about a dance bake sale and I made the cookies at 10 pm. they were simple and took no thought! and they were really good some of the best cookies I have ever made."
"1","2","Nothing special . Had no cocoa powder , maybe that's why it was tasteless. Won't make them again."
"1","5","These cookies are a chocolate lovers dream come true! I wish I could give this 10 stars instead of just 5. They are so moist, creamy, and have a great texture to them. Followed the recipe exactly, and they turned out excellent. I'll have to watch out on how many I eat, because they're very addicting :) Will definitely be making this again."
"1","5","Omg! I made these cookies last night and they were awesome!!!! They were moist and very, very chocolaty. I followed the recipe exactly and the results were amazing. I highly recommend this recipe to chocolate lovers. I made 24 cookies and I only ate 2. The next morning I found 13 left!!!! My family attacked them! That's just how good they were. I saw some people put the cookie dough in the fridge to chill for a few hours to prevent the cookies from flattening out. Since I really wanted this"
"1","5","I made the recipe exactly as written and we couldn't get enough of them. They lasted about 5 days and were still soft by the 5th day in a sealed container. These were so chocolaty and good, whole family loved them."
"1","5","Amazing, didn't change anything and it turned out perfectly. So soft and chocolatey, my husband and daughter loved them."
"1","5","Just made these. Fantastic. I gave the recipe 5 stars. Perfect for the ever present chocolate cravings."
"1","5","Best recipe ever! This is a total keeper. I made them one night and my family ate about 20."
"1","5","These might be my new favorite! I even did it wrong, and they still turned out awesome!"
"1","5","YES! This is the BEST chocolatey chip cookie recipe that I have made! I did what other reviewers suggested and used half butter and half butter flavored shortening. The cookies puffed up a little bit AND stayed moist and chewy for the next day!   I used dutch-processed cocoa and I really think that the higher quality cocoa made all the difference in this cookie. I also used REAL PURE vanilla. Yummy, yummy, yummy!!!   I immediately wrote this recipe in my personal recipe book and will use this for YEARS to come!  Thanks for this amazing recipe!  And thanks to Allrecipes.com for emailing me this recipe this week! What a wonderful way to try new recipes without doing a bunch of work to get there! :)"
"1","5","This is seriously the best cookie recipe I've tried!"
"1","5","Just made these and ey turned out sooo good! They are definitely for he chocoholic- very rich and gooey! Eat with a glass of milk! I loved how many cookies the recipe made. I would suggest doing VERY small balls, they will spread to just the right amount! After I separated out my balls I then cut them in half! Also, I refrigerated after they were in balls for 15 mins or so. Very glad I did. Delicious recipe! Definitely a keeper thank you so much!!"
"1","5","This was fantastic!"
"1","5","These were chocolatey and delicious. I used 1 cup semi-sweet chocolate chips and 1 cup white chocolate chips. My family loved them!"
"1","5","This is our favorite cookie! I like to add extra vanilla, and I use Ghirardelli chocolate chips with 60% cocoa content. Yum! Sometimes, we bake them for only 5-6 minutes on 375 so that they're a bit crisp on the outside but gooey on the inside."
"1","5","It's perfect, my whole family absolutely enjoys them, they don't last more than 15 minutes at my house, and the word 'leftovers' doesn't exist with this recipe. The one time that there WERE leftovers (5 cookies total, but only because I doubled the recipe), they stayed moist and tasted just as good the day after, but of course they always taste better having just come out of the oven ;)"
"1","5","To address some of the concerns noted below: I used to get flat cookies whether I used butter, margarine, or shortening. That changed when I started using a cookie scoop. Maybe it's because the heat from my hands doesn't transfer to the dough, or the cookie dough is nice and rounded so it spreads less.   With this batch, I used butter. I didn't chill the dough for the first half, I put the second half in the freezer for 10 minutes, and I used both light and dark cookie sheets and they all came out the same -- Perfect! I didn't change a thing from the recipe, and I did take them out just when set (as the recipe says). Although I thought they would be underdone, they were wonderful after cooling on the sheet for 2-3 minutes then being transferred to a wire rack to cool some more. I got lots of compliments."
"1","5","This recipe is perfect a written. Baked these for my family and they were hit! I chilled them for half an hour and they didn't flatten out (which is great). They stayed well formed. No changes needed to the recipe."
"1","4","I'm giving it four stars because when I made them as directed they came out very cakey and I didn't like them. However, when I used half brown sugar and half white and baked them at 375 for 10 minutes they came out like extra chocolatey chocolate chip cookies."
"1","4","Used only 1 cup of sugar (1/2 cup white, 1/2 brown) they are plenty sweet. As written, I feel like they would be too sweet. I used a bag of dark choco and mint chips. Also added a bit of peppermint extract. Used a bit less flour. They turned out really well!"
"1","5","I mixed it up a little to try and save some calories. I used 1 c. butter and 1/2 c. applesauce, used spelenda instead of sugar and 1 c. whole wheat flour with 1 c. unbleached flour. Cacao nibs instead of chocolate chips and I can call these healthy :) I baked two batches for 7 mins for 'mushy gushy' middles and 9 mins for cake like middles. Both were a hit in our house. And I can have two since they're sort of healthy!"
"1","5","So if you add 1/4 of milk and 1 tablespoon of shortening it makes a great Muffin recipe!!!!"
"1","5","All I can say is yum yum yummy"
"1","4","My family and I really liked this recipe. Everything went perfect! I had some unwanted peppermint extract left over from a past recipe, and wanted to use it up, so I replaced the 2 tsp. Vanilla with 2 tsp. Peppermint, and made some delicious mint chocolate cookies. Definate will make again."
"1","1","I think this all depends on the cocoa powder you use.... Use one that is more top shelf that you really enjoy."
"1","5","Satisfies a chocolate craving!! I substituted part of the sugar with Splenda and it was still perfect. -L"
"1","5","These cookies are really great! Please be sure to cream your butter and sugar well and use really good cocoa! Enjoy!"
"1","5","I just tried this for the first time and they turned out great, and taste even better. Not too sweet, just right!  Julie"
"1","5","These turned out top-notch! Followed the recipe to a T and wouldn't change a thing next time!"
"1","5","Loved it! I made these cookies and it was a hit! My family loved them they were so yummy!!"
"1","5","The BEST cookies!!!"
"1","5","These are super yummy. I added an extra ingredient to mine though. Peanut butter! I didn't have any walnuts so I just added the chocolate chips. Next time I'm going to add some strawberries. There are just so many possibilities with these cookies."
"1","5","YUM! Delicious! So chocolatey!"
"1","5","I wanted to share a modification to this recipe that turned out heavenly. I used 2 cups chocolate covered raisins from Bristol Farms instead of chocolate chips. And no nuts. It's what I had on hand. Wow! I loved the cookies and didn't want to share (but I did). Moist, chocolate rich cookies. I looked, and the ingredients on the chocolate covered raisins included chocolate liquor and chocolate butter. I will definitely make these again!"
"1","5","With well over 2K reviews already, it isn't quite necessary for me to add my 2 cents, but I love these cookies SO much, it'd be wrong not show my support. Ok, so if you're looking for, not only an extraordinary Chocolate Chocolate Chip Cookie recipe, but a recipe for just a 'really, REALLY AMAZING cookie', this is it! I've made these twice now, and both times the only change I made was cutting the recipe in half, as I only needed a small amount of cookies each time. With some recipes, halving results in failure, but not this one. You can successfully make a 1/2 batch, and I'm sure it would double just as easily. Moving on, this is a super flexible recipe - use any type of chip you want: semi-sweet, milk or white chocolate, peanut butter, butterscotch, mint, cinnamon, etc. Also, if nuts are your thing, these would be SO good with walnuts or pecans - with the chips, or by themselves. Dried berries - cranberries, cherries, blueberries, etc. - would also be yummo and my next batch will be white chocolate chip with dried cranberries & walnuts. Additionally, the consistency of this dough is a dream to work with. It's pretty stiff, so it scoops nicely, although I DO suggest flattening the dough a bit prior to baking and again once they are done, as they do not spread much. Finally, I use my 2 tsp. scoop and both times I have made these, I have found that the 1/2 batch yields 18 thumbprint-sized cookies. Overall, these really are the perfect cookies... Easy, consistent & DELISH!"
"1","2","found the cookies simply fell apart and did not have a great outstanding flavour....just your basic"
"1","5","These cookies are officially my new vice...my daughter dubbed them 'a bite of heaven in your mouth!!'. Only change I made was subbing chocolate extract for the vanilla & I left out the nuts (which were optional). Baked at 350 for 8 minutes, making 68 cookies out of this batch (we prefer small cookies for nibbling). I had to flatten mine slightly after pulling them out of the oven, as the cookies baked fairly high (I think it 's because I live at sea level & cookies generally cook so quickly they don't spread very much in my oven). BEWARE... These are highly addicting even if you don't generally have a sweet tooth. Thanks Kathy for this wonderful recipe...It is definitely going in the recipe book I am building for my kids. :-)"
"1","5","I had a note from family to not forget to write this recipe down and file with my best recipes. Circumstances resulted in a few changes that I believe made this recipe even better. I used two sizes of chocolate chips - the mini and regular - because it was what I had on hand. I also had to put the cookie dough in the fridge (about three hours)because I cleaned my oven which took longer than I anticipated. I used half Penzey's Cocoa and half Hershey's Dark (again that is what I had.) I used margarine instead of butter to accommodate a food allergy. I always, always swap the baking sheet locations half way through cooking time when using two sheets. Because the dough was chilled, I did not chill again after shaping, but I would do this just like the video to keep the nice puffy shape. There is a crunch on the outside and soft cookie inside - like a chocolate souffl. The chocolate really pops."
"1","5","I used un sweeten cocoa powder and followed the recipe. They came out soooo good. Best chocolate chocolate chip cookies I have made."
"1","5","Very good made it for the family and they loved it"
"1","5","perfect exactly as is."
"1","5","Perfect Chocolate Chocolate Chip cookie!!!"
"1","5","The cookies turned out really nicely. I have to say I'm fairly new to baking but this was easy to follow understand and made a good 36 fair sized cookies. Thank you for the recipe."
"1","5","Just the consistency and taste I was looking for, awesome!"
"1","5","My daughter asked if we could make chocolate chip cookies but all I had were peanut butter chips. So I went looking for a chocolate cookie recipe that I had the ingredients for and found this one. After reading some of the comments I made these changes. 1 cup light brown sugar and 1/2 cup white sugar. Then the dough wasn't thick enough so I added 1/3 cup more flour, and that did the trick. I left out the nuts and like I mentioned I only had peanut butter chips. Then I chilled it in the refrigerator for about half an hour, and baked them for 8 - 10 min. Let me tell ya... these are sooo good. I gave it 5 stars even though I changed it up a little."
"1","4","Very yummy! I made a few alterations since I really felt like adding 1/4tsp cayenne and an ounce of kahlua, which I'm pretty sure was a WONDERFUL idea, as it turns out. I also subbed brown sugar and whole wheat flour and almonds for walnuts and used dark ch. chips. The only thing I would do next time is reduce the amount of ch. chips since some cookies kind of fell apart out of the oven because of it..."
"1","5","These are AMAZING. Mine were nice and fluffy, but I did refrigerate the dough for an hour."
"1","2","My husband was craving choc. chip cookies and decided to have our son make them. He used light butter, and they turned out as flat as can be, and stuck to to the pan. We added more flour. We had a better texture. I suggest to anyone making this recipe, first make ONE cookie. If it turns out flat, then add flour. I think the light butter and margarines in general need more flour added to the recipes. If your looking for chocolate, then use Brookes Brownie, they are EXCELLENT, and we've never had any problems. They have the crunch and the moisture. We make them at least once a month, they are so good. In addition, we even tried them with white choc. chips, which gave them a different flavor. We won't be making these cookies again."
"1","5","Flawless. Used half butter, half shortening as well as half brown sugar, half regular sugar. They're like brownie cookies."
"1","5","Excellent! My grandaughter loves them. We bake them together every time she visits. We did not use the nuts and we used a whole bag of mini chocolate chips."
"1","5","These cookies are really good. Nice and chocolatey."
"1","5","Great with half white chocolate/half semi-sweet chocolate chips! Definitely add the walnuts."
"1","5","Excellent! Baked 10 min @ 350. Spray cookie sheets as they stick even to non-stick sheets. Remove from cookie sheet right away."
"1","5","SOFTEN your butter, don't melt it, and your cookies will be perfect. I used all butter, no margarine like some reviewers said. Melted butter does not make good cookies. Even half melted will mess up your dough. This is why some reviewers said it works better if it's put in the fridge... they melted it too much. If you don't take your butter out in time to soften just put a stick in the microwave for 2-3 seconds per side and it's perfect. I used 1/2 brown sugar and 1/2 white sugar. Be sure to press the brown sugar FIRMLY when measuring. Dough was very thick and I used a small scoop and then pushed down slightly so it wasn't just a ball. They don't expand much nor do they flatten like a pancake. Once again, that's a too soft/melted butter issue. WONDERFUL COOKIES. I used Ghiradelli (sp) cocoa powder. You want to make sure to use a good quality cocoa powder; it really makes a difference. Remember, take your BUTTER out of the fridge ahead of time and your baking will be perfect. Thanks for the wonderful recipe :-)"
"1","5","Yummy. Careful not to overtake as they will dry out. Not sure if this is the best recipe for this type of cookie, but pretty darn good."
"1","5","Very nice! So chocolate-y and good! Made small cookies and they were done in 8 minutes exactly, and the cookies were a little crunchy on the outside and soft on the inside. Ten minutes and they were slightly burnt. I think I will try again at a slightly lower temperature and longer time."
"1","5","Excellent! Easy, quick and delicious. Everyone who eats these says 'yum!'"
"1","5","I had some Andes Creme de Menthe Baking Chips that I needed to use so gave this recipe a try, a little on the rich side but delicious. I used 3/4 cup each white and brown sugar, 1 t of vanilla, 3/4 cup of chopped pecans and of course the baking chips in place of chocolate chips. The first batch I baked for 10 min, this was not enough so I baked the remaining batches for 12 minutes, perfect. I got a total of 73 cookies, using a cookie scoop (the one that is like an ice cream scoop)."
"1","4","Delicious! I made it with the chopped walnuts, and they were so good! I may play around with the butter content next time. I think I may try the half margerine/shortening next time. But, very pleased :-)"
"1","5","Family loved them, didn't change anything. 8 min in convection oven and came out perfect."
"1","5","These are amazing! Everyone who has tried them has asked for more. They are delicious!!"
"1","5","I have used this website for years without signing up for an account. Yet, I made an account today because these were maybe the best cookies I have EVER made (and I bake about once a week.) So soft, so chewy, so perfect.   The changes I made: used half brown, half white sugar, and instead of chocolate chips I used about half a bag of Heath toffee bits. Since I wanted it to have more of a toffee cookie flavor, I doubled the salt (which I tend to do in cookie recipes anyway since I love a salty/sweet flavor.)"
