helpfulCounts,ratings,reviewText
"2","3","I made this recipe 4 times. The first 2 times it was phenominal except for the topping being overcooked. The last 2 times I made it I tried cutting down the baking time of the topping by 5 minutes and it didn't bake all the way through. I may try lowering the over temperature and leaving it in the oven for the full 30 minutes."
"2","5","I made this recipe exactly as printed and it came out wonderful! I had a little trouble with the juices boiling over in the oven but that's my own fault (I accidentally used too small a bowl. The final result was a little runnier than I had expected so I think I'll try a little more cornstarch in the next batch. All in all though, amazing dessert and it will not last long!"
"2","4","A very good cobler recipe, thanks for sharing."
"2","4","Tasted great, I also only baked 25 minutes ...20 would have been better as the topping was a little hard. Next time I will add more peaches and way less sugar."
"2","4","The servings are more like 6-8 unless you're a pig and can eat a quarter of a pie! ;)"
"2","5","This was the first cobble recipe that I made and it was easier than I thought! i put half of a lemon in there instead of what it called for. It was such a great idea! The sweetness of farm-fresh peaches mixed with the tang of the lemon juice was AMAZING!!!!! I will make this again!!!"
"2","5","Wow."
"2","5","Oh heck yeah! I made this in a 9x13 pan, which made a thin-ish not too deep cobbler - you could easily double the peach layer with the same topping in that size pan. I followed the suggestion for 8 Tbsp butter and baking only 20 minutes, and it worked perfectly. I also ended up using just about half of the cinnamon sugar on top and it was great - I loved the crunch it creates! This is a great treat, especially with a little splash of half-and-half on top - but how dumb am I to make cobbler without vanilla ice cream in the house?! Next time!"
"2","5","Best cobbler ever! Buttery, sweet and perfect with ice cream."
"2","5","O.M.G! best cobbler ever! I love this recipe..it's very easy and I'm glad it uses fresh peaches. So many use canned and I'm just not a fan of canned fruit because it's so sweet. Nothing needs to be changed about this recipe. My cobbler did come out very juicy because my peaches were nice and ripe and I also added a half pint of fresh blueberries. I chose this recipe because it does not have any milk..as I am allergic to whey and need to avoid milk products. I wish I could put some fresh whipped cream or ice cream on top but it's great on its own. Thanks for sharing! Can't wait to try it with other fruit too like apples or berries."
"2","5","Family loved this. I didn't use Georgia peaches, instead I used Fredericksburg peaches ;) It was perfect. Served with a scoop of vanilla ice cream. Thanks!"
"2","5","Amazing! The 'cobbler' part is sweet and chewy, like a cookie. Served with a scoop of vanilla ice cream, and the hubby said it was a definite 'make again.' Only thing I would do differently next time would be to take it out of the oven a little sooner. It was a perfect golden brown after only 20 minutes. 30 minutes is a little too long."
"2","4","I did not personally cook this one, but watched as DH did. He used fozen peaches and they came out just wonderful. I helped clean the bowl the peaches and sauce were in. But the topping kind of ruinned the desert for me. It came out like a whole cake on top of the peaches. He has made this recipe three times in the past month so he must love it but I have had better cobbler."
"2","5","Absolutly perfect is all i can say."
"2","5","This is a keeper! This Cobbler was enjoyed by all. Didn't have fresh peaches on hand, so I use canned peaches instead. I guestamted each 'drained' can equaled two peaches. The Cobbler turned out fantastic, albeit, a bit sweet. I will cut down on the suger, for the topping by half, in the future. I can't wait til I try this recipe with fresh peaches from my tree. Thanks for sharing."
"2","4","I added oatmeal and doubled the ingredients to the topping- perfect"
"2","5","um.....WOW! Had to bake a little longer, but sooo good and easy. Used milk instead of water, frozen peaches instead of fresh."
"2","5","Only one we make! Rave reviews all the time!!!"
"2","4","I was going to remove the skin from the peaches but then I decided I was too lazy and fruit is more nutritious with skin on. I loved the cobbler but I lowered the sugar just a bit and still found it delish."
"2","5","I made a few small changes that made this into one of my favorite sweet treats. First I cut the amount of cinnamon / sugar topping in half. I also used canned peaches instead of fresh due to the season and added a package of fresh raspberries to the fruit mix. Baked in individual mini loaf pans and served with vanilla ice cream..absolutely to die for. the 6 others that tried it devoured it as well! YUM."
"2","5","This is great. I used 3 bags of frozen peaches instead of 8 fresh peaches and everyone loved it. I had never made a peach cobbler before and had no idea what it was supposed to look like. Didn't look pretty but tasted amazing."
"2","5","Oh My Goodness - This was so good and I didn't change a thing. So much better than any recipe I head ever tried/heard of."
"2","5","I have made this a few times. It is perfect. I always get compliments."
"2","5","Very good cobbler!! I made this for Sunday dinner and it was devoured. I used a little more sugar because I like my mine very sweet and i didn't have any baking powder, but the crust was still great, I will make this again!!"
"2","5","sounds great does anyone know how to calculate can peaches vs fresh ?"
"2","5","Oh my! This is a yummy cobbler! I used a 9 x 13 pan and only baked for 25 minutes. Served with ice cream of course! I'll think of this every time I see a bunch of fresh peaches because I'll buy them to make this!"
"2","5","Loved this! Def need more of the topping, and don't skimp on the peaches.  This was prob the best cobbler I've ever had. It got rave reviews from the family."
"2","5","I would give this 6 stars if I could! I have made lots of peach cobbler and this recipe is by far the best!!"
"2","5","Delicious!"
"2","5","This is my go-to dessert. I find that this recipe can work with peaches that aren't ripe so if anyone has some, no worries. I double the topping, as others do. This recipe makes the best peach cobbler."
"2","5","Excellent cobbler! Only changes for next time - add more cinnamon (i'd double it), and make 1/3 more topping - it was the best part!"
"2","5","I had never made cobbler before. This was so easy and so delicious! My husband and Mother in law both said it was the best they had ever had. I used about 8 cups of frozen peaches i had let thaw on the counter for a couple hours. I might try fresh peaches next time, or maybe not. Oh i also used 4 tsp cornstarch and the sauce was perfect. Great recipe!"
"2","5","I absolutely loved this. It was so so good. I may just not be able to make it again cause it was so good i would be to tempted to eat the whole thing and gain 5 pounds. One thing is I would rather gain 5 pounds from eating this than something else. I didn't have any corn starch so I used flower. I also did not have any unsalteted butter so I used sated butter and left out the salt. I used canned peaches and drained and rinsed them. I didnt have a lot of juices like others but I did use one level ts of flower and one heaping instead of the corn starch. If someone takes this to a potluck and it doesn't get devoured I think they probably made it wrong."
"2","5","First cobbler ever! Turned out great, can't wait to try an apple cobbler."
"2","5","This was wonderful! I am not normally a fan of anything 'peach' but this was delicious! The crust is definitely my favorite part, while my husbands was the peaches. All together..we love it!"
"2","5","I have done this a couple of times and as directed, it turned out really lovely...."
"2","5","My family and I have made ourselves sick on this cobbler dish. It is the perfect combination of fall flavors!!"
"2","4","This was easy to make and smelled so wonderful while cooking. My family loved it."
"2","5","My whole family loves this recipe. It is quick and easy too."
"2","5","Easy to make. Didn't change a thing since it was my first time preparing. Next time, I would add blueberries. But it was quite delicious as it was. We ate it warm with vanilla ice cream. Really hit the spot. One of the other reviewers thought 30 minutes was too long, so I checked it at 20 and let it go another 5 minutes. My husband likes crunch. I liked the topping with 25 minutes cooking time."
"2","5","Excellent in every way! SO delicious. This recipe has become a family favorite. The topping is very good, adds a nice little crunch -- I did add a few chopped almonds on top of the peaches, then put on the crust... just trying to use the toasted almonds. Not too sweet, which we like. Thanks for sharing this excellent recipe.  I wouldn't change a thing with this recipe."
"2","5","I followed this recipe to a tee - came out perfect! To easily peal the peaches, I cross-hatch the bottom (a plus or X) and then drop into boiling water for about 60 seconds - then immediately drop into cold water. The cross-hatching allows the skin to start the peeling process so you don't have to work that hard at it. Great recipe."
"2","5","I made this dessert yesterday for the 1st after telling someone that I can make a GREAT peach cobbler ( I didn't have a clue where to begin...lol). This dessert came out so delicious! I doubled the ingredients because I was serving more than 4 people. The only thing I would change would be the final part of putting the topping on...presentation is key so next time I will roll out the dough and lay it across the top of I will do a lattice topping. STANDING OVATION for the recipe!!!!"
"2","5","EXCELLENT!!!!!!!! doubled the topping and took it out after 25 minutes. Big hit!"
"2","5","I tried this recipe because of all the reviews. The BEST peach cobbler I have ever had. It's better than my mother's recipe. This was my first time ever making one. It was so easy and simple only thing I added was a added 1tbs vanilla extract and I doubled the topping like most of the reviews said. I too used fresh peaches. You won't be disappointed. TRUST"
"2","5","Love this recipe. My hubby doesn't like peach cobbler and he ate one third of the dish! It was voted 5 stars by all in our house. Next time I may double the crust. You can never have too much of a good thing. :-)"
"2","5","simply amazing!!"
"2","5","Awesome recipe! Love this -- ALOT."
"2","5","I've been making this for 5 years. I make it at least twice a month during the summer, and once a month the rest of the year. My family loves it. I make it with all kinds of fruit, but especially like it with blueberries, however the peach is better than anything else. Thank you for this wonderful recipe!"
"2","5","Amazing! This turned out really yummy. Since this was my first time making peach cobbler I followed the directions exactly and I wasn't disappointed. The only substitution that I made to the ingredients was using baking soda instead of baking powder. And the crust was soooooooo yummy. The texture was perfect not cakey at all. Next time, I will add more brown & white sugar to the peaches mixture. Since I would like it to be sweeter. But this recipe is a keeper!"
"2","5","This is an amazing peach cobbler recipe. I didn't change a thing. I'd love to try it with another type of fruit to see how it comes out."
"2","5","This was an amazing recipe! My boyfriend absolutely loved it! Throw some vanilla ice cream on top.... TO die FOR!!!!! Thank you soo much for such a great recipe!"
"2","4","This was lovely, great to use up peaches that need eating. I did not pr-cook the peaches, not necessary, also i did not use water, but 1/2 C cream. Will make again."
"2","5","5 stars! Not the 'crumb' type topping we are use to, this is more cake-like and we like it. stating the number of peaches instead of cups is kind of ridiculas, we had to just keep slicing until we were satisfied with the amount and ratio of sugar to peaches. Very tasty and warm with a scoop of ice cream was orgasmic!"
"2","5","Delicious! Didn't change a thing and everyone loved it."
"2","5","Absolutely delicious! Recipe also doubles for a 9x13 baking dish quite nicely."
"2","5","Delicious! I didn't change a thing, which is unusual for me. I did use a 3.5 qt container, which turned out great because there were more chewy, caramel-y bits. Will be making again soon, and will probably through in some raspberries for tartness. This will be my go-to cobbler recipe from now on!"
"2","4","by far one of my most favorite desserts, and my husband is hard is to please but he loves this. i know this would be better with fresh peaches but if unavailable, the canned ones work just as well. the only reason i rate this 4 stars is the presentation. i wanted to rate it 4.5 but thats not an option."
"2","5","More cakey than I was hoping for but the flavor was great! I only used 6 peaches and it was perfect."
"2","4","Good but too sweet. I'll cut the sugar in both the cobbler and on the fruit in half next time. It was so sweet it was hard to taste the peaches."
"2","4","This was a really good cobbler. I've only made it once but I would definitely make it again. There is room for improvement, however, just for my family's tastes. They like things slightly sweeter. As always, make sure your peaches are ripe."
"2","5","Yummy. I got fresh summer peaches and skipped peeling them and putting them in the oven for 10 minutes. Mixed the peach ingredients, spooned on the topping and baked 30 min. Delish and no one noticed they weren't peeled. A summer staple at our house now. Also, used Smart Balance instead of butter for less fat."
"2","5","My family loved this made just like it was written..Thanks for posting it..."
"2","4","A little too much sugar and cinnamon for my family's taste."
"2","4","Very tasty!  I did reduce the sugar somewhat. Instead of a total of 1/2 a cup in the peach mix, I used about 1/3 in total.  And for the sugar/cinnamon sprinkle on top, I ended up only using about half of the mixture.  It turned out fantastic! Nice full crumbly, slightly crunchy topping, very flavourful peach filling, good consistency.  Will definitely make again."
"2","4","Very good cobbler recipe and easy too."
"2","5","Block party favorite. I layered the first batch of topping as a bottom crust (without the water and only 1/2 the sugar) then added 6 very ripe, very sweet peaches and baked 10 minutes. I tossed 2 cups blueberries on and then used the topping suggested by another reviewer of equal parts milk, flour and sugar, but I shorted the sugar again, those peaches were already so sweet."
"2","5","Loved it just the way the recipe was, wouldn't change it at all. I will definately be making it again, I think my husband will insist on it!"
"2","5","Scrumptious. To lighten it up slightly, I only used the white sugar (1/4 C) in the peach mixture, and in the flour mixture, I used white whole wheat flour (yay-fiber!) and cut the white sugar in half. Thanks for a very good recipe! I thought the topping was enough for 8 peaches; I baked it in a 9-inch square pan."
"2","5","This recipe was easy to make and turned out great. I like a cobbler that has a little crunch to it without having to include nuts. This one did the job. I did reduce the amount of sugar in both the peach mixture and the topping. Reduced it by about 1/4 and it was still very sweet without being too much so. did include an extra teaspoon of corn starch and the consistency was fine. I did double the topping ingredients and can't imagine using less. Last but not least I only had salted butter, so i eliminated the salt measurements and what was in the butter was sufficient. My husband loved it and there is plenty left over for tomorrow night. YUM"
"2","5","What a great recipe! Leaves the best taste in your mouth - made it exactly as written but doubled the crust and put it as a bottom layer, an old 'Mom' trick!"
"2","5","This was amazingly wonderful... It was sweet and tart... This was very easy to make and I am not a baker. Thank you for sharing."
"2","4","Very good...easy to make"
"2","5","awesome. I cut the peaches a little thicker and I think I used 10, other than that I followed it to the T. It was devine."
"2","5","This was my first attempt at making this and it came out delicious!With the brown sugar and cinnamon on top it was a little hard to tell when it was browned, but it still worked out well.I think next time I will double the recipe and use a larger baking dish like a 9X 12 size!"
"2","5","This is the first review I've ever left. I've been making this recipe for about 2 years as a comfort food dessert for our family. I make it as written except that I use 6 cans of lite peaches and I double the topping, as fresh peaches are not always available and it's much faster to used canned peaches. You can NOT go wrong with this recipe!! Thank you for sharing!"
"2","5","This was soooooooooo delicious! I was a little suspect of the hot water as the 'batter' looked too 'wet' to me. The result was crisp on the top, cakelike inside. I didn't read the reviews until too late--definitely will do more topping next time--it really made it. Definitely a keeper!"
"2","5","Oh my goodness!! I have eaten a lot of peach cobbler but this is by far the best! I doubled the batter recipe and used 4 tsp of cornstarch, also instead of 6 tbsp of butter I did 8 (16 when doubled). It baked for exactly 30 mins and was perfect."
"2","5","This recipe reminds me of the cobbler my grannie made......Yummy"
"2","4","I loved that someone suggested boiling the peaches for 1 minute then dropping them in cold water to remove the peels. Great recipe minus the topping. It was kind of bland. I like the yellow cake cobbler topping better."
"2","5","BEST PEACH COBBLER I have EVER made!!! Every summer I crave it and try new recipes. Something is always missing. Not this year!!! You've hit the nail on the head! Thank you so much. I quickly copied the recipe and added it to my personal cookbook collection to keep forever."
"2","5","Delicious! Wow, this was awesome. I cannot think of anything that needs to be changed. I had to halve the recipe because the peaches were kinda spoiled and I had to cut a lot off, but it still worked out perfectly. Thanks so much for sharing this! :)"
"2","5","Very good easy recipe!. i always taste my peaches to see how sweet they are before adding sugar. I like the cobbler topping. Its a very forgiving recipe as in I don't measure the ingredients out and it always comes out! I also cook in a cast iron skillet makes all the difference!! Thanks for the recipe."
"2","4","Very tasty peach cobbler, but I did feel it called for more topping than the recipe indicated. I would almost double it."
"2","5","This recipe is WONDERFUL. I too have been experimenting with a peach cobbler recipes. I have now found THE one. Many thanks to the lady who made this recipe. Linda Florida"
"2","2","The cobbler looked great, but tasted bitter to me. I see reviews that it was just sweet enough or too sweet. I haven't made a peach cobbler before.. so maybe it was just me."
"2","3","Halve the sugar amounts; the rest is fine."
"2","5","The first time I've ever made a Cobbler, or even tasted one, for that matter, and it was exquisite. I substituted the corn starch for double the amount of flour, because corn starch isn't readily available, but it was still fantastic."
"2","5","This is by far the best peach cobbler ever! If you want your guests to rave about your cooking, this is it! The lemons give it that 'made with love' taste, and the nutmeg adds the perfect kick! I love recipes like this that come from the kitchens of truly talented chefs who don't mind sharing. Thank you, Thank you!! Keep em coming!!"
"2","5","This was delicious!"
"2","5","if u like a 'cake like' bread this is the recipe for you. i love it. tastes great!"
"2","5","My wife and I tried this out and loved it. Made as is and was the best peach cobbler I've ever had. Can't wait to make again!"
"2","5","i made this the other night, followed recipe to the tea and turn out wonderful"
"2","5","SIMPLY AMAZING!! I MAKE THIS EVERY YEAR. IN FACT, MY 9 YEAR OLD DAUGHTER HAS BEEN HOUNDING ME CAUSE I HAVEN'T MADE IT THIS WINTER YET."
"2","4","this recipe is awesome. I cut the sugar in half by only using the brown sugar and very ripe peaches. For the topping, I also only used the brown sugar, and I added 50% to the recipe. DELICIOUS!!!!"
"2","4","This was pretty good! Peaches are out of season here so we had to use canned peaches and it still turned out well."
"2","5","Everyone raved on this. Having neer made a cobbler before I didnt know what to expect. Peeling the peaches were a pain."
"2","5","DH and I both loved! I cut the sugar in half and it was a treat served a la mode!"
"2","5","Love this recipe, the topping is wonderful! I use more cinnamon and nutmeg and used frozen peaches"
"2","5","I have to say, I've never made the peach filling from this recipe but I love the cobbler topping!. I use it as the topping for green tomato cobbler and it is consistently good. I use an apple pie filling recipe and substitute in peeled, sliced green tomatoes (plus a little extra lemon juice and zest). Once that is ready, I use this recipe to finish the cobbler. It's a great way to use up unripe tomatoes early in the season, or after the first frost!"
"2","4","I've made this a couple of times now. I tried the route that some reviewers suggested - boiling the peaches and sliding the skin off. That didn't work for me, and I wound up wasting a lot of the peach, because it came off with the skin. It was easier and faster to use a peeler and slice the peaches the old fashioned way. I also like to add more cinnamon (about 1 tsp), 1/2 tsp allspice and nutmeg, and 1/4 tsp ground cloves to the peaches. They're great fall flavors for sweet, baked goodies. I'll be baking this again and again. This really goes so well with French Vanilla ice cream."
"2","5","Very good. I would cook the peaches for 10 minutes longer in oven. Cobbler had a nice flavor because of the brown sugar. Will use it again. Thanks."
"2","4","The best (so far) cobbler recipe I've tried. I omitted the extra sugar/cinnamon in the last step and found it to be quite sweet enough. Nice texture to the topping. I chose to increase the topping by another half and found it to be exactly right. I didn't peel the fruit as I like to keep all the natural fruit benefits in the dessert. Will definitely make this my cobbler standard."
"2","4","I made this gluten free by omitting the flour and baking powder and adding a gluten-free 'baking and pancake mix.' The only reason I only gave it 4 stars was because there definitely wasn't enough crust(which I love). Too bad I can't add half a star. I am not gluten free and I still loved the flavors as did my gluten free mother-in-law. Next time I will double the crust and half the topping. I used 4 golden delicious apples instead of peaches."
"2","5","I saved this recipe two years ago and have been making it ever since with no alterations. I double it and make it in a 12 qt. dutch oven when we go camping and it's always the first dessert request--especially when the peaches come from our own tree. It IS quite sweet and you may want to adjust the sugar, but then I guess it depends on how ripe and sweet your peaches are. You'll love this recipe!"
"2","5","Holy cow this is good. I made it just like the recipe. It is dense on top, but the flavor was very surprising. Hands down my favorite cobbler yet!"
"2","5","This is absolutely my favorite cobbler recipe, I have been using it for a couple years right now and since I am making it again today I thought i better get on here and review it while I have the time! some tips, I always double the topping recipe! I just love it and I always use fresh peaches and way more than it says so it balances out perfect! I add a full tsp or more of cinnamon, gives it a little extra and I also sometimes will throw in four apples or some berries, all of them work well with peaches to me, though blackberries are the best! I have put merengue topping on it before when i was making other pies and didn't have any icecream or whip crm and it was blissful! I also sometimes will add a topping onto the batter that i use for apple crisp! it makes it that much more special! also if you mix it all together rather than just top it with the batter (doubled recipe on batter) with a cup of raisens and drizzle warm vanilla pudding over it afterwards its one of the most amazingly decadent bread puddings ever! i would give it 10 stars if i could!"
"2","5","Used 6 fresh peaches and omitted the nutmeg. Turned out superb. :-)"
"2","5","We made the cobbler in small onion soup bowls and it was awesome!"
"2","5","My husband LOVED this recipe. I found him in the kitchen literally licking the pan. This is the first time I have tried Peach Cobbler and it was a very easy recipe. I love the use of fresh peaches instead of canned."
"2","5","Made this for work and had 5-6 people ask for the recipe! I cut each peach into about 10 segments and then cut those in half, to make nice sizeable chunks. I used a 2.5 qt casserole and made 1.5 times the topping recipe; next time will probably just go ahead and double it."
"2","5","This recipe is very much like the one I grew up on in Colorado. I do recommend using fresh grated nutmeg; this turns a good cobbler into a wonderful cobbler. Also top with good vanilla ice cream."
"2","5","This was great reminded me of my daddys"
"2","5","I used a bag of frozen peaches and it turned out wonderful! Very tastey topping. Thanks!"
