helpfulCounts,ratings,reviewText
"2","5","I am not a big peanut butter cookie fan and had never made them before, but my husband asked me to make him some. I first tried a flourless peanut butter cookie recipe and they were awful! I tried this recipe next and what a difference! I sub'd creamy PB for the crunchy, added an extra 1/4 c of PB and 1/4 c of quinoa flour I had in the pantry in addition to the all-purpose flour and a tsp of vanilla extract. They came out perfect! Not too soft and not too crispy. They came out pretty big and made more than the recipe said they'd make. This recipe made me a fan of PB cookies!"
"2","5","I made these cookies last night and they were yummy! I added an extra 1/2 cup peanut butter, 1 tsp vanilla, and rolled them in sugar. Thanks for the recipe Shirley!"
"2","5","These were great cookies, but i took the advice and added flour and they came out fluffy and tasted great!"
"2","4","Great texture, but not terribly peanutty. Might benefit from the addition of some ground peanuts."
"2","5","I made a double batch and froze the extra dough. Now when I want a few I just scoop it out and cook it up."
"2","4","I also added 1/2 cup flour and 1/2 cup peanut butter, also a bit of nutmeg. Warm out of the oven, very good! Oh, also added a scoop or so of chocolate chips."
"2","5","These were the DANKEST peanut butter cookies Ive ever made! I added 1\2 teaspoon of vanilla to this recipe. I would strongly recommend it to anyone who has a sweet tooth for peanut butter cookies."
"2","5","FABULOUS!!! I added 1/2 cup more (creamy-store brand) peanut butter and 1 cup peanut butter chips. I made my cookie balls a little larger than suggested and they turned out wonderfully at 375 degrees, 12 min. Great tip: Roll the cookie balls in white sugar for even better presentation! Try this recipe!"
"2","4","I had a mad craving for something sweet tonight but i didn't have any oil to bake any of the items i want. I came across this and thought i'd try it since i had all the ingredients. It was very yummy. I followed what others said and added 1/2 cup more each of PB and flour and added some vanilla. My 4 year old is on his 3rd cookie right now. I did however was hoping that they would be more chewy then crumbly in texture but the flavor is really nice and the more i ate the more i like it :) Would definitely remake again."
"2","5","I was going to make the 3-ingredient peanut butter cookie (1c pb, 1 egg, 1c sugar) but I decided to venture out. This was excellent. My daughter and I got in there togeter and rolled out the balls and pressed them down on the pan. Everytime I make this delicious cookie I will remember the time I spent with her making them. They were not to thin, nor were they crumbly. They were a perfect balance of moist and dry; which, made them a little chewy. You can take the same recipe and pass it around and everyone can get different results. I dod not alter this recipe and it was perfect."
"2","5","Didn't have unsalted butter so used sweet cream butter and no salt. This will be the recipe that I will use for peanut butter cookies from now on. My grandkids love them."
"2","5","Awesome. I added a little more peanut butter and flour in addition to a teaspoon of vanilla. I made half the amount which ended up being 2 dozen - my husband and I ate so many that I had to take the leftovers to work the next day to keep us from getting fat! Everyone at work like them, too :-) I think next time I'll throw in 1/2 cup of chopped peanuts like my grandma used to do."
"2","5","great cookie recipe. I followed the other suggestions and added another 1/2 cup flour and peanut butter. i baked at 350 for 10 min. The cookies on my dark non-stick pan browned nicely. I would turn the heat to 375 for my light aluminum pan as those were still not brown after 10 min. I also rolled the dough in sugar before baking and everyone said they liked that touch. I don't care for peanut butter cookies but ended up eating a bunch because they tasted great! Awesome recipe!!!"
"2","5","Great cookies, but a little too greasy the first time I made them. I reduced the butter by 1/2 and the white sugar by 1/4 Cup and instead sprinkled the sugar on top of the cookie before baking. I also used this recipe to put chocolate kisses on top. I took them out of the oven when they almost seemed underdone and then after they cooled a bit, they were perfect."
"2","5","Great!! I used more flour and peanut butter as some other reviewers suggested. I took it to a church youth activity, everyone loved it!! I would say that if you add extra flour, add equal amounts of extra PB, otherwise it gets crumbly and hard to roll into cookies."
"2","5","These cookies + milk = Pure goodness!!"
"2","5","I made them just how the recipe states and left them in fridge so I could make 6 every couple of days. They were great and lasted well!"
"2","5","These cookies are awesome! I like the texture of them. I used creamy peanut butter instead of crunchy. After making the criss-cross deign, I sprinkled sugar on them."
"2","4","These cookies were wonderful! I absolutely loved them! And a tasty hint, add 2 cups of chocolate chips for an extra burst of yummy goodness. :)"
"2","5","I made this for an end of year party for high schoolers--- I received so many compliments! My friend that loves peanut butter also loved them- I also added 1/2c more of flour and 1/2c more of peanut butter, these were just perfect, not too thin either."
"2","4","These cookies were great. A little on the dry side when rolling into balls but very moist when cooked. I over cooked my first batch, my oven is a little on the hotter side. So, watch the timing."
"2","5","Simply delicious!! This is the perfect peanut butter cookie recipe...Per other reviwers I did use 1 1/2 cups of peanut butter and increased the four by 1/4 cup. Very good and this will be my new peanut butter cookie recipe."
"2","5","This is a great cookie, I added 1 tea vanilla and cut the flour in half with oatmeal, not quick cook oats ,that I ran thur the food processor to get it like flour , also added 1 cup chocolate chip semi sweet.....375 at 10 mins was perfect."
"2","5","Its faster if you use a meat pulverizer instead of a fork and the cookies look really professional after cooking. Its also a good stress reducer, just don't hit the dough too hard."
"2","4","Per a previous review I added an extra 1/2 c. peanut butter and 1/4 c. flour. It tasted excellent, but it really spread out quite a bit. Next time I'll only add 1/4 cup extra PB, but I'll leave everything else the same. I used half natural style PB and half regular PB (I was trying to use up what I had on hand), and it came out great. With the additional PB & flour this recipe makes more like 32 cookies, rather than the 24 stated."
"2","5","I've been looking for a great peanut butter cookies recipe for many years. I like butter in my recipes and so just couldn't find the right one. This is it! The cookies were thick, soft, and yummy. I did add the extra 1/4 cup peanut butter and 1/4 cup flour, as some reviewers suggested, and they were beautiful. My family ate them all!"
"2","4","These were very good. I made a few changes, after reading some of the reviews. I used 1 1/2 cups smooth peanut butter and added an extra 1/4 cup flour. I used a fork to make a criss-cross pattern on top of the cookies and I baked them at 350 degrees for 12 minutes. With these changes they turned out great."
"2","5","I added 1/2 cup peanut butter and 1/4 cup flour. I used creamy peanut butter and regular butter, so I left out the salt. Cooked for 7 minutes."
"2","5","I found this recipe to be awesome! The dough was perfect and the baking time was perfect. They came out very soft and chewy. I have had great reviews on these cookies and many requests to make more. I had absolutely no crumbling and no 'flour taste'. This will be placed in my permanent recipe file!"
"2","5","The first time I attempted to make (sugar) cookies they came out horrible! LOL But this recipe looked simple so I decided to give it another shot. After reading several reviews, I added an extra 1/4 c. of flour & PB & 1 tsp vanilla. The cookies came out yummy & my hubby loved them! Thanks for the great recipe :)"
"2","5","These are my make-up cookies to my husband because I yelled at him last night.:)"
"2","5","I love this recipe but I had to substitute some things as my daughter is anaphylactic to eggs and nuts. So for those of you w/ allergies try this: Instead of peanut butter, use Soybutter or Sunbutter; instead of eggs, use EnerG egg replacer; and if your little one is allergic to milk use a butter substitute; and if your little one is allergic to wheat, use gluten free flour. Hopes this helps. :) Also, I added more flour and soybutter as suggestions from others. Thanks for a great recipe."
"2","5","I made a half batch of these with about 3/4 cup of whole wheat flour and also used mostly that Omega 3 super healthy peanut butter. With most cookies make sure you undercook this babies just a little bit. They definitely keep that melt in your mouth effect the next day, even if they're not straight out of the oven."
"2","5","Fantastic! I added a 1/2c creamy peanut butter and an additional 1/2c flour and these could not be more perfect. I didn't even chill the dough and these were downright fantastic!"
"2","5","This recipe is great! I'm giving it five stars because I estimated the quantities, forgot to add the eggs until the last minute, didn't have any brown sugar or baking powder, and then baked them in an oven with no temperature controls, and they still turned out perfectly. You really can't go wrong.  Next time I might add chocolate chips though. :)"
"2","5","I don't think I have had a peanutbutter cookie in over 10 years. Not that I don't like them, I just usually choose chocolate when I have a choice. But the other day I had a hankering for an old fashioned peanut butter cookie like my grandma used to make. This recipe fits that bill exactly. My only change was that I used all natural creamy peanut butter. These were soft, and perfectly flavored. I only baked a few the first batch and left the dough in the fridge. Worked perfectly all week to bake just what I wanted and have fresh cookies every day."
"2","5","My 14 yr old daughter made these by herself, using the suggested hints (extra pb and flour) and they are PERFECT! Thanks for sharing this!"
"2","5","Added smashed up Reeces pieces to this recipe, cake out with 48 cookies which were eaten within 4 hours!!!!!!!!! Excellent recipe, easy to follow, thanks :O)"
"2","5","I thought these were great, and easy to make for my first p.butter cookie. I'll probably add a little more peanut butter next time, like others suggested."
"2","5","I ended up with excellent cookies! My whole family loves these! I put Hershey Kisses on top for a little extra fun and they were devoured!!"
"2","3","I gave this recipe three stars because I did make some changes. I made these with half organic, unsalted butter and half I Can't Believe It's Not Butter; I also reduced the brown sugar by 1/4C and replaced the regular sugar with half raw sugar and half Splenda; and I doubled the amount of peanut butter in the recipe. I might add a little vanilla next time, as well, but with the changes I made I felt that the flavors were perfect! These cookies are soft and fluffy, but with just enough crunch around the edges. I baked them for 10 minutes at 350 degrees in my convection oven."
"2","5","This recipe is awesome! I took other reviewers advice and added 1/4 cup of peanut butter and 1/4 cup of flour to thicken it up a little and added 1 tsp of vanilla for a little extra flavor. I used creamy peanut butter since we didn't have chunky on hand. I made some by rolling them in granulated sugar (another reviewer's suggestion) before putting them on the cookie sheet and I made some without the sugar to compare the two. The cookies rolled in sugar are much better! I guess sugar makes everything better. :)"
"2","4","I found this recipe to be quite good. Leave the sugar like it is but cut out some of the flour or else the batter gets too crumbly. I did add in some extra peanut butter and they turned out beautifully."
"2","5","These cookies are 'yum yum yum delicioso!' The cookies were crunchy and chewy at the same time! My family loves them!"
"2","5","Great basic recipe. I did a few changes myself which made it wonderful. I started with melting the butter. I increased the flour 1/2 a cup. Added Vanilla extract.. 1/2 to 1 teaspoon. Added an extra 1/2 cup of peanut butter. I also added 2 cups of semi-sweet chocolate chips (yes you can press them with a fork when they have the chips added) and baked them for about 9 minutes."
"2","3","Although the cookies baked up nicely, they didn't taste much like peanut butter. I like The Joy of Cooking recipe better. It makes a denser, more 'peanuty' cookie."
"2","4","I think this needs just a little more peanut flavor to rate a 5 for me. It's very good but I can taste too much butter for my taste next time I'll use about 1 1/2 c of peanut butter. This time I added 1 tsp. of vanilla, 3 cups flour, no baking powder but increase baking soda to 2 tsps. and used 1 1/4 c peanut butter. These were initially 'fluffy looking' but as they cooled flattened right out and ended up a slightly crispy cookie. Very good, it's a keeper."
"2","4","I should have looked at the photo. I was hoping for the cute litte PB cookies that keep their fork marks. I spread this recipe out onto 2 cookie sheets - what a mistake. They spread more than any cookie I've ever seen. I started with one inch balls flattend slightly, and ended up with 2 giant sheets of 1/4 inch thick cookie that I had to slice into squares. Absolutely could not tell they started off as circles or that they had cute fork marks I lovingly made in designs. They did taste good though - wickedly sweet."
"2","4","I give this 4 stars as-is, but with the addition of 1 tbs. vanilla and 1 cup of peanut butter chips, this recipe is perfect! I also only cooked for about 8 minutes rather than 10."
"2","5","I am so excited! I just made my first ever batch of homemade cookies! I used this recipe. These cookies were amazing! Hint for those that arent used to making cookies from scratch, especially peanut butter cookies. When all finished, the dough looks really dry and doesnt seem to clump very well (I added  cup more flour and peanut butter also), but that is how homemade peanut butter dough is supposed to look! I almost threw it outor Ill admit thought I had to eat all of the dough (which is very yummy by the way, yes I know not very unadvisable because of the eggs). I am very pleased! These tasted better than most of the other peanut butter cookies Ive tried, and I am just a novice chief. Thank you!"
"2","5","There are NOT words!!! Wow. I am making cookies for a friends wedding actually and I have NEVER, no NEVER had success with peanut butter cookies. BUT that has definitely changed. I used a full 16 oz. jar of creamy JIF peanut butter, 3 sticks of butter, 1 1/2 cups of each sugar,(plus a tsp or so of molasses as I ran short of the brown sugar by a bit). 3 eggs, and 1 tsp vanilla. Then i did a full 4 cups of flour. Basically I time and a halved the recipe with a couple small additions. No need to refrigerate. 8 minutes at 350. WOW!! Oh, and a hint. I used the bottom of a plastic potato masher/ricer for perfect criss-cross pattern. And I rolled them in sugar. Perfect."
"2","5","Deeeelicious!!! I doubled the recipe because I wanted to give some to friends and wow did I get alot of cookies. We have cookies coming out of our ears!!!"
"2","5","Hubby and son agree these are fantastic peanut butter cookies. I doubled the recipe and used an extra half cup of flour total, and I used an entire 18oz jar of crunchy peanut butter total. This made just a little over 12 dozen decent sized cookies! I let the dough sit for about 15 minutes in fridge before forming balls. Cooked 12 at a time on parchment paper for 9 minutes per tray at 350 degrees. Done perfectly in my oven this way (mine tends to run a little warm)."
"2","5","These cookies are great! Even after a week, each cookie still tasted like it was fresh out of the oven!"
"2","5","Awesome cookies! First batch of cookie recipes from this site that didn't turn out horrible! I did some editing tho.. changed the oven settings to 350F for 10 minutes.. came our delicious! Also used splenda instead of sugar. Awesome recipe!"
"2","5","I'm the 290th person to rate this cookie and I'll continue to give it 5 stars. Only thing wrong with the recipe is I should have doubled it to begin with!!!"
"2","2","The only variation I made on this recipe was to add a little vanilla and Reese's pieces. Not a great recipe. Will not make it again."
"2","4","DON'T bake at 375!!! Maybe my oven is just hotter but at 375 my cookies were too crispy and I only baked them for 7 mins!!! I'm going to have to play around with this recipe..."
"2","4","I saw the tips from other people to add more flour and peanut butter. I made half the recipe and added 1/8 cup peanut butter, but accidentally added too much flour (1/2 cup instead of 1/4 cup). So when I formed the cookies they were too crumbly... Don't make that mistake! Cookies turned out really yuummy but a little crispy. Next time I think I will just try to follow the recipe (and add a bit of vanilla extract still). The only other problem I had was that I made half the recipe, expecting to have 12 cookies. I came out with 36 cookies! The proportions are incorrect. Otherwise these cookies had a wonderfully nutty and completely peanut buttery flavor."
"2","5","These were really good - reminded me of what my mom used to make! I did make some changes: I made them vegan, using egg substitute for the egg. I also had bought a jar of sunflower butter, which I love, but this time I had accidentally bought the unsalted, unsweetened kind, which really isn't so good for eating straight up. So I was looking for a way to use it up in a delicious way. I used about 2 1/4 c. sunflower butter (the rest of my can) and about 1/4 c. almond butter. I also upped the flour to 3 cups, as others suggested, but used whole wheat pastry flour. The cookies came out perfect, light and buttery. I will be making these again, probably with almond and sunflower butters again, but I will decrease the amount of shortening/butter/margarine to about 3/4 c. or even 1/2 c. They were just a little on the greasy side for my taste. Everyone at the potluck loved them though - said they tasted just like peanut butter cookies!"
"2","5","I made the recipe pretty much as stated except I used salted butter and creamy peanut butter. All amounts and other ingredients were kept the same. I baked for 9 minutes at 375 degrees and they came out perfect. Very good flavor for a peanut butter cookie, in my opinion. I will put this recipe into my permanent stash."
"2","5","Very tasty! I added 1/2 c flour and 1/4 peanut butter extra like others suggested, and they turned out perfect! I used reduced fat peanut butter and you couldn't even tell. I would definatley make these again!!"
"2","5","very easy recipe and delicious! I made them into peanut blossoms (added a Hershey kiss in the middle when the cookie was done baking)"
"2","5","These are great peanut butter cookies...I only baked mine about 7 minutes then left them on the cookie sheet for about 3 minutes to finish cooking. I froze about half the dough per another reviewers advice, so hopefully they turn out as well the second time around. Thanks for a keeper :)"
"2","5","Followed to a T and they turned out perfect! Mmm!"
"2","4","I used 1 and 1/4 c. peanut butter and salted butter; I decreased the salt to 1/4 t. and used kosher salt. Even so, these were too salty. I strongly suggest using unslated butter if possible, and, if using salted, I wouldn't use any extra salt. Also, don't overbake these - 10 minutes is just long enough; they finish baking on the cookie sheet, and if you overbake, they will be dry and too crispy. These are much better the second day; they were a little crumby right after they cooled. Overall, these are good cookies, easy to bake and quite tasty."
"2","4","I added an extra 1/4 cup of flour and 1/4 cup of peanut butter as well as a teaspoon of vanilla. My husband likes crunchier cookies so we stuck with the 375 degree temperature and a slightly longer cooking time."
"2","5","I'm in love with this recipe! These cookies turned out perfect. My mom is allergic to peanuts, so I made them with soy nut butter. They're completely yummy! I almost wanna wake her up to get her to try one now. They're that awesome. But I'll wait until tomorrow. Thanks for the delicious and easy recipe.  **Update: I made these with peanut butter finally! They were every bit as amazing as I thought they'd be. I took them to my boyfriend's house the first time I met his family, and they loved both the cookies and me! They all said the recipe is a definite keeper."
"2","5","I am updating this review slightly - as previous reviewers suggested, I am still adding 1 teas vanilla, and additional peanut butter and sugars to my batter. I also reduced the salt, but I used salted butter. And definitely roll the balls in sugar. I am now using 1/4 cup LESS flour because I like flatter cookies and I recently learned that more flour makes puffier cookies. I also want to mention that I use Smucker's natural creamy peanut butter, so I have added a tablespoon or two of vegetable oil depending on the state of my PB. I still luv these cookies, the batter is super tasty too!"
"2","5","This is the perfect peanut butter cookie!"
"2","5","These were the BEST peanut butter cookies I have ever had! The only changes we made were to use regular salted butter, 1 1/4 cup peanut butter, and a teaspoon of vanilla. Holy cow!!"
"2","5","these are the best peanut butter cookies! i did a few revisions, and they came out perfect. i added 2 cups of peanut butter and 2 cups white sugar, and only had one egg. if you are looking for more peanut butter taste, just keep adding peanut butter by the 1/4 cup and do some taste testing until it's to your liking. will definitely use this for a base recipe again!"
"2","5","This is the best peanut butter cookie and I've made many.. I used Jiff and the aroma was wonderful. I think it is important to use good quality peanut butter. I took them to a pot luck supper and everyone wanted the recipe. A keeper for sure."
"2","4","One of the best I have tried! I like mine on the crunchy side so I baked an extra 4-6 minutes. Texture is just right for a peanut butter cookie, but I will try different brands of peanutbutter to get a more peanutty flavor. This one is going in my favorite recipe stash."
"2","4","This recipe makes a big, chewy cookie with just the right amount of sweetness. However, even though I added an EXTRA 1/4 cup of peanut butter and an extra 1/4 cup of flour, my family still felt it could use more intense PB flavor. I also found they needed to cook more than 10 minutes long. Finally, I discovered that smashing the cookies with the fork made them spread out and get too flat, so with my last batches I just marked a crisscross pattern but did not press down hard. Next time, we will add even MORE peanut butter and see what happens. All in all, a very tasty cookie with great texture."
"2","4","Tasty and simple. I halved the recipe and added a bit more peanut butter per the advice of others."
"2","5","These turn out perfectly- very simple, just like peanut butter cookies are supposed to be! I add chocolate chips sometimes. Love these! A+"
"2","5","These cookies were delicious! I did have a problem with how fast the bottoms browned, but I think it would be perfect if the temperature was 15 or 30 degrees lower."
"2","5","Excellent classic peanut butter cookie recipe. I am making this one for upcoming Christmas parties!"
"2","4","I went with other reviewers and added more peanut butter in addition to a tablespoon of honey. Super delicious and chewy!"
"2","5","My son and I made these today and this recipe was easy, fun and turned out very well. Perfect if you dont have a lot of time. Try this recipe!"
"2","5","My family and i loved this recipe. I changed a few things to it. I added extra half cup of peanut butter. 1 tablespoon of honey,and half a bag of choc. chips. I rolled the 1 inch balls in sugar but did not criss cross them with a fork. I baked them at 375 for 8 mins. They came out very soft and chewy. I will make these all the time now."
"2","5","This is a great receipe! The only thing i changed was i used more pb as other reviewers said. My granddaughter helped me i rolled into balls and she rolled them in sugar and did the fork thing. We had a blast and they were very tasty! TY for great receipe!"
"2","4","I was looking for a hearty, chewy cookie. This one is light and fluffy, with a few crumbs falling off the top. It's tasty, but not the cookie I wanted. These do puff up quite a bit as they cook, then fall down to a fairly 'standard' size. Won't make again."
"2","5","Just like Mom used to make! I did however, add extra peanut butter(and I used creamy) and a tsp. of vanilla."
"2","5","These cookies were amazing... my roommates ate an entire double batch in under two days!!! Definitly try these"
"2","5","I'm no peanut butter cookie expert but these looked beautiful and tasted great. Let them cool on the pan a minute or so to avoid breaking them while you are taking them off the pan."
"2","4","My husband loves peanut butter cookies...and I didn't have a recipe. I tried this recipe and he loved them. Next time I'm going to add some more peanut butter for a little added flavor. Overall though, a very excellent (and easy to make) cookie!"
"2","5","very good cookies...nice and soft"
"2","5","great recipie!!!!! My hubby suggested roling the balls of dough in sugar before flattening them, tasty!!!"
