helpfulCounts,ratings,reviewText
"0","5","These are awesome! They aren't my favorite since they are SO chocolatey, but the chocoholics can't get enough. I baked them for 10 minutes and they were still perfectly chewy--more like a brownie than a typical cc cookie. I did use 1/2 white and 1/2 brown sugar but forgot to try 1/2 shortening for the butter. Next time I'd like to try white chocolate chips for a change."
"0","5","Ok so I am completely confident this recipe would be tops without any changes. Due to limited ingredients, I did make some adjustments. As suggested I used 1/2 butter and 1/2 crisco. Then with limited sugar, I used 1/2 cup granulated and 1 3/4 cup powdered. I omitted the nuts and made these with 2 1/2 cups of mixed chips (semisweet, butterscotch and white chips.) They came out soooo good, that I would make them with the strange sugar combination again next time, but look forward to trying them again with another combination of chips. Maybe chocolate and peanut butter. YUM!"
"0","5","This is a keeper! Tastes like a cookie version of a brownie. I used crisco instead of butter, because I always do in cookies, and I used 1/2 C brown sugar, and 1 cup white sugar, just because it seemed like a good idea. I will be making these again. Thanks for the recipe!"
"0","5","AWESOME. These are guaranteed to kill even the strongest of chocolate cravings!"
"0","5","perfect! i saved half the dough to make the rest for the hubs to take to work. they were even awesome w/o the walnuts."
"0","4","OMG - chocolate! I cut the sugar with Splenda, that's the only change I made. I could only eat one and everyone that knows me knows I love all that is chocolate so these are really rich. Taking them to work tomorrow as I'm afraid most will go to waste since a little goes a long way (good for satisfying your chocolate craving without adding to much to your waistline!)."
"0","4","Made them exactly as written. Very moist and yummy!!"
"0","5","These cookies were yummy! I made the recipe the same except I added a cup of white chocolate and a cup of dark chocolate chips for a little different taste. I recommend it...tastes so good!"
"0","5","Delightful cookies. The semisweet chocolate chips and the chocolate from the cookie give it a dark chocolate flavor for any dark chocolate lovers out there. It was extremely easy to make and definitely worth repeating."
"0","5","Very good! I made exactly as written. At first they had a bitter cocoa taste to them, but the next day they had mellowed and the right amount of chocolate to sweetness...yummy! Thanks, Kathy!"
"0","4","I made these vegan by substituting Earth Balance shortening for the butter and 3 Tbsp applesauce for the eggs and they came out great! Super easy recipe with very satisfying results; can't wait to make them again"
"0","3","Meh. Not a bad recipe by any means, but I found them too cocoa-ey. I'll keep using my double-chocolate cookie recipe which uses melted chocolate instead of cocoa."
"0","4","These were very rich and chocolaty. I followed prev. suggestions used half-brown and half-white sugar, and baked for only 8 minutes to keep them soft. Personally, I prefer a more chewy texture, but these were still a great chocolate fix. If I make them again I'll double the nuts - I hate it when you only get one or two in a whole cookie."
"0","5","I live in Denver, Colorado (high altitude). My teenage daughters and I made this recipe and we followed all the directions and ingredients exactly. These are some of the best cookies we have had. My brother and his girlfriend also loved them and they are very picky about their sweets."
"0","5","Really tasty cookies. They have a nice balance of chocolate and aren't too sweet. i took the advice and put the dough in the fridge for an hour before baking and the cookies didn't flatten out. super moist too, people called them 'brookies' b/c they were brownie-like cookies. I'll definitely keep this recipe."
"0","5","These cookies are just simply amazing. These are by far the best cookie I have ever baked. I made these with my 2 year old and she loved helping and enjoying the result. I kept the sugar the same, I used half Crisco and half butter and I only had half the amount of chocolate chips available so I used a broken up Ghirardelli chocolate bar too. Absolute heaven. I plan to impress and bribe with these!"
"0","5","I made this because I needed chocolate right away, but after starting to mix it up I realized I only had whole wheat flour in the house. Decided to make it that way anyway, and they tasted great!"
"0","5","These are amazing, especially when you make them as chocolate chocolate chocolate chip chocolate chip. To do this, use both semi-sweet and dark chocolate chips in equal amounts to meet the chip requirements and use Penzey's natural and Dutch Process cocoas in equal amounts to meet the cocoa requirements. In my oven they come out at about 8.5 minutes and I put the sheet on the cooling rack to cool it down as quickly as possible. The cookies stay moist for up to 3 days, if they last that long."
"0","5","I followed a previous poster's instructions and did half white half brown sugar and half margarine half vegetable shortening. Turned out great! Update: I made these again following the previous notation (except butter instead of margarine). I also replaced the cocoa with flour this time. THE BEST CHOCOLATE CHIP COOKIES I HAVE EVER HAD."
"0","4","amazing flavor! i also used half shortening and half butter, and half brown sugar and half white. used white choc chips and semi sweet chips, they even convinced my sugar free friend to try one!"
"0","5","These disappear as quickly as I can bake them. Spectacular! Thanks Kathy."
"0","5","Outstanding cookie recipe, a lunch box must!! My family loves this recipe!! It deserves 5 stars and more!!!!!!! Chocolate lovers friend :)"
"0","5","Edited 10/11 Just made these again, this time all butter and actually cut back on the cocoa a bit and added two healthy squirts of Hershey's Syrup and they were AMAZING. Still 1/2 brown sugar 1/2 white sugar. Previous review: Amazing. I did 1/2 butter and 1/2 shortening, and 1/2 white sugar and 1/2 brown sugar. I think mine were a little big, made 3 dozen, so I cooked them 9 minutes. My husband, who doesn't have as much of a sweet tooth as me loved them! That says a lot, will make again."
"0","5","These are seriously delicious! Million thanks for the recipe."
"0","5","super chocolately which is exactly what i wanted! perfect for the chocolate lover or someone who is in the mood for a brownie/cookie! also great frozen :)"
"0","5","I too did have white half brown sugar instead of all white sugar, also did half butter half shortening. They are so chewy and moist they are great!"
"0","5","Great! They taste better than the ones i bought in the bakery."
"0","5","These are awesome!! The only negative is that it doesn't make as many as I was hoping. I got 36 small(ish) cookies instead of the 48 I thought I was going to get."
"0","5","These cookies are divine. Thanks for sharing."
"0","5","These cookies are amazing with their almost brownie-like texture. We tried them with white chocolate chips as well and found them just as divine. These cookies will not disappoint!"
"0","5","I halved the recipe with great success. Very easy and super delicious!"
"0","5","We made this vegan, with egg replacer instead of eggs. We also used splenda, not sugar. We made them a few times and each time they turned out very well! They were super delicious! The cookie dough was also really yummy cold/frozen. We'll definitely keep making them."
"0","3","This was just an O.K. cookie for me. It was tasty but not outstanding in any way. My kids told me not to save this recipe."
"0","5","Everyone who tried these cookies loved them. They were thick and chewy, not flat and/or crispy. I halved the recipe, and instead of using 1 cup of chocolate chips I used 3/4 cup and 1/4 cup white/vanilla chips and no nuts. I also used 1/2 white sugar and 1/2 brown sugar to make the cookies more chewy. Another reviewer suggested using half butter and half shortening to avoid the cookie flattening out - I used only butter and my cookies turned out fine (I did not chill the dough prior to baking). They took exactly 10 minutes to bake perfectly. Also, I don't use vanilla extract for personal reasons - so I just used 1 tsp water. The next time I make these, which will be soon, I'm going to add coffee - another nice flavour might be orange juice as oranges go nicely with chocolate. Thanks for a great recipe!"
"0","5","These cookies where a hit in my house, but to give it a little lift and moistness I add one package of instant white chocolate pudding or you can use any flavor, it makes the cookies even more delicious"
"0","3","We did not care for these; too salty tasting (don't know why with only 1/4 tsp salt, and kind of dry."
"0","5","The only thing chocolate my boyfriend has requested. Usually he's a fruity kinda sweet tooth type, but these he requests chocolate for a change."
"0","4","Very good cookies. I added a little more cocoa and a tad more vanilla for my tastes. They came out perfect! A little crisp on the edges, nice and soft in the middle."
"0","5","I skip the walnuts and add half mint chocolate chips and the other half regular, semisweet. A nice, minty variation!"
"0","4","An 'adult' cookie when made with Hershey's Special Dark cocoa and semi sweet chips. Satisfies even the worst chocolate cravings with just one or two of these little cookies!"
"0","5","So tasty! It was hard to stop my family from eating them...I made the recipe exactly as followed, and baked them on parchment paper for easy cleanup. On parchment at least they took at least 10 min."
"0","4","Good cookies :)"
"0","4","Good but not great. I prefer chewy cookies with a little more flavor. Not sure what this recipe needs, but if I need a chocolate cookie fix, this would probably do the trick."
"0","5","Made these cookies on Father's day and they were a hit. Followed recipe to the tee and came out with super moist cookies. Just enough chocolate but not overwhelming, will definitely make again. Thank you for the recipe."
"0","5","Rich, chocolatey flavor! I substituted as follows: 1 cup sugar + 1/2 cup Splenda; 1 egg, 1/4 cup Egg Beaters; 1-1/2 cups butter + 1/2 cup applesauce. Also threw in cranberries instead of nuts."
"0","5","These are awesome. Perfect when made small for a little bite of chocolate. Yum!"
"0","4","These are great fast cookies!! I'm only giving it 4 stars because I made the recipe exactly how it said & they are a tad bit too soft! Next time I will havle the butter like everyone suggested!"
"0","5","The best cookie in the world. Love it x 10!!! I did a half and half mix of chocolate chips and butterscotch chips and they were AMAZING!!! Everyone who has tried these just beg for more."
"0","4","These cookies were great!! Tried to use half shortening and even put the dough in the fridge so prevent having flat cookies but this still did not help. Cookies were still delicious!! They should rename this receipe to 'gone in 60 seconds'"
"0","5","These are great! I didn't have my normal recipe and I found this one. I used 1/2 c brown sugar and 1 c white sugar. My old recipe requires the dough to be refrigerated so I put these in the fridge for awhile. They came out perfectly! Everyone has been raving about them. I also noticed that people have had their cookies dry out. I store mine in tupperware and they are still extremely fresh. You can also freeze them. My only complaint is that the recipe doesn't make as many as it says."
"0","5","The BEST Chocolate Chip Cookies I have ever enjoyed. I used Hersheys Special Dark Chips. K.R. Sciba Roanoke, Virginia"
"0","4","First time making cookies- not bad! I used a hand wire whip as I dont have an electic mixer yet, so cant say I mixed the butter and sugar mix to 'light and fluffy'... I put lots of space in between the spoonfuls on the cookie sheet, thinking they would spread out and flatten, but they never did, they stayed nearly exactly as I plopped them out. Keep a good eye on them and dont cook them entirely, undercook, so they cool down soft. Much like a brownie, very chocolately, great with milk..."
"0","5","These are EXCELLENT cookies!!! I cannot stay out of them! Kids and adults love them!"
"0","5","I have never had soo many people ask me for this recipe! Totally biggest cookie recipe request ever! I will be baking these cookies for the rest of my life! Y-U-M-M-Y!!!"
"0","4","Mine did NOT turn out flat and I still used unsalted butter! I changed the recipe to 1 1/4 cup of white sugar, 1 teaspoon of baking soda, and added 1 teaspoon of baking powder."
"0","4","These are very good cookies. My daughter is allergic to milk and eggs and I was able to make these cookies with all of the necessary substitutions (fleischmann's unsalted margarine & shortening, ener-g egg replacer, and Ghirardelli chocolate chips) and they still tasted great! Baked on a silpat for 8 minutes."
"0","4","I made these for my sons beaver scout sleepover! Hmm there very sweet & chocolatey but I didnt get chewy & I didnt get 48 out of the mixture. But other then that there nice enough for the kids! Way to sweet for me thou!"
"0","4","These cookies are awesome. I have made them several times. I however trade the chocolate chips for the little andes mint chips."
"0","5","These cookies are VERY good. I will make these again (and again, and again)."
"0","5","There's no such thing as too much chocolate!"
"0","4","These are delicious. I make them with both milk chocolate chips and white chocolate chips. It's like a hybrid of a brownie and cookie. Yum!"
"0","5","Yum! I will definitely make these again! I want to try making them with peanut butter chips and also with white chocolate chips. I think those would be so good. Great recipe!"
"0","5","SOOOOO Good!"
"0","4","VERY CHOCOLATEY AND DELICIOUS. I'm not a big fan of chocolate and i love it. My choco-lover friends can't stop eating these cookies. Made these several times, tried substituting 1/3 of the sugar with brown sugar produces extra 'moistness?' to the cookies and really complements the chocolate. Also love to add white chocolate chips. YUM. Have been succesful cutting the recipe in half. I find that 8 minutes in my oven makes perfect cookies."
"0","5","Sooo Good!! Perfect balance of cocoa and sugar, and I will definately be making these again!"
"0","5","Better than brownies!"
"0","4","Very moist and good cookies!.."
"0","5","Yum! Tastes like a great chocolate chip cookie. Very moist and the perfect amount of chocolate and sweetness. I followed the recipe exactly, except I used mini chocolate chips and cut the recipe in half. I got about 30 cookies."
"0","5","Yummy. My kids loved these, me too."
"0","5","Taste like brownies! I cooked them for 8 minutes then pulled them out of the oven and let them rest on the aluminum foiled pan until the next batch came out. Amazing with half marg and half butter."
"0","5","I am writing more in hopes to get help. I can't get the cookies to be soft, chewy or at least have a shape of a chewy cookie. My cookies always flat out, the moment they get hot in the oven I Just watch them get as flat as a disc. I try to put more flour but didn't help much. Can anyone give me suggestions? What am I doing wrong? Help!"
"0","5","best i have ever tasted i did what some people said and half butter half shortning sprinkeled icing sugar turned out amazing"
"0","5","These are awesome! The only thing I did differently was substituted 1/2 cup of the white sugar for brown sugar to make the cookies softer. They almost have the consistency of a brownie, so good!"
"0","5","Quite the tasty cookie! I didn't add the nuts as I didn't have any and they turned out delicious. Will add white chips next time for a nice contrast."
"0","4","These were very good. I halved the recipe and ended up with 14 cookies. Cookies were very rich, very chocolaty, very soft. I took some other advice listed here and cut the sugar with brown sugar. The only detraction was that the cookies came on really strong. Milk to cookie ratio was 1 glass to 1 cookie. I might reduce the cocoa powder, sugar, and butter in the next round."
"0","5","These turned out great. Make sure not to overcook, thats key to keeping soft."
"0","5","Scrumptious! Couldn't have asked for a better cookie. I baked them about 10 minutes."
"0","5","This is now my 14 year old daughter's 'signature' recipe! Best cookie i've every tasted. My daughter omits the nuts and uses vanilla chips instead of chocolate. YUMMY!"
"0","5","These were wonderful! Nice & soft."
"0","5","I made these for my boyfriend and he loved them! Thanks for the great recipe! I took some of the cookies and dusted them with powdered sugar, it was delicious!"
"0","4","Very good. Chewy and tasty. Used mint chocolate chips."
"0","2","Too chocolatey...way too much cocoa powder! I would do 1/3 c next time instead of 2/3"
"0","5","I really enjoyed these cookies. I actually put them in the fridge and 2 weeks later they were even better than the 1st day."
"0","5","Followed recipe as is minus the walnuts...absolutely DELICIOUS!"
"0","5","I just made these and love them. They came out a little soft - just the way I love my cookies. I also appreciated a chocolatey recipe that didn't use melted bakers chocolate which can add up."
"0","5","And I normally don't like these cookies and I very rarely write a review, these were just too good. I used white and dark chips otherwise followed to a T!"
"0","5","it was awesome!!! it wasn't too sweet, the perfect amount of chocolate-ness!"
"0","5","I made this recipe tonight, and it was AMAZING! The edges were chewy and the middle was soft and chocolatey. I did not use walnuts and I substituted half of the semi-sweet chips for white chocolate chips, which was a perfect complement to the semi-sweet chocolate. A definite keeper!!"
"0","5","Amazing! Everyone loved these - even my friends who 'hate chocolate' loved them. I used 1/2 C brown sugar and 1 C white sugar. I also substituted half whole wheat & half regular flour, and I used half butter, half margarine. They even stayed soft for days!"
"0","5","Tried with nuts and without nuts. Good recipe either way."
"0","5","These are the best cookies I have ever made! I did follow the others suggestion of using 1/2 cup of brown sugar and 1 c of white. Baked for 10 minutes. PERFECTION!"
"0","4","I wasn't too fond of the texture....I used Margarine maybe if that's why but everything else was the same....although I omitted the walnuts didn't think that would make a difference....it was too bland so i added a cup of white chocolate chips.....a bit too soft..."
"0","5","These cookies are wonderful! I made the 1 cup white sugar/1/2 cup light brown sugar subsitution that was recommended and baked until just set as the recipe called for. They're still soft on the second day."
"0","5","Awesome. Seemed a bit too soft still after 10 minutes so I left the first batch in 13. Those turned out good, but crunchy. I followed the directions for the rest and they turned out soft and chewy. Great recipe! I already printed it out and put it in my recipe box."
"0","5","I followed this recipe verbatim, and I think that the cookies were probably the best I have ever tasted! PERFECT! The chocolate chips that I used were white chocolate chip, though. So I guess I did change something :/! Oh well, they were still AMAZING!"
"0","5","I am a chocolate fanatic and these cookies totally satisfied my sweet tooth. Very delicious!"
"0","5","These cookies are the best. I didn't put nuts in and used mini chocolate chips. I also used dark chocolate cocoa.....delicious."
"0","5","These are spectacular. My sister made these cookies for me and wow they were delicious, so I went ahead and got the recipe and made some myself. I baked them for 8 minutes and they were nice and chewy. They didn't get hard. I've read a lot of reviews of people saying their hard, maybe they should cover the cookies after their baked so they don't get hard. I did the recipe exactly as it says. Thanks!"
"0","2","I decided to try this recipe because of the high rating, and because I am a chocoholic. The recipe was followed exactly, except for the addition of chopped dried berries. (Love them with chocolate!) I am somewhat disappointed, as ours seem 'dry' in the mouth, though the cookie is not overbaked or stale. It also has an aftertaste that we can't quite place, but it is slightly bitter and unleasant. The real statement came last night. I wanted a snack, and knew these were in the kitchen, but opted for a piece of candy instead. Never happens with me and cookies! I don't think we'll make these again..."
"0","4","these are VERY rich, but very good! they tend to work better when made smaller, and i actually used a bit less butter than the recipe calls for, but the cookie didn't suffer from it due to the added chocolate chips."
"0","5","Mexican Chocolate Cookies: I wanted to bring dessert for a Cinco de Mayo dinner at our church, so I took this basic recipe and added 1 tsp. cinnamon. I didn't have chocolate chips in the house, but I had 4 squares of semi sweet chocolate, which I chopped up and mixed in. I left out the walnuts (I don't think they eat too many walnuts in Mexico). Anyway, the cookies came out very good...with just a hint of cinnamon, which is how I like Mexican hot chocolate. This is an interesting variation on a great recipe."
"0","5","Perfect for my chocoholic husband; he could not stop oooh-ing and ahhh-ing! I followed the recipe exactly and they were anything but dry, even days later. Delicious, delicious, delicious. I have already passed this on to friends and will certainly be making these regularly."
"0","5","Awesome! For all you vegans out there, I used vegan margarine (Smart Balance) and Ener-G Egg Replacer with Ghiradelli choc chips and these were to die for. They even spread out and looked like a 'regular' cookie!:) My hubby had no idea these were vegan!"
"0","5","My daughter and I renamed them brownie cookies because they are that goooooood!!! I used shortening instead of butter and I went 3/4white sugar and 3/4 brown. I found it most helpful to use the beaters when blending the dry into the wet a little at a time. It went in my recipe box :)"
"0","5","i love this recipe, its so easy to make and they still taste great without the chocolate chips, i've used this recipe about three times already and the family still cant get enough of them!!"
"0","5","I have made these cookies at least 3 times now and they are wonderful! I follow the recipe exactly, then bake them for about 7 minutes. A friend of my husband's was over the first time I made these and he still talks about these cookies months later! This recipe is now in my own favorite recipe book."
"0","5","Excellent. I did not change a single thing and they turned out perfect. We also made a batch to use for ice cream sandwiches. Thank you for sharing the recipe!"
"0","5","ten stars!! these cookies are so AMAZING! i followed someone's suggestion and used 1 cup white sugar and 1/2 brown. i also used one cup white chocolate chips. it came to about 60-65 cookies and they sure went fast! i kept them in a airtight jar witha slice of apple and they stayed so chewy and soft!! love love this recipe and cant wait to make it again! thanks!! FOR ROSE: are your baking trays warm or hot when you put the cookies on? once i made cookies and as soon as the tray came out of the oven i removed the cookies and put the next batch on and they all went very flat..so maybe that could be it? also it might help to chill your cookie dough in the fridge?"
"0","5","LOVED IT!!!!"
"0","5","Fantabulous! If you have a need for chocolate... this is it! VERY GOOD!"
"0","5","unbelievably delicious, these were the best cookies I've EVER had, I'm not even exaggerating I would wake up in the middle of the night with a craving for these, chocolate dough with choc chips with nuts...i added walnuts AND slivered almonds...the most heavenly combination!"
"0","5","AMAZING! These cookied have a nice cruncy outside and a chewy inside. They are delicious!"
"0","5","These turned out great. I am thinking next time I might try peanut butter chips."
"0","5","Everyone loved them. I will use this recipe from now on."
"0","4","these were really easy to make, but my dough seemed kind of dry when all mixed up. The cookies themselves are not bad, but not the best either. I think I may add less flour next time...??"
"0","5","DELICIOUS!! I used only white chocolate chips and they were great! My daughter who will NOT eat regular chocolate chip cookies loved them! Definitely a keeper!"
"0","5","I'm not a chocolate person. Made these during my visit to my boyfriend's, not quite sure what I did different, but the ones I baked kinda spreaded out, not quite anything like the picture showed, but they still turned out great! Boyfriend and his parents love it, it's all gone in less than a day! Thanks alot for sharing this recipe! =)"
"0","5","I've made these several times. I like to make them for my daughter when she travels. I pretty much follow the recipe exact and they are wonderful!"
"0","5","These were absolutely excellent and they were a lot of fun to make. My 3-year old helped me make them and she had a ton of fun. They tasted incredible."
"0","5","There aren't enough stars in the universe to rate this one! WOW!! I was out of butter so I used margarine, fearful that would have a negative affect. (It didn't.) Absolutely wonderful in all areas! (taste, texture, ease, convenient ingredients, etc...) Shame on me if I don't share these. Thanks so much for sharing this recipe."
"0","5","Followed directions to a 'T' and it came out fantastic!! Moist..like a brownie. The husband did a cookie dance...he LOVED it!"
