helpfulCounts,ratings,reviewText
"1","5","I made this recipe for 25 people, did not have access to fresh Georgia peaches, used can peaches unfortunately, and Oh, my gosh was it heavenly! Of course everyone will not be pleased but 2 out of 25 unhappy people are excellent numbers! :-) The unhappy peoples' complaints were that 1)'I never seen dough that thick on cobbler before', 2)'It's not how real southerners make it, but it was still good'. Everyone else loved everything about it, the dough, the peaches, the flavoring! This was my first time making anything from scratch, so thank you very much!"
"1","4","I was searching for a recipe for a cobbler that had just the right amount of 'cobbler crust' for me. I took the advise of a few others and doubled the crust recipe so that i had enough to cover the top and boy was i delightfully pleased with the end results. I also used 2 cans peaches in heavy syrup and instead reduced the sugar of the recipe slightly. I would definitely make this again."
"1","5","This peach cobbler was to die for and easy to make too!"
"1","4","I doubled my measurements for the topping, and added ginger to the peach filling. Gives it a lil sumtin sumtin. VERY tasty."
"1","5","This is a wonderful recipe. Looks just like the picture! I subsituted the sugar with Splenda brown sugar (3/4 c) and it turned out wonderful! Added a extra peaches too :-)"
"1","5","I really loved this recipe. I made it exactly as shown and it was wonderful. I might add it was my first time ever making peach cobbler. I am looking forward to trying it with different fruits. I think you could use apples or Blackberries and it would still be great..."
"1","5","WOW.... I took this to our family reunion and everyone loved it! I did cut down on the lemon juice and added 2 tablespoons of butter and 2 tablespoons of flour to the peaches. IT WAS A HIT!"
"1","5","By far the best peach cobbler I have ever made! The only thing I did differently is instead of sprinkling cinnamon sugar on the top I used coarse sugar."
"1","5","This is my standard peach cobbler recipe. I like to increase the recipe and use a 9x13-inch pan. I double all filling ingredients; however, since I'm a sucker for cobbler topping, I triple the dough ingredients. I can't imagine ever using another peach cobbler recipe. Perfection."
"1","2","I tried this recipe after all the rave reviews, but sadly I thought it was less than wonderful. It came out really pretty, but bland bland. The crust was a bit flavorless, maybe it was the flour? The filling was just OK. I used fresh ripe, Colorado peaches which are yummy! But not even my husband liked this recipe and he loves every dessert, even if it's not great. I'm going to tweak it and see how it comes out. I like the thickness of the crust, just not the flavor."
"1","5","very good had requests to make it again"
"1","5","This is the best peach cobbler I have ever made. All the kids in my neighborhood see me picking my peaches and ask if I am making peach cobbler, because last year I gave them all their own little pan of it. This year my husband and I decided we are having them all over for peach cobbler and ice cream. I am also giving all my neighbors a pan of it."
"1","5","This is so delicious. Double the recipe and keep half of it all to yourself!"
"1","5","delicious. I had 5 medium sized peaches that were very ripe so I didn't need all the sugar. The cake mixture amount was perfect for the 5 peaches, if I had more I definitely would have doubled it. I also did not add the extra sugar and cinnamon on top of the cake mixture. It was very good!!"
"1","5","Turned out wonderful!"
"1","5","This is my first time to rate something, This cobbler is AWESOME!! It's a keeper. Thank you!"
"1","5","BIG HIT! My mother-in-law said that it was the best peach cobbler she EVER had. Used fresh picked peaches and topped it with Pillsbury's Crescent Rolls (un-rolled) then sprinkled the white sugar and cinnamon mix over the rolls and baked it. LOVED IT!!!!"
"1","5","Five stars for this one!! It is just wonderful, I would add a little less sugar on top, but it is just divine!!"
"1","5","AWESOME!! made it for my girlfriend & she loves peach cobbler! she ate the whole pan and barely wamted to share. this recipe is a must. I used canned peaches in heavy syrup & still folowed all ingredients & it turned out great. just be sure not to put all the heavy syrup juice in the pan because it will overflow! GOODLUCK! DELICIOUS!"
"1","5","This cobbler is absolutely fantastic! The topping is soooo good that I may try it with an apple cobbler or other fruit. I followed other reviews and made about 1.5 times the topping. I used about 10 smaller peaches. . .and it was perfect. Even Ohio peaches make a wonderful dessert!"
"1","3","I'm not sure why but my cobbler burned with the sugar topping. I don't see any other reviews that mention this so I wonder what I did wrong. It doesn't say to turn down the oven temp after the initial 10 minutes of baking. After scraping off the burnt part of the topping, it tasted good and no one knew covered in ice cream!"
"1","3","Not the topping I was expecting when eating a peach cobbler. Not horrible tasting, but I'll try other recipes before I make this one again."
"1","4","This was a great recipe to take to a picnic, everyone loved it...I did double the toping recipe for the peaches, it was not enough! I would forgo the surgar mix on the top if using fresh peaches, it is not necessary and browns to quickly."
"1","5","love it"
"1","5","um. wow. i halved the recipe because i had 4 peaches. and this recipe is insanely delicious."
"1","5","I would have to agree with an earlier comment about increasing the amount of toping. I had only 5 peaches left that needed to be used and the amount of toping was perfect for the smaller dish. Otherwise excellent!"
"1","5","oh my goodness! this is one delicious cobbler!!! this was my first attempt at making a peach cobbler and i got rave reviews all around. i followed the recipe as is except for a few exceptions: more peaches ( i think i used 10 and wish i had used more!), 3-4 teaspoons of cornstarch, and from reading other reviews, made 1 1/2 of the topping ( i didn't double it). i didn't think the cobbler was too sweet with the amt of sugar listed....and my non-sweet tooth husband didn't either. you will not be disappointed with this recipe!!!!"
"1","5","My husband said it was the best peach cobbler he had ever had. The peaches came right off our tree, so super ripe and delicious, the cobbler part was like cookies, crispy and light, not all soggy. I did do 1 1/2 recipe of the topping using raw sugar, after reading another review. First cobbler that could stand on it's own and not rely on ice cream or something. Great recipe. Thanks for sharing."
"1","5","YummmmmO! This was really good. I reduced the sugar to 1/3 c. and used sucanat instead of the white and brown sugar. in the peach mixture. I used about 12 peaches so I also increased the cornstarch to 3 tsp. I also used sucanat in the topping and doubled the topping. I'm glad I did. I was delicious! It was crunchy on the top from the cinnamon and sugar and tender underneath. Can't wait to make again."
"1","5","Absolutely Amazing! I have a peach tree in my backyard and everyone in my family gets so excited when it's that time of the year again to make this cobbler! I usually need to alter the recipe to make more topping because I usually use about 50 peaches!"
"1","5","This was the recipe I'd been looking for. I did 1 1/2 times the topping, and it was almost too much, but not quite--go figure. Added 1/2 cup flour to the sugar and peaches to thicken the juice, and it was just right. Next time I would increase the peaches just a little and still 1 1/2 times the topping. Was delicious warm with vanilla ice cream!!"
"1","5","Delicious! I added 1 extra teaspoon of cornstarch based on the other reviews. Perfect!"
"1","5","What a great peach cobbler recipe. I made it exactly as shown and the only thing I might change the next time is to make more of the cobbler topping. I like a higher cake to fruit ratio, but this was great as it is. I tried what another reviewer suggested about scalding the peaches and then plunging them in ice water. Didn't work for me but my peaches could have been a little more ripe. That may have had something to do with it."
"1","5","This was a really good and easy recipe - haven't made peach cobbler in years, and was anxious to find a good one. (It is sometimes difficult to find peaches in the grocery stores which will ripen properly - without just shriveling up before they even get ripe.) Had 8 large-ish peaches sliced and ready to go the night before, which saved me time putting the cobbler together yesterday. I wondered about using boiling water, after using chilled butter in the mix - so used 1/2 cream and 1/2 milk instead, as I normally do. The brown sugar in the 'cobble' was a nice addition for flavor! I did make extra 'cobble', as I used a 13 X 9 X 2 pan...I doubled it, but 1 1/2 times the recipe would have been just right for us. My husband, who loves homey desserts, was delighted with this cobbler - served with a scoop of vanilla ice cream, of course!! Will most definitely make this again soon!"
"1","5","double sugar"
"1","5","I can't believe I made this!! I stepped back in time 30 years to my childhood in KY!!! This cobbler is amazing. I followed the recipe exactly and I'm sure it won't last once the family gets home."
"1","5","This recipe was wonderful!!! I usually edit recipes I find on this site as per other users recommendations. But I made this recipe exactly as it was written and it was fantasitc. The topping was very cake-like - it was delicious! I liked the topping to peaches ratio, although if you especially like topping you could increase it. I thought the amount of sugar was perfect. The only change I would make for next time would be to increase the cornstarch. I did have extra liquid. But we poured it over the vanilla ice cream and it tasted great! I'll be making this recipe again!!"
"1","5","I didn't change a thing! Yummy! I especially like the topping, it was nice and fluffy."
"1","5","Followed the recipe with the exception of only using about 1 Tablespoon of sugar over the top with the cinnamon. Very yummy!"
"1","5","I made this last night just as the recipe read. It was a total hit. Make sure the peaches are fresh and ripe and this is a no fail delicious and easy to follow recipe"
"1","5","Excellent recipe!! Easy to make and the comments about cooking time are just right. The cobbler cooks about 30 minutes to get golden brown. My husband asked for this to be made again just a few days from when I first made it. I only made it with fresh peaches."
"1","4","This was so easy and YUMMY!! Just made it today with fresh peaches and it couldn't have been better. I didn't need to pre-cook the peaches for 10 minutes because they were really ripe and already soft enough. Just baked for 30 minutes."
"1","5","Great recipe. So easy to make. Used ripe peaches and fresh lime juice. My family loved it."
"1","5","Made with white peaches from Carrefour---perfect!"
"1","5","I'm just learning to cook and was genuinely surprised that I had cooked this myself as it was so tasty and easy to do."
"1","5","Fabulous recipe! I used an equal amount of Splenda for Baking in place of the white sugar, and half the amount of Splenda Brown Sugar, as my husband is a diabetic with a sweet tooth-he couldn't get enough! Still have some fresh Georgia peaches, so I'm making it for the second time this week! Thanks for sharing this!"
"1","2","dough isn't the greatest and the mixture to toss around the peaches doesn't tastes the greatest either. I'll try a different cobbler recipe."
"1","5","This is amazing!!! The topping is light and crispy and the filling is perfect! Thanks for an amazing cobbler!!"
"1","2","Maybe somehow I did my calulations incorrect but I used 2 cans of peaches instead of fresh peaches because it was all i had and this same out very dry and crispy. Even with using the canned peaches i dont see how this would come out very good. The crumble covers the entire cobbler and it becomes thick and very cake like and then there is not very much filling on the inside. I was dissapointed with this recipe and will not try it again"
"1","5","Yum Yum and more Yum! I doubled the filling recipe and it STILL wasn't enough. The crust topping was a little too moist, I would recommend half of the amount of water for it. Recipe is a Keeper!"
"1","5","This was the first time I made a cobbler of any kind, and I am so glad I chose this recipe!!! Thumbs WAY UP! Loved it."
"1","5","THIS IS A KEEPER we were going to a 4th of July party and needed to bring dessert. WHAT A WONDERFUL SURPRISE to find this Southern Peach Cobbler recipe. It sounded so good and it turned out better than expected. I doubled the recipe and it wasn't enough. It was go good everyone actually ate it before the main course."
"1","5","This is the best Peach Cobbler. My family loved it. We used fresh NC peaches and they were great."
"1","4","Overall this recipe was very good but way too sweet for me. If I make this again, I would ease up on the amount of sugar. I love the topping, I feel it balances out the sweetness."
"1","4","Overall this recipe was good. I added 1/4 to 2/3 cup of oats to the flour&sugar mixture. Since i also had some raspberries, i added a handful of them as well. It wasn't too sweet or too bitter!"
"1","5","I used fresh peaches which took quite a while. Did not have enough to feed our family of 5. family loved the crunchy crust on this cobbler. May try canned peaches next time to cut down on time to make. Not overly sweet which was nice for a change"
"1","5","used fresh picked apricots instead. Perfect!!!!!!"
"1","5","I bought some fresh peaches and paid a fortune for them....$2.99/lb. I was debating whether to make a pie or try a cobbler to get the most from these expensive beauties! I happened to find this recipe and based on all the rave reviews I gave it a try instead of a pie! What a delicious dessert! I didn't have fresh lemon juice so I used my bottled stuff but I did grate fresh cinnamon and nutmeg which added remarkable flavor to the filling. I followed the recipe as stated and it is fantastic just the way it is written. I do understand why some readers said to increase the topping either by 50% or even to double it .....it IS that good! I can't wait to try it with blueberries next!"
"1","5","This was almost exactly what I was looking for. I only wish I had picked better peaches. I used a 9X9 and had plenty of topping."
"1","5","Love this cobbler, but the first time I made it the topping was too dark for my liking. Baked the second at 375, and it came out totally perfect. Served it to my guests last night with the ice cream and ended up sending some home with them. They loved it. One other note. I have a Ninja Food Prep machine that I use to cut in my butter. Cut the butter up real small, add to the mixture and with 6 pulses the butter is cut in perfectly."
"1","5","OH MY GOSH! This was sooo delicious!! After it was just baked and still hot we topped with whipped cream and had a side of vanilla frozen yogurt and it was soooo good! I DON'T like peaches but I loved this cobbler! Right out of the oven it was sweet and tasty. After sitting for a few hours my third helping was super sugary-I guess letting it sit for a while after sweetens it up even more. I prefer it straight out of the oven but still loved it when it was super sugary sweet as well. The only downside is that peach cobbler goes fast in a family of 5 and I need to double this recipe next time. Also the crust (which was super delicious) recipe needs to be doubled to cover the entire pie generously. I waited to put the cinnamon and sugar topping on until 10 minutes before it was done. I also doubled the cinnamon sugar topping so that it would be plenty to cover. Make this recipe-it's DELISH!!!!!!!!!"
"1","5","This was great!! My whole family loved it. I loved the the crumbly cake-like texture. I was looking for a cobbler to make from scratch, and this was easy to follow. I felt like a gourmet chef. :) But next time I'll used canned peaches. Though there was nothing wrong with it, preparing fresh peaches is A LOT of work for a busy mom. And once cooked, they taste the same as good quality canned peaches. But this recipe is great, and I'll be making it again. Also, I tripled the cinnamon. We like cinnamon in this house!"
"1","5","This was soooo good. I used canned peaches instead of fresh ones. We all loved it and I will defanetly make it again."
"1","5","I have made this 5 times now. It's sooo good! I made it again today. Peaches are not in season and they were not even that ripe. It still turned out great!! Thank you so much for this recipe. My family and I love it!"
"1","5","Made it tonight and it's all gone now! It was very easy to make and came out delicious. I made no changes. I used about 9 peaches or so, basically it filled up the bottom of a 9x13 pan. The crust was simple too. Maybe my only change would be to make more crust (it was good!). I'll be making it again maybe tomorrow!"
"1","5","This was my first attempt at a peach cobbler. Per my husband, it was as good as his grandmother's. Thank you so much for sharing this recipe. It is definitely a keeper. I used some of the peaches I canned in lite syrup this summer. So I reduced the first stage cook down to 6 min. instead of ten. Could not have been easier!"
"1","5","Very good! Made recipe as written and it came out perfect! I had to use canned peaches (29 oz drained) because it is now winter where I live. I also threw in some leftover frozen blueberries with the peaches, wow how good!"
"1","5","Very, very good. My husband who does not typically like cobblers was a big fan too."
"1","5","This was my first cobbler and me and my hubby were blown away with how amazing it came out. I followed the recipe except for the fact that i left out the lemon juice (i didn't have any) and i only used about 1/4 tsp of salt because i use salted butter. The best cobbler hands down, must try!"
"1","5","Family loved it!"
"1","5","I am giving this recipe a 5 star since it worked with my adjustments. I substituted a mix of splenda and truvia for white sugar since that is all I had. It came out great. I am still searching for a recipe with a crusty crust."
"1","5","This was fantastic just as written. I will probably reduce the sugar that goes on top next time, but this was a huge hit! Thanks for making my first cobbler a success!"
"1","5","This was absolutely WONDERFUL! I made it just as the recipe stated. It was completely gone in 30 minutes LOL...will def be making this for more occasions!"
"1","3","This was good but not great. I love fresh peaches and was expecting something fantastic. After cooking the peaches they tasted like canned peaches. The topping was a little too sweet. I think I will end up sticking with fresh berry cobbler. The fruit taste so much fresher with a little bit of tartness."
"1","4","This was good and not difficult to make. It was the first time I had made cobbler, and the first time my family had eaten it (not too common in Canada, I think). The cooking time was too long for my oven, so it was a little burned on the top, and I would reduce the sugar a little the next time, but otherwise it was good. Thanks!"
"1","5","My mother was going to an ice cream social and wanted to take along a dessert. This was a HUGE success!!! Everyone loved it, I've made it a couple of times and my mother has also made it a couple more times since."
"1","5","it may not look the prettiest if serving to guests for a more formal 'do' but who cares.... this is to die for. screw the guests, you'll want this all for yourself! thanks! You MUST pair this with a scoop or 2 of real french vanilla ice cream - theres a big difference between plain o vanilla and french. mmmmm mmm mmmmmm"
"1","5","my husband has made this twice and it is AWEWSOME!!! so good. wonderful. excellent. and don't even think about making it unless you have vanilla ice cream on hand to serve with it. absolutely the best peach cobbler we've ever had."
"1","4","Made this for a Southern friend who loves peach cobblers and he gave 4 stars. The topping is flaky, cake-like, yet dense and really good. I will use the topping for pies and other fruits."
"1","5","Perfect!"
"1","5","Excellent dish. Easy to make. Simply delicious. The only change I made was to add some ripe plums we had laying around and this added excellent flavor and color to the recipe. Yum. I can't wait to make this and eat it again."
"1","4","I made this recipe last night, and the taste was awesome. The only problem I had with it, is in the 1/2 hr after the topping was on, the topping was going very dark, yet when we ate it a couple hours later the dough closest to the fruit wasn't cooked, still wet. But a very tasty recipe, I have copied it into my own book!!"
"1","5","Absolutely delicious and so easy to throw together. For those of you who might not know, to easily peel peaches, first scald them for a minute in boiling water. Take them out of the pan and immediately rinse with cold water. Skin will slip right off. I may have to go buy some more peaches, this recipe rocks!"
"1","5","I should have known to double this recipe. It was gone in 1 hour. Nice way to use up a lot of peaches. Definitely double the amount of corn starch. I would not reduce the amount of sugar. UPDATE:If doubling, use 2 2 qt dishes. My large batch was uncooked under the topping, yuck."
"1","5","This is a fantastic peach cobbler recipe. I made it with fresh peaches picked from a farm that were just ripe but not too watery. I followed other advise and used a little extra corn starch and less sugar but otherwise followed the rest of receipe as is. Came out extremely well. The topping was just yummmmm"
"1","4","everyone loved this, i would double the dough mix and up the cornstarch as some other members suggested"
"1","5","Oh my goodness!! I did just like the suggestions said and added a bit more corn starch and did 1  times the topping. Go with fresh firm peaches if you can  it always makes a difference. It turned out fantastic! I didnt get to take a picture it had a taste test to make sure it was perfect for my guests later today You will not be disappointed with this one folks! This one is worth that extra time on the tread mill."
"1","5","My motto is butter is better, but I had no butter when making this so I substituted Smart Balance Light with hesitation. To my suprise it turned out wonderfully. So if you would like to cut the fat in half try it! But I guess cutting the calories doesn't help if you still end up eating half the pan. Delicious!!!"
"1","5","I made this for a dinner party and it was the rave. Very tasty. However, if this makes 4 serviings for the submitter s/he must be serving 4 line backers from the Miami Dolphins. I got 6-8 servings out of it."
"1","4","Excellent!!! Only complaint was that there wasn't enough batter to put ontop, will double that part of the recipe next time. I too went easy on the sugar/cin last step. Mmmm, very good!!!"
"1","4","Pretty good. The cobbler dough came out too wet and thin, but overall it tasted good. It did not keep well, and I would recommend eating it the same day it is baked."
"1","5","Excellent just as is. I made mine in a 9x12 pan. What I did not do was skin the peaches. No need and too much work. My organic peaches (including skin) baked up nicely and made a delicious cobbler!"
"1","5","I am not a cobbler fan. My husband loves cobbler so I made it for him because of our peach tree. Wow I can honestly say I am now a cobbler fan. Wonderful!"
"1","5","Fantastic! I used peaches that were no where near ripe, but they cooked and were just as juicy and soft as they were supposed to be. The topping was delish! It was a little more crust- like, and a little less cake-like, which is exactly what I wanted. I think the sugar/cinnamon sprinkled on the top made all the difference. Mmmmm, I'm gonna go get another piece!"
"1","4","This came out very good. However, it was very sweet! I chose this recipe over others because it seemed to call for less sugar than others. Mine did come out a little runny too. I put a little vanilla ice cream over it and that did the trick! If I make this again I will add a little more cornstarch and less sugar."
"1","5","This was absolutely delicious. I didn't have quite enough peaches, so I added blueberries and made it into Berry Peach Cobbler. My entire family devoured it and begged me to make more the next day. The topping is quite yummy. And it is great when it's hot, and also quite tasty after a day in the fridge."
"1","5","So easy and yummy! I added fresh blackberries for a bit of tart. Everyone loved it with vanilla ice cream!"
"1","5","Great recipe. I have made it twice now, and it got great reviews both times."
"1","5","This was a great tasting cobbler. I will keep this one in my recipe box..Thanks"
"1","5","I have never made Peach Cobbler and decided to give this one a try and glad I did. My husband's exact words were, 'this is the bomb'!!! I will be making this again. I made the recipe exactly as stated."
"1","5","This is one fantastic recipe! I made it exactly like the recipe described and it was perfect .. I would not change a thing. It was so good my husband told me it would win a prize in a contest. If it were me, I would follow the recipe to a tee the first time you make it, then alter it based on your taste . .. but until you make it the original way, you won't know how good it is!! (And I totally disagree with those that say there is too much sugar - it is a dessert and should be sweet!!)"
