helpfulCounts,ratings,reviewText
"1","5","Followed others advice: an extra 1/2 cup of flower, an extra 1/2 cup of peanut butter (used creamy), and a teaspoon of vanilla. Cooked 10 minutes at 375."
"1","5","These cookies are fabulous! Per other reviewers' recommendations, I increased the flour to 2 3/4 cups and peanut butter to 1 1/2 cups. I also used creamy instead of crunchy peanut butter to suit my family's tastes. The cookies came out beautifully - thick, soft and floury, not either crunchy or grease-moist like other recipes I've tried. They also didn't get crunchy around the edges after cooling, but stayed uniformly soft and chewy. I have made these several times, and they never last more than a day - my husband loves them! Thanks for a real keeper of a recipe!"
"1","4","We liked this recipe very much. I took the advice of user 'JenniferC77' and added an additional 1/2c of peanut butter, and a teaspoon of vanilla extract. Also added an additional 1/4c of flour. Boyfriend likes anything with peanut butter and chocolate, so made half batch with chocolate chips. Very yummy! Thank you for sharing the recipe!"
"1","5","I was had nothing to do so thought of trying this recipe and didnt know it would turn out to be so good.. really enjoyed every bit of cookies i made.. a recipe worth trying.. will be making these again and again.. :)"
"1","5","Very good recipe , although I made these without chilling the dough, just like my mother use to make these. very good!"
"1","5","The best Peanut Butter cookies I've ever had!!! I followed some of the suggestions for upping the flour and peanut butter by another 1/2 cup each ,and added 1 tsp. vanilla...I used creamy peanut butter(prefer)..and baked 11-13 minutes.They werent overbaked and stayed soft and alittle chewy.SOOO good! Have looked for a really good recipe for peanut butter cookies for many years,finally found it! Thanks for a really excellent recipe..Bravo!"
"1","5","perfect recipe! pull it out at 8 or 9 minutes if you like your cookies chewy, because they harden quickly after."
"1","3","A little dry..."
"1","5","I baked two dozen of these following the directions last night and the remaining two dozen the tonight baking only 9 minutes. I am now enjoying an outstanding cookie where as last night's cookies were a complete disappointment. Chilling the dough overnight and reducing baking time by one minute made all the difference."
"1","4","I took the advice and added 1/4 c extra PB and 1/4 c extra flour, couldnt be happier. I might try the 1/2 c next time, but these are still excellent."
"1","5","Leave slightly undercooked for chewy cookies. Good pnut flavor"
"1","5","I've made several versions of peanut butter cookies over the years, but these were by far the best. Nice balance of crispy and soft. I used 3 eggs instead of 2 1/2 and baked them for 12 minutes instead of 10. They are our favorite family cookie."
"1","5","very nice cookie - added 1/2 cup more peanut butter on second batch for a bit more pb taste!"
"1","5","Awesome, awesome cookies: An alternative: make homemade Peanut Butter Cup Cookies by making the cookies smaller, using a vanilla frosting between two cookies to sandwich them together. Then cover the top with a melted semi-sweet baking chocolate. Let cool. They are considered the best cookies in the world at my fiance's university!"
"1","5","i made it, it turned out great, thank you"
"1","5","My go to peanut butter cookie recipe."
"1","5","This recipe made the best peanut butter cookies I have ever had, ever. I doubled the amount of peanut butter for extra flavor and they were AMAZING. Will definitely make again."
"1","5","Wonderful recipe! I don't like my cookies too sweet so I cut the sugars down to 3/4 cup each. Perfect! The only challenge I run into is that my husband and I always want to eat the dough before it's baked. The timing is key: I overbaked once by about one minute and it made all the difference in a chewy cookie and a dry, crackery cookie. I will continue to make these again and again!"
"1","5","PERFECT! Never made better peanut buttter cookies! My family was 'whoa'd'! Thanks for sharing this recipe!"
"1","5","Everyone loves these! They are the perfect sweetness, texture and have just the right amount of peanut butter, but you can add a bit if you like them extra peanut-buttery :) This recipe is much better than the ones using shortening, they taste perfect!"
"1","4","I decided to try out a new ingredient - white chocolate peanut spread in lieu of the peanut butter and the result was worth it."
"1","2","I was not impressed with these cookies. They were very crunchy even with reduced bake time. Also the flavor was a little blan. I will be looking for a better recipe. I was really dissapointed."
"1","5","Delicious and a Family favorite! I used creamy instead of chunky peanut butter and added a hint of vanilla and a little more flour. So yummy and so easy- This is a keeper!!!"
"1","4","awesome cookies, make sure you tinker with the recipe, I added more flour and a little less butter."
"1","5","I had just moved and did not have baking soda or powder when I made these but they still turned out delicious which is a true testament to the recipe. I added a drop of cinnamon extract and a drop of honey (I would take back the honey, though - it was too dark) to bring up the complexity just a bit. These cookies were top notch."
"1","5","My son in college loves for me to make these for him to take back to school. They keep them in the freezer and thaw when they're ready to eat. I didn't change a thing. Thanks for the best PBCookie recipe I have!"
"1","5","I just finished making these and they are grest and also did take the advice and added more peanut butter and flour and vanilla. Will keep this recipe and make more. Lee"
"1","5","Great peanut butter cookie recipe!! I did take the advice of others and added a little bit more flour and peanut butter. Also added one tsp vanilla. Was a bit hit with family and friends!"
"1","5","Excellent cookies. I used 20% less sugar than suggested (otherwise it's too sweet). I also added roasted skinned peanuts for extra crunch. Will definitely remake this."
"1","3","Too dry and crumbly. I like mine to be chewy."
"1","5","These were good! I followed a few others' reviews and added 1/2 c. more of both peanut butter and flour and they turned out fabulous! I also only cooked these at 350 instead of 375. I will definetely make these again!"
"1","5","I made these cookies and I was so excited. I added some chocolate chips and a bag of peanut butter chips. What I also did was forget to put the eggs in. I have to say, despite not having the eggs it was a pretty good cookie. I'm going to make them again, but this time with the eggs :)"
"1","4","This is a good starter recipe. I took the suggestions and added 1/2c of flour and 1/2c of PB and they were very soft. I also added some Reeses peanut butter chips and baked for 9 mins at 375. Thanks for the great recipe."
"1","5","I made these cookies and my family and co-workers loved them. I added 1/2 cup more flour, 1/2 cup more peanut butter, 1 teaspoon of vanilla, and also for something different added M&M's. They were delicious."
"1","4","These cookies came out great. However, I changed the recipie a little. I cut down on sugar - 3/4 brown, 1/2 white - to make them less sweet. As for flour, I used 1.5 cups whole wheat flour and 1 cup all-purpose for more fiber. I used creamy peanut butter as I didn't have the crunchy one and I added vanilla extract (1 tsp) as suggested by other reviewers. I love them this way - they're not that sweet and they're a little healthier! Thank you!"
"1","4","Very good recipe for Peanut Butter cookies with a good serving amount. The dough in the fridge is a must. You can add broken peanuts to regular peanut butter with good results."
"1","5","Awesome!! I was brave and made a double batch the first time I made this recipe. They were so yummie. Everyone loved them and requested the recipe. I did follow other reviewers and added the extra flour and peanut butter."
"1","5","These are soooo...yummy! i added a bag of white chocolate chips and then dropped them by the tablespoon onto the cookie sheet. They were like white resse's."
"1","5","Awesome cookies, turned out perfectly. To avoid thin cookies make sure you refrigerate them, otherwise they will be thin. =) Awesome cookies!!!"
"1","5","I added a bag oc choc chips."
"1","5","OH. MY. HECK. No doubt the best peanut butter cookies I ever did eat! They kept real well and were soft even the next day. I did add about a fourth cup extra peanut butter but it could do without. It even made more than the two dozen it said it was! Although one thing that made it better was chocolate chips! Which I did after I made half the cookies."
"1","5","This is a great cookie recipe, 5 stars. The only thing I did differently was I used 1/2 butter and 1/2 butter flavored shortening (Crisco). I do that a lot with my cookie recipes. It makes a BIG difference I think,the texture is out of this world. It just melts in your mouth. Also my cookies only needed about 8 minutes. But this is by far the best peanut butter cookie recipe yet!!!"
"1","5","Great tasting dough, we also were lucky that any got cooked. I used Peter Pan Honey Roasted Crunchy. Also added 1tsp of vanilla. I like them fresh baked but friends I gave some to a week later said they were fantastic. I did not increase flour or peanut butter, just put them in the fridge for a while. I don't roll mine into balls, instead used the medium sized PC scoop, they baked up almost perfectly round, very nice."
"1","5","Hands down, best tasting cookie dough ever! My family was lucky there was enough dough left to bake! I did use 1/2C. extra peanut butter and flour as some suggested and, my son demanded 1C. semi-sweet chocolate chips. After about 30 minutes in the frig and 10 minutes in the oven, my cookies came out bite sized and fantastic. Everybody loved them; 5 dozen gone in two days. Thanks for a new family favorite"
"1","5","I didn't have brown sugar and they still came out fantastic! Thanks for the yummy recipe."
"1","5","I didn't have baking powder so I omitted it. I put 2/3 cup of butter instead. And I followed some reviewers comments to bake at 350 for exactly 9 minutes. They turned out great!"
"1","5","i loved the cookies they were still soft the next day like from the store. very good !!"
"1","5","Wonderful cookies! I made them exactly according to the recipe and they turned out perfect. The dough freezes well too!"
"1","5","My 13 year old son made these & they were sooo yummy. Will keep this recipe & make them again."
"1","5","great cookies-the whole family loved them."
"1","5","I loved these! I did add 1 tsp vanilla, and 1/4 cup extra flour and peanut butter. I also rolled the dough balls in sugar before I forked them! I didn't have unsalted butter at home so I cut out the salt and used a little less baking soda and a little more baking powder. They were excellent."
"1","5","This cookies were DELICIOUS! I'm not even crazy about peanut butter, but these were fantastic! Just the perfect combination! I did listen to the advice of others, and add a few alterations. I added an additional 1/2 cup of peanut butter, 1/2 cup of flour, and 1 tsp. of pure vanilla extract. I also added a medium sized bag of M&Ms! Mmmmmmmmm! These were amazing!"
"1","5","I added the extra flour and peanut butter, and they came out perfect. They had great line from the fork, the right amount of crunchy edges and chewy center. I also got created and rolled some out and used a squirrel cookie cutter dragging a fork over the tail section to make it look like fur. They were really cute but all crunchy, which was okay by me. Loved this so much!"
"1","5","This is THE best Peanut Butter cookie recipe!!! I did as other suggested and used an extra 1/2 cup of peanut butter & 1/2 cup extra of flour, plus 1 tsp vanilla. SO good... TOO good... I can't stop eating them, and I usually have enough after one cookie. Will definitely make these again... my kids, husband and daycare kids all enjoyed these. Thank you for an amazing recipe!"
"1","5","YUM, this were terrific and made a good amount of cookies. Sent to work with my husband and everyone gobbled them up"
"1","5","These are fantastic!! I made a batch for my family and they loved them. Be sure to not overcook them, I found that the ten minutes was perfect and gave them a crispy outside and a softer center. Also make sure you chill the dough a bit. I too added some extra flour and peanut butter (about 1/4 cup of each) and rolled the balls in sugar before pressing them with a fork. Super rich and tasty!"
"1","3","Well this was a good base. I would make again but with my changes...I made as stated for 9 cookies but they were too crumbly for me and not peanut buttery enough. I added a 1/2 c peanut butter (used organic chunky), 1/2 cup flour, 1/4 c sugar, and another 1/3 stick butter. I did chill too. I also baked at 350 for 13 min on an airbake sheet (longer then a normal cookie sheet) Perfection! Made a lot- might cut in half next time- made 50 good size cookies (I did add to the mix). oops I added a capful of vanilla too!"
"1","3","Although, I decided to make a few tweaks to this recipe, it gave me the basis to create a great peanut butter cookie! I added 1 extra egg and a sprinkle of water because I did not like how dry the batter was. I eliminated the baking soda. If I had more peanut butter I would have probably added that before anything else. And I would suggest to add another half cup of peanut butter AT LEAST. Baked at 375 for 10 minutes! They stayed soft!"
"1","5","Perfect! Excellent texture and peanutty flavor. I used smooth peanut butter (and a little more than recipe calls for). Also, since I had salted butter on hand, I simply omitted the salt. Added a bag of chocolate chips--yummy. Thanks for sharing this recipe. It's a keeper."
"1","5","These are the best peanut butter cookies we have ever tasted! Perfect flavor and texture! I did follow other suggestions of adding extra flour and peanut butter and we couldn't have been happier. Truly a no fail cookie!"
"1","5","By far the best peanut butter cookie recipie ever!!"
"1","5","Good, I cut the recipe in half cuz i didnt want so many cookies! I also added crushed peanut butter cups ( that i had left over from a recipe) and M & M's!"
"1","4","Excellent! I added the peanut butter using a 1/4C measuring cup, and made sure they were heaping quarter-cups. I also added an additional heaping quarter-cup. I didn't add any flour. (I was out of all-purpose, so I used cake flour and it worked just fine.) I baked them at 350 for exactly 10 minutes, without refigerating the dough, and they turned out just fine. They didn't seem 'done' when I took them out, but I let them sit for 10 minutes and they firmed up perfectly. Wonderful recipe!"
"1","5","Actually... very good. I made a gluten free version of this recipe. Everyone loved them!"
"1","5","I didn't have no-salt butter as the recipe says, so I used the regular and they were a bit salty. I added chocolate chips to the rest of the batter after I tasted the first batch and it made them taste really good as the chocolate went well with the extra salt. I rated these cookies a 5 star because if I would have made them with no salt butter, I wouldn't of had to add the chocolate chips."
"1","5","Excellent!!!!In Greece,we don't use so much peanut butter. So , we don't use it, not even for cookies. But that recipe proves how wrong we are. These cookies are really fantastic!!!I added some chocolate chips, which made them even more gorgeous!!Thank you!!!"
"1","2","Not very good. Maybe not enough peanut butter? Did taste better after they were a day old."
"1","5","With the suggested changes (additional 1/4 c pb & flour & 1 tsp vanilla) & my own change ( I used ALL whole wheat flour) these are the best PB cookies I've ever had! Very moist!!!!"
"1","5","excellent cookies I made them according to the receipe very light."
"1","5","perfect peanut butter cookies, I was delighted at how well they turned out for my christmas baskets :)"
"1","5","We LOVE this recipe and make it over and over. They are soft and moist!"
"1","4","This Recipe is very good. I took the advice of other reviews and added 1/4 C. more flour and 1/4 C. more peanut butter. I used salted butter and left out the 1/2 tsp. of salt and used creamy peanut butter instead of crunchy. I also added a couple handfuls of cinnamon chips adn they turned out delicious"
"1","5","Classic is correct - these were perfect. I did take the suggestions of others and use 1 1/2 cups of peanut butter and 2 3/4 cups AP flour. I also added about 3/4 tsp. vanilla."
"1","5","These turned out nice and crisp on the edges and chewy on the inside. Easy and tasty."
"1","5","absolutely no need to add flour, just chill the dough properly and the cookies stay moist and thick. I did find that 350 for 9 min was just right. added 1/2 tsp. vanilla."
"1","5","excellent cookies. I found that they were overcooked at 10 minutes, 8.5 was perfect. I live at 800 feet above sea level, if that matters."
"1","5","This is a great peanut butter cookie. I took the advice of others and increased the peanut butter and flower 1/2c each and added vanilla. I also added a bag of peanut butter chips. My family loved them."
"1","5","I loved this recipe it was simple and yeilded delectable cookies. Just a couple tips, I like my cookies soft and moist in the inside but these cookies are actually better stiff. Otherwise the cookies don't taste like cookies but more like a spoonful of peanut butter. Also I baked them for 10 minutes on 350 F.I also rolled the balled dough in granulated sugar before pressing them down with a fork on the baking sheet.this kept them from sticking to the cookie sheet and gave them a more delicate texture in the end."
"1","5","My family loves this recipe, they ask me to make it all the time. I did not refrigerate the cookies because I heard that it makes it to hard, and my family LOVES soft cookies. I also added a some vanilla and extra peanut butter. Also I cooked the cookies for six to eight minutes. Instead of one cup of regular sugar and one cup of brown sugar I did 3/4 cup of regular sugar and 1 1/4 cup of brown sugar. I have been making this recipe for over a year now. I recommend this recipe to everyone!"
"1","5","This is the best ever peanut butter cookies recipe I have made so far.Mine turned out fudgy which my 5 year old son enjoyed."
"1","5","This is an excellent recipe. I used Peter Pan Honey Roast Crunchy Peanut butter and rolled the dough in granulated sugar before flattening them wiht a fork. The result was the perfect crispy, chewy PB cookie. Thanks for the perfect recipe!"
"1","2","Although the taste was ok the texture was rubbish! They were so cakey. Too much flour in my opinion! I did add coconut and that really brought them out. They were just too hard, crunchy and cakey."
"1","5","I can't stop Eatin' Em they are that good! I did read the other reviews and made the following changes. I added an extra 1/2 cup of peanut butter, changed half the butter to veg. shortening, added one teaspoon of vanilla, changed half the flour to whole wheat flour, used baking splenda instead of the white sugar and added one bag of milk chocolate chips. I than refrigrated the dough for 1 hour. I used a 1/4 measuring cup as a mold and press them a little with a fork. I bake them on parchment paper for 10 min and let them cool on the sheet for 5 more before placing on cooling rack. I was swatting my kids away after the first one. They had no idea of the healthy changes made to the recipe. They were soft, big and yummy!What can I say I like a big cookie with my coffee."
"1","5","This is a great recipe! Thanks. I chilled my cookie dough only 30 minutes due to anxiety, I couldn't wait to bake them. Exactly 10 minutes as a previous reviewer stated...these are perfect! I made them with choc. chips and with M&M's and Plain...great no matter what. I definately enjoy them as is with no chips or anything the best! Thanks again!"
"1","5","I added 1/2 cup more peanut butter and 1 cup chocalate chips!!! Yummy!! I also refrigerated the dough for 1/2 an hour befor bakeing them.They were GREAT!!"
"1","4","This is a great recipe! I added a cup of chopped dry roasted nuts. I also used 1/2 cooking margerine and 1/2 real butter. I rolled some of them in plain sugar and some in cinnamon and sugar. They were a hit either way. Thanks!!"
"1","4","Instead of adding salt, i just used regular salted butter. I like peanut butter cookies when using butter instead of shortning. Their not so hard. I hate a hard cookie! lol very good."
"1","4","I just made these cookies. And like other reviewers said, I added more peanut butter and more flour (1/2 cup extra of each). While the flavor is amazing, the consistency is a little off. My cookies are a little crumbly and chewy. Didn't know that could happen, hahaha. I would give it 4 1/2 stars if I could."
"1","5","Wow! I actually made cookies, and didn't ruin them. These were awesome!!! They taste just like my mom used to make. I CAN wait until hubby gets home, he'll devore them all."
"1","4","1ST TIME I MADE PB COOKIES FROM SCRATCH AND THEY ARE REALLY GOOD"
"1","5","WOW! I made these for my bible study group and everyone couldn't get over how amazing the cookies were. I added oats to mine, and dipped the tops in sugar before pressing them with a fork. Like some others have said, they really don't look done when they are, in fact they seem downright uncooked but they harden up a good deal as they cool. But they're still perfectly chewy and moist! I'm going to use this recipe over and over, I'll just have to triple it next time!"
"1","5","I am eating these as I type! By far the best peanut butter cookie I have ever put in my mouth! I added more peanut butter and flour as others suggested and added 1/2 a bag of Reese's peanut butter chips - AMAZING!"
"1","5","YUMMY!!! These were so quick and easy to make. I prepared the dough which didn't take long at all. My 4 children couldn't wait the hour for dough to refrigerate so I made them in half hour. They were delicious and gone sooner than the time they took to cook...lol."
"1","5","loved this recipe. I also topped it off with chocolate sprinkles and the sugar, just amazing. Will make again and again!!!"
"1","5","I've been looking for a good peanut butter cookie recipe -- these are the best I've ever tasted. I made a double batch for a church event, the next weekend I made a double batch for the family (me). EXCELLENT! Thanks for Sharing."
"1","5","I have always strayed away from pb cookies because as a kid I could never get the recipe just right. 14 years later I try again, with success! All I did differently was add a small amount of vanilla and rolled the 1 in. balls in sugar before pressing with a fork. I divided the dough in half and added mini chocolate chips to one batch and kept one as is. Baked for about 12 minutes. Fantastic!"
"1","5","everyone loved these cookies I also added more flour and more peanut butter. thank you very much."
"1","5","This is a easy recipe, with amazing results. I get special request to bring the peanut butter cookies to things. That to me means it deserves 5 stars!!! Only thing I do different is press my cookies down with a fork, when they are hot out of the oven and then sprinkle the hot cookies with sugar."
"1","5","I've never been a peanut butter cookie fan, but my Sweetie is. I decided to do something nice and make some just for him. This recipe is SOOO good. Reading other reviews I kind of sloppily measured the peanut butter and flour (a little more of each) and did add vanilla. I've been told by my husband and my two neighbors who covet peanut butter cookies, that these are the best they've ever had. I even like them. I've made them twice this week and will probably continue to do so on a regular basis. These really are very good."
"1","4","Followed recipe exactally and my husband and I found them to not be very peanut buttery, but still tasty enough."
"1","5","Finally! A peanut butter cookie recipe that tastes great, stays moist, and doesn't fall apart!"
"1","5","oh man these are good they melt in your mouth and boy i just love peanut butter cookies yumm-o"
"1","5","This recipe is absolutely amazing. I took advice from a few other reviews and added 1/4 C more peanut butter, 1/4 C more flour, and vanilla. Best cookies that I've ever had!! I've had nothing but raving compliments and requests for the recipe :)"
"1","5","These were great! The first time i made peanut butter cookies. Unfortunatley - I ate them all myself so much for my diet. A personal tip - add a box of vanilla pudding mix to the batter to keep the cookies soft forever!"
"1","4","This is a great recipie! it is really good. But i used the recipie that makes 24 cookies, we followed the directions and everything. But, it made 139 cookies. The cookies are delicous though."
"1","5","A GREAT recipe. I did add the extra 1/4c peanut butter and 1/4c flour. I purchased the creamy peanut butter by mistake, but had salted peanuts(1/2 cup) at home and put them in a mini chopper, then added them. I also made the balls slightly larger...YUMMY!!!"
"1","5","I did increase the flour and peanut butter as instructed by several other reviewers and the cookies were crisp on the outside and chewy on the inside. Perfect! Brought these to a party and everyone loved them!"
"1","5","Great recipe! I added 1/4 cup of peanut butter and a 1/4 cup of flour to the recipe on suggestion of a few other users. I also added a bit of cinnamon, as I do to most of my recipes. I baked my cookies for 9 minutes, and they were just the perfect golden color on the bottom and just barely around the edges. It's a great dough, and a smooth cookie, but it just crumbles and melts in your mouth. Thanks for the deeeelicious recipe!"
